title,description,link,source,author,published,scraped_at,guid
German police arrest Syrian man suspected of plotting ‘jihadist’ attack,"22-year-old had been preparing a ‘serious act of violence against the state,’ spread propaganda for terror organizations, German police and prosecutors claim The post German police arrest Syrian man suspected of plotting &#8216;jihadist&#8217; attack appeared first on The Times of Israel .",https://www.timesofisrael.com/german-police-arrest-syrian-man-suspected-of-plotting-jihadist-attack/,Times of Israel,,2025-11-02T20:48:38,2025-11-02 21:08:28.118097,https://www.timesofisrael.com/?p=3679583
US bishop apologizes for school’s Auschwitz Halloween parade float,Catholic leader in Pennsylvania 'shocked and appalled' by replica of death camp gate in school march The post US bishop apologizes for school’s Auschwitz Halloween parade float appeared first on The Times of Israel .,https://www.timesofisrael.com/us-bishop-apologizes-for-schools-auschwitz-halloween-parade-float/,Times of Israel,,2025-11-02T21:03:10,2025-11-02 21:08:28.118041,https://www.timesofisrael.com/?p=3679465
The meaning of the Tomer-Yerushalmi affair,"Can Israel remain the strong, proud democracy it must be to survive when the war for its existence is fought not only on the battlefield but inside its own institutions? The post The meaning of the Tomer-Yerushalmi affair appeared first on JNS.org .",https://www.jns.org/the-meaning-of-the-tomer-yerushalmi-affair/,JNS,Fiamma Nirenstein,2025-11-02T19:54:18,2025-11-02 20:08:57.756158,https://www.jns.org/?p=601481
The Lessons We Were Taught and the Ones Being Forgotten,"Jewish safety depends on clarity, memory and the courage to see reality as it is, not as we wish it to be. The post The Lessons We Were Taught and the Ones Being Forgotten appeared first on Jewish Journal .",https://jewishjournal.com/commentary/opinion/384698/the-lessons-we-were-taught-and-the-ones-being-forgotten/,Jewish Journal,Samuel J. Abrams,2025-11-02T19:17:53,2025-11-02 20:08:55.221141,https://jewishjournal.com/?p=384698
‘Two years of praying’: Freed hostage Bar Kuperstein returns home to Holon,"‘You didn’t let me disappear,’ he tells crowd, following three weeks of recovery; hospital says freed captive Alon Ohel underwent successful surgery for untreated eye injury The post &#8216;Two years of praying&#8217;: Freed hostage Bar Kuperstein returns home to Holon appeared first on The Times of Israel .",https://www.timesofisrael.com/two-years-of-praying-freed-hostage-bar-kuperstein-returns-home-to-holon/,Times of Israel,,2025-11-02T19:13:31,2025-11-02 20:08:52.951500,https://www.timesofisrael.com/?p=3679402
Israel rolls out tax benefits to lure back tech talent and investments after Gaza war,Finance Minister Bezalel Smotrich vows that the reform will simplify tax processes and provide tax breaks and regulatory certainty for investors in Israeli funds and tech companies The post Israel rolls out tax benefits to lure back tech talent and investments after Gaza war appeared first on The Times of Israel .,https://www.timesofisrael.com/israel-rolls-out-tax-benefits-to-lure-back-tech-talent-and-investments-after-gaza-war/,Times of Israel,,2025-11-02T19:39:10,2025-11-02 20:08:52.951441,https://www.timesofisrael.com/?p=3679404
Netanyahu says Gazan detainee abuse leak 'most severe diplomatic attack Israel has faced',"The IDF reservists accused of abusing the Palestinian at the Sde Teiman facility held a press conference calling for their charges to be dropped and for the military advocate general who took responsibility for the leak to be prosecuted instead. Meanwhile, Israel's justice minister and attorney general continue to clash over the latter's jurisdiction to investigate the leak",https://www.haaretz.com/israel-news/2025-11-02/ty-article/.premium/netanyahu-gazan-detainee-abuse-leak-most-severe-diplomatic-attack-in-israels-history/0000019a-44b3-d3af-afdf-54fbd5cc0000,Haaretz,Jonathan Lis,2025-11-02T18:45:06,2025-11-02 19:08:46.289731,https://www.haaretz.com/israel-news/2025-11-02/ty-article/.premium/netanyahu-gazan-detainee-abuse-leak-most-severe-diplomatic-attack-in-israels-history/0000019a-44b3-d3af-afdf-54fbd5cc0000
"Mourners lay slain hostages Amiram Cooper, Sahar Baruch to rest in southern Israel","Cooper's wife eulogizes him as a guy who wrote poems and whistled melodies, while Baruch's mother remembers her son as 'a traveler, chess player, kayaker, scholar, nerd' The post Mourners lay slain hostages Amiram Cooper, Sahar Baruch to rest in southern Israel appeared first on The Times of Israel .",https://www.timesofisrael.com/mourners-lay-slain-hostages-amiram-cooper-sahar-baruch-to-rest-in-southern-israel/,Times of Israel,,2025-11-02T18:07:28,2025-11-02 19:08:33.490044,https://www.timesofisrael.com/?p=3679333
Ex-IDF legal chief Tomer-Yerushalmi found alive after frantic beachside search,"Former military advocate general, who resigned over Sde Teiman abuse video scandal, had been unreachable for hours and her car was found near beach, sparking concern The post Ex-IDF legal chief Tomer-Yerushalmi found alive after frantic beachside search appeared first on The Times of Israel .",https://www.timesofisrael.com/ex-idf-legal-chief-tomer-yerushalmi-found-alive-after-frantic-beachside-search/,Times of Israel,,2025-11-02T19:02:47,2025-11-02 19:08:33.489996,https://www.timesofisrael.com/?p=3679486
"Zohran Mamdani, Muslim Democratic NYC candidate, looms large at national Republican Jewish confab","Florida Rep. Randy Fine, one of four Jewish Republicans in Congress, called for Mamdani to be deported. -- The post Zohran Mamdani, Muslim Democratic NYC candidate, looms large at national Republican Jewish confab appeared first on Jewish Telegraphic Agency .",https://www.jta.org/2025/11/02/politics/zohran-mamdani-muslim-democratic-nyc-candidate-looms-large-at-republican-jewish-confab,JTA,Joseph Strauss,2025-11-02T18:12:11,2025-11-02 19:08:28.603380,https://www.jta.org/?p=1891734
‘Khamenei is intent to continue on the old path’,Former national security adviser Jacob Nagel tells JNS that Tehran is likely following a carefully sequenced recovery plan. The post ‘Khamenei is intent to continue on the old path’ appeared first on JNS.org .,https://www.jns.org/khamenei-is-intent-to-continue-on-the-old-path/,JNS,Yaakov Lappin,2025-11-02T17:21:18,2025-11-02 18:10:17.702782,https://www.jns.org/?p=601451
"After topping other Jewish NCAA coaches, Gators’ Golden shoots for title repeat","Over a decade after playing basketball for Israel, Todd Golden says the country remains on his mind, though his focus now is on defending last year's collegiate championship for Florida The post After topping other Jewish NCAA coaches, Gators&#8217; Golden shoots for title repeat appeared first on The Times of Israel .",https://www.timesofisrael.com/after-topping-other-jewish-ncaa-coaches-gators-golden-shoots-for-title-repeat/,Times of Israel,,2025-11-02T17:14:32,2025-11-02 18:10:12.542111,https://www.timesofisrael.com/?p=3652749
Jewish GOP conference pivots to tackling antisemitism within the Republican Party,"Originally planning to celebrate the release of hostages from Gaza, Republican Jewish Coalition confab shifts focus to the growing anti-Israel and anti-Jewish rhetoric on the right The post Jewish GOP conference pivots to tackling antisemitism within the Republican Party appeared first on The Times of Israel .",https://www.timesofisrael.com/jewish-gop-conference-pivots-to-tackling-antisemitism-within-the-republican-party/,Times of Israel,,2025-11-02T17:42:55,2025-11-02 18:10:12.542061,https://www.timesofisrael.com/?p=3679368
"Why Satmar Hasidic leaders endorsed Zohran Mamdani as mayor, stunning many Jewish voters","In a surprising show of support, Zohran Mamdani secured a major endorsement from one of the largest blocs of voters in the Haredi community, even as he still struggles to earn the trust of many Jews in the race for New York City mayor. The Satmar Hasidic community in Brooklyn, led by Rabbi Aaron Teitelbaum... The post Why Satmar Hasidic leaders endorsed Zohran Mamdani as mayor, stunning many Jewish voters appeared first on The Forward .",https://forward.com/fast-forward/779920/satmar-mamdani-nyc-mayor-election-endorsement/,The Forward,Jacob Kornbluh,2025-11-02T17:27:21,2025-11-02 18:10:10.418049,https://forward.com/?p=779920
"'Memory carriers': Hidden away for years, some of Yad Vashem's greatest treasures go on display","Among the artifacts on display at Yad Vashem's new 'Living Memory' exhibit are actual Holocaust hiding spaces, a Shabbat candelabra made from barbed wired picked off a concentration camp fence by a Jewish inmate, and an original copy of Schindler's List",https://www.haaretz.com/life/2025-11-02/ty-article-magazine/.premium/hidden-away-for-years-yad-vashems-greatest-treasures-go-on-display/0000019a-443b-d151-adbb-773b2f780000,Haaretz,Judy Maltz,2025-11-02T16:12:20,2025-11-02 17:08:38.404932,https://www.haaretz.com/life/2025-11-02/ty-article-magazine/.premium/hidden-away-for-years-yad-vashems-greatest-treasures-go-on-display/0000019a-443b-d151-adbb-773b2f780000
Planning to visit to the Western Wall? There's a secular option too,"As the Western Wall plaza grows increasingly religious and even messianic, many secular Israelis feel out of place. Just to the south, however, a beautiful empty plaza awaits for egalitarian prayer, quiet reflection or a historical tour",https://www.haaretz.com/israel-news/travel/2025-11-02/ty-article-magazine/.premium/planning-to-visit-to-the-western-wall-theres-a-secular-option-too/0000019a-3600-da7a-abdb-bf928eea0000,Haaretz,Eitan Leshem,2025-11-02T16:13:31,2025-11-02 17:08:38.404894,https://www.haaretz.com/israel-news/travel/2025-11-02/ty-article-magazine/.premium/planning-to-visit-to-the-western-wall-theres-a-secular-option-too/0000019a-3600-da7a-abdb-bf928eea0000
"After widespread searches, IDF top prosecutor found alive, contacted husband","Yifat Tomer-Yerushalmi has been missing since Sunday morning, and her car was found abandoned at Hof HaTzuk beach in Herzliya. She resigned on Friday after admitting she had authorized the leak of footage showing the abuse of a detainee at the Sde Teiman facility",https://www.haaretz.com/israel-news/2025-11-02/ty-article/.premium/police-searching-for-idf-legal-chief-missing-after-resignation-over-sde-teiman-leak/0000019a-4560-dd4d-a9bb-75e7aa6b0000,Haaretz,Josh Breiner,2025-11-02T16:35:38,2025-11-02 17:08:38.404862,https://www.haaretz.com/israel-news/2025-11-02/ty-article/.premium/police-searching-for-idf-legal-chief-missing-after-resignation-over-sde-teiman-leak/0000019a-4560-dd4d-a9bb-75e7aa6b0000
An Israeli drone operator couldn't bear his role in the Gaza war. 'Moral injury' made him take his own life,He was an officer in the reserves who a few weeks before his suicide said the war would have unforeseen consequences and had to stop. Other drone operators are suffering just as he did. A Haaretz exposé,https://www.haaretz.com/israel-news/2025-11-02/ty-article-magazine/.premium/israeli-drone-operator-driven-to-suicide-by-moral-injury-in-gaza-war/0000019a-0777-d582-a39e-5ff7625d0000,Haaretz,Tom Levinson,2025-11-02T16:35:54,2025-11-02 17:08:38.404828,https://www.haaretz.com/israel-news/2025-11-02/ty-article-magazine/.premium/israeli-drone-operator-driven-to-suicide-by-moral-injury-in-gaza-war/0000019a-0777-d582-a39e-5ff7625d0000
Force is not the only way: An Amos Gitai show on Yitzhak Rabin lays bare the power of memory,"Gitai's 'Yitzhak Rabin: Chronicle of an Assassination' explores the incitement in 1995 that Benjamin Netanyahu helped stoke. After 30 years, the play has finally been put on in Israel",https://www.haaretz.com/life/2025-11-02/ty-article-magazine/.premium/force-is-not-the-only-way-an-amos-gitai-show-on-rabin-lays-bare-the-power-of-memory/0000019a-448d-d1db-abda-d6cd457c0000,Haaretz,Talia Banon Tsur,2025-11-02T16:44:40,2025-11-02 17:08:38.404791,https://www.haaretz.com/life/2025-11-02/ty-article-magazine/.premium/force-is-not-the-only-way-an-amos-gitai-show-on-rabin-lays-bare-the-power-of-memory/0000019a-448d-d1db-abda-d6cd457c0000
Lebanese officials: Israel escalating strikes on Lebanon to pressure Beirut into diplomatic talks,"Israel has been escalating its strikes on Lebanon in recent days while senior officials are escalating their rhetoric against it. The Israeli narrative was that Hezbollah had been weakened and deterred, one official said, but now it is shifting to justify strikes and pressure Beirut",https://www.haaretz.com/israel-news/2025-11-02/ty-article/.premium/lebanese-officials-israel-escalating-strikes-to-pressure-beirut-into-diplomatic-talks/0000019a-451f-d313-af9a-7fdf86d70000,Haaretz,Jack Khoury,2025-11-02T16:49:11,2025-11-02 17:08:38.404752,https://www.haaretz.com/israel-news/2025-11-02/ty-article/.premium/lebanese-officials-israel-escalating-strikes-to-pressure-beirut-into-diplomatic-talks/0000019a-451f-d313-af9a-7fdf86d70000
The first brick in Israel’s ‘deep state’ wall has fallen,Maj. Gen. Yifat Tomer-Yerushalmi must be stripped of her rank and face jail time for the damage she did to IDF soldiers and the State of Israel. The post The first brick in Israel’s ‘deep state’ wall has fallen appeared first on JNS.org .,https://www.jns.org/the-first-brick-in-israels-deep-state-wall-has-fallen/,JNS,Avi Abelow,2025-11-02T16:07:28,2025-11-02 17:08:30.979492,https://www.jns.org/?p=601446
Netanyahu: Lebanon must ‘uphold its commitments’ to disarm Hezbollah,"PM says Lebanese terror group is 'trying to rearm and recuperate,' as hundreds gather in south Lebanon for funeral of five operatives slain by IDF in recent strikes The post Netanyahu: Lebanon must &#8216;uphold its commitments&#8217; to disarm Hezbollah appeared first on The Times of Israel .",https://www.timesofisrael.com/netanyahu-lebanon-must-uphold-its-commitments-to-disarm-hezbollah/,Times of Israel,,2025-11-02T16:33:07,2025-11-02 17:08:26.436920,https://www.timesofisrael.com/?post_type=liveblog_entry&p=3679270
"At the 30-year memorial after Rabin's assassination: Same place, same people, still calling for peace","It wasn't a state ceremony, no one tried to make it one. It belonged entirely to one camp: smaller now, bruised and insecure, yet still there, still standing. Even the word peace was spoken",https://www.haaretz.com/israel-news/2025-11-02/ty-article/.premium/at-the-30-year-rabin-memorial-same-place-same-people-still-calling-for-peace/0000019a-44dd-d06a-a1be-c4ffff420000,Haaretz,Moran Sharir,2025-11-02T15:39:15,2025-11-02 16:09:27.775052,https://www.haaretz.com/israel-news/2025-11-02/ty-article/.premium/at-the-30-year-rabin-memorial-same-place-same-people-still-calling-for-peace/0000019a-44dd-d06a-a1be-c4ffff420000
"'Springsteen: Deliver Me From Nowhere' was born to run out of ideas, depth and emotional punch","Scott Cooper's biopic about Bruce Springsteen's 'Nebraska' album trades rock-and-roll energy for moody silences, while 'Regretting You' lives up to its title, and Guillermo del Toro's lavish 'Frankenstein' can't bring fresh life to an over-stitched tale",https://www.haaretz.com/life/film/2025-11-02/ty-article/.premium/springsteen-deliver-me-from-nowhere-was-born-to-run-out-of-ideas-and-emotional-punch/0000019a-30b8-d856-a9ff-7ebbf8a80000,Haaretz,Adrian Hennigan,2025-11-02T15:41:06,2025-11-02 16:09:27.775014,https://www.haaretz.com/life/film/2025-11-02/ty-article/.premium/springsteen-deliver-me-from-nowhere-was-born-to-run-out-of-ideas-and-emotional-punch/0000019a-30b8-d856-a9ff-7ebbf8a80000
PM: Palestinian prisoner abuse video leak ‘most serious PR attack’ against Israel to date,AG Baharav-Miara rejects Levin’s ‘unlawful’ effort to bar her from investigating incident; indicted soldiers say leak of video footage means they cannot get a fair trial The post PM: Palestinian prisoner abuse video leak &#8216;most serious PR attack&#8217; against Israel to date appeared first on The Times of Israel .,https://www.timesofisrael.com/pm-palestinian-prisoner-abuse-video-leak-most-serious-pr-attack-against-israel-to-date/,Times of Israel,,2025-11-02T15:49:57,2025-11-02 16:09:14.154513,https://www.timesofisrael.com/?p=3679150
There was a fox in Bethsaida,"In the dead of night, an unexpected animal walked on the freshly mortared wall of a Byzantine church complex by the shore of the Sea of Galilee 1,700 years ago",https://www.haaretz.com/archaeology/2025-11-02/ty-article-magazine/there-was-a-fox-in-bethsaida/0000019a-4400-dec4-a7db-f7f3f7680000,Haaretz,Ruth Schuster,2025-11-02T12:41:50,2025-11-02 15:09:07.718505,https://www.haaretz.com/archaeology/2025-11-02/ty-article-magazine/there-was-a-fox-in-bethsaida/0000019a-4400-dec4-a7db-f7f3f7680000
Netanyahu: IDF eliminating Hamas holdouts in Israeli-controlled Gaza,"Pockets of the terror group in Rafah and Khan Yunis are being dismantled, the prime minister said. The post Netanyahu: IDF eliminating Hamas holdouts in Israeli-controlled Gaza appeared first on JNS.org .",https://www.jns.org/netanyahu-idf-eliminating-hamas-holdouts-in-israeli-controlled-gaza/,JNS,JNS Staff,2025-11-02T14:06:52,2025-11-02 15:08:59.988400,https://www.jns.org/?p=601412
"‘Clearly have antisemitism element of our party,’ McCormick says at RJC","“It’s a very small minority, but we have to confront it,” the Republican senator told JNS. “It’s never in my opinion appropriate to give platform, to give license, to people who are explicitly pro-Hitler, pro-Nazi, explicitly antisemitic.” The post ‘Clearly have antisemitism element of our party,’ McCormick says at RJC appeared first on JNS.org .",https://www.jns.org/clearly-have-antisemitism-element-of-our-party-mccormick-says-at-rjc/,JNS,Jonathan D. Salant,2025-11-02T14:38:13,2025-11-02 15:08:59.988359,https://www.jns.org/?p=601439
"In newly released recordings, Rabin counsels to plan for peace but expect the unexpected","Marking 30 years since assassination, publication of archival audio shines light on fighter and peacemaker's dual-track strategy, still strikingly relevant today The post In newly released recordings, Rabin counsels to plan for peace but expect the unexpected appeared first on The Times of Israel .",https://www.timesofisrael.com/in-new-recordings-rabin-heard-counseling-to-plan-for-peace-but-expect-the-unexpected/,Times of Israel,,2025-11-02T14:12:56,2025-11-02 15:08:54.447603,https://www.timesofisrael.com/?p=3678157
Model Leen Peer named as suspect in murder case after gag order lifted,"Peer, along with 3 others, suspected of having stabbed Shalom Nissim who then fell to his death from balcony of model's apartment after drug-fueled argument The post Model Leen Peer named as suspect in murder case after gag order lifted appeared first on The Times of Israel .",https://www.timesofisrael.com/model-leen-peer-named-as-suspect-in-murder-case-after-gag-order-lifted/,Times of Israel,,2025-11-02T14:41:12,2025-11-02 15:08:54.447552,https://www.timesofisrael.com/?p=3679195
Israeli settlers filmed torturing lambs in a Palestinian-owned pen in the West Bank,"The videos from the southern West Bank show masked Israeli settlers entering the sheep pen, abusing and injuring lambs on the ground. Human rights activists say that settler violence against Palestinian flocks in the West Bank has worsened recently",https://www.haaretz.com/israel-news/2025-11-02/ty-article/.premium/israeli-settlers-filmed-torturing-lambs-in-a-palestinian-owned-pen-in-the-west-bank/0000019a-4415-d151-adbb-773722bb0000,Haaretz,Matan Golan,2025-11-02T13:28:01,2025-11-02 14:08:52.158603,https://www.haaretz.com/israel-news/2025-11-02/ty-article/.premium/israeli-settlers-filmed-torturing-lambs-in-a-palestinian-owned-pen-in-the-west-bank/0000019a-4415-d151-adbb-773722bb0000
"Newly released recordings of Yitzhak Rabin: Israel wouldn't exist without military might, but the goal is peace","Audio recordings have been newly released to coincide with the 30th anniversary of Yitzhak Rabin's assassination. The former chief of staff and prime minister talks about balancing military might with a diplomatic process, the importance of U.S. ties and the need to strengthen ground forces",https://www.haaretz.com/israel-news/2025-11-02/ty-article-magazine/.premium/yitzhak-rabin-israel-wouldnt-exist-without-military-might-but-the-goal-is-peace/0000019a-4483-d1db-abda-d6cf42e00000,Haaretz,Ofer Aderet,2025-11-02T14:00:17,2025-11-02 14:08:52.158565,https://www.haaretz.com/israel-news/2025-11-02/ty-article-magazine/.premium/yitzhak-rabin-israel-wouldnt-exist-without-military-might-but-the-goal-is-peace/0000019a-4483-d1db-abda-d6cf42e00000
"Protesters at PM’s office: ‘Finish the job, dismantle Hamas now’","Knesset members and protesters demanded that Israel's government fulfill the war aims it set for itself at the start of the war. The post Protesters at PM’s office: &#8216;Finish the job, dismantle Hamas now&#8217; appeared first on JNS.org .",https://www.jns.org/protesters-at-pms-office-finish-the-job-dismantle-hamas-now/,JNS,David Isaac,2025-11-02T13:14:38,2025-11-02 14:08:44.691640,https://www.jns.org/?p=601384
Netanyahu: Disgraced military advocate general caused state’s worst PR crisis,"“This requires an independent, impartial investigation, and I expect such an investigation to take place,” the premier added. The post Netanyahu: Disgraced military advocate general caused state&#8217;s worst PR crisis appeared first on JNS.org .",https://www.jns.org/netanyahu-disgraced-top-idf-lawyer-caused-states-worst-pr-crisis/,JNS,JNS Staff,2025-11-02T13:20:07,2025-11-02 14:08:44.691598,https://www.jns.org/?p=601401
Daily Briefing Nov. 2: Day 758 – Scandal rocks IDF even as Hamas reroots in Gaza,"Military correspondent Emanuel Fabian describes terror group's current military capabilities, intensified strikes in south Lebanon, and a crisis in the Military Advocate General's office The post Daily Briefing Nov. 2: Day 758 &#8211; Scandal rocks IDF even as Hamas reroots in Gaza appeared first on The Times of Israel .",https://www.timesofisrael.com/daily-briefing-nov-2-day-758-scandal-rocks-idf-even-as-hamas-reroots-in-gaza/,Times of Israel,,2025-11-02T13:24:18,2025-11-02 14:08:39.302897,https://www.timesofisrael.com/?p=3679202&preview=true&preview_id=3679202
"Celebrate love, support Israel. Find your perfect ketubah at Ketubah.com - Sponsored Content","Ketubah.com is the trusted home for meaningful, handcrafted ketubahs celebrating love, tradition, and identity. Find your ketubah and support Israeli artists in the process. The post Celebrate love, support Israel. Find your perfect ketubah at Ketubah.com appeared first on The Times of Israel .",https://toi.li/9oSyi7,Times of Israel,,2025-11-02T13:46:16,2025-11-02 14:08:39.302850,https://www.timesofisrael.com/?post_type=spotlight&p=3679279
Philanthropist Sylvan Adams pledges $100 million to Iranian missile-struck Soroka hospital,"Canadian Israeli philanthropist Sylvan Adams committed $100 million to help rebuild the southern Israeli city of Beersheva’s Soroka Medical Center, which was seriously damaged this summer in an Iranian missile strike. The donation, which was announced on Sunday during the Israeli government’s weekly meeting, matches a commitment by the Israeli government and one by Clalit... Read More The post Philanthropist Sylvan Adams pledges $100 million to Iranian missile-struck Soroka hospital appeared first on eJewishPhilanthropy .",https://ejewishphilanthropy.com/philanthropist-sylvan-adams-pledges-100-million-to-iranian-missile-struck-soroka-hospital/,eJewish Philanthropy,Judah Ari Gross,2025-11-02T13:54:43,2025-11-02 14:08:31.908361,https://ejewishphilanthropy.com/?p=165415
There was a fox in Bethsaida,"In the dead of night, an unexpected animal walked on the freshly mortared wall of a Byzantine church complex by the shore of the Sea of Galilee 1,700 years ago",https://www.haaretz.com/archaeology/2025-11-02/ty-article/there-was-a-fox-in-bethsaida/0000019a-4400-dec4-a7db-f7f3f7680000,Haaretz,Ruth Schuster,2025-11-02T12:41:50,2025-11-02 13:12:31.791075,https://www.haaretz.com/archaeology/2025-11-02/ty-article/there-was-a-fox-in-bethsaida/0000019a-4400-dec4-a7db-f7f3f7680000
"Two leaks, two tales: Why the Gazan abuse video and the Bild Hamas document are different","Members of Prime Minister Benjamin Netanyahu's circle are seeking the same strict conditions for those who leaked the video of IDF soldiers abusing a Palestinian detainee as were imposed on his associates who leaked confidential IDF documents to Bild. Though both involve security leaks, key differences remain",https://www.haaretz.com/haaretz-explains/2025-11-02/ty-article/.premium/two-leaks-two-tales-why-the-gazan-abuse-video-and-the-bild-hamas-document-are-different/0000019a-43ae-dec4-a7db-f7ffd9f80000,Haaretz,Bar Peleg,2025-11-02T13:02:34,2025-11-02 13:12:31.791039,https://www.haaretz.com/haaretz-explains/2025-11-02/ty-article/.premium/two-leaks-two-tales-why-the-gazan-abuse-video-and-the-bild-hamas-document-are-different/0000019a-43ae-dec4-a7db-f7ffd9f80000
IDF intercepts drone smuggling guns into Israel,Eight firearms were recovered by Israeli forces. The post IDF intercepts drone smuggling guns into Israel appeared first on JNS.org .,https://www.jns.org/idf-intercepts-drone-smuggling-guns-into-israel/,JNS,JNS Staff,2025-11-02T12:25:38,2025-11-02 13:12:24.338009,https://www.jns.org/?p=601392
Arab-Israeli teen charged over Al-Qaeda plot to kill Netanyahu,"The 14-year-old resident of Israel's center also contacted Hamas and carried out espionage activities, according to his indictment. The post Arab-Israeli teen charged over Al-Qaeda plot to kill Netanyahu appeared first on JNS.org .",https://www.jns.org/arab-israeli-teen-charged-over-al-qaeda-plot-to-kill-netanyahu/,JNS,JNS Staff,2025-11-02T11:20:52,2025-11-02 12:12:52.418787,https://www.jns.org/?p=601373
