title,description,link,source,author,published,scraped_at,guid
"Netanyahu criticizes Trump over Gaza Board of Peace staffing, says he was not consulted; Source: The rebuke is for show","The White House named advisers on the next steps of the Gaza cease-fire, including Turkish and Qatari officials. Netanyahu said he was not consulted and that the inclusion of unspecified members was 'contrary to Israeli policy,' but a source said that he was consulted and was aware of the picks",https://www.haaretz.com/gaza/2026-01-17/ty-article/.premium/netanyahu-criticizes-trump-over-gaza-board-of-peace-staffing-source-rebuke-is-for-show/0000019b-ccd7-d484-a9bf-ceff970b0000,Haaretz,Liza Rozovsky,2026-01-17T18:45:52,2026-01-17 19:08:53.779537,https://www.haaretz.com/gaza/2026-01-17/ty-article/.premium/netanyahu-criticizes-trump-over-gaza-board-of-peace-staffing-source-rebuke-is-for-show/0000019b-ccd7-d484-a9bf-ceff970b0000
Protesters Rally in Denmark and Greenland Against Trump Annexation Threat,Protesters in Denmark and Greenland demonstrated on Saturday against President Donald Trump&#8217;s demand that the Arctic island be ceded to...,https://www.algemeiner.com/2026/01/17/protesters-rally-in-denmark-and-greenland-against-trump-annexation-threat/,Algemeiner,Reuters and Algemeiner Staff,2026-01-17T18:13:33,2026-01-17 19:08:48.479395,https://www.algemeiner.com/?p=763128
Trump calls for ‘new leadership in Iran’,"Ayatollah Ali Khamenei is “a sick man who should run his country properly and stop killing people,” the U.S. president said. The post Trump calls for ‘new leadership in Iran’ appeared first on JNS.org .",https://www.jns.org/trump-calls-for-new-leadership-in-iran/,JNS,JNS Staff,2026-01-17T18:21:07,2026-01-17 19:08:46.082289,https://www.jns.org/?p=628201
"In first, Trump appears to call for end of ‘sick man’ Khamenei’s rule in Iran","In interview, US president says 'best decision' Iranian supreme leader ever made was not hanging political dissidents, calls Iran 'worst place to live anywhere in the world' The post In first, Trump appears to call for end of &#8216;sick man&#8217; Khamenei&#8217;s rule in Iran appeared first on The Times of Israel .",https://www.timesofisrael.com/in-first-trump-appears-to-call-for-end-of-sick-man-khameneis-rule-in-iran/,Times of Israel,,2026-01-17T18:24:41,2026-01-17 19:08:41.585353,https://www.timesofisrael.com/?post_type=liveblog_entry&p=3736035
Iran’s Leader Khamenei Accuses Trump of Inciting Deadly Protests,Iran&#8217;s Supreme Leader Ayatollah Ali Khamenei on Saturday blamed President Donald Trump for weeks of demonstrations that rights groups said have...,https://www.algemeiner.com/2026/01/17/irans-leader-khamenei-accuses-trump-of-inciting-deadly-protests/,Algemeiner,Reuters and Algemeiner Staff,2026-01-17T17:46:26,2026-01-17 18:12:39.457126,https://www.algemeiner.com/?p=763119
Israel Says US Gaza Executive Board Composition Against Its Policy,Prime Minister Benjamin Netanyahu&#8217;s office said on Saturday that this week&#8217;s Trump administration announcement on the composition of a Gaza...,https://www.algemeiner.com/2026/01/17/israel-says-us-gaza-executive-board-composition-against-its-policy/,Algemeiner,Reuters and Algemeiner Staff,2026-01-17T17:58:30,2026-01-17 18:12:39.457089,https://www.algemeiner.com/?p=763125
"Syrian, Kurdish forces clash west of the Euphrates","Fighting resumed in northern Syria a day after President Ahmed al-Sharaa declared national recognition of the Kurdish language. The post Syrian, Kurdish forces clash west of the Euphrates appeared first on JNS.org .",https://www.jns.org/syrian-kurdish-forces-clash-west-of-the-euphrates/,JNS,JNS Staff,2026-01-17T17:37:40,2026-01-17 18:12:37.113788,https://www.jns.org/?p=628187
Netanyahu’s office: Trump’s Gaza committee contradicts Israel’s policy,"The matter will be discussed with Secretary Marco Rubio, the premier stated. The post Netanyahu&#8217;s office: Trump’s Gaza committee contradicts Israel’s policy appeared first on JNS.org .",https://www.jns.org/netanyahus-office-trumps-gaza-committee-contradicts-israels-policy/,JNS,JNS Staff,2026-01-17T18:02:25,2026-01-17 18:12:37.113748,https://www.jns.org/?p=628194
An undercover reporter joined France’s anti-Israel movement. Here’s what she found,"In her explosive book 'Les Nouveaux Antisemites,' journalist Nora Bussigny reveals pervasive hatred of Jews and Israel on the radical left and worries for country’s future The post An undercover reporter joined France&#8217;s anti-Israel movement. Here&#8217;s what she found appeared first on The Times of Israel .",https://www.timesofisrael.com/an-undercover-reporter-joined-frances-anti-israel-movement-heres-what-she-found/,Times of Israel,,2026-01-17T17:25:05,2026-01-17 18:12:32.853079,https://www.timesofisrael.com/?p=3701894
"Live the Tel Aviv dream, just steps from the sea. - Sponsored Content","A rare opportunity to own a spacious garden apartment or a breathtaking penthouse in Israel’s most vibrant city. The post Live the Tel Aviv dream, just steps from the sea. appeared first on The Times of Israel .",https://www.timesofisrael.com/spotlight/live-the-tel-aviv-dream-just-steps-from-the-sea/,Times of Israel,,2026-01-17T17:48:43,2026-01-17 18:12:32.853023,https://www.timesofisrael.com/?post_type=spotlight&p=3736039
"Khamenei blames US, Israel for thousands of Iranian deaths","“We consider the U.S. president a criminal,” the supreme leader said, as reports indicated the national unrest has been quelled. The post Khamenei blames US, Israel for thousands of Iranian deaths appeared first on JNS.org .",https://www.jns.org/khamenei-blames-us-israel-for-thousands-of-iranian-deaths/,JNS,JNS Staff,2026-01-17T16:34:28,2026-01-17 17:08:40.381059,https://www.jns.org/?p=628172
‘Make America Go Away’: Danes protest against US push to take over Greenland,Delegation of members of US Congress tells Greenlandic and Danish politicians that many Americans oppose Trump's stance on Arctic island The post &#8216;Make America Go Away&#8217;: Danes protest against US push to take over Greenland appeared first on The Times of Israel .,https://www.timesofisrael.com/make-america-go-away-danes-protest-against-us-push-to-take-over-greenland/,Times of Israel,,2026-01-17T16:29:50,2026-01-17 17:08:35.894363,https://www.timesofisrael.com/?p=3735989
Investing in Israel Starts Here - Sponsored Content,"Israel bonds are more than an investment. They fuel Israel’s growth, support its economy, and offer a reliable, time-tested way to stand with the Jewish State. The post Investing in Israel Starts Here appeared first on The Times of Israel .",https://toi.li/1iqg5i,Times of Israel,,2026-01-17T16:37:53,2026-01-17 17:08:35.894313,https://www.timesofisrael.com/?post_type=spotlight&p=3736013
"US invites Erdoğan to join Board of Peace, Turkey says","The White House released a list of members of the technocratic body set to govern Gaza, including officials from Turkey, Qatar and Egypt. The post US invites Erdoğan to join Board of Peace, Turkey says appeared first on JNS.org .",https://www.jns.org/us-invites-erdogan-to-join-board-of-peace-turkey-says/,JNS,JNS Staff,2026-01-17T15:52:14,2026-01-17 16:09:37.100549,https://www.jns.org/?p=628161
Egyptian President Sissi thanks Trump for offer to mediate with Ethiopia,"Cairo and Addis Ababa in years-long dispute over sharing water from Grand Ethiopian Renaissance Dam, which would double electricity production in Ethiopia The post Egyptian President Sissi thanks Trump for offer to mediate with Ethiopia appeared first on The Times of Israel .",https://www.timesofisrael.com/egyptian-president-el-sissi-thanks-trump-for-offer-to-mediate-with-ethiopia/,Times of Israel,,2026-01-17T15:16:40,2026-01-17 16:09:32.469548,https://www.timesofisrael.com/?p=3735973
"‘We are open to normal relations with Israel,’ says Qatar opposition leader","Exiled Qatar National Democratic Party head Khalid Al-Hail condemns Hamas, exposes royal family’s terror funding. The post ‘We are open to normal relations with Israel,’ says Qatar opposition leader appeared first on JNS.org .",https://www.jns.org/we-are-open-to-normal-relations-with-israel-says-qatar-opposition-leader/,JNS,Shachar Kleiman,2026-01-17T14:54:28,2026-01-17 15:09:00.539301,https://www.jns.org/?p=627965
"With appointment to Gaza Board of Peace, Tony Blair returns to Middle East limelight","Former British prime minister widely criticized for having the UK join the US in its 2003 invasion of Iraq; Blair has remained active in the region as an envoy and consultant The post With appointment to Gaza Board of Peace, Tony Blair returns to Middle East limelight appeared first on The Times of Israel .",https://www.timesofisrael.com/with-appointment-to-gaza-board-of-peace-tony-blair-returns-to-middle-east-limelight/,Times of Israel,,2026-01-17T14:46:20,2026-01-17 15:08:56.046308,https://www.timesofisrael.com/?p=3735956
The mysterious case of Barbra Streisand and the missing half-pound of Zabar’s sturgeon,"The whole story of Barbra Streisand and the sturgeon began a few months ago on a Thursday when I was at my regular spot at the fish counter. A very pleasant, attractive woman ordered a pound of Nova and, before Slim, my long sharp slicing knife, and I started our journey through the salmon, she... The post The mysterious case of Barbra Streisand and the missing half-pound of Zabar&#8217;s sturgeon appeared first on The Forward .",https://forward.com/culture/797205/barbra-streisand-lox-sturgeon-zabars/,The Forward,Len Berk,2026-01-17T14:30:03,2026-01-17 15:08:53.947031,https://forward.com/?p=797205
"Khamenei calls Trump a ‘criminal,’ blames him for protest casualties and damage","'Iranian nation must break the back of the seditionists just as it broke the back of the sedition,' says Iran's supreme leader, alluding to 'several thousand' killed The post Khamenei calls Trump a ‘criminal,’ blames him for protest casualties and damage appeared first on The Times of Israel .",https://www.timesofisrael.com/khamenei-calls-trump-a-criminal-blames-him-for-protest-casualties-and-damage/,Times of Israel,,2026-01-17T13:55:33,2026-01-17 14:08:51.863101,https://www.timesofisrael.com/?p=3735940
"'Israeli liberals must recognize their true enemy: Not Bibi supporters, but religious Zionism and the settler movement'","The idea of seeking social 'unity' is a fraud and it's dismantling Israel from within, says political philosopher Assaf Sharon",https://www.haaretz.com/israel-news/2026-01-17/ty-article-magazine/.highlight/time-for-israeli-liberals-to-recognize-their-true-enemy/0000019b-cba7-decf-a99f-cbffcd5d0000,Haaretz,Ayelett Shani,2026-01-17T12:38:33,2026-01-17 13:16:51.328093,https://www.haaretz.com/israel-news/2026-01-17/ty-article-magazine/.highlight/time-for-israeli-liberals-to-recognize-their-true-enemy/0000019b-cba7-decf-a99f-cbffcd5d0000
Hapoel Tel Aviv reclaims EuroLeague lead with fourth-quarter rally,"Hapoel Tel Aviv overcame a 12-point deficit to beat Villeurbanne 81–73 in France, moving to the top of the EuroLeague standings. Daniel Oturu led the scorers with 18 points, followed by 17 points by Elijah Bryant",https://www.haaretz.com/israel-news/sports/2026-01-17/ty-article/.premium/hapoel-tel-aviv-reclaims-euroleague-lead-with-fourth-quarter-rally/0000019b-cb40-decf-a99f-cb78d8b00000,Haaretz,Haaretz Sports Staff,2026-01-17T12:46:28,2026-01-17 13:16:51.328053,https://www.haaretz.com/israel-news/sports/2026-01-17/ty-article/.premium/hapoel-tel-aviv-reclaims-euroleague-lead-with-fourth-quarter-rally/0000019b-cb40-decf-a99f-cb78d8b00000
Iranian regime plans to permanently cut people off from internet — watchdog,"Blackout imposed amid brutal crackdown likely to last until March 20, and authorities are implementing plan to turn country into a 'communication black hole,' says Filterwatch The post Iranian regime plans to permanently cut people off from internet &#8212; watchdog appeared first on The Times of Israel .",https://www.timesofisrael.com/iranian-regime-plans-to-permanently-cut-people-off-from-internet-watchdog/,Times of Israel,,2026-01-17T12:09:37,2026-01-17 13:16:38.483328,https://www.timesofisrael.com/?post_type=liveblog_entry&p=3735896
Syrian government forces enter towns in north after Kurdish fighters withdraw,Two soldiers said killed in latest clash as Damascus and Kurdish-led SDF trade blame for violating agreement that followed deadly fighting in Aleppo The post Syrian government forces enter towns in north after Kurdish fighters withdraw appeared first on The Times of Israel .,https://www.timesofisrael.com/syrian-government-forces-enter-towns-in-north-after-kurdish-fighters-withdraw/,Times of Israel,,2026-01-17T12:38:35,2026-01-17 13:16:38.483283,https://www.timesofisrael.com/?p=3735910
Apparent human fetus found in drain under Hadera residential building,Residents said to have discovered 5- to 6-week-old fetus in sewer after days of plumbing issues; unclear if it was aborted or miscarried The post Apparent human fetus found in drain under Hadera residential building appeared first on The Times of Israel .,https://www.timesofisrael.com/apparent-human-fetus-found-in-drain-under-hadera-residential-building/,Times of Israel,,2026-01-17T13:00:15,2026-01-17 13:16:38.483233,https://www.timesofisrael.com/?p=3735930
"Brutal beatings, arson and impunity: A Palestinian plant nursery becomes a target for settler pogroms","After setting fire last fall to one of the largest and oldest plant nurseries in the West Bank, causing millions of shekels in damage, settlers returned to the site this month, torching cars and brutally attacking an older worker",https://www.haaretz.com/israel-news/twilight-zone/2026-01-17/ty-article-magazine/.highlight/brutal-beatings-and-arson-a-palestinian-plant-nursery-is-targeted-by-settler-pogroms/0000019b-cb28-d810-a99f-dbfc54a30000,Haaretz,Gideon Levy,2026-01-17T11:10:14,2026-01-17 12:14:46.321891,https://www.haaretz.com/israel-news/twilight-zone/2026-01-17/ty-article-magazine/.highlight/brutal-beatings-and-arson-a-palestinian-plant-nursery-is-targeted-by-settler-pogroms/0000019b-cb28-d810-a99f-dbfc54a30000
"Trump's Gaza Board of Peace aims to rival UN, charter shows","The document, sent to dozens of heads of state, emphasizes the need for a 'more nimble and effective international peace-building body,' calling to 'depart from institutions that have too often failed.' Notably, the document does not mention Gaza by name",https://www.haaretz.com/world-news/2026-01-17/ty-article/.premium/trumps-proposed-gaza-board-of-peace-aims-to-rival-un-charter-suggests/0000019b-cb7f-d810-a99f-dbff6b830000,Haaretz,Liza Rozovsky,2026-01-17T11:13:57,2026-01-17 12:14:46.321848,https://www.haaretz.com/world-news/2026-01-17/ty-article/.premium/trumps-proposed-gaza-board-of-peace-aims-to-rival-un-charter-suggests/0000019b-cb7f-d810-a99f-dbff6b830000
Larry Ellison renamed superyacht whose name backwards was ‘I’m a Nazi’,"Superyacht Izanami, originally built for a Japanese businessman, was named after Shinto deity, but Jewish billionaire rechristened it after local press pointed out reverse of name The post Larry Ellison renamed superyacht whose name backwards was ‘I’m a Nazi’ appeared first on The Times of Israel .",https://www.timesofisrael.com/larry-ellison-renamed-superyacht-whose-name-backwards-was-im-a-nazi/,Times of Israel,,2026-01-17T11:03:15,2026-01-17 11:08:29.781343,https://www.timesofisrael.com/?p=3735886
US AG says she’ll seek death penalty for suspect in killing of Israeli embassy staffers,Pam Bondi tells Florida pro-Israel conference that Sarah Lynn Milgrim and Yaron Lischinsky were 'murdered because they were Jewish' The post US AG says she&#8217;ll seek death penalty for suspect in killing of Israeli embassy staffers appeared first on The Times of Israel .,https://www.timesofisrael.com/us-ag-says-shell-seek-death-penalty-for-suspect-in-killing-of-israeli-embassy-staffers/,Times of Israel,,2026-01-17T09:21:23,2026-01-17 10:09:24.919123,https://www.timesofisrael.com/?post_type=liveblog_entry&p=3735844
"Family of Iranian protester searched for body in pile of corpses, buried her on a roadside","Friends of Robina Aminian, 23, told family she was shot in back of the head at close range during Tehran rally; mother 'looked through so many beautiful faces' before finding her The post Family of Iranian protester searched for body in pile of corpses, buried her on a roadside appeared first on The Times of Israel .",https://www.timesofisrael.com/family-of-iranian-protester-searched-for-body-in-pile-of-corpses-buried-her-on-a-roadside/,Times of Israel,,2026-01-17T09:48:10,2026-01-17 10:09:24.919074,https://www.timesofisrael.com/?p=3735869
‘Holding Liat’: Post-Oct. 7 anguish and inconvenient truths,Jordan Hoffman and Amanda Borschel-Dan on the Darren Aronofsky-produced film that records an Israeli-American clan from Nir Oz's struggle to free their loved ones taken hostage in October 2023 The post &#8216;Holding Liat&#8217;: Post-Oct. 7 anguish and inconvenient truths appeared first on The Times of Israel .,https://www.timesofisrael.com/holding-liat-post-oct-7-anguish-and-inconvenient-truths/,Times of Israel,,2026-01-17T08:12:28,2026-01-17 09:09:13.900077,https://www.timesofisrael.com/?p=3734075&preview=true&preview_id=3734075
"Deadly crackdown appears to have quashed Iran protests, residents say","Tehran residents describe large troop deployment in capital, 'massive disappointment and disillusionment'; hard-line cleric threatens Trump, urges death to detained protesters The post Deadly crackdown appears to have quashed Iran protests, residents say appeared first on The Times of Israel .",https://www.timesofisrael.com/deadly-crackdown-appears-to-have-quashed-iran-protests-residents-say/,Times of Israel,,2026-01-17T08:46:43,2026-01-17 09:09:13.900031,https://www.timesofisrael.com/?p=3735815
"Israeli researcher finds that by eavesdropping, ‘genius’ dogs learn words like toddlers","In Shany Dror's study, super-smart canines had 90% accuracy in fetching toys whose names they learned directly or overheard; findings shed light on how language learning may have evolved The post Israeli researcher finds that by eavesdropping, &#8216;genius&#8217; dogs learn words like toddlers appeared first on The Times of Israel .",https://www.timesofisrael.com/israeli-researcher-finds-that-by-eavesdropping-genius-dogs-learn-words-like-toddlers/,Times of Israel,,2026-01-17T07:13:18,2026-01-17 08:11:37.660519,https://www.timesofisrael.com/?p=3733546
"Israel Museum celebrates 60 with towering art, color-drenched canvases and historical prints","Country's most prominent cultural institution marks milestone with three new exhibits, including 'Ages of the World,' an Anselm Kiefer installation donated to the museum The post Israel Museum celebrates 60 with towering art, color-drenched canvases and historical prints appeared first on The Times of Israel .",https://www.timesofisrael.com/israel-museum-celebrates-60-with-towering-art-color-drenched-canvases-and-historical-prints/,Times of Israel,,2026-01-17T07:42:16,2026-01-17 08:11:37.660465,https://www.timesofisrael.com/?p=3727746
"White House says Rubio, Witkoff, Blair to join Trump-led 'Board of Peace' to oversee postwar Gaza","Trump's son-in-law, Jared Kushner, will also be a member of the board's executive committee, alongside key financial executives and officials. Trump also appointed a major general who monitered the deal between Israel and Lebanon to lead the international stabilization forces",https://www.haaretz.com/gaza/2026-01-17/ty-article/.premium/white-house-says-rubio-witkoff-blair-to-join-trump-led-board-to-oversee-postwar-gaza/0000019b-c959-d810-a99f-dbfdb5650000,Haaretz,Haaretz,2026-01-17T06:45:57,2026-01-17 07:09:56.998398,https://www.haaretz.com/gaza/2026-01-17/ty-article/.premium/white-house-says-rubio-witkoff-blair-to-join-trump-led-board-to-oversee-postwar-gaza/0000019b-c959-d810-a99f-dbfdb5650000
UK police arrest protester who raised shah-era flag over Iran’s London embassy,Footage shows man removing Islamic Republic banner for pre-revolution tri-color; police say several others also arrested after objects were thrown at officers at protest The post UK police arrest protester who raised shah-era flag over Iran&#8217;s London embassy appeared first on The Times of Israel .,https://www.timesofisrael.com/uk-police-arrest-protester-who-raised-shah-era-flag-over-irans-london-embassy/,Times of Israel,,2026-01-17T06:58:29,2026-01-17 07:09:44.709514,https://www.timesofisrael.com/?p=3735829
"Alex Bregman, who drew Jewish star on his cap after Oct. 7, inks $175M deal with Cubs","Contract is the second-largest ever for a Jewish baseball player; his father has described his major league career as 'the fulfillment of four generations of short Jewish Bregmans' The post Alex Bregman, who drew Jewish star on his cap after Oct. 7, inks $175M deal with Cubs appeared first on The Times of Israel .",https://www.timesofisrael.com/alex-bregman-who-drew-jewish-star-on-his-cap-after-oct-7-inks-175m-deal-with-cubs/,Times of Israel,,2026-01-17T04:34:56,2026-01-17 05:09:56.512332,https://www.timesofisrael.com/?p=3735804
White House announces members of Trump-led Board of Peace to run Gaza as cease-fire moves to phase two,,https://www.haaretz.com/israel-news/2026-01-17/ty-article-live/white-house-announces-members-of-trump-led-board-of-peace-to-run-gaza/0000019b-c9e9-d641-a9bf-cbf906ac0005,Haaretz,Haaretz,2026-01-17T03:15:30,2026-01-17 03:36:15.337853,https://www.haaretz.com/israel-news/2026-01-17/ty-article-live/white-house-announces-members-of-trump-led-board-of-peace-to-run-gaza/0000019b-c9e9-d641-a9bf-cbf906ac0005
"US unveils key Gaza panel with prominent roles given to Israel critics Qatar, Turkey","Board of Peace executive committee responsible for overseeing postwar management of Gaza also includes representatives from UAE, Egypt along pair of prominent businessmen The post US unveils key Gaza panel with prominent roles given to Israel critics Qatar, Turkey appeared first on The Times of Israel .",https://www.timesofisrael.com/us-unveils-key-gaza-panel-with-prominent-roles-given-to-israel-critics-qatar-turkey/,Times of Israel,,2026-01-17T02:53:53,2026-01-17 03:36:01.926575,https://www.timesofisrael.com/?p=3735772
"Why did Israel sell arms to the ayatollahs' Iran, its bitterest enemy?","In 1979, the last Israelis were expelled from Iran and the new regime declared a complete severing of ties. Yet this didn't prevent Israel from selling weapons and ammunition to the ayatollahs' regime a few years later. The full details of the secret ties between the two countries may come to light if the regime in Tehran falls",https://www.haaretz.com/israel-news/2026-01-16/ty-article-magazine/.premium/why-did-israel-sell-arms-to-the-ayatollahs-iran-its-bitterest-enemy/0000019b-bbf8-d66b-a5df-bff8ad290000,Haaretz,Ofer Aderet,2026-01-16T13:03:00,2026-01-17 02:43:06.288301,https://www.haaretz.com/israel-news/2026-01-16/ty-article-magazine/.premium/why-did-israel-sell-arms-to-the-ayatollahs-iran-its-bitterest-enemy/0000019b-bbf8-d66b-a5df-bff8ad290000
Nick Fuentes clarifies his problem with Trump ‘is that he is not Hitler’,"Avowed antisemite says there is 'sort of a big difference' between his views and those of the left, as he gains more traction on right and after drawing some progressive praise The post Nick Fuentes clarifies his problem with Trump ‘is that he is not Hitler’ appeared first on The Times of Israel .",https://www.timesofisrael.com/nick-fuentes-clarifies-his-problem-with-trump-is-that-he-is-not-hitler/,Times of Israel,,2026-01-17T01:44:20,2026-01-17 02:42:52.847261,https://www.timesofisrael.com/?p=3735783
"Jewish caricature in Ukrainian Christmas tradition appears at NJ church, drawing criticism","Church shares video of man dressed as Hasidic Jew who refers to himself as a 'zhyd' while carrying a sack of coins and dancing with the devil The post Jewish caricature in Ukrainian Christmas tradition appears at NJ church, drawing criticism appeared first on The Times of Israel .",https://www.timesofisrael.com/jewish-caricature-in-ukrainian-christmas-tradition-appears-at-nj-church-drawing-criticism/,Times of Israel,,2026-01-17T00:53:27,2026-01-17 01:37:29.594825,https://www.timesofisrael.com/?p=3735778
NYC's first Jewish council speaker introduces plan to combat rising antisemitism,"Council Speaker Julie Menin unveiled a five-point plan to tackle antisemitism in the city, including $1.25 million dedicated to Holocaust education. 'City Council is taking decisive action to ensure we have the tools to confront antisemitism wherever it appears,' she said",https://www.haaretz.com/us-news/2026-01-17/ty-article/.premium/nycs-first-jewish-council-speaker-introduces-plan-to-combat-rising-antisemitism/0000019b-c83f-d85c-a9fb-f97fb4ba0000,Haaretz,Etan Nechin,2026-01-16T23:17:26,2026-01-17 00:38:36.795738,https://www.haaretz.com/us-news/2026-01-17/ty-article/.premium/nycs-first-jewish-council-speaker-introduces-plan-to-combat-rising-antisemitism/0000019b-c83f-d85c-a9fb-f97fb4ba0000
"Despite operation's end, Israel Police continues to raid Bedouin village Tarabin, residents say","Local residents told Haaretz that officers threw stun grenades and flares and fired tear gas, and even damaged the local mosque. 'We hear explosions, as if it's war,' one resident said. 'I don't understand what they want from us. I don't know who to turn to anymore'",https://www.haaretz.com/israel-news/2026-01-17/ty-article/.premium/despite-operations-end-israel-police-continues-to-raid-bedouin-village-tarabin/0000019b-c930-d641-a9bf-cbb0d7940000,Haaretz,Eden Solomon,2026-01-17T00:17:46,2026-01-17 00:38:36.795697,https://www.haaretz.com/israel-news/2026-01-17/ty-article/.premium/despite-operations-end-israel-police-continues-to-raid-bedouin-village-tarabin/0000019b-c930-d641-a9bf-cbb0d7940000
