title,description,link,source,author,published,scraped_at,guid
"Burn towns, slaughter, broadcast: 2022 Sinwar memo said to detail Hamas plan for Oct. 7","'Kill everyone you encounter': Recovered this year in an IDF raid on a tunnel used by Sinwar's brother, the document mirrors intercepted Hamas field orders sent that day, NYT reports The post Burn towns, slaughter, broadcast: 2022 Sinwar memo said to detail Hamas plan for Oct. 7 appeared first on The Times of Israel .",https://www.timesofisrael.com/burn-towns-slaughter-broadcast-2022-sinwar-memo-said-to-detail-hamas-plan-for-oct-7/,Times of Israel,,2025-10-11T18:20:32,2025-10-11 19:08:22.885276,https://www.timesofisrael.com/?p=3662082
Reservist succumbs to wounds sustained in accidental grenade blast in Gaza this week,"IDF has established panel of experts led by a colonel to examine incident, in which Master Sgt. (res.) Shmuel Gad Rahamim was killed, with 2 other troops hurt The post Reservist succumbs to wounds sustained in accidental grenade blast in Gaza this week appeared first on The Times of Israel .",https://www.timesofisrael.com/reservist-succumbs-to-wounds-sustained-in-accidental-grenade-blast-in-gaza-this-week/,Times of Israel,,2025-10-11T18:54:00,2025-10-11 19:08:22.885233,https://www.timesofisrael.com/?p=3662219
"Thousands of anti-Israel protesters march in London, argue Gaza ceasefire isn’t enough","Organizer claims US-backed deal doesn't address 'root causes of Israeli occupation and colonization of Palestine'; marchers scuffle with pro-Israel counterprotesters The post Thousands of anti-Israel protesters march in London, argue Gaza ceasefire isn&#8217;t enough appeared first on The Times of Israel .",https://www.timesofisrael.com/thousands-of-anti-israel-protesters-march-in-london-argue-gaza-ceasefire-isnt-enough/,Times of Israel,,2025-10-11T18:59:04,2025-10-11 19:08:22.885183,https://www.timesofisrael.com/?p=3662029
Israel's Smotrich: Not all IDF deployed to Gaza border on October 7 over 'deception' fears,"In an interview with the Israeli newspaper Yedioth Ahronoth, the far-right finance minister said that the attack was 'a grace from God, delivering a painful, severe slap, a great disaster with terrible consequences. This slap woke us up after many years of complacency'",https://www.haaretz.com/israel-news/2025-10-11/ty-article/.premium/israels-smotrich-not-all-idf-deployed-to-gaza-border-on-october-7-over-deception-fears/00000199-d421-d8a7-afdd-f7bd3f8b0000,Haaretz,Haaretz,2025-10-11T17:08:27,2025-10-11 18:09:50.443322,https://www.haaretz.com/israel-news/2025-10-11/ty-article/.premium/israels-smotrich-not-all-idf-deployed-to-gaza-border-on-october-7-over-deception-fears/00000199-d421-d8a7-afdd-f7bd3f8b0000
"Multiple concerts said canceled in Belgium, Turkey over performers’ Israel support","US metal band Disturbed and UK singer-songwriter Morrissey both have shows nixed, with reports saying images of past visits to Israel were the reason The post Multiple concerts said canceled in Belgium, Turkey over performers&#8217; Israel support appeared first on The Times of Israel .",https://www.timesofisrael.com/multiple-concerts-said-canceled-in-belgium-turkey-over-performers-israel-support/,Times of Israel,,2025-10-11T17:26:23,2025-10-11 18:09:38.377703,https://www.timesofisrael.com/?p=3661969
Sinwar Memo Obtained by IDF Reveals Hamas Chief Ordered ‘Shocking’ Violence on Oct. 7,i24 News &#8211; A handwritten memo authored by late Hamas chief Yahya Sinwar shows the arch terrorist&#8217;s instructions to his...,https://www.algemeiner.com/2025/10/11/sinwar-memo-obtained-by-idf-reveals-hamas-chief-ordered-shocking-violence-on-oct-7/,Algemeiner,i24 News and Algemeiner Staff,2025-10-11T16:23:15,2025-10-11 17:08:55.997771,https://www.algemeiner.com/?p=755145
Activist Laura Loomer Blasts Pentagon Over Planned Qatar Military Facility in Idaho,Far-right activist Laura Loomer slammed President Donald Trump&#8217;s administration on Friday over its deepening defense ties with Qatar and made...,https://www.algemeiner.com/2025/10/11/activist-laura-loomer-blasts-pentagon-over-planned-qatar-military-facility-in-idaho/,Algemeiner,Reuters and Algemeiner Staff,2025-10-11T16:39:41,2025-10-11 17:08:55.997738,https://www.algemeiner.com/?p=755147
Gazans Stream Back Home as Israel-Hamas Ceasefire Holds,"Thousands of Palestinians streamed north along the coast of Gaza on Saturday, trekking by foot, car and cart back to...",https://www.algemeiner.com/2025/10/11/gazans-stream-back-home-as-israel-hamas-ceasefire-holds/,Algemeiner,Reuters and Algemeiner Staff,2025-10-11T16:49:17,2025-10-11 17:08:55.997704,https://www.algemeiner.com/?p=755151
WATCH: Israelis gather at ‘Hostage Square’ in support of Trump deal,U.S. Middle East envoy Steve Witkoff was scheduled to address the crowd. The post WATCH: Israelis gather at ‘Hostage Square&#8217; in support of Trump deal appeared first on JNS.org .,https://www.jns.org/watch-israelis-gather-at-hostages-square-in-support-of-trump-deal/,JNS,,2025-10-11T16:56:03,2025-10-11 17:08:53.581508,https://www.jns.org/?p=594124
"Israel recovers Sinwar memo ordering Hamas attacks on Israeli civilians and communities on October 7, report says","The New York Times also published intercepted messages from Hamas commanders on October 7, ordering militants to take hostages and broadcast the attacks to rally Arab support. While the memo did not explicitly mention killing or abducting Israelis, it instructed militants to set neighborhoods ablaze and film the atrocities to sow fear and destabilize Israel",https://www.haaretz.com/israel-news/2025-10-11/ty-article/.premium/israel-recovers-sinwar-memo-detailing-plans-for-hamas-october-7-attack-report-shows/00000199-d3ac-d253-a3bd-f7ae27360000,Haaretz,Haaretz,2025-10-11T15:33:22,2025-10-11 16:09:14.496957,https://www.haaretz.com/israel-news/2025-10-11/ty-article/.premium/israel-recovers-sinwar-memo-detailing-plans-for-hamas-october-7-attack-report-shows/00000199-d3ac-d253-a3bd-f7ae27360000
"U.S. envoys Witkoff, Kushner to open Hostage Square rally ahead of expected Monday release","As Israel prepares for the return of the hostages on Monday, families say the fight 'is not over' until all 48 hostages, including the deceased, are returned home",https://www.haaretz.com/israel-news/2025-10-11/ty-article/.premium/u-s-envoys-witkoff-kushner-to-open-hostage-square-protest-ahead-of-mondays-release/00000199-d3bc-d8a7-afdd-f7bd4ea10000,Haaretz,Linda Dayan,2025-10-11T15:41:02,2025-10-11 16:09:14.496910,https://www.haaretz.com/israel-news/2025-10-11/ty-article/.premium/u-s-envoys-witkoff-kushner-to-open-hostage-square-protest-ahead-of-mondays-release/00000199-d3bc-d8a7-afdd-f7bd4ea10000
Indonesia bars Israeli gymnasts from World Championships,The Israel Gymnastics Federation said it will challenge the “outrageous decision.” The post Indonesia bars Israeli gymnasts from World Championships appeared first on JNS.org .,https://www.jns.org/indonesia-bars-israeli-gymnasts-from-world-championships/,JNS,,2025-10-11T16:00:08,2025-10-11 16:09:05.475670,https://www.jns.org/?p=594104
Witkoff visits Gaza base as ceasefire holds and displaced Palestinians return home,"US envoy, CENTCOM commander reportedly make trip to confirm IDF pullout; US troops begin arriving to monitor truce, as Gazans make their way back to ruins of their neighborhoods The post Witkoff visits Gaza base as ceasefire holds and displaced Palestinians return home appeared first on The Times of Israel .",https://www.timesofisrael.com/witkoff-visits-gaza-base-as-ceasefire-holds-and-displaced-palestinians-return-home/,Times of Israel,,2025-10-11T15:31:29,2025-10-11 16:09:00.732963,https://www.timesofisrael.com/?p=3662034
"Roei Shalev, who survived the Nova festival massacre, dies by suicide: 'Everything inside me is dead'","'I'm really sorry, I can't take this pain anymore,' wrote Roei Shalev, who survived the October 7 massacre but lost his partner, Mapal Adam, who was murdered by Hamas. In the two years that have passed, Shalev is said to be the second survivor of the festival to take his own life",https://www.haaretz.com/israel-news/2025-10-11/ty-article/.premium/survivor-of-nova-festival-massacre-dies-by-suicide-everything-inside-me-is-dead/00000199-d373-dde4-a7bd-db7f784f0000,Haaretz,Tom Levinson,2025-10-11T14:31:02,2025-10-11 15:08:44.228981,https://www.haaretz.com/israel-news/2025-10-11/ty-article/.premium/survivor-of-nova-festival-massacre-dies-by-suicide-everything-inside-me-is-dead/00000199-d373-dde4-a7bd-db7f784f0000
All Gaza hostages to return home by 6 on Monday morning,"Hamas is “unearthing” the captives, alive and deceased, “as we speak,” Trump tells reporters. The post All Gaza hostages to return home by 6 on Monday morning appeared first on JNS.org .",https://www.jns.org/all-gaza-hostages-to-return-home-by-6-on-monday-morning/,JNS,,2025-10-11T14:45:48,2025-10-11 15:08:36.279884,https://www.jns.org/?p=594089
Trump says hostages will be released Monday as he prepares to visit Israel the same day,"The U.S. president cited 'a consensus' on the next phases of his Gaza plan. After speaking at the Israeli Knesset, he will reportedly depart for Cairo for a high-level meeting with European and Arab leaders",https://www.haaretz.com/israel-news/2025-10-11/ty-article/.premium/trump-says-hostages-will-be-released-monday-as-he-prepares-to-visit-israel-the-same-day/00000199-d2d1-d7e9-adfd-dbf738d10000,Haaretz,Jonathan Lis,2025-10-11T13:33:44,2025-10-11 14:08:55.203263,https://www.haaretz.com/israel-news/2025-10-11/ty-article/.premium/trump-says-hostages-will-be-released-monday-as-he-prepares-to-visit-israel-the-same-day/00000199-d2d1-d7e9-adfd-dbf738d10000
Hostage families told release could happen any moment through Monday,"There is still no confirmed time for the return of the living hostages, to enable a coordinated release of all of them and to avoid delays or mishaps. The post Hostage families told release could happen any moment through Monday appeared first on JNS.org .",https://www.jns.org/hostage-families-told-release-could-happen-any-moment-through-monday/,JNS,,2025-10-11T13:22:17,2025-10-11 14:08:46.949102,https://www.jns.org/?p=594074
Herzog visits graves of soldiers slain in Hamas war,The Israeli president paid his respects “to honor and salute the heroes of Israel as we await the return of the kidnapped for whom they fought.” The post Herzog visits graves of soldiers slain in Hamas war appeared first on JNS.org .,https://www.jns.org/herzog-visits-graves-of-soldiers-slain-in-hamas-war/,JNS,JNS Staff,2025-10-11T13:43:00,2025-10-11 14:08:46.949054,https://www.jns.org/?p=594076
"‘Thank you, people of Israel’: Families forum organizes mass rally as hostages set to come home","Atmosphere in Hostages Square turns from somber to hopeful, but forum says struggle won't end until last captive is freed; Witkoff, Kushner expected to make appearance The post &#8216;Thank you, people of Israel&#8217;: Families forum organizes mass rally as hostages set to come home appeared first on The Times of Israel .",https://www.timesofisrael.com/masses-expected-at-rally-as-hostages-set-to-come-home-families-thank-you-people-of-israel/,Times of Israel,,2025-10-11T13:51:48,2025-10-11 14:08:42.346798,https://www.timesofisrael.com/?p=3661998
I know exactly why leftists aren’t celebrating this ceasefire,"“We can’t hear you, Zohran,&#8221; read one New York Post headline this week: &#8220;Pro-Hamas crowd goes quiet on Trump’s Gaza peace deal.” “It seems awfully curious that the people who have made Gazans a central political cause do not seem at all relieved that there’s at least a temporary cessation of violence…Why aren’t there widespread... The post I know exactly why leftists aren&#8217;t celebrating this ceasefire appeared first on The Forward .",https://forward.com/opinion/775429/ceasefire-pro-palestinian-celebration/,The Forward,Emily Tamkin,2025-10-11T13:15:53,2025-10-11 14:08:40.221306,https://forward.com/?p=775429
Could dementia be the key to saving endangered Jewish languages?,"One day, when Sabrina Hakim was out for a walk with her father, he started speaking a language she could not understand. Sabrina figured he must be speaking Judeo-Kashi, a variety of Judeo-Iranian. Her father spoke this language as a child in the Iranian city of Kashan before he moved to the capital, Tehran. Since... The post Could dementia be the key to saving endangered Jewish languages? appeared first on The Forward .",https://forward.com/culture/773977/saving-lost-jewish-iranian-languages-iran/,The Forward,Lauren Hakimi,2025-10-11T13:30:04,2025-10-11 14:08:40.221241,https://forward.com/?p=773977
The tanks that turned the tide on Oct. 7,"On that fateful Shabbat morning, 12 tanks from IDF Battalion 77 were on alert facing a quiet Gaza border. This is the story of some of the crews who fought to the last shell against thousands of terrorists and gave their lives. The post The tanks that turned the tide on Oct. 7 appeared first on JNS.org .",https://www.jns.org/the-tanks-that-turned-the-tide-on-oct-7/,JNS,Hanan Greenwood,2025-10-11T12:18:00,2025-10-11 13:11:11.865996,https://www.jns.org/?p=593821
The International Jerusalem March brings joy and friendship to the capital,"The annual event transformed the city's Sacher Park into a sea of flags, costumes and music. The post The International Jerusalem March brings joy and friendship to the capital appeared first on JNS.org .",https://www.jns.org/the-international-jerusalem-march-brings-joy-and-friendship-to-the-capital/,JNS,Sharon Altshul,2025-10-11T12:44:00,2025-10-11 13:11:11.865946,https://www.jns.org/?p=594067
"A Gaza cease-fire, celebrations at Hostage Square and protests: This week in photos","Israelis marked the second anniversary of the October 7 massacres on Tuesday, during the week-long Jewish holiday of Sukkot. On Friday, the Israeli government and Hamas said they had agreed to the first phase of an American cease-fire proposal, effectively pausing hostilities in Gaza and accelerating the expected return of the 48 hostages still held in the enclave",https://www.haaretz.com/israel-news/2025-10-11/ty-article-magazine/.premium/a-gaza-cease-fire-celebrations-at-hostage-square-and-marches/00000199-d2cf-dde4-a7bd-daff9b490000,Haaretz,Rami Shllush,2025-10-11T11:30:49,2025-10-11 12:12:52.611759,https://www.haaretz.com/israel-news/2025-10-11/ty-article-magazine/.premium/a-gaza-cease-fire-celebrations-at-hostage-square-and-marches/00000199-d2cf-dde4-a7bd-daff9b490000
IDF troops kill grenade-wielding terrorist in Samaria,No injuries were reported among Israeli forces. The post IDF troops kill grenade-wielding terrorist in Samaria appeared first on JNS.org .,https://www.jns.org/idf-troops-kill-grenade-wielding-terrorist-in-samaria/,JNS,JNS Staff,2025-10-11T11:37:00,2025-10-11 12:12:44.337268,https://www.jns.org/?p=594043
"Nova survivor dies by suicide, 2 years after girlfriend was killed in front of him","Roei Shalev's body found in burning car soon after anniversary of Mapal Adam's October 7 murder; Nova organization urges awareness of mental toll on survivors, bereaved The post Nova survivor dies by suicide, 2 years after girlfriend was killed in front of him appeared first on The Times of Israel .",https://www.timesofisrael.com/nova-survivor-dies-by-suicide-2-years-after-girlfriend-was-killed-in-front-of-him/,Times of Israel,,2025-10-11T11:26:07,2025-10-11 12:12:38.884480,https://www.timesofisrael.com/?p=3661984
Syria’s FM visits Lebanon in bid to rebuild ties after years of strain under Assad,"In first visit to Beirut by Syrian minister since Assad's ouster, FM says trip 'to reaffirm the depth' of relations; visit focused on status of border, refugees and detainees The post Syria&#8217;s FM visits Lebanon in bid to rebuild ties after years of strain under Assad appeared first on The Times of Israel .",https://www.timesofisrael.com/syrias-fm-visits-lebanon-in-bid-to-rebuild-ties-after-years-of-strain-under-assad/,Times of Israel,,2025-10-11T11:42:04,2025-10-11 12:12:38.884439,https://www.timesofisrael.com/?p=3661928
The living hostages expected to be released from Gaza under the ceasefire deal,"Agreement will see return of 20 living hostages and the bodies of 28 others, which implies the deaths of 2 hostages over whose fates Israel had previously expressed 'grave concern' The post The living hostages expected to be released from Gaza under the ceasefire deal appeared first on The Times of Israel .",https://www.timesofisrael.com/the-living-hostages-expected-to-be-released-from-gaza-under-the-ceasefire-deal/,Times of Israel,,2025-10-11T11:46:31,2025-10-11 12:12:38.884385,https://www.timesofisrael.com/?p=3661929
Charlie Kirk's leaked text messages before murder show frustration over Jewish donors,"Private texts show Kirk defending ties to Tucker Carlson and Candace Owens amid growing backlash from Jewish donors, exposing his mounting frustration with Israel and its supporters. Some on the far-right have since floated conspiracies about Israel's involvement in his death",https://www.haaretz.com/us-news/2025-10-11/ty-article/charlie-kirks-leaked-text-messages-before-murder-show-frustration-over-jewish-donors/00000199-d294-da09-a1bb-d2be7e000000,Haaretz,JTA,2025-10-11T10:33:56,2025-10-11 11:08:59.827253,https://www.haaretz.com/us-news/2025-10-11/ty-article/charlie-kirks-leaked-text-messages-before-murder-show-frustration-over-jewish-donors/00000199-d294-da09-a1bb-d2be7e000000
Netanyahu: Trump deserves Nobel Peace Prize,The prize was awarded to Venezuelan opposition leader María Corina Machado. The post Netanyahu: Trump deserves Nobel Peace Prize appeared first on JNS.org .,https://www.jns.org/netanyahu-trump-deserves-nobel-peace-prize/,JNS,JNS Staff,2025-10-11T10:46:00,2025-10-11 11:08:52.174765,https://www.jns.org/?p=594036
IDF: Gaza war conducted with ‘deep love for the people and the land’,"“This operation produced unprecedented achievements across all sectors and enabled the return of hostages,” said IDF Spokesman Brig. Gen. Effie Defrin. The post IDF: Gaza war conducted with &#8216;deep love for the people and the land&#8217; appeared first on JNS.org .",https://www.jns.org/idf-gaza-war-conducted-with-deep-love-for-the-people-and-the-land/,JNS,JNS Staff,2025-10-11T09:55:00,2025-10-11 10:08:51.575765,https://www.jns.org/?p=594038
IDF says strikes in Lebanon destroyed hundreds of Hezbollah construction vehicles,"1 reportedly killed, some 300 vehicles blown up; Israeli military says heavy machinery used by Hezbollah to rebuild infrastructure; Lebanese president condemns attacks The post IDF says strikes in Lebanon destroyed hundreds of Hezbollah construction vehicles appeared first on The Times of Israel .",https://www.timesofisrael.com/idf-says-strikes-in-lebanon-destroyed-hundreds-of-hezbollah-construction-vehicles/,Times of Israel,,2025-10-11T09:18:34,2025-10-11 10:08:47.162717,https://www.timesofisrael.com/?p=3661905
Artist behind ‘Daily Postcard’ illustrations of hostages releases hopeful postwar imagery,"As Gaza ceasefire takes hold and return of Israeli captives is on the horizon, Zeev 'Shoshke' Engelmayer's latest artwork includes vivid imagined reunions The post Artist behind &#8216;Daily Postcard&#8217; illustrations of hostages releases hopeful postwar imagery appeared first on The Times of Israel .",https://www.timesofisrael.com/artist-behind-daily-postcard-illustrations-of-hostages-releases-hopeful-postwar-imagery/,Times of Israel,,2025-10-11T09:19:58,2025-10-11 10:08:47.162666,https://www.timesofisrael.com/?p=3659419
"The turbulent life of Michael Podolsky, the man an Israeli court allowed to die","His entire body paralyzed, Michael Podolsky could only communicate with the world by blinking. Bedridden, immobile, but completely lucid, he set medical and legal precedents, deciding how and when his life would end",https://www.haaretz.com/israel-news/2025-10-11/ty-article-magazine/.highlight/my-life-is-hell-now-and-i-want-to-end-it-the-man-an-israeli-court-allowed-to-die/00000199-cf32-d5c1-ad9d-df7bde7d0000,Haaretz,Or Kashti,2025-10-11T08:19:06,2025-10-11 09:09:00.236041,https://www.haaretz.com/israel-news/2025-10-11/ty-article-magazine/.highlight/my-life-is-hell-now-and-i-want-to-end-it-the-man-an-israeli-court-allowed-to-die/00000199-cf32-d5c1-ad9d-df7bde7d0000
Tel Aviv beach closed after shark sighting,"On Thursday, a shark was seen off the coast of the Tel Aviv suburb of Bat Yam, marking the third such sighting in Israel over the past two weeks. The post Tel Aviv beach closed after shark sighting appeared first on JNS.org .",https://www.jns.org/tel-aviv-beach-closed-after-shark-sighting/,JNS,JNS Staff,2025-10-11T08:44:00,2025-10-11 09:08:52.514985,https://www.jns.org/?p=594034
RFK Jr. accused of antisemitism over claim that ‘early’ circumcisions lead to autism,"Nadler urges colleagues to 'clearly denounce' health secretary's 'antisemitic remark' over child circumcision, and subsequent Tylenol use; scientists decry lack of evidence for claim The post RFK Jr. accused of antisemitism over claim that ‘early’ circumcisions lead to autism appeared first on The Times of Israel .",https://www.timesofisrael.com/rfk-jr-accused-of-antisemitism-over-claim-that-early-circumcisions-lead-to-autism/,Times of Israel,,2025-10-11T08:10:57,2025-10-11 09:08:47.036535,https://www.timesofisrael.com/?p=3661890
Posting without a hand: Gaza's teenage girls turn survival into online diaries,"While girls their age across the world post videos of themselves opening gifts, girls in Gaza document a different reality – which includes hunger, loss and shortages. This documentation, beyond being a tool for collecting donations, also has a therapeutic effect",https://www.haaretz.com/israel-news/2025-10-11/ty-article-magazine/.premium/posting-without-a-hand-gazas-teenage-girls-turn-survival-into-online-diaries/00000199-9f74-dc12-a5df-9f7f70090000,Haaretz,Sheren Falah Saab,2025-10-11T07:51:00,2025-10-11 08:10:06.467124,https://www.haaretz.com/israel-news/2025-10-11/ty-article-magazine/.premium/posting-without-a-hand-gazas-teenage-girls-turn-survival-into-online-diaries/00000199-9f74-dc12-a5df-9f7f70090000
Netanyahu visits hospital preparing to receive Hamas hostages,The Israeli prime minister also met with IDF soldiers wounded in the war. The post Netanyahu visits hospital preparing to receive Hamas hostages appeared first on JNS.org .,https://www.jns.org/netanyahu-visits-hospital-preparing-to-receive-hamas-hostages/,JNS,JNS Staff,2025-10-11T07:33:00,2025-10-11 08:09:58.505920,https://www.jns.org/?p=594017
MIT president rejects Trump’s ‘priority’ funding offer in exchange for policy changes,"Sally Kornbluth, who is Jewish, is first university leader to reject Trump's offer; US's academic leadership 'depends on independent thinking,' she says in letter to administration The post MIT president rejects Trump&#8217;s ‘priority’ funding offer in exchange for policy changes appeared first on The Times of Israel .",https://www.timesofisrael.com/mit-president-rejects-trumps-priority-funding-offer-in-exchange-for-policy-changes/,Times of Israel,,2025-10-11T07:09:32,2025-10-11 08:09:53.664554,https://www.timesofisrael.com/?p=3661879
Former Israeli Minister: 'Return of hostages is a prerequisite for rebuilding the country',"Haim Oron, formerly of the Zionist left Meretz party, believes that the continued captivity of the hostages, two years after October 7, reflects the fracture within Israeli society. Despite all that, he has not lost faith in the two-state solution and peace between Israelis and Palestinians",https://www.haaretz.com/israel-news/2025-10-11/ty-article/.premium/former-israeli-minister-return-of-hostages-is-a-prerequisite-for-rebuilding-the-country/00000199-d1b5-d253-a3bd-f7bf27db0000,Haaretz,Chen Maanit,2025-10-11T06:19:18,2025-10-11 07:09:18.770407,https://www.haaretz.com/israel-news/2025-10-11/ty-article/.premium/former-israeli-minister-return-of-hostages-is-a-prerequisite-for-rebuilding-the-country/00000199-d1b5-d253-a3bd-f7bf27db0000
Palestinian factions say they will implement Gaza cease-fire despite Israel's refusal to release high-ranking prisoners,"Earlier Friday, the Israeli government revised a list of Palestinian prisoners slated for release under the cease-fire deal: Eleven Hamas members would be released instead of 11 members of Fatah. 'We have made great efforts to ensure the release of all prisoners,' Hamas and two factions said",https://www.haaretz.com/israel-news/2025-10-11/ty-article/.premium/palestinian-factions-continue-with-gaza-cease-fire-despite-israel-withholding-prisoners/00000199-d1b8-d5c1-ad9d-d1f91e510000,Haaretz,Rawan Suleiman,2025-10-11T06:58:16,2025-10-11 07:09:18.770371,https://www.haaretz.com/israel-news/2025-10-11/ty-article/.premium/palestinian-factions-continue-with-gaza-cease-fire-despite-israel-withholding-prisoners/00000199-d1b8-d5c1-ad9d-d1f91e510000
Why does the fossil fuel industry still dominate in Israel?,The struggle to repair petrochemical facilities and keep them in northern Israel's Haifa Bay is an example of a greater battle waged by the Trump administration on behalf of fossil fuel companies worldwide,https://www.haaretz.com/israel-news/2025-10-11/ty-article/.premium/why-does-the-fossil-fuel-industry-still-dominate-in-israel/00000199-b97a-db56-a5db-bd7b19a20000,Haaretz,Zafrir Rinat,2025-10-11T07:01:00,2025-10-11 07:09:18.770329,https://www.haaretz.com/israel-news/2025-10-11/ty-article/.premium/why-does-the-fossil-fuel-industry-still-dominate-in-israel/00000199-b97a-db56-a5db-bd7b19a20000
