title,description,link,source,author,published,scraped_at,guid
'Delusional': Netanyahu's office thanks families of hostages killed in captivity for 'heavy price they paid',"The Hostages Directorate in the Prime Minister's Office linked the deaths of Israelis in Gaza captivity to Monday's release of all living hostages in a letter sent to their families. A sister of a hostage killed in captivity said, 'Start by apologizing and acknowledging your responsibility. Only then can you send flowers'",https://www.haaretz.com/israel-news/2025-10-14/ty-article/.premium/netanyahus-office-thanks-families-of-hostages-killed-in-captivity-for-heavy-price-paid/00000199-e37f-d8a7-afdd-f7ffed5a0000,Haaretz,Eden Solomon,2025-10-14T17:38:16,2025-10-14 18:12:50.617476,https://www.haaretz.com/israel-news/2025-10-14/ty-article/.premium/netanyahus-office-thanks-families-of-hostages-killed-in-captivity-for-heavy-price-paid/00000199-e37f-d8a7-afdd-f7ffed5a0000
"Freed hostage Nimrod Cohen said food in captivity ran low when aid to Gaza was blocked, father shares","Nimrod Cohen was reunited with his family on Monday after two years in captivity. His father, who was prominent in the protest movement to secure his son's release, says he 'has to make sure that those responsible for the incident, primarily the prime minister, step aside'",https://www.haaretz.com/israel-news/2025-10-14/ty-article/.premium/freed-hostage-nimrod-cohen-said-food-ran-low-when-aid-to-gaza-was-blocked-father-shares/00000199-e367-d7e9-adfd-fb67c8170000,Haaretz,Bar Peleg,2025-10-14T16:15:45,2025-10-14 17:09:05.860334,https://www.haaretz.com/israel-news/2025-10-14/ty-article/.premium/freed-hostage-nimrod-cohen-said-food-ran-low-when-aid-to-gaza-was-blocked-father-shares/00000199-e367-d7e9-adfd-fb67c8170000
Hamas Executes Dozens of Gazans Accused of ‘Treason’,"i24 News &#8211; Hours after the release of the final Israeli hostages under the US-brokered ceasefire, Hamas gunmen executed more...",https://www.algemeiner.com/2025/10/14/hamas-executes-dozens-of-gazans-accused-of-treason/,Algemeiner,i24 News and Algemeiner Staff,2025-10-14T16:34:33,2025-10-14 17:09:00.513085,https://www.algemeiner.com/?p=755319
IDF: Troops fired at Gazan suspects who approached them after crossing ceasefire line,"Israel launches pair of drone strikes 'to remove threats,' which Hamas charges breached the truce; Israel to restrict aid to Strip after terror group returns only four of the slain hostages The post IDF: Troops fired at Gazan suspects who approached them after crossing ceasefire line appeared first on The Times of Israel .",https://www.timesofisrael.com/idf-troops-fired-at-gazan-suspects-who-approached-them-after-crossing-ceasefire-line/,Times of Israel,,2025-10-14T17:03:56,2025-10-14 17:08:52.245544,https://www.timesofisrael.com/?post_type=liveblog_entry&p=3665045
"Son of Israel's oldest Oct. 7 hostage still awaits his father's body, warns government won't act","'We hope the state, which abandoned my father on October 7, will fulfill its commitment,' Boaz, son of Arye Zalmanovich says",https://www.haaretz.com/israel-news/2025-10-14/ty-article/.premium/son-of-israels-oldest-hostage-still-awaits-his-fathers-body-warns-government-wont-act/00000199-e31a-d8a7-afdd-f7bfa43c0000,Haaretz,Ofer Aderet,2025-10-14T15:29:45,2025-10-14 16:10:42.169266,https://www.haaretz.com/israel-news/2025-10-14/ty-article/.premium/son-of-israels-oldest-hostage-still-awaits-his-fathers-body-warns-government-wont-act/00000199-e31a-d8a7-afdd-f7bfa43c0000
Gaza Ceasefire Outlook Darkens as Israel Delays Aid and Hamas Tightens Grip,"Israel delayed aid into Gaza and kept the enclave&#8217;s border shut on Tuesday, while re-emergent Hamas fighters demonstrated their grip...",https://www.algemeiner.com/2025/10/14/gaza-ceasefire-outlook-darkens-as-israel-delays-aid-and-hamas-tightens-grip/,Algemeiner,Reuters and Algemeiner Staff,2025-10-14T15:14:51,2025-10-14 16:10:36.466652,https://www.algemeiner.com/?p=755312
Arafat’s Nephew Returns to West Bank with Plan for Post-War Gaza,"A nephew of late Palestinian leader Yasser Arafat has returned to the West Bank after four years of self-exile, outlining...",https://www.algemeiner.com/2025/10/14/arafats-nephew-returns-to-west-bank-with-plan-for-post-war-gaza/,Algemeiner,Reuters and Algemeiner Staff,2025-10-14T16:10:19,2025-10-14 16:10:36.466613,https://www.algemeiner.com/?p=755316
Oxford student chants ‘Put Zios in the ground’ in London,"The young man identified himself as Samuel Williams, studying philosophy, politics and economics. The post Oxford student chants ‘Put Zios in the ground&#8217; in London appeared first on JNS.org .",https://www.jns.org/oxford-student-chants-put-zios-in-the-ground-in-london/,JNS,,2025-10-14T15:30:00,2025-10-14 16:10:34.129183,https://www.jns.org/?p=595118
Meet the 83-year-old Jewish activist who stars in Zohran Mamdani’s campaign ads,"(JTA) — When Zohran Mamdani’s first TV ad of the general election went live last week, the first person viewers saw was an 83-year-old Jewish woman from the Upper West Side. Rosalind Petchesky, a retired political scientist and progressive activist, has become a recurring star of Mamdani’s social media video campaign, which is widely seen... The post Meet the 83-year-old Jewish activist who stars in Zohran Mamdani’s campaign ads appeared first on The Forward .",https://forward.com/fast-forward/776023/meet-the-83-year-old-jewish-activist-who-stars-in-zohran-mamdanis-campaign-ads/,The Forward,Joseph Strauss,2025-10-14T15:33:58,2025-10-14 16:10:21.341538,https://forward.com/?p=776023
"With hostages home, the filmmaker behind ‘Torn’ says his documentary about NYC’s poster wars remains sadly relevant","(JTA) — What caught Nim Shapira’s eye when videos of New Yorkers tearing down posters of Israeli hostages began circulating in October 2023 wasn’t just the stark affront. It was also the poles the posters had been attached to. “I recognized every corner,” he said. “This was my neighborhood.” The filmmaker had never before turned... The post With hostages home, the filmmaker behind ‘Torn’ says his documentary about NYC’s poster wars remains sadly relevant appeared first on The Forward .",https://forward.com/fast-forward/776044/with-hostages-home-the-filmmaker-behind-torn-says-his-documentary-about-nycs-poster-wars-remains-sadly-relevant/,The Forward,Philissa Cramer,2025-10-14T15:55:03,2025-10-14 16:10:21.341465,https://forward.com/?p=776044
Trump in Jerusalem: When Israel's Knesset went full MAGA,"Netanyahu and his ministers still believe Trump will lose interest and allow Israel to resume the war in Gaza. This is wishful thinking, as dozens of world leaders committed to Trump's peace plan on Monday, and all Netanyahu received in return was the U.S. president's support for a criminal trial pardon",https://www.haaretz.com/israel-news/2025-10-14/ty-article/.premium/trump-in-jerusalem-when-israels-knesset-went-full-maga/00000199-e2d6-da09-a1bb-f2fe80d10000,Haaretz,Yossi Verter,2025-10-14T14:51:50,2025-10-14 15:09:41.774512,https://www.haaretz.com/israel-news/2025-10-14/ty-article/.premium/trump-in-jerusalem-when-israels-knesset-went-full-maga/00000199-e2d6-da09-a1bb-f2fe80d10000
Full text of Oct. 9 Israel-Hamas deal on Trump’s plan for ‘comprehensive end’ to Gaza war,"Agreement says Hamas must release all living and dead hostages, but also 'share all the information it obtained' on remaining dead hostages, within 72 hours of Israeli withdrawal The post Full text of Oct. 9 Israel-Hamas deal on Trump&#8217;s plan for &#8216;comprehensive end&#8217; to Gaza war appeared first on The Times of Israel .",https://www.timesofisrael.com/full-text-of-oct-9-israel-hamas-deal-on-trumps-plan-for-comprehensive-end-to-gaza-war/,Times of Israel,,2025-10-14T14:35:59,2025-10-14 15:09:23.948386,https://www.timesofisrael.com/?p=3664922
"Too soon? Amid hostage releases, some US Jews retire solidarity rituals with gratitude and grief","With the freeing of the living captives and continued demands for the return of 24 bodies still held in Gaza, worshipers grapple with closure on Simhat Torah, two years into an ordeal begun on Oct. 7, 2023 The post Too soon? Amid hostage releases, some US Jews retire solidarity rituals with gratitude and grief appeared first on The Times of Israel .",https://www.timesofisrael.com/too-soon-amid-hostage-releases-some-us-jews-retire-solidarity-rituals-with-gratitude-and-grief/,Times of Israel,,2025-10-14T14:36:05,2025-10-14 15:09:23.948343,https://www.timesofisrael.com/?p=3664894
"Israel won’t reopen Rafah crossing, will limit aid, to press Hamas for release of 24 slain hostages","As IDs confirmed of returned hostages' remains, families of captives still in Gaza demand deal be put on hold until their loved ones returned, accuse gov't of shirking 'immediate duty' to bring them back The post Israel won’t reopen Rafah crossing, will limit aid, to press Hamas for release of 24 slain hostages appeared first on The Times of Israel .",https://www.timesofisrael.com/israel-wont-reopen-rafah-crossing-will-limit-aid-to-press-hamas-for-release-of-24-slain-hostages/,Times of Israel,,2025-10-14T15:00:29,2025-10-14 15:09:23.948291,https://www.timesofisrael.com/?post_type=liveblog_entry&p=3664836
Project Esther created a blueprint for Trump to fight antisemitism. The ‘Shofar Report’ is a liberal response.,"Most American Jews have taken a dim view of the Trump administration’s approach to fighting antisemitism, saying his policies are disingenuous and prone to exacerbate the problem rather than solve it. But beyond rejecting the crackdown on universities, liberal Jews have lacked a singular blueprint for fighting antisemitism akin to what the conservative Heritage Foundation... The post Project Esther created a blueprint for Trump to fight antisemitism. The ‘Shofar Report’ is a liberal response. appeared first on The Forward .",https://forward.com/news/antisemitism-decoded/776002/project-esther-created-a-blueprint-for-trump-to-fight-antisemitism-the-shofar-report-is-a-liberal-response/,The Forward,Arno Rosenfeld,2025-10-14T14:25:32,2025-10-14 15:09:21.371355,https://forward.com/?p=776002
"With hostages home, the filmmaker behind ‘Torn’ says his documentary about NYC’s poster wars remains sadly relevant","Hear more from Nim Shapira at a virtual screening on Thursday evening. -- The post With hostages home, the filmmaker behind &#8216;Torn&#8217; says his documentary about NYC&#8217;s poster wars remains sadly relevant appeared first on Jewish Telegraphic Agency .",https://www.jta.org/2025/10/14/culture/with-hostages-home-the-filmmaker-behind-torn-says-his-documentary-about-nycs-poster-wars-remains-sadly-relevant,JTA,Philissa Cramer,2025-10-14T15:00:58,2025-10-14 15:09:18.731072,https://www.jta.org/?p=1890675
"Amid rising antisemitism and far-right nationalism, U.K. Jews find their plight politicized",A right-wing politician's speech at an antisemitism rally and Israel's embrace of extremist Tommy Robinson after the Manchester synagogue attack has some British Jewish leaders warning about mistaking far-right elements for allies,https://www.haaretz.com/jewish/2025-10-14/ty-article-magazine/.premium/amid-rising-antisemitism-and-far-right-sentiment-u-k-jews-find-their-plight-politicized/00000199-ddc2-da09-a1bb-dfea9b630000,Haaretz,Daniella Peled,2025-10-14T13:44:13,2025-10-14 14:09:47.337730,https://www.haaretz.com/jewish/2025-10-14/ty-article-magazine/.premium/amid-rising-antisemitism-and-far-right-sentiment-u-k-jews-find-their-plight-politicized/00000199-ddc2-da09-a1bb-dfea9b630000
Gaza in turmoil: Hamas and militias clash amid executions in bid to 'restore order',"Sources affiliated with Hamas claimed that the group seeks to tighten its control and is acting against 'criminals and collaborators.' On Monday, footage emerged showing a public execution in Gaza City, with reports stating that Hamas executed four men accused of spying for Israel",https://www.haaretz.com/israel-news/2025-10-14/ty-article/.premium/gaza-in-turmoil-hamas-and-militias-clash-amid-executions-in-bid-to-restore-order/00000199-e2ff-dde4-a7bd-faff2d830000,Haaretz,Jack Khoury,2025-10-14T13:59:53,2025-10-14 14:09:47.337685,https://www.haaretz.com/israel-news/2025-10-14/ty-article/.premium/gaza-in-turmoil-hamas-and-militias-clash-amid-executions-in-bid-to-restore-order/00000199-e2ff-dde4-a7bd-faff2d830000
What Israeli “Victory” Looks Like - The Trump deal doesn’t destroy Hamas but it does further Palestinian dispossession.,,https://jewishcurrents.org/what-israeli-victory-looks-like,Jewish Currents,Peter Beinart,2025-10-14T14:05:00,2025-10-14 14:09:44.095752,https://jewishcurrents.org/what-israeli-victory-looks-like
"Daily Briefing Oct. 14: Day 739 – Hamas withholds dead hostages, dampening joy of returned living","ToI editor David Horovitz describes Israelis' dueling jubilation and despair as US President Donald Trump insists the Gaza war has ended -- without all peace plan promises fulfilled The post Daily Briefing Oct. 14: Day 739 &#8211; Hamas withholds dead hostages, dampening joy of returned living appeared first on The Times of Israel .",https://www.timesofisrael.com/daily-briefing-oct-14-day-739-hamas-withholds-dead-hostages-dampening-joy-of-returned-living/,Times of Israel,,2025-10-14T14:08:41,2025-10-14 14:09:29.685990,https://www.timesofisrael.com/?p=3664933&preview=true&preview_id=3664933
The Trump administration is targeting Jewish organizations — what are we prepared to do?,"Kol Yisrael Areivim Zeh La’Zeh, goes the aphorism: All Jews are responsible for one another. Well, now we’re about to find out if it’s true. Even as American Jews celebrate the long-yearned-for release of Israeli hostages, some in our community are being threatened by the Trump administration, which has promised to investigate and prosecute nine... The post The Trump administration is targeting Jewish organizations — what are we prepared to do? appeared first on The Forward .",https://forward.com/opinion/775546/jewish-voice-for-peace-if-not-now-soros-trump/,The Forward,Jay Michaelson,2025-10-14T13:50:37,2025-10-14 14:09:25.094247,https://forward.com/?p=775546
Meet the 83-year-old Jewish activist who stars in Zohran Mamdani’s campaign ads,"Rosalind Petchesky, a retired political scientist, first met Mamdani while lobbying with anti-Zionist group Jewish Voice for Peace. -- The post Meet the 83-year-old Jewish activist who stars in Zohran Mamdani&#8217;s campaign ads appeared first on Jewish Telegraphic Agency .",https://www.jta.org/2025/10/14/default/meet-the-83-year-old-jewish-activist-who-stars-in-zohran-mamdanis-campaign-ads,JTA,Joseph Strauss,2025-10-14T14:00:33,2025-10-14 14:09:22.626041,https://www.jta.org/?p=1890532
"Red Cross: Returning Israeli hostages' bodies will take time, some may never be found","Israeli government officials have refused to say whether they see this as a significant issue in implementing the cease-fire, or whether it's considered a reasonable delay. The forum called on Israel and the mediators to halt the implementation of the cease-fire agreement following the violation",https://www.haaretz.com/israel-news/2025-10-14/ty-article/.premium/red-cross-returning-israeli-hostages-bodies-will-take-time-some-may-never-be-found/00000199-e285-d8a7-afdd-f7bd3d7f0000,Haaretz,Jonathan Lis,2025-10-14T12:46:13,2025-10-14 13:17:24.961779,https://www.haaretz.com/israel-news/2025-10-14/ty-article/.premium/red-cross-returning-israeli-hostages-bodies-will-take-time-some-may-never-be-found/00000199-e285-d8a7-afdd-f7bd3d7f0000
Eurovision postpones vote on boycotting Israel,Organizers said the members will address the issue during a regular winter session in December. The post Eurovision postpones vote on boycotting Israel appeared first on JNS.org .,https://www.jns.org/eurovision-postpones-vote-on-boycotting-israel/,JNS,,2025-10-14T13:09:00,2025-10-14 13:17:17.300482,https://www.jns.org/?p=595074
Israeli gymnasts remain excluded from world championship after court rejects request,Top sports court rejects Israeli request to 'guarantee its participation'; world gymnastics federation says it has no jurisdiction to force Jakarta to issue visas The post Israeli gymnasts remain excluded from world championship after court rejects request appeared first on The Times of Israel .,https://www.timesofisrael.com/israeli-gymnasts-remain-excluded-from-world-championship-after-court-rejects-request/,Times of Israel,,2025-10-14T12:28:20,2025-10-14 13:17:12.848919,https://www.timesofisrael.com/?post_type=liveblog_entry&p=3664858
CNN anchor sorry for saying hostages treated better than Gazans,"“They've told me their stories of barely being able to breathe in the tunnels,” Christiane Amanpour said in her apology. The post CNN anchor sorry for saying hostages treated better than Gazans appeared first on JNS.org .",https://www.jns.org/cnn-anchor-sorry-for-saying-hostages-treated-better-than-gazans/,JNS,,2025-10-14T11:17:00,2025-10-14 12:15:42.123852,https://www.jns.org/?p=595081
Israel confirms 4 bodies it received were of hostages,"The bodies, some of the 28 Hamas is due to hand over, were of Guy Illuz, Bipin Joshi and two others whose names haven't been cleared for publication. The post Israel confirms 4 bodies it received were of hostages appeared first on JNS.org .",https://www.jns.org/israel-confirms-4-bodies-it-received-were-of-hostages/,JNS,,2025-10-14T12:00:00,2025-10-14 12:15:42.123805,https://www.jns.org/?p=595111
Snipers on roof as Udine braces for high-risk Italy-Israel World Cup soccer qualifier,"Most shops and restaurants to close in northern Italy city as pro-Palestinian, anti-Israel demonstrators plan march despite Gaza ceasefire going into effect The post Snipers on roof as Udine braces for high-risk Italy-Israel World Cup soccer qualifier appeared first on The Times of Israel .",https://www.timesofisrael.com/snipers-on-roof-as-udine-braces-for-high-risk-italy-israel-world-cup-soccer-qualifier/,Times of Israel,,2025-10-14T12:01:03,2025-10-14 12:15:35.802876,https://www.timesofisrael.com/?p=3664892
"Hamas releases remains of just 4 deceased hostages, leaving 24 still unaccounted for","(JTA) — Hours after freeing 20 living hostages to a jubilant Israel, Hamas released the remains of four deceased hostages — far fewer than the 28 it is holding and obligated under the terms of the ceasefire to release. The group had already indicated that it was not prepared to release all of the deceased... The post Hamas releases remains of just 4 deceased hostages, leaving 24 still unaccounted for appeared first on The Forward .",https://forward.com/fast-forward/775981/hamas-releases-remains-of-just-4-deceased-hostages-leaving-24-still-unaccounted-for/,The Forward,Philissa Cramer,2025-10-14T11:22:30,2025-10-14 12:15:33.600632,https://forward.com/?p=775981
"Settlers said to attack pair of West Bank Palestinian communities, wounding 5 people","Attackers in Beit Fajjar reportedly also targeted medics who came to treat Palestinians assaulted with sticks, stones and dogs; no arrests reported The post Settlers said to attack pair of West Bank Palestinian communities, wounding 5 people appeared first on The Times of Israel .",https://www.timesofisrael.com/settlers-said-to-attack-pair-of-west-bank-palestinian-communities-wounding-5-people/,Times of Israel,,2025-10-14T10:40:42,2025-10-14 11:08:37.775949,https://www.timesofisrael.com/?post_type=liveblog_entry&p=3664816
Full text of Trump’s Knesset speech: You’ve won. You can’t beat the world. It’s time for peace,"US president tells Netanyahu, regarding Gaza deal: 'It was getting bad, heated... You're gonna be remembered for this far more than if you kept this thing going, going, going; kill, kill, kill' The post Full text of Trump&#8217;s Knesset speech: You&#8217;ve won. You can&#8217;t beat the world. It&#8217;s time for peace appeared first on The Times of Israel .",https://www.timesofisrael.com/full-text-of-trumps-knesset-speech-youve-won-you-cant-beat-the-world-its-time-for-peace/,Times of Israel,,2025-10-14T11:01:50,2025-10-14 11:08:37.775899,https://www.timesofisrael.com/?p=3664792
Kamala Harris on whether Israel committed genocide: ‘We should all step back and ask this question’,(JTA) — Former Vice President Kamala Harris held back from labeling Israel’s actions in Gaza a “genocide” on Sunday but said it was an appropriate question. “A lot of folks in your party have called what&#8217;s happening in Gaza a genocide. Do you agree with that?” correspondent Eugene Daniels asked Harris during an interview on... The post Kamala Harris on whether Israel committed genocide: ‘We should all step back and ask this question’ appeared first on The Forward .,https://forward.com/fast-forward/775933/kamala-harris-on-whether-israel-committed-genocide-we-should-all-step-back-and-ask-this-question/,The Forward,Grace Gilson,2025-10-14T10:10:05,2025-10-14 11:08:35.145393,https://forward.com/?p=775933
Why there are new laws shaping how schools teach about the Israeli-Palestinian conflict,"Teachers, parents and schools have long debated what students should learn about the Israeli-Palestinian conflict. But lesson plans have typically been discussed in PTA gatherings, faculty meetings, and curriculum committees — not determined by legislation. That’s changing, as new laws around the country seek to regulate how narratives about the conflict are taught. The measures... The post Why there are new laws shaping how schools teach about the Israeli-Palestinian conflict appeared first on The Forward .",https://forward.com/news/775954/california-law-antisemitism-ethnic-studies-curriculum-gavin-newsom-israel/,The Forward,Hannah Feuer,2025-10-14T10:42:06,2025-10-14 11:08:35.145330,https://forward.com/?p=775954
"IDF says bodies of Guy Ilouz, Bipin Joshi and two additional hostages identified","According to the Israeli army, Bipin Joshi was murdered in captivity during the first months of the Gaza war, while Ilouz died of wounds sustained on Oct. 7 due to lack of proper medical care",https://www.haaretz.com/israel-news/2025-10-14/ty-article/.premium/idf-says-bodies-of-guy-ilouz-bipin-joshi-and-two-additional-hostages-identified/00000199-e1ef-d54a-abfb-f5ffff720000,Haaretz,Bar Peleg,2025-10-14T09:18:25,2025-10-14 10:10:05.748401,https://www.haaretz.com/israel-news/2025-10-14/ty-article/.premium/idf-says-bodies-of-guy-ilouz-bipin-joshi-and-two-additional-hostages-identified/00000199-e1ef-d54a-abfb-f5ffff720000
IDF troops open fire on Palestinians who violated ceasefire in Gaza,The military urged Gaza residents to follow instructions and avoid approaching troops deployed in the area. The post IDF troops open fire on Palestinians who violated ceasefire in Gaza appeared first on JNS.org .,https://www.jns.org/idf-troops-open-fire-on-palestinians-who-violated-ceasefire-in-gaza/,JNS,JNS Staff,2025-10-14T09:29:44,2025-10-14 10:09:58.749343,https://www.jns.org/?p=595097
"Israeli man, 76, dies from injuries sustained in Iranian missile attack","Aharon Mizrahi was injured in his apartment on June 13 when an explosion killed his life partner instantly. The post Israeli man, 76, dies from injuries sustained in Iranian missile attack appeared first on JNS.org .",https://www.jns.org/israeli-man-76-dies-from-injuries-sustained-in-iranian-missile-attack/,JNS,,2025-10-14T09:55:00,2025-10-14 10:09:58.749300,https://www.jns.org/?p=595091
"Iran accuses US of ‘criminal behavior,’ says Trump’s call for dialogue inconsistent","Washington is 'leading producer of terrorism,' 'has no moral authority to accuse others,' Tehran says after Trump's appeal for peace, nuclear deal with Iran in Knesset speech The post Iran accuses US of &#8216;criminal behavior,&#8217; says Trump&#8217;s call for dialogue inconsistent appeared first on The Times of Israel .",https://www.timesofisrael.com/iran-accuses-us-of-criminal-behavior-says-trumps-call-for-dialogue-inconsistent/,Times of Israel,,2025-10-14T09:13:26,2025-10-14 10:09:54.199802,https://www.timesofisrael.com/?p=3664788
Kamala Harris: ‘We should all step back and ask’ whether Israel committed genocide,"In interview, former VP and Democratic nominee stops short of calling Gaza war a genocide, but says question is applicable given number of civilians killed, 'refusal to give aid' The post Kamala Harris: &#8216;We should all step back and ask&#8217; whether Israel committed genocide appeared first on The Times of Israel .",https://www.timesofisrael.com/kamala-harris-we-should-all-step-back-and-ask-whether-israel-committed-genocide/,Times of Israel,,2025-10-14T09:14:46,2025-10-14 10:09:54.199738,https://www.timesofisrael.com/?p=3664786
"Iran, Abraham Accords and Bibi’s trial: What Trump said in his historic Knesset speech","(JTA) — As the last of the Israeli hostages were released from Gaza, President Donald Trump addressed the country’s parliament — and was given a hero’s welcome. Trump’s speech to the Knesset on Monday offered effusive praise for the state of Israel, warm — but not unguarded — praise for Prime Minister Benjamin Netanyahu, and... The post Iran, Abraham Accords and Bibi’s trial: What Trump said in his historic Knesset speech appeared first on The Forward .",https://forward.com/fast-forward/775912/iran-abraham-accords-and-bibis-trial-what-trump-said-in-his-historic-knesset-speech/,The Forward,Philissa Cramer,2025-10-14T09:52:06,2025-10-14 10:09:52.073779,https://forward.com/?p=775912
