title,description,link,source,author,published,scraped_at,guid
The first deadly attack against Jews in Australia follows two years of unprecedented antisemitism,The mass shooting that killed at least 11 at Sydney's Bondi Beach – the first time gun violence targeted Jews in Australia – comes only a week after a major report documented a rise in antisemitic events in Australia in the two years since the Oct. 7 attack in Israel,https://www.haaretz.com/jewish/2025-12-14/ty-article-magazine/.premium/the-first-deadly-attack-against-australian-jews-follows-two-years-of-spiking-antisemitism/0000019b-1d79-d93d-a5fb-3f7b0a070000,Haaretz,Judy Maltz,2025-12-14T16:53:25,2025-12-14 17:09:04.468569,https://www.haaretz.com/jewish/2025-12-14/ty-article-magazine/.premium/the-first-deadly-attack-against-australian-jews-follows-two-years-of-spiking-antisemitism/0000019b-1d79-d93d-a5fb-3f7b0a070000
‘A nation that dwells alone’,"That doesn’t mean you are left or forgotten. Rather, it speaks of having one’s own way—a way not determined by others. The post ‘A nation that dwells alone’ appeared first on JNS.org .",https://www.jns.org/a-nation-that-dwells-alone/,JNS,David Smorodinski,2025-12-14T17:00:00,2025-12-14 17:08:57.106559,https://www.jns.org/?p=616420
Targeted Hanukkah lighting underscores defiant Chabad mission to set globe aglow,"Over 50 years after the first public menorah lighting in Philadelphia, annual tradition has spread to some 15,000 locales worldwide from Australia to Uzbekistan The post Targeted Hanukkah lighting underscores defiant Chabad mission to set globe aglow appeared first on The Times of Israel .",https://www.timesofisrael.com/targeted-hanukkah-lighting-underscores-defiant-chabad-mission-to-set-globe-aglow/,Times of Israel,,2025-12-14T16:12:09,2025-12-14 17:08:51.706688,https://www.timesofisrael.com/?p=3711536
Israeli cyber startup Armis nears deal to be sold to ServiceNow for up to $7b — report,"Founded in 2016, Armis has a cyberthreat exposure management platform that protects firms from risks as they connect all sorts of devices to their systems The post Israeli cyber startup Armis nears deal to be sold to ServiceNow for up to $7b &#8212; report appeared first on The Times of Israel .",https://www.timesofisrael.com/israeli-cyber-startup-armis-nears-deal-to-be-sold-to-servicenow-for-up-to-7b-report/,Times of Israel,,2025-12-14T16:25:23,2025-12-14 17:08:51.706643,https://www.timesofisrael.com/?p=3711449
Timeline: How attacks on Jews in Australia have been growing since Oct. 7,"The mass shooting at a Hanukkah celebration on Sydney’s Bondi Beach on Sunday marked a grim new chapter in a pattern Australian officials have been tracking for more than two years: the steady escalation of antisemitic threats, from harassment and vandalism to arson, attempted attacks on synagogues and, now, mass-casualty violence at a public Jewish... The post Timeline: How attacks on Jews in Australia have been growing since Oct. 7 appeared first on The Forward .",https://forward.com/news/790237/australia-antisemitism-timeline-oct-7-bondi-beach/,The Forward,Benyamin Cohen,2025-12-14T16:11:17,2025-12-14 17:08:49.165482,https://forward.com/?p=790237
U.S. leaders condemn ‘vile act of antisemitic terror’ after deadly Hanukkah attack in Australia,"American politicians responded early Sunday to devastating reports from Sydney, Australia, where at least 11 people were killed during a Hanukkah celebration at the popular Bondi Beach on the first night of Hanukkah. Australian Prime Minister Anthony Albanese called the terror attack an &#8220;act of evil antisemitism&#8221; that targeted Australia&#8217;s Jewish community. Some elected officials... The post U.S. leaders condemn ‘vile act of antisemitic terror’ after deadly Hanukkah attack in Australia appeared first on The Forward .",https://forward.com/fast-forward/790258/bondi-beach-hanukkah-attack-antisemitism-reaction/,The Forward,Jacob Kornbluh,2025-12-14T16:18:29,2025-12-14 17:08:49.165422,https://forward.com/?p=790258
"Gunmen in Australia open fire during Hanukkah event at Sydney's Bondi beach, killing 11","At least another 29 have been wounded, including two police officers. One of the dead was confirmed to be a gunman, and police are looking into the possibility that there is a third shooter. 'The evil that was unleashed at Bondi Beach today is beyond comprehension,' Australian Prime Minister Anthony Albanese said",https://www.haaretz.com/world-news/asia-and-australia/2025-12-14/ty-article/.free/gunmen-open-fire-during-hannukah-event-at-sydneys-bondi-beach/0000019b-1c04-d0fb-a9df-7ecd93270000,Haaretz,Ben Kroll,2025-12-14T08:47:08,2025-12-14 16:09:57.100763,https://www.haaretz.com/world-news/asia-and-australia/2025-12-14/ty-article/.free/gunmen-open-fire-during-hannukah-event-at-sydneys-bondi-beach/0000019b-1c04-d0fb-a9df-7ecd93270000
Netanyahu on Sydney's Bondi Beach shooting: Australian policy 'pours fuel on antisemitic fire',"Israel's prime minister also said 'antisemitism is a cancer that spreads when leaders are silent,' in response to the attack that killed at least 11 people at a Hannukah event. Diaspora minister Chikli said the Australian government bore the 'sole responsibility' for the attack after failing to act decisively against antisemitism",https://www.haaretz.com/world-news/asia-and-australia/2025-12-14/ty-article/netanyahu-on-sydney-shooting-australian-policy-pours-fuel-on-antisemitic-fire/0000019b-1d03-d058-a7fb-1dfbb64a0000,Haaretz,Haaretz,2025-12-14T14:43:48,2025-12-14 16:09:57.100702,https://www.haaretz.com/world-news/asia-and-australia/2025-12-14/ty-article/netanyahu-on-sydney-shooting-australian-policy-pours-fuel-on-antisemitic-fire/0000019b-1d03-d058-a7fb-1dfbb64a0000
'Absolute hell on Earth': Witnesses recount Bondi Beach Hanukkah shooting attack,"Eyewitnesses to the deadly shooting at a Hanukkah celebration in Sydney described scenes of terror as gunmen opened fire. One witness told Haaretz he 'immediately understood' the Jewish event was the target, as others spoke of bodies on the ground, nonstop gunfire and families fleeing in panic",https://www.haaretz.com/world-news/asia-and-australia/2025-12-14/ty-article/absolute-hell-on-earth-witnesses-recount-sydney-hanukkah-shooting-attack/0000019b-1d3b-d058-a7fb-1dfb1e2c0000,Haaretz,Ben Kroll,2025-12-14T15:45:12,2025-12-14 16:09:57.100658,https://www.haaretz.com/world-news/asia-and-australia/2025-12-14/ty-article/absolute-hell-on-earth-witnesses-recount-sydney-hanukkah-shooting-attack/0000019b-1d3b-d058-a7fb-1dfb1e2c0000
"If there were an award for Jewish director of the year, Minkie Spiro would be first choice","TV director Minkie Spiro's work on shows from 'Better Call Saul' to 'All Her Fault,' hasn't stopped her from starting an Israel-focused production company. 'I'm very privileged to have navigated a career in the TV industry as someone who is both a woman and Jewish,' she says",https://www.haaretz.com/life/2025-12-14/ty-article-magazine/.premium/if-there-were-an-award-for-jewish-director-of-the-year-minkie-spiro-would-be-first-choice/0000019b-0301-ddfd-afdf-13072e350000,Haaretz,Adrian Hennigan,2025-12-14T16:01:36,2025-12-14 16:09:57.100612,https://www.haaretz.com/life/2025-12-14/ty-article-magazine/.premium/if-there-were-an-award-for-jewish-director-of-the-year-minkie-spiro-would-be-first-choice/0000019b-0301-ddfd-afdf-13072e350000
Holding the Light,[&#8230;] The post Holding the Light appeared first on Jewish Journal .,https://jewishjournal.com/commentary/blogs/385210/holding-the-light/,Jewish Journal,Lisa Ellen Niver,2025-12-14T16:00:45,2025-12-14 16:09:46.747539,https://jewishjournal.com/?p=385210
"IDF says it struck 3 Hezbollah operatives in south Lebanon, killing at least 2","Lebanese media reports three killed, at least one injured in three separate drone strikes on vehicles in Yater, Safad al-Battikh and Jouaiya The post IDF says it struck 3 Hezbollah operatives in south Lebanon, killing at least 2 appeared first on The Times of Israel .",https://www.timesofisrael.com/idf-says-it-carried-out-3-strikes-against-hezbollah-operatives-in-south-lebanon/,Times of Israel,,2025-12-14T15:02:07,2025-12-14 16:09:43.582236,https://www.timesofisrael.com/?post_type=liveblog_entry&p=3711544
"Rhode Island cops nab suspect in Brown University shooting that killed 2, wounded 9","Providence police chief says suspect, seen in surveillance video walking calmly away from carnage at engineering finals, is in 30s; shelter-in-place order lifted after manhunt The post Rhode Island cops nab suspect in Brown University shooting that killed 2, wounded 9 appeared first on The Times of Israel .",https://www.timesofisrael.com/rhode-island-cops-nab-suspect-in-brown-university-shooting-that-killed-2-wounded-9/,Times of Israel,,2025-12-14T15:30:54,2025-12-14 16:09:43.582198,https://www.timesofisrael.com/?p=3711548
"To pardon, or not to pardon? - Sponsored Content","As President Herzog weighs whether to pardon Prime Minister Netanyahu, Israel stands at a juncture between justice and stability The post To pardon, or not to pardon? appeared first on The Times of Israel .",https://toi.li/e5QDJS,Times of Israel,,2025-12-14T15:50:56,2025-12-14 16:09:43.582158,https://www.timesofisrael.com/?post_type=spotlight&p=3711712
“Adults In The Room: Where Are You?” - Sponsored Content,"Alissa Zeffren, director of NILI, the women’s division of the YU Torah Mitzion Kollel, tells us how she and her students navigated the unexpected challenges that followed Oct 7. The post &#8220;Adults In The Room: Where Are You?&#8221; appeared first on The Times of Israel .",https://www.timesofisrael.com/spotlight/adults-in-the-room-where-are-you/,Times of Israel,,2025-12-14T16:01:15,2025-12-14 16:09:43.582115,https://www.timesofisrael.com/?post_type=spotlight&p=3711717
Deadly Hanukkah attack at Bondi Beach comes after years of escalating antisemitic incidents in Australia,The attack followed what Jewish leaders describe as an unprecedented normalization of antisemitic threats and intimidation. -- The post Deadly Hanukkah attack at Bondi Beach comes after years of escalating antisemitic incidents in Australia appeared first on Jewish Telegraphic Agency .,https://www.jta.org/2025/12/14/global/deadly-hanukkah-attack-at-bondi-beach-comes-after-years-of-escalating-antisemitic-incidents-in-australia,JTA,Asaf Elia-Shalev,2025-12-14T16:06:51,2025-12-14 16:09:38.791749,https://www.jta.org/?p=1893767
'Go back to Gaza': How escalating settler intimidation and violence are normalized in Israel's parliament,"'There is no such thing as Palestinians…You are depraved': Working in the human rights field, I'm used to seeing settler attacks against Palestinians in the West Bank, but I was still shocked to see that same violence mirrored in the Knesset, as far-right lawmakers mounted a vicious verbal attack on an Arab MK",https://www.haaretz.com/opinion/2025-12-14/ty-article-opinion/.premium/go-back-to-gaza-how-settler-threats-and-violence-are-normalized-in-israels-parliament/0000019b-123f-d3a9-afbf-1f7f4f800000,Haaretz,Anton Goodman,2025-12-14T14:18:15,2025-12-14 15:09:03.456925,https://www.haaretz.com/opinion/2025-12-14/ty-article-opinion/.premium/go-back-to-gaza-how-settler-threats-and-violence-are-normalized-in-israels-parliament/0000019b-123f-d3a9-afbf-1f7f4f800000
Netanyahu on Sydney's Bondi Beach shooting: Australian policy 'pours fuel on antisemitic fire',"Israel's prime minister also said 'antisemitism is a cancer that spreads when leaders are silent,' in response to the attack that killed at least 11 people at a Hannukah event. Diaspora minister Chikli said the Australian government bore the 'sole responsibility' for the attack after failing to act decisively against antisemitism",https://www.haaretz.com/world-news/asia-and-australia/2025-12-14/ty-article/.premium/netanyahu-on-sydney-shooting-australian-policy-pours-fuel-on-antisemitic-fire/0000019b-1d03-d058-a7fb-1dfbb64a0000,Haaretz,Haaretz,2025-12-14T14:43:48,2025-12-14 15:09:03.456885,https://www.haaretz.com/world-news/asia-and-australia/2025-12-14/ty-article/.premium/netanyahu-on-sydney-shooting-australian-policy-pours-fuel-on-antisemitic-fire/0000019b-1d03-d058-a7fb-1dfbb64a0000
'There is no alternative': This German antisemitism warrior is a devout Muslim,"Since October 7, Dervis Hizarci, longtime chairman of the Kreuzberg Initiative against Antisemitism, has been overcome with despair, watching many of the bridges he helped build over the years begin to crumble. Caught between his Muslim and Jewish friends, he vows nonetheless not to give up the good fight",https://www.haaretz.com/world-news/europe/2025-12-14/ty-article-magazine/.premium/there-is-no-alternative-this-german-antisemitism-warrior-is-a-devout-muslim/0000019a-feb3-deef-a3ff-febb7e350000,Haaretz,Judy Maltz,2025-12-14T14:53:05,2025-12-14 15:09:03.456850,https://www.haaretz.com/world-news/europe/2025-12-14/ty-article-magazine/.premium/there-is-no-alternative-this-german-antisemitism-warrior-is-a-devout-muslim/0000019a-feb3-deef-a3ff-febb7e350000
Photo gallery: The Israeli Super Spartans,"The state of the body after the war, photographed by Itai Ron",https://www.haaretz.com/life/2025-12-14/ty-article-magazine/.premium/photo-gallery-the-israeli-super-spartans/0000019b-1c98-d793-a19f-bd98ac7c0000,Haaretz,Haaretz,2025-12-14T15:07:02,2025-12-14 15:09:03.456809,https://www.haaretz.com/life/2025-12-14/ty-article-magazine/.premium/photo-gallery-the-israeli-super-spartans/0000019b-1c98-d793-a19f-bd98ac7c0000
Israeli lawmaker presses for deeper ties with Taiwan,MK Ohad Tal warns of the China–Iran–North Korea–Russia axis as he meets Taiwan’s vice president and senior officials. The post Israeli lawmaker presses for deeper ties with Taiwan appeared first on JNS.org .,https://www.jns.org/israeli-lawmaker-presses-for-deeper-ties-with-taiwan/,JNS,Amelie Botbol and Joshua Marks,2025-12-14T14:25:00,2025-12-14 15:08:55.340456,https://www.jns.org/?p=616704
At least 11 killed as gunmen open fire on Hanukkah celebration at Sydney’s Bondi Beach,"Dozens more wounded in terror attack on Chabad event, one of deadliest attacks on Jews outside Israel in decades; Australian authorities accused of failing to combat antisemitism; Chabad emissary among victims The post At least 11 killed as gunmen open fire on Hanukkah celebration at Sydney&#8217;s Bondi Beach appeared first on The Times of Israel .",https://www.timesofisrael.com/at-least-11-killed-as-gunmen-open-fire-on-hanukkah-celebration-at-sydneys-bondi-beach/,Times of Israel,,2025-12-14T14:24:50,2025-12-14 15:08:51.018574,https://www.timesofisrael.com/?p=3711433
High Court annuls firing of attorney general; cabinet ministers urge defiance of ruling,"In unanimous decision, justices says government failed to justify politicizing the process for firing an AG in effort to dismiss Baharav-Miara The post High Court annuls firing of attorney general; cabinet ministers urge defiance of ruling appeared first on The Times of Israel .",https://www.timesofisrael.com/high-court-annuls-firing-of-attorney-general-cabinet-ministers-urge-defiance-of-ruling/,Times of Israel,,2025-12-14T14:39:20,2025-12-14 15:08:51.018530,https://www.timesofisrael.com/?p=3711480
‘It was a bloodbath. I saw children falling’: Eyewitnesses describe Sydney terror attack,Survivors describe long minutes of gunfire as blood-soaked dead and injured lay strewn on the ground: 'Bullets were flying in all directions... It seemed never-ending' The post &#8216;It was a bloodbath. I saw children falling&#8217;: Eyewitnesses describe Sydney terror attack appeared first on The Times of Israel .,https://www.timesofisrael.com/it-was-a-bloodbath-i-saw-children-falling-eyewitnesses-describe-sydney-terror-attack/,Times of Israel,,2025-12-14T14:55:24,2025-12-14 15:08:51.018465,https://www.timesofisrael.com/?p=3711457
"After Sydney attack, Netanyahu says he warned that Canberra ‘pours fuel on antisemitic fire’","Israeli politicians liken Sydney attack to Oct. 7, accuse Australia of ignoring anti-Jewish incidents prior to attack; some officials say victims' blood is on government's hands The post After Sydney attack, Netanyahu says he warned that Canberra ‘pours fuel on antisemitic fire’ appeared first on The Times of Israel .",https://www.timesofisrael.com/after-sydney-attack-netanyahu-says-he-warned-that-canberra-pours-fuel-on-antisemitic-fire/,Times of Israel,,2025-12-14T14:57:50,2025-12-14 15:08:51.018414,https://www.timesofisrael.com/?p=3711376
I grew up believing Australia was the best place to be Jewish. This Hanukkah shooting forces a reckoning I do not want.,"I grew up believing that Australia was one of the best places on earth to be Jewish. This country always felt like a gift: Extraordinary beaches, glorious wildlife, and a cultural temperament that values fairness and ease over hierarchy. For most of my life, my Jewishness in Australia was unremarkable. My parents and grandparents chose... The post I grew up believing Australia was the best place to be Jewish. This Hanukkah shooting forces a reckoning I do not want. appeared first on The Forward .",https://forward.com/opinion/790189/bondi-beach-shooting-antisemitism-australia/,The Forward,Nomi Kaltmann,2025-12-14T14:28:25,2025-12-14 15:08:48.862236,https://forward.com/?p=790189
"Bondi Beach witnesses, including antisemitism activist, describe grim scene after Hanukkah attack","(JTA) — Arsen Ostrovsky moved back to Australia from Israel two weeks ago to helm the Sydney office of AIJAC, the Australia/Israel &#38; Jewish Affairs Council. On Sunday, he was one of scores of people shot during an attack on a Hanukkah celebration at Sydney’s Bondi Beach. At least 11 people were killed, as well... The post Bondi Beach witnesses, including antisemitism activist, describe grim scene after Hanukkah attack appeared first on The Forward .",https://forward.com/fast-forward/790210/bondi-beach-witnesses-including-antisemitism-activist-describe-grim-scene-after-hanukkah-attack/,The Forward,Philissa Cramer,2025-12-14T14:34:01,2025-12-14 15:08:48.862186,https://forward.com/?p=790210
Unarmed man who tackled Bondi Beach Hanukkah attacker identified as Ahmed al-Ahmed,"(JTA) — Viral video circulating after the Bondi Beach Hanukkah attack showed an unarmed man racing toward one of the shooters and tackling him from behind before wrestling the gun from his hands. The man has been identified as Ahmed al-Ahmed, the operator of a fruit stand in a Sydney suburb who happened to be... The post Unarmed man who tackled Bondi Beach Hanukkah attacker identified as Ahmed al-Ahmed appeared first on The Forward .",https://forward.com/fast-forward/790228/unarmed-man-who-tackled-bondi-beach-hanukkah-attacker-identified-as-ahmed-al-ahmed/,The Forward,Philissa Cramer,2025-12-14T14:36:58,2025-12-14 15:08:48.862126,https://forward.com/?p=790228
"Witnesses, including antisemitism activist, describe ‘absolute bloodbath’ in Bondi Beach Hanukkah attack","The pro-Israel activist Arsen Ostrovsky was injured in the attack. -- The post Witnesses, including antisemitism activist, describe &#8216;absolute bloodbath&#8217; in Bondi Beach Hanukkah attack appeared first on Jewish Telegraphic Agency .",https://www.jta.org/2025/12/14/global/witnesses-including-antisemitism-activist-describe-grim-scene-after-bondi-beach-hanukkah-attack,JTA,Philissa Cramer,2025-12-14T14:23:30,2025-12-14 15:08:46.408632,https://www.jta.org/?p=1893754
Unarmed man who tackled Bondi Beach Hanukkah attacker identified as Ahmed al-Ahmed,A Jewish man threw something at the shooter after al-Ahmed disarmed him. -- The post Unarmed man who tackled Bondi Beach Hanukkah attacker identified as Ahmed al-Ahmed appeared first on Jewish Telegraphic Agency .,https://www.jta.org/2025/12/14/global/unarmed-man-who-tackled-bondi-beach-hanukkah-attacker-identified-as-ahmed-al-ahmed,JTA,Philissa Cramer,2025-12-14T14:31:38,2025-12-14 15:08:46.408583,https://www.jta.org/?p=1893753
"Freed hostage Elizabeth Tsurkov: 'I still see Arabs as human beings, an unpopular opinion in Israel after October 7'","Elizabeth Tsurkov was kidnapped in March 2023 and held in captivity in Iraq until September. Read her full Haaretz Podcast interview about the shock of returning to a post-October 7 Israel and sparring with right wing pundit Amit Segal – plus her analyses of Iraq, Syria and Gaza",https://www.haaretz.com/israel-news/2025-12-14/ty-article-magazine/.premium/elizabeth-tsurkov-i-still-see-arabs-as-human-beings-an-unpopular-opinion-in-israel/0000019b-0d55-d999-ad9f-8fffb9510000,Haaretz,Allison Kaplan Sommer,2025-12-14T13:35:06,2025-12-14 14:09:08.491592,https://www.haaretz.com/israel-news/2025-12-14/ty-article-magazine/.premium/elizabeth-tsurkov-i-still-see-arabs-as-human-beings-an-unpopular-opinion-in-israel/0000019b-0d55-d999-ad9f-8fffb9510000
"Israeli settlers reportedly attack Palestinian village in West Bank, wounding nine","According to residents, the Israeli settler attack against a village near Jericho focused on a building where foreign activists had been wounded in November",https://www.haaretz.com/israel-news/2025-12-14/ty-article/.premium/israeli-settlers-reportedly-attack-palestinian-village-in-west-bank-wounding-nine/0000019b-1ce9-d93d-a5fb-3efb50a00000,Haaretz,Matan Golan,2025-12-14T13:42:13,2025-12-14 14:09:08.491542,https://www.haaretz.com/israel-news/2025-12-14/ty-article/.premium/israeli-settlers-reportedly-attack-palestinian-village-in-west-bank-wounding-nine/0000019b-1ce9-d93d-a5fb-3efb50a00000
Sydney terror attack leaves Australian Jews feeling abandoned,Jewish leaders accuse Australian Prime Minister Anthony Albanese of ignoring rising antisemitism. The post Sydney terror attack leaves Australian Jews feeling abandoned appeared first on JNS.org .,https://www.jns.org/sydney-terror-attack-leaves-australian-jews-feeling-abandoned/,JNS,,2025-12-14T13:22:45,2025-12-14 14:09:01.564309,https://www.jns.org/?p=616666
United Hatzalah deploys crisis response team to Australia,"“When called upon to help others around the world, our volunteers have always responded,” said United Hatzalah President Eli Beer. The post United Hatzalah deploys crisis response team to Australia appeared first on JNS.org .",https://www.jns.org/united-hatzalah-deploys-crisis-response-team-to-australia/,JNS,JNS Staff,2025-12-14T13:39:29,2025-12-14 14:09:01.564271,https://www.jns.org/?p=616672
IDF targets three Hezbollah terrorists in Lebanon,Beirut's Foreign Minister Youssef Rajj told Qatar's “Al Jazeera” that Hezbollah refuses to lay down arms. The post IDF targets three Hezbollah terrorists in Lebanon appeared first on JNS.org .,https://www.jns.org/idf-targets-three-hezbollah-terrorists-in-lebanon/,JNS,JNS Staff,2025-12-14T13:51:33,2025-12-14 14:09:01.564228,https://www.jns.org/?p=616657
"‘Horrified, not shocked’: Australian Jews blame Bondi attack on ongoing ‘incitement’","Community leaders say government has failed to respond to burgeoning antisemitism since the October 7, 2023, attack, leaving Jewish people fearful The post &#8216;Horrified, not shocked&#8217;: Australian Jews blame Bondi attack on ongoing &#8216;incitement&#8217; appeared first on The Times of Israel .",https://www.timesofisrael.com/horrified-but-not-shocked-australian-jews-say-bondi-attack-was-inevitable/,Times of Israel,,2025-12-14T13:02:54,2025-12-14 14:08:57.145377,https://www.timesofisrael.com/?p=3711340
Daily Briefing Dec. 14: Day 800 – Ceasefire tensions escalate after top Hamas commander is killed,"Diplomatic correspondent Lazar Berman discusses phase 2 of Gaza truce, latest on Lebanon; reporter Sue Surkes reviews a desalination channel to the Sea of Galilee and sea turtle rehabilitation The post Daily Briefing Dec. 14: Day 800 &#8211; Ceasefire tensions escalate after top Hamas commander is killed appeared first on The Times of Israel .",https://www.timesofisrael.com/daily-briefing-dec-14-day-800-ceasefire-tensions-escalate-after-top-hamas-commander-is-killed/,Times of Israel,,2025-12-14T13:33:18,2025-12-14 14:08:57.145323,https://www.timesofisrael.com/?p=3711358&preview=true&preview_id=3711358
Australia's PM condemns Hanukkah shooting as 'targeted attack on Jewish Australians',"The Australian PM said that 'an attack on Jewish Australians is an attack on every Australian,' promising that his government will eradicate such 'hate, violence and terrorism.' Israeli PM Netanyahu said that 'antisemitism is a cancer that spreads when leaders are silent'",https://www.haaretz.com/world-news/2025-12-14/ty-article/australias-pm-condemns-hanukkah-shooting-as-targeted-attack-on-jewish-australians/0000019b-1ca3-d058-a7fb-1dfb4a0b0000,Haaretz,Haaretz,2025-12-14T12:48:01,2025-12-14 13:15:42.062775,https://www.haaretz.com/world-news/2025-12-14/ty-article/australias-pm-condemns-hanukkah-shooting-as-targeted-attack-on-jewish-australians/0000019b-1ca3-d058-a7fb-1dfb4a0b0000
Israel ranked No. 3 among world’s strongest economies,"The Jewish state “has continued its strong recovery from the chaos of 2023,” “The Economist” reported. The post Israel ranked No. 3 among world&#8217;s strongest economies appeared first on JNS.org .",https://www.jns.org/israel-ranked-no-3-among-worlds-strongest-economies/,JNS,JNS Staff,2025-12-14T12:23:55,2025-12-14 13:15:33.673312,https://www.jns.org/?p=616517
Toronto woman says Uber driver ejected her after hearing Hebrew,It was the third reported case this year of alleged antisemitic discrimination involving the ride sharing company and residents of the Canadian city. The post Toronto woman says Uber driver ejected her after hearing Hebrew appeared first on JNS.org .,https://www.jns.org/toronto-woman-says-uber-driver-ejected-her-after-hearing-hebrew/,JNS,JNS Staff,2025-12-14T12:47:33,2025-12-14 13:15:33.673264,https://www.jns.org/?p=616640
