title,description,link,source,author,published,scraped_at,guid
Sanae Takaichi chosen as Japan’s first female prime minister,"Ultraconservative's policies include stronger military and economy, revising Japan's pacifist constitution, and even measures against women's advancement The post Sanae Takaichi chosen as Japan&#8217;s first female prime minister appeared first on The Times of Israel .",https://www.timesofisrael.com/sanae-takaichi-chosen-as-japans-first-female-prime-minister/,Times of Israel,,2025-10-21T06:23:23,2025-10-21 07:10:41.102607,https://www.timesofisrael.com/?p=3670126
American chess grandmaster and popular streamer Daniel Naroditsky dies at 29,"Son of Jewish immigrants from Ukraine and Azerbaijan, prodigy earned highest chess title short of world champion at 18; his livestreams drew thousands, bringing game to new audiences The post American chess grandmaster and popular streamer Daniel Naroditsky dies at 29 appeared first on The Times of Israel .",https://www.timesofisrael.com/american-chess-grandmaster-and-popular-streamer-daniel-naroditsky-dies-at-29/,Times of Israel,,2025-10-21T07:02:50,2025-10-21 07:10:41.102563,https://www.timesofisrael.com/?p=3670118
Defense committee postpones discussions on ultra-Orthodox conscription bill,Knesset Foreign Affairs and Defense Committee chair Boaz Bismuth says delay until next week needed as legal adviser works on new version of controversial proposal The post Defense committee postpones discussions on ultra-Orthodox conscription bill appeared first on The Times of Israel .,https://www.timesofisrael.com/defense-committee-postpones-discussions-on-ultra-orthodox-conscription-bill/,Times of Israel,,2025-10-21T07:03:12,2025-10-21 07:10:41.102511,https://www.timesofisrael.com/?p=3670106
King Charles visits Manchester synagogue in wake of deadly attack,"The monarch spent several minutes outside of the Heaton Park Hebrew Congregation Synagogue, where wreaths lie for two Jews slain on Oct. 2. The post King Charles visits Manchester synagogue in wake of deadly attack appeared first on JNS.org .",https://www.jns.org/king-charles-visits-manchester-synagogue-in-wake-of-deadly-attack/,JNS,,2025-10-21T05:33:00,2025-10-21 06:13:20.422493,https://www.jns.org/?p=596938
Gal Gadot returns to London set after disruptions by anti-Israel activists,The star was considering nixing filming in the British capital due to consistent harassment by protesters. The post Gal Gadot returns to London set after disruptions by anti-Israel activists appeared first on JNS.org .,https://www.jns.org/gal-gadot-returns-to-london-set-after-disruptions-by-anti-israel-activists/,JNS,JNS Staff,2025-10-21T04:22:00,2025-10-21 05:09:41.125553,https://www.jns.org/?p=596816
Palestinian Authority police active near Jewish towns in Judea and Samaria,"“Within seconds, they can turn their guns on us,” security official tells JNS. The post Palestinian Authority police active near Jewish towns in Judea and Samaria appeared first on JNS.org .",https://www.jns.org/palestinian-authority-police-active-near-jewish-towns-in-judea-and-samaria/,JNS,Josh Hasten,2025-10-21T04:45:00,2025-10-21 05:09:41.125515,https://www.jns.org/?p=596860
Vance set to arrive in Israel,The U.S. vice president is visiting amid repeated Hamas violations of the ceasefire in the Gaza Strip. The post Vance set to arrive in Israel appeared first on JNS.org .,https://www.jns.org/vance-set-to-arrive-in-israel/,JNS,JNS Staff,2025-10-21T04:50:19,2025-10-21 05:09:41.125467,https://www.jns.org/?p=597259
Hamas terrorists who attacked IDF troops ‘may have come out of tunnels’,"""This war isn't over,"" a military official warned, as Hamas violations mounted following a deadly attack on IDF soldiers in southern Gaza on Sunday. The post Hamas terrorists who attacked IDF troops ‘may have come out of tunnels’ appeared first on JNS.org .",https://www.jns.org/hamas-terrorists-who-attacked-idf-troops-may-have-come-out-of-tunnels/,JNS,Yaakov Lappin,2025-10-21T04:01:00,2025-10-21 04:10:54.349519,https://www.jns.org/?p=596831
Massive Amazon cloud outage resolved after disrupting internet use worldwide,"Issue crippled internet use around the world, taking down a broad range of online services and highlighting global dependence on tech giants The post Massive Amazon cloud outage resolved after disrupting internet use worldwide appeared first on The Times of Israel .",https://www.timesofisrael.com/massive-amazon-cloud-outage-resolved-after-disrupting-internet-use-worldwide/,Times of Israel,,2025-10-21T04:00:11,2025-10-21 04:10:49.946024,https://www.timesofisrael.com/?p=3670100
Texas man arrested for alleged death threats against Florida Jews in conservative media,"""I'm so happy to live in Florida where my attorney general takes seriously and acts against threats to Floridians,"" Karol Markowicz told JNS. The post Texas man arrested for alleged death threats against Florida Jews in conservative media appeared first on JNS.org .",https://www.jns.org/texas-man-arrested-for-alleged-death-threats-against-florida-jews-in-conservative-media/,JNS,,2025-10-21T02:48:15,2025-10-21 03:25:25.975703,https://www.jns.org/?p=597231
"Body of hostage Tal Haimi, killed on October 7 at Kibbutz Nir Yitzhak, returned to Israel",,https://www.haaretz.com/israel-news/2025-10-21/ty-article-live/body-of-hostage-tal-haimi-killed-on-october-7-at-kibbutz-nir-yitzhak-returned-to-israel/0000019a-0479-d2fc-a79a-9e7f36f10000,Haaretz,Haaretz,2025-10-21T02:02:21,2025-10-21 02:38:23.881534,https://www.haaretz.com/israel-news/2025-10-21/ty-article-live/body-of-hostage-tal-haimi-killed-on-october-7-at-kibbutz-nir-yitzhak-returned-to-israel/0000019a-0479-d2fc-a79a-9e7f36f10000
"Ro Khanna, Dem critic of Israel, says he backs Zionism and ‘right for Israel to exist’","Khanna has faced criticism for saying Israel committed genocide in Gaza, appearing alongside defenders of Hamas The post Ro Khanna, Dem critic of Israel, says he backs Zionism and ‘right for Israel to exist’ appeared first on The Times of Israel .",https://www.timesofisrael.com/ro-khanna-dem-critic-of-israel-says-he-backs-zionism-and-right-for-israel-to-exist/,Times of Israel,,2025-10-21T01:50:42,2025-10-21 02:38:11.829311,https://www.timesofisrael.com/?p=3670093
‘You shall choose life’,"In Israel, the joy of reuniting with the hostages was tempered by a sense of fear for what the future may hold. The post ‘You shall choose life’ appeared first on JNS.org .",https://www.jns.org/you-shall-choose-life/,JNS,Sarah N. Stern,2025-10-21T01:00:00,2025-10-21 01:37:00.700405,https://www.jns.org/?p=597193
"Maccabi Tel Aviv refuses away tickets for Aston Villa match, citing safety concerns","After local British authorities' ban of supporters sparked uproar, soccer club says even if decision reversed, it will decline any allocation for fans The post Maccabi Tel Aviv refuses away tickets for Aston Villa match, citing safety concerns appeared first on The Times of Israel .",https://www.timesofisrael.com/maccabi-tel-aviv-refuses-away-tickets-for-aston-villa-match-citing-safety-concerns/,Times of Israel,,2025-10-21T01:00:06,2025-10-21 01:36:55.355654,https://www.timesofisrael.com/?p=3670077&preview=true&preview_id=3670077
"Rabbi Arthur Waskow, longtime progressive US activist and author, dies at 92","From Philadelphia, Waskow spent over six decades championing progressive causes like civil rights, economic injustice and climate change through a spiritual Jewish lens The post Rabbi Arthur Waskow, longtime progressive US activist and author, dies at 92 appeared first on The Times of Israel .",https://www.timesofisrael.com/rabbi-arthur-waskow-longtime-progressive-us-activist-and-author-dies-at-92/,Times of Israel,,2025-10-20T23:27:06,2025-10-21 00:35:31.625283,https://www.timesofisrael.com/?p=3669965
Jewish leaders issue fresh warnings about Mamdani in closing weeks of campaign,"Rabbi Elliot Cosgrove, a leader in the Conservative movement, calls candidate 'a danger to the security of the New York Jewish community' The post Jewish leaders issue fresh warnings about Mamdani in closing weeks of campaign appeared first on The Times of Israel .",https://www.timesofisrael.com/jewish-leaders-issue-fresh-warnings-about-mamdani-in-closing-weeks-of-campaign/,Times of Israel,,2025-10-21T00:22:24,2025-10-21 00:35:31.625237,https://www.timesofisrael.com/?p=3669931
The Lakers were about to shock the NBA. But Shabbat had to end first.,"Luka Dončić was headed to Los Angeles — if the Lakers could keep it quiet for one more Shabbat. The Feb. 2 trade that brought Dončić, widely touted as one of the two or three best basketball players on the planet, to Los Angeles blindsided the NBA — and Dončić himself. It was the most... The post The Lakers were about to shock the NBA. But Shabbat had to end first. appeared first on The Forward .",https://forward.com/culture/books/777355/luka-doncic-trade-shabbat-lakers-book/,The Forward,Louis Keene,2025-10-20T23:41:43,2025-10-21 00:35:29.518446,https://forward.com/?p=777355
"HUC says ‘most crass, baseless charges’ it aimed to sell rare texts","The scholar, whom the Reform seminary hired to appraise its library, told JNS that she was told “quite firmly” that there was no plan to sell. The post HUC says ‘most crass, baseless charges’ it aimed to sell rare texts appeared first on JNS.org .",https://www.jns.org/huc-says-most-crass-baseless-charges-it-aimed-to-sell-rare-texts/,JNS,Aaron Bandler and JNS Staff,2025-10-20T22:07:04,2025-10-20 23:09:07.849034,https://www.jns.org/?p=597209
JD Vance heads to Israel as part of efforts to shore up Gaza ceasefire,Vice president will meet Netanyahu and other top officials * Syria announces seizure of 12 million Captagon pills The post JD Vance heads to Israel as part of efforts to shore up Gaza ceasefire appeared first on The Times of Israel .,https://www.timesofisrael.com/liveblog-october-21-2025/,Times of Israel,,2025-10-20T22:37:43,2025-10-20 23:09:03.424459,https://www.timesofisrael.com/?p=3670046&preview=true&preview_id=3670046
"Hamas hands over body of hostage Tal Haimi, killed and kidnapped on Oct. 7","Haimi identified after remains taken to Tel Aviv forensic institute; Netanyahu said to appoint US-Israeli businessman to ceasefire monitoring mechanism The post Hamas hands over body of hostage Tal Haimi, killed and kidnapped on Oct. 7 appeared first on The Times of Israel .",https://www.timesofisrael.com/hamas-hands-over-casket-with-apparent-remains-of-hostage-after-gaza-truce-tested/,Times of Israel,,2025-10-20T22:38:38,2025-10-20 23:09:03.424410,https://www.timesofisrael.com/?p=3669969
"As Greenpoint’s Jewish community grows, so does this shul’s Hebrew school","(New York Jewish Week) — Greenpoint, Brooklyn is known for many things: its extensive waterfront, a tight-knit Polish community and a vibrant arts scene. One thing it&#8217;s not known for: a thriving Jewish community. But that&#8217;s rapidly changing. The Greenpoint Shul — North Brooklyn’s only non-Haredi, brick-and-mortar synagogue — is today home to some 100... The post As Greenpoint’s Jewish community grows, so does this shul’s Hebrew school appeared first on The Forward .",https://forward.com/fast-forward/777331/as-greenpoints-jewish-community-grows-so-does-this-shuls-hebrew-school/,The Forward,Jackie Hajdenberg,2025-10-20T22:42:49,2025-10-20 23:09:01.282782,https://forward.com/?p=777331
IDF sees Hamas restoring control over Gaza with no opposition from local gangs,"According to Israel military sources, Hamas has staffed senior government positions and its police forces are operating on the ground. At the same time, fear is growing of clashes between soldiers and residents who will move toward the Yellow Line - the IDF withdrawal line - due to the insurmountable congestion",https://www.haaretz.com/israel-news/2025-10-21/ty-article/.premium/idf-sees-hamas-restoring-control-over-gaza-with-no-opposition-from-local-gangs/0000019a-037e-dfc6-a3bf-f37e28f50000,Haaretz,Yaniv Kubovich,2025-10-20T21:36:49,2025-10-20 22:09:05.473676,https://www.haaretz.com/israel-news/2025-10-21/ty-article/.premium/idf-sees-hamas-restoring-control-over-gaza-with-no-opposition-from-local-gangs/0000019a-037e-dfc6-a3bf-f37e28f50000
Islamic Group CAIR’s Lawsuit Against University to Block Antisemitism Course Prompts Derision,"Northwestern University in Illinois is being sued for teaching its students and staff not to indulge or promote antisemitism, according...",https://www.algemeiner.com/2025/10/20/islamic-group-cairs-lawsuit-against-university-block-antisemitism-course-prompts-derision/,Algemeiner,Dion J. Pierre,2025-10-20T21:46:01,2025-10-20 22:09:00.428199,https://www.algemeiner.com/?p=755666
UN Nuclear Watchdog Believes Iran’s Enriched Uranium Survived War With Israel as Tehran Rebuffs Trump,"The International Atomic Energy Agency (IAEA), the UN&#8217;s nuclear watchdog, confirmed that most of Iran&#8217;s enriched uranium survived the 12-day...",https://www.algemeiner.com/2025/10/20/un-nuclear-watchdog-believes-irans-enriched-uranium-survived-war-israel-tehran-rebuffs-trump/,Algemeiner,Ailin Vilches Arguello,2025-10-20T21:53:12,2025-10-20 22:09:00.428160,https://www.algemeiner.com/?p=755736
Haaretz Cartoon,,https://www.haaretz.com/opinion/daily-cartoon/2025-10-20/ty-article-opinion/haaretz-cartoon/0000019a-0344-d7b0-a5ba-6f667b140000,Haaretz,Amos Biderman,2025-10-20T20:18:52,2025-10-20 21:09:17.658234,https://www.haaretz.com/opinion/daily-cartoon/2025-10-20/ty-article-opinion/haaretz-cartoon/0000019a-0344-d7b0-a5ba-6f667b140000
Netanyahu taps confidant accused of bribery as next Likud director general,David Sharan was part of numerous bribery and corruption investigations involving Prime Minister Benjamin Netanyahu's criminal trials ■ Likud sources say his appointment could be nixed by the court],https://www.haaretz.com/israel-news/2025-10-20/ty-article/.premium/netanyahu-taps-confidant-accused-of-bribery-as-next-likud-director-general/0000019a-0318-d582-a39e-5bfc19c10000,Haaretz,Michael Hauser Tov,2025-10-20T20:25:58,2025-10-20 21:09:17.658211,https://www.haaretz.com/israel-news/2025-10-20/ty-article/.premium/netanyahu-taps-confidant-accused-of-bribery-as-next-likud-director-general/0000019a-0318-d582-a39e-5bfc19c10000
Netanyahu's not interested in anything but himself,"As the government allocates huge sums of money to the ultra-Orthodox, settlers and superfluous government ministries, the country is getting poorer. Will Netanyahu's 2026 budget save Israel?",https://www.haaretz.com/opinion/2025-10-20/ty-article-opinion/.premium/netanyahus-not-interested-in-anything-but-himself/0000019a-02d7-d582-a39e-5af726cf0000,Haaretz,Nehemia Shtrasler,2025-10-20T20:27:45,2025-10-20 21:09:17.658179,https://www.haaretz.com/opinion/2025-10-20/ty-article-opinion/.premium/netanyahus-not-interested-in-anything-but-himself/0000019a-02d7-d582-a39e-5af726cf0000
This government has turned shamelessness into virtue; Israelis must return to the streets,,https://www.haaretz.com/opinion/2025-10-20/ty-article-opinion/.premium/this-government-has-turned-shamelessness-into-virtue-israelis-must-return-to-the-streets/0000019a-02d7-d3e1-adfe-5ed72bb60000,Haaretz,Uzi Baram,2025-10-20T20:30:59,2025-10-20 21:09:17.658145,https://www.haaretz.com/opinion/2025-10-20/ty-article-opinion/.premium/this-government-has-turned-shamelessness-into-virtue-israelis-must-return-to-the-streets/0000019a-02d7-d3e1-adfe-5ed72bb60000
Can Israelis now start healing and educating towards peace in the Middle East?,"Winston Churchill promised his nation 'Blood, sweat and tears,' and after the hard years Europe was rebuilt. In the past two years we've seen blood and tears in unimaginable quantities. Now comes the stage of building and repair, doing and healing",https://www.haaretz.com/opinion/2025-10-20/ty-article-opinion/.premium/can-israelis-now-start-healing-and-educating-towards-peace-in-the-middle-east/0000019a-021f-dfc6-a3bf-f33f1b510000,Haaretz,Rivka Neriya-Ben Shahar,2025-10-20T20:35:14,2025-10-20 21:09:17.658118,https://www.haaretz.com/opinion/2025-10-20/ty-article-opinion/.premium/can-israelis-now-start-healing-and-educating-towards-peace-in-the-middle-east/0000019a-021f-dfc6-a3bf-f33f1b510000
"Nothing is 'over,' not in the Gaza Strip nor in the West Bank","The same equation Israel has adopted in Gaza – where Palestinian society is consumed by internal strife, fighting over the crumbs of what little they have – is also applied to the West Bank, where repression and trampling of rights are the order of the day under a brutal Israeli military regime",https://www.haaretz.com/opinion/2025-10-20/ty-article-opinion/.premium/nothing-is-over-not-in-the-gaza-strip-nor-in-the-west-bank/0000019a-02d7-d582-a39e-5af72a040000,Haaretz,Jack Khoury,2025-10-20T20:40:33,2025-10-20 21:09:17.658084,https://www.haaretz.com/opinion/2025-10-20/ty-article-opinion/.premium/nothing-is-over-not-in-the-gaza-strip-nor-in-the-west-bank/0000019a-02d7-d582-a39e-5af72a040000
Israel's spineless prosecutor has become a tool of the state,,https://www.haaretz.com/opinion/editorial/2025-10-20/ty-article-opinion/israels-spineless-prosecutor-has-become-a-tool-of-the-state/0000019a-031b-d582-a39e-5bfffaee0000,Haaretz,Haaretz Editorial,2025-10-20T20:51:44,2025-10-20 21:09:17.658041,https://www.haaretz.com/opinion/editorial/2025-10-20/ty-article-opinion/israels-spineless-prosecutor-has-become-a-tool-of-the-state/0000019a-031b-d582-a39e-5bfffaee0000
Funerals held for two Israeli soldiers killed by anti-tank missile in southern Gaza,Maj. Yaniv Kula and Staff Sgt. Itay Yavetz were killed when militants emerged from a tunnel and fired at IDF bulldozers near a humanitarian aid route,https://www.haaretz.com/israel-news/2025-10-21/ty-article/.premium/funerals-held-for-two-israeli-soldiers-killed-by-anti-tank-missile-in-southern-gaza/0000019a-0325-d3e1-adfe-5f37948f0000,Haaretz,Josh Breiner,2025-10-20T21:03:11,2025-10-20 21:09:17.658006,https://www.haaretz.com/israel-news/2025-10-21/ty-article/.premium/funerals-held-for-two-israeli-soldiers-killed-by-anti-tank-missile-in-southern-gaza/0000019a-0325-d3e1-adfe-5f37948f0000
Muslim Groups Call on US Lawmakers to Condemn Jewish Rep. Randy Fine for ‘Islamophobic Attack’ on Mamdani,A coalition of Muslim organizations across New York has called on the state&#8217;s congressional delegation to take a public stand...,https://www.algemeiner.com/2025/10/20/muslim-groups-call-us-lawmakers-condemn-jewish-rep-randy-fine-islamophobic-attack-mamdani/,Algemeiner,Corey Walker,2025-10-20T20:58:17,2025-10-20 21:09:12.735727,https://www.algemeiner.com/?p=755676
Minneapolis Socialist mayoral candidate open to fundraiser offer from Gaza ‘chief rabbi’,Omar Fateh said he “would love” for the fake rabbi of Gaza “to get more involved” in his campaign efforts after being in contact with the parody account. The post Minneapolis Socialist mayoral candidate open to fundraiser offer from Gaza ‘chief rabbi’ appeared first on JNS.org .,https://www.jns.org/minneapolis-socialist-mayoral-candidate-open-to-fundraiser-offer-from-gaza-chief-rabbi/,JNS,Mike Wagenheim,2025-10-20T20:43:03,2025-10-20 21:09:10.297839,https://www.jns.org/?p=597170
"In first, police drop case against couple detained on Iranian espionage suspicions","Probe into Ra’anana couple Doria Achiel and Yuvda Israilov closed after three months without explanation; lawyer says police lacked sufficient evidence The post In first, police drop case against couple detained on Iranian espionage suspicions appeared first on The Times of Israel .",https://www.timesofisrael.com/in-first-police-drop-case-against-couple-detained-on-iranian-espionage-suspicions/,Times of Israel,,2025-10-20T20:05:15,2025-10-20 21:09:02.729354,https://www.timesofisrael.com/?p=3669825
"Trump floats renewal of Gaza fighting, but says Hamas still has chance to ‘behave’","'We’re going to eradicate them if we have to,' US president says of terror group, after IDF response to killing of 2 troops; Witkoff, Kushner said to urge PM not to endanger truce The post Trump floats renewal of Gaza fighting, but says Hamas still has chance to &#8216;behave&#8217; appeared first on The Times of Israel .",https://www.timesofisrael.com/trump-floats-renewal-of-gaza-fighting-but-says-hamas-still-has-chance-to-behave/,Times of Israel,,2025-10-20T20:37:13,2025-10-20 21:09:02.729302,https://www.timesofisrael.com/?p=3669837
"Ro Khanna, Democratic critic of Israel, says he supports Zionism and the ‘right for Israel to exist’","(JTA) — California Democratic Rep. Ro Khanna, a leading critic of Israel in Congress, said he believes in the &#8220;right for Israel to exist&#8221; and that it is antisemitic to oppose the existence of a Jewish state. Khanna made the comment during an interview Friday with J. The Jewish News of Northern California. Speaking with... The post Ro Khanna, Democratic critic of Israel, says he supports Zionism and the ‘right for Israel to exist’ appeared first on The Forward .",https://forward.com/fast-forward/777256/ro-khanna-democratic-critic-of-israel-says-he-supports-zionism-and-the-right-for-israel-to-exist/,The Forward,Grace Gilson,2025-10-20T20:22:16,2025-10-20 21:09:00.474514,https://forward.com/?p=777256
Prominent NYC rabbi urges congregants to vote against Zohran Mamdani in Shabbat sermon,"(JTA) — This piece first ran as part of The Countdown, JTA&#8217;s daily newsletter rounding up all the developments in the New York City mayor’s race. Sign up here to get it in your inbox. There are 15 days to the election. 🗣 Rabbis speak out Two leading New York rabbis are using their pulpits... The post Prominent NYC rabbi urges congregants to vote against Zohran Mamdani in Shabbat sermon appeared first on The Forward .",https://forward.com/fast-forward/777265/prominent-nyc-rabbi-urges-congregants-to-vote-against-zohran-mamdani-in-shabbat-sermon/,The Forward,JTA Staff,2025-10-20T20:28:28,2025-10-20 21:09:00.474450,https://forward.com/?p=777265
"As Greenpoint’s Jewish community grows, so does this shul’s Hebrew school","Newly incorporated by the Greenpoint Shul, a mom-and-pop, twice-a-week school aims to serve all of North Brooklyn's Jewish community. -- The post As Greenpoint’s Jewish community grows, so does this shul’s Hebrew school appeared first on Jewish Telegraphic Agency .",https://www.jta.org/2025/10/20/ny/as-greenpoints-jewish-community-grows-so-does-this-shuls-hebrew-school,JTA,Jackie Hajdenberg,2025-10-20T20:58:24,2025-10-20 21:08:57.840864,https://www.jta.org/?p=1890976
'War of Redemption': The real reason Netanyahu is renaming the Gaza war,Prime Minister Benjamin Netanyahu has not been a fan of the name since the beginning and has been on a continuing mission to rebrand the war. Here's why,https://www.haaretz.com/israel-news/haaretz-today/2025-10-20/ty-article/.highlight/war-of-redemption-the-real-reason-netanyahu-is-renaming-the-gaza-war/0000019a-02c2-dfc6-a3bf-f3e635b80002,Haaretz,Allison Kaplan Sommer,2025-10-20T20:02:18,2025-10-20 20:10:32.593264,https://www.haaretz.com/israel-news/haaretz-today/2025-10-20/ty-article/.highlight/war-of-redemption-the-real-reason-netanyahu-is-renaming-the-gaza-war/0000019a-02c2-dfc6-a3bf-f3e635b80002
"Kabul Must Rein in Militants for Ceasefire to Hold, Says Pakistan","A ceasefire agreement between Islamabad and Kabul rests on the ruling Afghan Taliban&#8217;s ability to rein in militants attacking Pakistan across their shared border, Pakistan&#8216;s Defense Minister Khawaja Muhammad Asif told...",https://www.algemeiner.com/2025/10/20/kabul-must-rein-in-militants-ceasefire-hold-says-pakistan/,Algemeiner,Reuters and Algemeiner Staff,2025-10-20T19:10:54,2025-10-20 20:10:27.156330,https://www.algemeiner.com/?p=755699
US Steps Up Diplomacy After Gaza Truce Shaken,US envoys met Israeli Prime Minister Benjamin Netanyahu on Monday aiming to corral Israel and Hamas to get the Gaza ceasefire plan...,https://www.algemeiner.com/2025/10/20/us-steps-up-diplomacy-after-gaza-truce-shaken/,Algemeiner,Reuters and Algemeiner Staff,2025-10-20T19:18:05,2025-10-20 20:10:27.156299,https://www.algemeiner.com/?p=755709
"Tel Aviv Soccer Game Abruptly Canceled After Dozens Injured by Fans Throwing Smoke Grenades, Violent Riots",An Israeli Premier League soccer game on Sunday at Tel Aviv&#8217;s Bloomfield Stadium between city rivals Hapoel and Maccabi was...,https://www.algemeiner.com/2025/10/20/tel-aviv-soccer-game-abruptly-canceled-dozens-injured-fans-throwing-smoke-grenades-violent-riots/,Algemeiner,Shiryn Ghermezian,2025-10-20T19:21:14,2025-10-20 20:10:27.156272,https://www.algemeiner.com/?p=755651
Harvard Faces $113 Million Budget Shortfall After Trump Cuts,Harvard University registered a $113 million budget deficit caused chiefly by the Trump administration&#8217;s confiscation of much of its federal...,https://www.algemeiner.com/2025/10/20/harvard-faces-113-million-budget-shortfall-after-trump-cuts/,Algemeiner,Dion J. Pierre,2025-10-20T19:43:32,2025-10-20 20:10:27.156243,https://www.algemeiner.com/?p=755522
Antisemitic AI-Generated Videos Flood OpenAI’s New Sora 2 App,"The release of OpenAI&#8217;s Sora 2 video generating app last month has prompted a wave of criticisms, notably from the...",https://www.algemeiner.com/2025/10/20/antisemitic-ai-generated-videos-flood-openais-new-sora-2-app/,Algemeiner,David Swindle,2025-10-20T19:55:45,2025-10-20 20:10:27.156212,https://www.algemeiner.com/?p=755664
Israel receives remains of another hostage via Red Cross,"The IDF requested that the public act with sensitivity and wait for the official identification, which will first be provided to the families. The post Israel receives remains of another hostage via Red Cross appeared first on JNS.org .",https://www.jns.org/israel-receives-remains-of-another-hostage/,JNS,JNS Staff,2025-10-20T17:26:33,2025-10-20 20:10:24.738944,https://www.jns.org/?p=597050
