title,description,link,source,author,published,scraped_at,guid
"Six countries have committed to joining Trump’s Board of Peace, say officials","US expects leaders of Egypt, Qatar, UAE, UK, Italy, Germany to sit on top panel overseeing Strip's rebuild, but similar commitments to join ISF lacking amid questions about mandate The post Six countries have committed to joining Trump’s Board of Peace, say officials appeared first on The Times of Israel .",https://www.timesofisrael.com/six-countries-have-committed-to-joining-trumps-board-of-peace-say-officials/,Times of Israel,,2025-12-17T18:22:02,2025-12-17 19:10:17.005402,https://www.timesofisrael.com/?p=3714473
Compassion in action: how Yad Sarah brings hope to a nation in crisis - Sponsored Content,"As Israel continues to endure and heal, Yad Sarah remains committed to standing by our people, providing vital medical equipment, transportation, and support in moments of crisis. The post Compassion in action: how Yad Sarah brings hope to a nation in crisis appeared first on The Times of Israel .",https://toi.li/J4BKUm,Times of Israel,,2025-12-17T18:50:39,2025-12-17 19:10:17.005355,https://www.timesofisrael.com/?post_type=spotlight&p=3714633
"Brain drain: 12% of Israelis with PhDs lived abroad last year, finds state report","6% of those with degrees and 25% with math doctorates have left country, says Central Bureau of Statistics; exodus of educated professionals a threat to Israel, warn academic leaders The post Brain drain: 12% of Israelis with PhDs lived abroad last year, finds state report appeared first on The Times of Israel .",https://www.timesofisrael.com/brain-drain-12-of-israelis-with-phds-lived-abroad-last-year-finds-state-report/,Times of Israel,,2025-12-17T19:01:47,2025-12-17 19:10:17.005308,https://www.timesofisrael.com/?p=3714431
"Australia’s Yiddish community is thriving, not reviving","As a professional translator of Yiddish literature, I was surprised by the characterization of the Australian Jewish community&#8217;s connection to the Yiddish language in the recent Forward piece &#8220;Australia’s Jewish community is defined by Holocaust survivors, Yiddishkeit and immigrants.&#8221; Australia&#8217;s Jewish community has indeed been shaped by the Yiddish language. This is why, when I... The post Australia&#8217;s Yiddish community is thriving, not reviving appeared first on The Forward .",https://forward.com/opinion/letters/791563/australias-yiddish-community-is-thriving-not-reviving/,The Forward,Maia Evrona,2025-12-17T18:40:31,2025-12-17 19:10:14.347082,https://forward.com/?p=791563
"At White House Hanukkah party, Trump says Congress ‘is becoming antisemitic’","(JTA) — President Donald Trump said Congress &#8220;is becoming antisemitic&#8221; and warned about what he said was the fading influence of the “Jewish lobby” and “Israeli lobby” in an address to his Jewish supporters at a White House celebration marking the third night of Hanukkah. During his remarks, the president also honored the victims of... The post At White House Hanukkah party, Trump says Congress ‘is becoming antisemitic’ appeared first on The Forward .",https://forward.com/fast-forward/791572/at-white-house-hanukkah-party-trump-says-congress-is-becoming-antisemitic/,The Forward,Andrew Lapin,2025-12-17T18:46:42,2025-12-17 19:10:14.347025,https://forward.com/?p=791572
"After Sydney attack, Christians light menorahs – and spark a Jewish debate","From a viral Threads post to a U.S.-based initiative active in 16 countries, non-Jews are putting menorahs in their windows after the Bondi Beach killings. Supporters frame it as neighborly solidarity; critics caution that lighting Hanukkah candles crosses a line into a 'closed practice'",https://www.haaretz.com/jewish/2025-12-17/ty-article/after-sydney-attack-christians-light-menorahs-and-spark-a-jewish-debate/0000019b-2cb2-d5c5-a3df-bef69cf10000,Haaretz,The Forward,2025-12-17T17:28:28,2025-12-17 18:14:34.812555,https://www.haaretz.com/jewish/2025-12-17/ty-article/after-sydney-attack-christians-light-menorahs-and-spark-a-jewish-debate/0000019b-2cb2-d5c5-a3df-bef69cf10000
"As he appeals to GOP's America First camp, JD Vance might find he has an antisemitism problem","Amid the Bondi massacre and rifts over Israel and antisemitism in the Republican Party, the U.S. vice president blamed antisemitism on 'ethnic grievances.' Echoing the great replacement theory, JD Vance also said that to fight Jew-hatred, one should 'support our efforts to lower immigration and promote assimilation'",https://www.haaretz.com/us-news/2025-12-17/ty-article/.premium/appealing-to-the-america-first-camp-jd-vance-might-find-he-has-an-antisemitism-problem/0000019b-2cf6-d8f0-a9db-6dfeb5bd0000,Haaretz,Ben Samuels,2025-12-17T18:03:51,2025-12-17 18:14:34.812520,https://www.haaretz.com/us-news/2025-12-17/ty-article/.premium/appealing-to-the-america-first-camp-jd-vance-might-find-he-has-an-antisemitism-problem/0000019b-2cf6-d8f0-a9db-6dfeb5bd0000
"Ticketless Israeli teen sneaks onto flight from Tel Aviv to Vienna, casting doubt on Ben-Gurion Airport security",The 18-year-old managed to pass through four separate airport checkpoints without a ticket and board the plane. A former transport security official said the incident – the second in recent months – warrants an external investigation,https://www.haaretz.com/israel-news/2025-12-17/ty-article/.premium/ticketless-teen-boards-flight-out-of-israel-casting-doubt-on-ben-gurion-airport-security/0000019b-2d11-d60f-a5db-6d1f41560000,Haaretz,Ben Kroll,2025-12-17T18:07:17,2025-12-17 18:14:34.812479,https://www.haaretz.com/israel-news/2025-12-17/ty-article/.premium/ticketless-teen-boards-flight-out-of-israel-casting-doubt-on-ben-gurion-airport-security/0000019b-2d11-d60f-a5db-6d1f41560000
Will Mamdani and His Support for Israel Boycotts Make New York Less Affordable?,"Mayor-elect Zohran Mandani’s vocal support of the Boycott, Divestment, and Sanctions (BDS) movement is an announcement to the world that...",https://www.algemeiner.com/2025/12/17/will-mamdani-and-his-support-for-israel-boycotts-make-new-york-less-affordable/,Algemeiner,Charles A. Stone,2025-12-17T17:12:28,2025-12-17 18:14:30.095571,https://www.algemeiner.com/?p=760516
Israel Must Increase Its Advocacy — and Jews Must Continue Speaking Up,"When will Israel answer the decades-long smear campaign against it? How can a nation known for breakthroughs in medicine, science,...",https://www.algemeiner.com/2025/12/17/israel-must-increase-its-advocacy-and-jews-must-continue-speaking-up/,Algemeiner,Anya Gillinson,2025-12-17T17:17:31,2025-12-17 18:14:30.095542,https://www.algemeiner.com/?p=760357
UK Police Plan Tougher Action Against Antisemitic Chants and Protests,"British police on Wednesday said they would take tougher action against people who use placards and chants to target the Jewish community, saying recent violent incidents...",https://www.algemeiner.com/2025/12/17/uk-police-plan-tougher-action-against-antisemitic-chants-protests/,Algemeiner,Reuters and Algemeiner Staff,2025-12-17T17:42:11,2025-12-17 18:14:30.095514,https://www.algemeiner.com/?p=760562
Alleged Bondi Gunman Charged With 15 Murders as Funerals of Victims Begin,"A man who allegedly opened fire on a Jewish Hanukkah celebration on Sydney&#8217;s famed Bondi Beach has been charged with 59 offenses,...",https://www.algemeiner.com/2025/12/17/alleged-bondi-gunman-charged-15-murders-funerals-victims-begin/,Algemeiner,Reuters and Algemeiner Staff,2025-12-17T17:50:46,2025-12-17 18:14:30.095485,https://www.algemeiner.com/?p=760565
Israeli NBA Player Deni Avdija Wishes ‘Happy Hanukkah’ After Star Performance in Win for Portland Trail Blazers,"Israeli NBA player Deni Avdija clocked in 26 points, seven rebounds, eight assists, and one steal in 33 minutes during...",https://www.algemeiner.com/2025/12/17/israeli-nba-player-deni-avdija-wishes-happy-hanukkah-star-performance-win-portland-trail-blazers/,Algemeiner,Shiryn Ghermezian,2025-12-17T17:58:22,2025-12-17 18:14:30.095455,https://www.algemeiner.com/?p=760411
"Oscars Shortlists Include Israeli, Palestinian Films About Oct. 7 Hostage, Deceased Palestinian Girl",Four films about Israelis and Palestinian are on the various shortlists of films that will advance for the 98th Academy...,https://www.algemeiner.com/2025/12/17/oscars-shortlists-include-israeli-palestinian-films-oct-7-hostage-deceased-palestinian-girl/,Algemeiner,Shiryn Ghermezian,2025-12-17T18:11:08,2025-12-17 18:14:30.095418,https://www.algemeiner.com/?p=760536
"‘I’ve taken loaded guns off of children,’ says Jewish new Seattle Public Schools superintendent","Ben Shuldiner, the outgoing superintendent of the Lansing School District in Michigan, told JNS that deep-blue Seattle is a better political fit for him than the Michigan capital. The post ‘I’ve taken loaded guns off of children,’ says Jewish new Seattle Public Schools superintendent appeared first on JNS.org .",https://www.jns.org/ive-taken-loaded-guns-off-of-children-says-jewish-new-seattle-public-schools-superintendent/,JNS,Jessica Russak-Hoffman,2025-12-17T17:20:39,2025-12-17 18:14:27.718925,https://www.jns.org/?p=617987
"Four Seasons Orlando: Where Luxury, Sunshine, and Storybook Magic Meet","[&#8230;] The post Four Seasons Orlando: Where Luxury, Sunshine, and Storybook Magic Meet appeared first on Jewish Journal .",https://jewishjournal.com/culture/travel/385717/four-seasons-orlando-where-luxury-sunshine-and-storybook-magic-meet/,Jewish Journal,Lisa Ellen Niver,2025-12-17T17:14:11,2025-12-17 18:14:25.378552,https://jewishjournal.com/?p=385717
"Norman Podhoretz, Commentary Editor and Archetypal Jewish Neoconservative, Dies at 95","Podhoretz’s pro-Israel, pro-democracy outlook made him an intellectual forebear of the neocon movement. The post Norman Podhoretz, Commentary Editor and Archetypal Jewish Neoconservative, Dies at 95 appeared first on Jewish Journal .",https://jewishjournal.com/judaism/obituaries/385719/norman-podhoretz-commentary-editor-and-archetypal-jewish-neoconservative-dies-at-95/,Jewish Journal,"Philissa Cramer, JTA",2025-12-17T17:45:31,2025-12-17 18:14:25.378514,https://jewishjournal.com/?p=385719
Words,"Today words are used in a propaganda war, not to reveal, but to conceal, not to summon truth but to distort it. Mark Twain wrote: “A lie can travel half way around the world while the truth is putting on his shoes.” The post Words appeared first on Jewish Journal .",https://jewishjournal.com/commentary/opinion/385721/words/,Jewish Journal,Paul Socken,2025-12-17T17:56:04,2025-12-17 18:14:25.378474,https://jewishjournal.com/?p=385721
Rabbi Cosgrove Exposed a Generational Rift We Can No Longer Ignore,Rabbi Elliot Cosgrove finally said aloud what too many communal leaders have been afraid to confront. The post Rabbi Cosgrove Exposed a Generational Rift We Can No Longer Ignore appeared first on Jewish Journal .,https://jewishjournal.com/commentary/opinion/385725/rabbi-cosgrove-exposed-a-generational-rift-we-can-no-longer-ignore/,Jewish Journal,Samuel J. Abrams,2025-12-17T18:06:20,2025-12-17 18:14:25.378426,https://jewishjournal.com/?p=385725
"At White House Hanukkah party, Trump says ‘Jewish lobby’ no longer most powerful","US president says many in Congress now 'hate Israel,' falsely claims twice he got all hostages out of Gaza; Miriam Adelson pledges $250m for third Trump term The post At White House Hanukkah party, Trump says &#8216;Jewish lobby&#8217; no longer most powerful appeared first on The Times of Israel .",https://www.timesofisrael.com/at-white-house-hanukkah-party-trump-says-jewish-lobby-no-longer-most-powerful/,Times of Israel,,2025-12-17T17:30:17,2025-12-17 18:14:23.164645,https://www.timesofisrael.com/?post_type=liveblog_entry&p=3714458
Bennett denies his phone was hacked after Iranian group claims to leak its contents,"The 'Handala' hackers group claims it breached ex-prime minister's phone in 'Operation Octopus,' publishes images, contact list and documents it says were on the device The post Bennett denies his phone was hacked after Iranian group claims to leak its contents appeared first on The Times of Israel .",https://www.timesofisrael.com/bennett-denies-his-phone-was-hacked-after-iranian-group-claims-to-leak-its-contents/,Times of Israel,,2025-12-17T18:01:07,2025-12-17 18:14:23.164580,https://www.timesofisrael.com/?p=3714479
Black Jews seek renewed solidarity to fight hate after Bondi Beach,"In the backlash against Israel following the Oct. 7, 2023 Hamas terrorist attack, many American Jews put away Stars of David or avoided wearing yarmulkes in public, fearing they would be targeted in antisemitic violence. The burgeoning anti-Zionist protests on the left, coupled with emboldened right-wing antisemitism during the Trump years, shattered a sense of... The post Black Jews seek renewed solidarity to fight hate after Bondi Beach appeared first on The Forward .",https://forward.com/opinion/791509/australia-bondi-beach-black-jews-antisemitism/,The Forward,Robin Washington,2025-12-17T17:17:20,2025-12-17 18:14:20.972146,https://forward.com/?p=791509
"At White House Hanukkah party, Trump says Congress ‘is becoming antisemitic’","The president added that he believes the power of the ""Jewish lobby"" and ""Israeli lobby"" is fading. -- The post At White House Hanukkah party, Trump says Congress &#8216;is becoming antisemitic&#8217; appeared first on Jewish Telegraphic Agency .",https://www.jta.org/2025/12/17/politics/at-white-house-hanukkah-party-trump-says-congress-is-becoming-antisemitic,JTA,Andrew Lapin,2025-12-17T18:05:49,2025-12-17 18:14:18.391154,https://www.jta.org/?p=1893990
"Knesset advances judicial coup legislation, seeks to expand Judaism's role in Israeli public life",Bills approved by lawmakers in a preliminary vote include proposed legislation to strip powers from the president of the Supreme Court and grant politicians authority to revoke the rank and benefits of former senior defense officials if lawmakers believe they defamed the IDF,https://www.haaretz.com/israel-news/2025-12-17/ty-article/.premium/knesset-advances-judicial-coup-bills-aims-to-expand-judaisms-role-in-public-life/0000019b-2c6f-d4d0-a9db-fdefb3250000,Haaretz,Noa Shpigel,2025-12-17T16:25:17,2025-12-17 17:12:13.809094,https://www.haaretz.com/israel-news/2025-12-17/ty-article/.premium/knesset-advances-judicial-coup-bills-aims-to-expand-judaisms-role-in-public-life/0000019b-2c6f-d4d0-a9db-fdefb3250000
Serbian government threatens Trump Tower protesters after Kushner withdraws from development deal,Jared Kushner's investment firm nixxed a deal to develop a former Yugoslav military HQ into a Trump Tower hotel after Belgrade residents protested the project – and the far-right government's efforts to circumvent laws protecting the building's historical status,https://www.haaretz.com/world-news/europe/2025-12-17/ty-article/.premium/serbian-government-threatens-trump-tower-protesters-after-kushner-withdraws-from-deal/0000019b-2c77-d932-a7bf-6f77fa9f0000,Haaretz,Liam Hoare,2025-12-17T16:50:47,2025-12-17 17:12:13.809060,https://www.haaretz.com/world-news/europe/2025-12-17/ty-article/.premium/serbian-government-threatens-trump-tower-protesters-after-kushner-withdraws-from-deal/0000019b-2c77-d932-a7bf-6f77fa9f0000
Lawmakers from Ben-Gvir's far-right party set to take control of key Knesset committees,"MK Zvi Succot, set to chair an education committee, said earlier this month that Palestinians who set fire to waste and cause widespread air pollution should be shot. MK Limor Son Har-Melech, set to chair a health committee, said, 'There is no such thing as Palestinians'",https://www.haaretz.com/israel-news/2025-12-17/ty-article/.premium/lawmakers-from-ben-gvirs-far-right-party-set-to-take-control-of-key-knesset-committees/0000019b-2ce0-d8f0-a9db-6dfc6bec0000,Haaretz,Noa Shpigel,2025-12-17T17:03:25,2025-12-17 17:12:13.809017,https://www.haaretz.com/israel-news/2025-12-17/ty-article/.premium/lawmakers-from-ben-gvirs-far-right-party-set-to-take-control-of-key-knesset-committees/0000019b-2ce0-d8f0-a9db-6dfc6bec0000
The Missing Context: Media Distort the West Bank Terror Threat,"Compared to the terror threats emanating from numerous fronts, including Gaza, Lebanon, Syria, Yemen, and Iran, the international media often...",https://www.algemeiner.com/2025/12/17/the-missing-context-media-distort-the-west-bank-terror-threat/,Algemeiner,Sharon Levy,2025-12-17T17:01:38,2025-12-17 17:12:08.910299,https://www.algemeiner.com/?p=760386
"Amnesty International Finally Acknowledged Israeli Victims, and the Media Looked Away","Two years. That is how long it took Amnesty International, one of the world’s supposedly leading human rights organizations, to...",https://www.algemeiner.com/2025/12/17/amnesty-international-finally-acknowledged-israeli-victims-and-the-media-looked-away/,Algemeiner,Sharon Levy,2025-12-17T17:07:57,2025-12-17 17:12:08.910258,https://www.algemeiner.com/?p=760388
Homeland Security denies Ilhan Omar’s claims son was pulled over by ICE,"“With no evidence, it is shameful that Congresswoman Omar would level accusations to demonize ICE as part of a PR stunt,” the department stated. The post Homeland Security denies Ilhan Omar’s claims son was pulled over by ICE appeared first on JNS.org .",https://www.jns.org/homeland-security-denies-ilhan-omars-claims-son-was-pulled-over-by-ice/,JNS,,2025-12-17T16:29:26,2025-12-17 17:12:06.459878,https://www.jns.org/?p=617972
"On fifth day after fatal shooting at Brown, unknown if gunman shouted anti-Jewish slur","“Silence” from the Ivy League school and the authorities “only amplifies these fears,” Nathan Miller, who runs a PR firm, told JNS. The post On fifth day after fatal shooting at Brown, unknown if gunman shouted anti-Jewish slur appeared first on JNS.org .",https://www.jns.org/on-fifth-day-after-fatal-shooting-at-brown-unknown-if-gunman-shouted-anti-jewish-slur/,JNS,Aaron Bandler,2025-12-17T16:32:57,2025-12-17 17:12:06.459834,https://www.jns.org/?p=617967
The Saudis have mastered the art of manipulation,They have always wanted the benefits of normalization without normalization itself. The post The Saudis have mastered the art of manipulation appeared first on JNS.org .,https://www.jns.org/the-saudis-have-mastered-the-art-of-manipulation/,JNS,Mitchell Bard,2025-12-17T17:00:00,2025-12-17 17:12:06.459786,https://www.jns.org/?p=617988
"UK police plan crackdown on antisemitic chants, including ‘Globalize the intifada’","London's Metropolitan Police and Greater Manchester Police say decision comes after recent 'violent acts' in Manchester and Sydney changed the 'context' of the chants The post UK police plan crackdown on antisemitic chants, including ‘Globalize the intifada’ appeared first on The Times of Israel .",https://www.timesofisrael.com/uk-police-plan-tougher-action-on-antisemitic-chants-including-globalize-the-intifada/,Times of Israel,,2025-12-17T16:13:33,2025-12-17 17:11:59.677848,https://www.timesofisrael.com/?p=3714432
"Israeli-founded cyber unicorn Cyera said to raise $400m, soaring to $9 billion valuation","The investment led by US alternative asset manager Blackstone comes six months after the previous round, when the Israeli data security startup was valued at $6 billion The post Israeli-founded cyber unicorn Cyera said to raise $400m, soaring to $9 billion valuation appeared first on The Times of Israel .",https://www.timesofisrael.com/israeli-founded-cyber-unicorn-cyera-said-to-raise-400m-soaring-to-9-billion-valuation/,Times of Israel,,2025-12-17T16:47:02,2025-12-17 17:11:59.677796,https://www.timesofisrael.com/?p=3714362
What can really be done to prevent antisemitic attacks like Bondi Beach?,"In the wake of the horrific antisemitic attack in Sydney, Australia, many have called for a stronger response to antisemitism – in Australia and elsewhere – and for us to do more to combat it. But what would that actually mean in practice? This is not an easy question to answer. Arguably, the first step... The post What can really be done to prevent antisemitic attacks like Bondi Beach? appeared first on The Forward .",https://forward.com/opinion/791443/bondi-beach-antisemitic-attacks-prevention/,The Forward,Jay Michaelson,2025-12-17T17:00:16,2025-12-17 17:11:57.502333,https://forward.com/?p=791443
"Azerbaijan gives up anticipated role in Gaza peacekeeping force, bails on Doha conference","Thanks to its ties with Turkey and Israel, Azerbaijan was considered an ideal country to take part in the U.S.-led international stabilization force for the Gaza Strip. However, Haaretz has learned that it tends to lean away from Gaza or from committing to the Abraham Accords",https://www.haaretz.com/middle-east-news/2025-12-17/ty-article/.premium/azerbaijan-gives-up-anticipated-role-in-gaza-peacekeeping-force-bails-on-doha-conference/0000019b-2c71-d248-a3fb-2e7d7ea00000,Haaretz,Liza Rozovsky,2025-12-17T15:51:33,2025-12-17 16:12:02.187044,https://www.haaretz.com/middle-east-news/2025-12-17/ty-article/.premium/azerbaijan-gives-up-anticipated-role-in-gaza-peacekeeping-force-bails-on-doha-conference/0000019b-2c71-d248-a3fb-2e7d7ea00000
NYPD reportedly probing stabbing of Jewish man in Brooklyn as hate crime,"The victim heard the attacker curse Jews as he went by, according to a Chabad spokesman. The post NYPD reportedly probing stabbing of Jewish man in Brooklyn as hate crime appeared first on JNS.org .",https://www.jns.org/nypd-reportedly-probing-stabbing-of-jewish-man-in-brooklyn-as-hate-crime/,JNS,JNS Staff,2025-12-17T15:15:51,2025-12-17 16:11:55.012143,https://www.jns.org/?p=617957
"‘No matter what, go Bills,’ Schumer says before addressing Sydney attack","During a news conference on gun violence, the Senate minority leader said the football game was “a big deal,” before commenting on the shootings at Bondi Beach and Brown University. The post ‘No matter what, go Bills,’ Schumer says before addressing Sydney attack appeared first on JNS.org .",https://www.jns.org/no-matter-what-go-bills-schumer-says-before-addressing-sydney-attack/,JNS,,2025-12-17T16:03:33,2025-12-17 16:11:55.012100,https://www.jns.org/?p=617963
Study shows 76% of people raised as Jews continue to be Jewish as adults,"Nationwide, 56% of all Americans still identify with their childhood religion, but Jews cited different reasons than other groups in Pew survey The post Study shows 76% of people raised as Jews continue to be Jewish as adults appeared first on The Times of Israel .",https://www.timesofisrael.com/study-shows-76-of-people-raised-as-jews-continue-to-be-jewish-as-adults/,Times of Israel,,2025-12-17T15:24:52,2025-12-17 16:11:47.963963,https://www.timesofisrael.com/?p=3714390
Israel says famine monitor did not seek aid facilitators’ input for upcoming Gaza report,"Defense Ministry's COGAT says food aid entering Strip 'five times greater' than needed to sustain populace, but claims IPC did not consult with it or US-led CMCC The post Israel says famine monitor did not seek aid facilitators&#8217; input for upcoming Gaza report appeared first on The Times of Israel .",https://www.timesofisrael.com/israel-says-famine-monitor-did-not-seek-aid-facilitators-input-for-upcoming-gaza-report/,Times of Israel,,2025-12-17T15:47:15,2025-12-17 16:11:47.963914,https://www.timesofisrael.com/?p=3714341
Fletcher Hanks and his prophet of chaos: what if Trump were a comic book character?,"Fantagraphics' new release of 'Turn Loose Our Death Rays and Kill Them All!' gathers all 51 stories in a complete portrait of Fletcher Hanks' strange, punishing cosmos",https://www.haaretz.com/life/2025-12-17/ty-article-magazine/.premium/fletcher-hanks-and-his-prophet-of-chaos-what-if-trump-were-a-comic-book-character/0000019a-d445-db55-a7bb-fdd518e40000,Haaretz,Aron Joseph Ehrlich,2025-12-17T14:34:01,2025-12-17 15:10:57.616658,https://www.haaretz.com/life/2025-12-17/ty-article-magazine/.premium/fletcher-hanks-and-his-prophet-of-chaos-what-if-trump-were-a-comic-book-character/0000019a-d445-db55-a7bb-fdd518e40000
European Parliament observes moment of silence for Bondi dead,"Lawmakers applauded when the body's president mentioned the bravery of rescuer Ahmed al-Ahmed, whom she called the “light” of the Chanukah tragedy. The post European Parliament observes moment of silence for Bondi dead appeared first on JNS.org .",https://www.jns.org/european-parliament-observes-moment-of-silence-for-bondi-dead/,JNS,JNS Staff,2025-12-17T14:57:56,2025-12-17 15:10:49.855025,https://www.jns.org/?p=617923
Lawmakers urge new definition of who is Haredi to close draft bill loophole,"MKs argue against current method of counting anyone who briefly went to an ultra-Orthodox school, citing study showing most 'Haredi' recruits are actually no longer in community The post Lawmakers urge new definition of who is Haredi to close draft bill loophole appeared first on The Times of Israel .",https://www.timesofisrael.com/lawmakers-urge-new-definition-of-who-is-haredi-to-close-draft-bill-loophole/,Times of Israel,,2025-12-17T14:12:19,2025-12-17 15:10:44.509158,https://www.timesofisrael.com/?p=3713384
Waiting for Ran Gvili,"Why ToI is not yet removing its 'Israel at War' tag. Plus, a quote from Rob Reiner. And the Australian leadership's despicable conduct The post Waiting for Ran Gvili appeared first on The Times of Israel .",https://www.timesofisrael.com/waiting-for-ran-gvili/,Times of Israel,,2025-12-17T14:26:34,2025-12-17 15:10:44.509094,https://www.timesofisrael.com/?p=3714137
