title,description,link,source,author,published,scraped_at,guid
A crucial Yom Kippur reading holds a scathing lesson on Gaza,"Why do we read the book of Jonah on Yom Kippur? Commentators — predictably — differ. But I believe one crucial reason is because of the book&#8217;s warning against dehumanizing others in the course of seeking our own redemption. This year, the biblical text, traditionally read as the haftorah during afternoon services, must challenge us to feel... The post A crucial Yom Kippur reading holds a scathing lesson on Gaza appeared first on The Forward .",https://forward.com/opinion/773011/yom-kippur-gaza-book-of-jonah/,The Forward,Sruli Fruchter,2025-10-01T15:53:46,2025-10-01 16:10:45.197090,https://forward.com/?p=773011
"Julius Jay Tanenbaum, naval veteran and real estate developer, dies at 99","Julius Jay Tanenbaum, a World War II veteran who rose from Depression-era Brooklyn to become a pioneer in Long Island and regional real estate development, died on July 1, 2025. He was six months away from celebrating his 100th birthday. Born on January 2, 1926, to Jewish immigrants David and Rose Tanenbaum, Mr. Tanenbaum grew [&#8230;] -- The post Julius Jay Tanenbaum, naval veteran and real estate developer, dies at 99 appeared first on Jewish Telegraphic Agency .",https://www.jta.org/2025/10/01/paid-life-tribute/julius-jay-tanenbaum-naval-veteran-and-real-estate-developer-dies-at-99,JTA,JTA Staff,2025-10-01T15:34:04,2025-10-01 16:10:42.501186,https://www.jta.org/?p=1889419
"The revolution will be bathrobed: Paul Thomas Anderson's big, bold American epic","""One Battle After Another"" skewers American delusion, Hollywood hubris and Leonardo DiCaprio's bathrobe budget",https://www.haaretz.com/life/2025-10-01/ty-article-magazine/.premium/the-revolution-will-be-bathrobed-paul-thomas-andersons-big-bold-american-epic/00000199-9eb8-df33-a5dd-9effcd590000,Haaretz,Adrian Hennigan,2025-10-01T14:08:03,2025-10-01 15:09:10.294224,https://www.haaretz.com/life/2025-10-01/ty-article-magazine/.premium/the-revolution-will-be-bathrobed-paul-thomas-andersons-big-bold-american-epic/00000199-9eb8-df33-a5dd-9effcd590000
Jewish House Democrat endorses Trump Middle East peace plan,"“I welcome the president’s proposal to finally bring this war to an end,” Rep. Lois Frankel said. The post Jewish House Democrat endorses Trump Middle East peace plan appeared first on JNS.org .",https://www.jns.org/jewish-house-democrat-endorses-trump-middle-east-peace-plan/,JNS,,2025-10-01T14:34:49,2025-10-01 15:09:00.897676,https://www.jns.org/?p=591145
Event at UN honors Israeli ‘lioness’ heroes,"“In the face of terror and murder,” Danny Danon said that Israeli women, “fought, saved and protected.” The post Event at UN honors Israeli ‘lioness’ heroes appeared first on JNS.org .",https://www.jns.org/event-at-un-honors-israeli-lioness-heroes/,JNS,Mike Wagenheim,2025-10-01T14:57:17,2025-10-01 15:09:00.897635,https://www.jns.org/?p=591154
Trump’s Gaza peace plan: Path to peace or new disaster?,"“Think Twice” with Jonathan Tobin and guest Ruthie Blum, Ep. 196 The post Trump’s Gaza peace plan: Path to peace or new disaster? appeared first on JNS.org .",https://www.jns.org/trumps-gaza-peace-plan-path-to-peace-or-new-disaster/,JNS,Jonathan S. Tobin and Ruthie Blum,2025-10-01T15:00:00,2025-10-01 15:09:00.897571,https://www.jns.org/?p=590760
Lawyer sues NJ township for allegedly firing him for being Jewish,"The suit alleges that a member of the township committee was promised “that Jew” would no longer be solicitor, “NJ.com” reported. The post Lawyer sues NJ township for allegedly firing him for being Jewish appeared first on JNS.org .",https://www.jns.org/lawyer-sues-nj-township-for-allegedly-firing-him-for-being-jewish/,JNS,,2025-10-01T15:00:54,2025-10-01 15:09:00.897527,https://www.jns.org/?p=591151
"Hamas said split on whether to back Trump’s plan to end Gaza war, seeks amendments","Sources both within and close to terror group say Hamas is pushing to change clauses on disarmament and timing of hostage's release, which are Israel's key demands for ending the fighting The post Hamas said split on whether to back Trump&#8217;s plan to end Gaza war, seeks amendments appeared first on The Times of Israel .",https://www.timesofisrael.com/hamas-said-split-on-whether-to-back-trumps-plan-to-end-gaza-war-seeks-amendments/,Times of Israel,,2025-10-01T14:14:21,2025-10-01 15:08:55.414147,https://www.timesofisrael.com/?p=3654408
"Katz: IDF has nearly encircled Gaza City, residents have ‘last opportunity’ to leave","Medical sources in Hamas-run Strip report at least 35 killed by Israeli fire, mainly in Gaza City; IDF downs two rockets that were launched from northern Gaza at southern Israel The post Katz: IDF has nearly encircled Gaza City, residents have &#8216;last opportunity&#8217; to leave appeared first on The Times of Israel .",https://www.timesofisrael.com/katz-idf-has-nearly-encircled-gaza-city-residents-have-last-opportunity-to-leave/,Times of Israel,,2025-10-01T15:01:02,2025-10-01 15:08:55.414098,https://www.timesofisrael.com/?post_type=liveblog_entry&p=3654344
"Trump withdraws nomination for E.J. Antoni, economist who praised Nazi warship","Antoni would have needed Senate approval to run the Bureau of Labor Statistics. -- The post Trump withdraws nomination for E.J. Antoni, economist who praised Nazi warship appeared first on Jewish Telegraphic Agency .",https://www.jta.org/2025/10/01/politics/trump-withdraws-nomination-for-e-j-antoni-economist-who-praised-nazi-warship,JTA,Andrew Lapin,2025-10-01T14:33:44,2025-10-01 15:08:50.431696,https://www.jta.org/?p=1890009
"Who by ICE, and who by mercy? An Unetanah Tokef for immigration court","A rabbi whose grandparents were murdered after being denied asylum in the United States describes witnessing painful immigration hearings. -- The post Who by ICE, and who by mercy? An Unetanah Tokef for immigration court appeared first on Jewish Telegraphic Agency .",https://www.jta.org/2025/10/01/ideas/who-by-ice-and-who-by-mercy-an-unetanah-tokef-for-immigration-court,JTA,Rabbi Michael Meyerstein,2025-10-01T14:44:43,2025-10-01 15:08:50.431655,https://www.jta.org/?p=1889834
"Your Daily Phil: How Jewish groups are, and aren’t, marking the Oct. 7 anniversary","The post Your Daily Phil: How Jewish groups are, and aren’t, marking the Oct. 7 anniversary appeared first on eJewishPhilanthropy .",https://ejewishphilanthropy.com/your-daily-phil-how-jewish-groups-are-and-arent-marking-the-oct-7-anniversary/,eJewish Philanthropy,EJP,2025-10-01T14:25:53,2025-10-01 15:08:47.988880,https://ejewishphilanthropy.com/?p=164490
Trump signed executive order 'assuring the security' of Qatar on day he met with Netanyahu,"The order says that the United States shall take any lawful measure, 'including diplomatic, economic, and, if necessary, military,' to defend Qatar if it is attacked. On Monday, Netanyahu apologized for Israel's attempted assassination of Hamas leadership in Doha",https://www.haaretz.com/israel-news/2025-10-01/ty-article/.premium/trump-signed-executive-order-assuring-the-security-of-qatar-on-day-he-met-with-netanyahu/00000199-9fec-df33-a5dd-9fff19780000,Haaretz,Jonathan Lis,2025-10-01T13:36:56,2025-10-01 14:09:21.336140,https://www.haaretz.com/israel-news/2025-10-01/ty-article/.premium/trump-signed-executive-order-assuring-the-security-of-qatar-on-day-he-met-with-netanyahu/00000199-9fec-df33-a5dd-9fff19780000
"In this shocking 'anti-Christian' novel, a Jewish American writer accuses God of incest","After three decades, Carolivia Herron's debut novel 'Thereafter Johnnie' has been sealed in the Book of Life by a reissue. The author reflects on finding new audiences at age 78, integrating a lunch counter and that time the KKK offered their support",https://www.haaretz.com/life/books/2025-10-01/ty-article-magazine/.premium/in-this-shocking-anti-christian-novel-a-jewish-american-writer-accuses-god-of-incest/00000199-9a80-dc12-a5df-9b8b2c890000,Haaretz,Andrew Esensten,2025-10-01T13:41:12,2025-10-01 14:09:21.336084,https://www.haaretz.com/life/books/2025-10-01/ty-article-magazine/.premium/in-this-shocking-anti-christian-novel-a-jewish-american-writer-accuses-god-of-incest/00000199-9a80-dc12-a5df-9b8b2c890000
Report: Four IDF soldiers jailed for refusing to drive on Gaza route in unarmored vehicle,"According to the soldiers, they had been ordered to drive along a high-risk route lined with buildings that the army had not yet demolished. 'Missions like this are done either in a tank, an armored vehicle, or at night,' one of the soldiers said",https://www.haaretz.com/israel-news/2025-10-01/ty-article/.premium/report-four-israeli-soldiers-jailed-after-refusing-risky-gaza-mission/00000199-a006-dc12-a5df-b90fddbe0000,Haaretz,Yaniv Kubovich,2025-10-01T13:55:44,2025-10-01 14:09:21.336045,https://www.haaretz.com/israel-news/2025-10-01/ty-article/.premium/report-four-israeli-soldiers-jailed-after-refusing-risky-gaza-mission/00000199-a006-dc12-a5df-b90fddbe0000
"On Yom Kippur, our legacy organizations should repent. Don’t hold your breath","For years, classical liberalism protected American Jews, but it has been under siege for decades and our leaders were asleep at the switch. The post On Yom Kippur, our legacy organizations should repent. Don’t hold your breath appeared first on JNS.org .",https://www.jns.org/on-yom-kippur-our-legacy-organizations-should-repent-but-dont-hold-your-breath/,JNS,Charles Jacobs,2025-10-01T14:00:00,2025-10-01 14:09:13.406901,https://www.jns.org/?p=590679
"Israel marks tense Yom Kippur, as Hamas mulls Trump’s offer and army fights in Gaza","On eve of Day of Atonement, Navy prepares to intercept large Gaza-bound aid flotilla while troops have been reinforced along all fronts amid concerns for potential friction The post Israel marks tense Yom Kippur, as Hamas mulls Trump&#8217;s offer and army fights in Gaza appeared first on The Times of Israel .",https://www.timesofisrael.com/israel-marks-tense-yom-kippur-as-hamas-mulls-trumps-offer-and-army-fights-in-gaza/,Times of Israel,,2025-10-01T13:31:06,2025-10-01 14:09:07.433800,https://www.timesofisrael.com/?p=3654279
"On Yom Kippur, the faint hope of a ‘good conclusion’","Why would Hamas free all the hostages and endorse a proposal designed to ensure its demise? Why would Hamas backers Turkey and Qatar, now key mediators, seek its extinction? What does Trump know that we don't? The post On Yom Kippur, the faint hope of a &#8216;good conclusion&#8217; appeared first on The Times of Israel .",https://www.timesofisrael.com/the-faint-hope-of-a-good-conclusion/,Times of Israel,,2025-10-01T13:36:10,2025-10-01 14:09:07.433749,https://www.timesofisrael.com/?p=3653280
‘Kavalier and Clay’ could be a Jewish-American ‘Ring Cycle’ — what would Richard Wagner think of it?,"It begins in the old world. A fog rolls in. Statues of saints on the bridge over the Moldau have their backs to us. Facing front is a young man in a straitjacket, planning his escape. Heralding his theatrics are horn blasts that can only be called Wagnerian. The Amazing Adventures of Kavalier and Clay,... The post ‘Kavalier and Clay’ could be a Jewish-American &#8216;Ring Cycle&#8217; — what would Richard Wagner think of it? appeared first on The Forward .",https://forward.com/culture/music/772474/kavalier-and-clay-opera-met-michael-chabon-mason-bates-wagner/,The Forward,PJ Grisar,2025-10-01T14:00:47,2025-10-01 14:09:05.288782,https://forward.com/?p=772474
Is It Possible to Atone for Genocide? - An investigation through Jewish text on responsibility and culpability in the face of mass death.,,https://jewishcurrents.org/is-it-possible-to-atone-for-genocide,Jewish Currents,Avigayil Halpern,2025-10-01T13:00:00,2025-10-01 13:16:46.845972,https://jewishcurrents.org/is-it-possible-to-atone-for-genocide
New topping on menu at Houston pizza place: A dollop of Wiesel wisdom,Fuzzy’s Pizza Katy in Texas is offering customers a limited-edition box and a commemorative USPS stamp to honor the legacy of the late Holocaust survivor and Nobel Prize laureate Elie Wiesel. The post New topping on menu at Houston pizza place: A dollop of Wiesel wisdom appeared first on JNS.org .,https://www.jns.org/new-topping-on-menu-at-houston-pizza-place-a-dollop-of-wiesel-wisdom/,JNS,Karen Schwartz,2025-10-01T13:01:00,2025-10-01 13:16:41.720457,https://www.jns.org/?p=591025
Netherlands’ top pension fund divests from US company Caterpillar over supplies to IDF,"Citing 'socially responsible' investment policy, ABP sells off 387 million-euro stake in US firm, following similar move by Norway's sovereign wealth fund in August The post Netherlands&#8217; top pension fund divests from US company Caterpillar over supplies to IDF appeared first on The Times of Israel .",https://www.timesofisrael.com/netherlands-top-pension-fund-divests-from-us-company-caterpillar-over-supplies-to-idf/,Times of Israel,,2025-10-01T12:16:50,2025-10-01 13:16:36.138184,https://www.timesofisrael.com/?p=3654276
Palestinian officials say Hamas inclined to accept Trump's Gaza cease-fire plan with revisions,"Sources in Doha told Haaretz that Hamas will demand guarantees for an Israeli withdrawal, a clear timetable, and clarifications on disarmament, making a deal unlikely in the coming days",https://www.haaretz.com/israel-news/2025-10-01/ty-article/.premium/palestinian-officials-say-hamas-inclined-to-accept-trumps-gaza-plan-with-revisions/00000199-9f5d-d0f3-a599-dfffe8cb0000,Haaretz,Jack Khoury,2025-10-01T11:15:52,2025-10-01 12:15:40.620739,https://www.haaretz.com/israel-news/2025-10-01/ty-article/.premium/palestinian-officials-say-hamas-inclined-to-accept-trumps-gaza-plan-with-revisions/00000199-9f5d-d0f3-a599-dfffe8cb0000
"Red Cross shuts down Gaza City operations, citing Israeli 'escalating hostilities'","The Red Cross said it will continue supporting civilians in Gaza from Deir al-Balah and Rafah, while the Israeli defense minister warned now is the 'last opportunity' for residents to evacuate south",https://www.haaretz.com/israel-news/2025-10-01/ty-article/.premium/red-cross-shuts-down-gaza-city-operations-citing-israeli-escalating-hostilities/00000199-9f74-d0f3-a599-dff7e7930000,Haaretz,Linda Dayan,2025-10-01T11:40:20,2025-10-01 12:15:40.620702,https://www.haaretz.com/israel-news/2025-10-01/ty-article/.premium/red-cross-shuts-down-gaza-city-operations-citing-israeli-escalating-hostilities/00000199-9f74-d0f3-a599-dff7e7930000
Rocket sirens sound in Gaza-border Israeli towns,Air-raid sirens sound in “Gaza Envelope” towns and social media videos show at least one interception over Kibbutz Alumim. The post Rocket sirens sound in Gaza-border Israeli towns appeared first on JNS.org .,https://www.jns.org/rocket-sirens-sound-in-gaza-border-israeli-towns/,JNS,JNS Staff,2025-10-01T11:28:22,2025-10-01 12:15:30.801094,https://www.jns.org/?p=591110
Knesset panel to hold urgent debate on UAV incursions from Egypt,"Between July 16 and Aug. 25, the IDF recorded 384 incidents of drones breaching the border. The post Knesset panel to hold urgent debate on UAV incursions from Egypt appeared first on JNS.org .",https://www.jns.org/knesset-panel-to-hold-urgent-debate-on-uav-incursions-from-egypt/,JNS,JNS Staff,2025-10-01T11:36:00,2025-10-01 12:15:30.801058,https://www.jns.org/?p=590079
"My dinner with Netanyahu, digested by ‘The Soup Guy’","The room went still, all eyes fixed on him. And there I was, a hot bowl of soup in front of me and cool tequila by my side. The post My dinner with Netanyahu, digested by ‘The Soup Guy’ appeared first on JNS.org .",https://www.jns.org/my-dinner-with-netanyahu-digested-by-the-soup-guy/,JNS,Shlomo Nasser,2025-10-01T12:00:00,2025-10-01 12:15:30.801016,https://www.jns.org/?p=590974
Cities fight decision to allow rebuild of oil refinery plant destroyed by Iran missile,"Accused of not considering cleaner alternatives, planners accept Energy Ministry request to allow Bazan oil refineries to fast-track construction of new Haifa power plant without permits The post Cities fight decision to allow rebuild of oil refinery plant destroyed by Iran missile appeared first on The Times of Israel .",https://www.timesofisrael.com/cities-fight-decision-to-allow-rebuild-of-oil-refinery-plant-destroyed-by-iran-missile/,Times of Israel,,2025-10-01T11:14:46,2025-10-01 12:15:26.094412,https://www.timesofisrael.com/?p=3653840
ADL takes down extremism database after criticism over entry on Charlie Kirk’s group,"Antisemitism watchdog says Glossary of Extremism and Hate 'outdated,' without directly addressing right-wing attacks from Musk and others over inclusion of Turning Point USA The post ADL takes down extremism database after criticism over entry on Charlie Kirk&#8217;s group appeared first on The Times of Israel .",https://www.timesofisrael.com/adl-takes-down-extremism-database-after-criticism-over-entry-on-charlie-kirks-group/,Times of Israel,,2025-10-01T11:15:04,2025-10-01 12:15:26.094365,https://www.timesofisrael.com/?post_type=liveblog_entry&p=3654215
"New aid flotilla nears Gaza coast, with Greta Thunberg and a Jewish activist on board","(JTA) — Israel is preparing to intercept another boatload of activists who are attempting to sail to Gaza to deliver aid to the Palestinians besieged by war there. The interception is expected to take place before and during Yom Kippur, the Jewish holiday that begins at sundown on Wednesday, and a Jewish activist on board... The post New aid flotilla nears Gaza coast, with Greta Thunberg and a Jewish activist on board appeared first on The Forward .",https://forward.com/fast-forward/773074/new-aid-flotilla-nears-gaza-coast-with-greta-thunberg-and-a-jewish-activist-on-board/,The Forward,Philissa Cramer,2025-10-01T11:24:18,2025-10-01 12:15:23.944950,https://forward.com/?p=773074
"New aid flotilla nears Gaza coast, with Greta Thunberg and a Jewish activist on board","The Israeli navy expects to intercept the flotilla during Yom Kippur. -- The post New aid flotilla nears Gaza coast, with Greta Thunberg and a Jewish activist on board appeared first on Jewish Telegraphic Agency .",https://www.jta.org/2025/10/01/israel/new-aid-flotilla-nears-gaza-coast-with-greta-thunberg-and-a-jewish-activist-on-board,JTA,Philissa Cramer,2025-10-01T11:13:46,2025-10-01 12:15:21.314214,https://www.jta.org/?p=1889991
ADL deletes ‘Glossary of Extremism and Hate’ amid flurry of right-wing criticism,"The deletion came a day after Elon Musk called the ADL a ""hate group."" -- The post ADL deletes &#8216;Glossary of Extremism and Hate&#8217; amid flurry of right-wing criticism appeared first on Jewish Telegraphic Agency .",https://www.jta.org/2025/10/01/united-states/adl-deletes-glossary-of-extremism-and-hate-amid-flurry-of-right-wing-criticism,JTA,JTA Staff,2025-10-01T12:03:35,2025-10-01 12:15:21.314172,https://www.jta.org/?p=1889996
"Tepper Foundation grants JFNA $8.75 million to bolster security, support interfaith outreach","As the cost of security climbs alongside increased antisemitism, the Tepper Foundation — founded by Carolina Panthers owner David Tepper in 1996 —is granting $8.75 million to the Jewish Federations of North America to help foot the bill. Last year, the foundation awarded $9 million to JFNA to protect Jewish spaces and support interfaith and... Read More The post Tepper Foundation grants JFNA $8.75 million to bolster security, support interfaith outreach appeared first on eJewishPhilanthropy .",https://ejewishphilanthropy.com/tepper-foundation-grants-jfna-8-75-million-to-bolster-security-support-interfaith-outreach/,eJewish Philanthropy,Nira Dayanim,2025-10-01T11:09:23,2025-10-01 12:15:18.843976,https://ejewishphilanthropy.com/?p=164463
"The personal is powerful, Bank of America philanthropy study find","Personal connections are a potent force in philanthropy, increasing both the likelihood of charitable giving and the amount, according to the latest Bank of America Study of Philanthropy, a biennial report on the field, which was released yesterday. The study found that affluent Americans — defined as those with a net worth of more than... Read More The post The personal is powerful, Bank of America philanthropy study find appeared first on eJewishPhilanthropy .",https://ejewishphilanthropy.com/the-personal-is-powerful-bank-of-america-philanthropy-study-find/,eJewish Philanthropy,Judah Ari Gross,2025-10-01T11:48:56,2025-10-01 12:15:18.843916,https://ejewishphilanthropy.com/?p=164479
'Without drama and BS': Azealia Banks to perform in Israel and mark Oct. 7 anniversary,"Banks plans to visit the Dead Sea, Yad Vashem Holocaust memorial and the Nova festival site of the Oct. 7 Hamas attack, as well as the Jabotinsky Institute, honoring the leader whose Revisionist movement influenced Israel's right-wing Likud party",https://www.haaretz.com/israel-news/2025-10-01/ty-article/.premium/without-drama-and-bs-azealia-banks-to-perform-in-israel-and-mark-oct-7-anniversary/00000199-9f05-d0f3-a599-dfe7d89f0001,Haaretz,Shay Ringel,2025-10-01T10:37:37,2025-10-01 11:08:59.204789,https://www.haaretz.com/israel-news/2025-10-01/ty-article/.premium/without-drama-and-bs-azealia-banks-to-perform-in-israel-and-mark-oct-7-anniversary/00000199-9f05-d0f3-a599-dfe7d89f0001
IDF seizes 15 rockets in raid near Ramallah,"Israeli forces found rockets, explosives and weapons in Beitunia after a Shin Bet probe linked to a terrorist cell arrested last week. The post IDF seizes 15 rockets in raid near Ramallah appeared first on JNS.org .",https://www.jns.org/idf-seizes-15-rockets-in-raid-near-ramallah/,JNS,JNS Staff,2025-10-01T10:48:10,2025-10-01 11:08:52.045244,https://www.jns.org/?p=591103
"Daily Briefing Oct. 1: Day 726 – With ‘peace’ flotilla on horizon, Hamas weighs Trump plan","Military reporter Emanuel Fabian describes Israel's plans to intercept the 47-vessel convoy set to reach the Gaza maritime blockade and editor David Horovitz weighs in on Hamas's options The post Daily Briefing Oct. 1: Day 726 &#8211; With &#8216;peace&#8217; flotilla on horizon, Hamas weighs Trump plan appeared first on The Times of Israel .",https://www.timesofisrael.com/daily-briefing-oct-1-day-726-with-peace-flotilla-on-horizon-hamas-weighs-trump-plan/,Times of Israel,,2025-10-01T10:41:21,2025-10-01 11:08:47.635620,https://www.timesofisrael.com/?p=3654227&preview=true&preview_id=3654227
"Netanyahu bets Trump’s Gaza plan will put pressure on Hamas, but risks coalition","Proposal, welcomed by Arab and Muslim world, asks little from Israel in short term, but reference to Palestinian state likely to infuriate far-right partners Smotrich and Ben Gvir The post Netanyahu bets Trump&#8217;s Gaza plan will put pressure on Hamas, but risks coalition appeared first on The Times of Israel .",https://www.timesofisrael.com/netanyahu-bets-trumps-gaza-plan-will-put-pressure-on-hamas-but-risks-coalition/,Times of Israel,,2025-10-01T10:54:17,2025-10-01 11:08:47.635575,https://www.timesofisrael.com/?p=3654230
"At least 69 dead in Philippines earthquake as many more trapped, missing","Officials say sporadic rains, damaged bridges and road hamper efforts to rescue people trapped under debris, with death toll expected to rise The post At least 69 dead in Philippines earthquake as many more trapped, missing appeared first on The Times of Israel .",https://www.timesofisrael.com/at-least-69-dead-in-philippines-earthquake-as-many-more-trapped-missing/,Times of Israel,,2025-10-01T10:54:37,2025-10-01 11:08:47.635525,https://www.timesofisrael.com/?p=3654245
"‘Jews must protect themselves,’ says NYC mayoral candidate Curtis Sliwa","Sliwa, a Republican, said Jewish communities should lean into their own volunteer patrol organizations rather than ""depend strictly on Gentiles."" -- The post &#8216;Jews must protect themselves,&#8217; says NYC mayoral candidate Curtis Sliwa appeared first on Jewish Telegraphic Agency .",https://www.jta.org/2025/10/01/politics/jews-must-protect-themselves-says-nyc-mayoral-candidate-curtis-sliwa,JTA,Joseph Strauss,2025-10-01T10:30:06,2025-10-01 11:08:42.877115,https://www.jta.org/?p=1889966
"Oct. 7 memorial preparations fraught as American Jews yearn for hostage return, grapple with war","As the second anniversary of the Oct. 7 terror attacks approaches, Jewish organizations and their supporters are planning programming to mark the day. But with Israel’s war with Gaza still raging amid growing international denunciations, 48 hostages still held captive and uncertainty about whether Hamas will accept President Donald Trump’s ceasefire plan, organizers say they... Read More The post Oct. 7 memorial preparations fraught as American Jews yearn for hostage return, grapple with war appeared first on eJewishPhilanthropy .",https://ejewishphilanthropy.com/oct-7-memorial-preparations-fraught-as-american-jews-yearn-for-hostage-return-grapple-with-war/,eJewish Philanthropy,Jay Deitcher,2025-10-01T10:40:47,2025-10-01 11:08:40.468318,https://ejewishphilanthropy.com/?p=164464
