title,description,link,source,author,published,scraped_at,guid
How Judeo-languages helped transmit knowledge to the Jewish masses,"זינט אוראַלטע צײַטן האָבן זיך ייִדן באַנוצט מיט פֿרעמדע שפּראַכן כּדי צו באַקענען פֿאַרשײדענע ייִדישע ייִשובֿים מיט קאַנאָנישע טעקסטן פֿון תּנ״ך, גמרא און תּפֿילות. דער דאָזיקער טעמע זײַנען געװידמעט קאַפּיטלען אינעם נײַעם זאַמלבאַנד „בריקן פֿון קענטעניש: ייִדישע שפּראַכן אינעם קולטורעלן קאָנטעקסט“, רעדאַקטירט דורך די פּראָפֿעסאָרן זשאַן באַומגאַרטען (סאָרבאָן־אוניװערסיטעט, פּאַריז), רות פֿאָן בערנוט (אוניװערסיטעט פֿון צפֿון־קאַראָלײַנע)... The post How Judeo-languages helped transmit knowledge to the Jewish masses appeared first on The Forward .",https://forward.com/yiddish/778999/how-judeo-languages-helped-transmit-knowledge-to-the-jewish-masses/,The Forward,מיכאל קרוטיקאָװ,2025-10-28T13:17:42,2025-10-28 14:09:21.875440,https://forward.com/?p=778999
Activists rally behind Israeli academics facing threats abroad,"Over 1,600 sign letter backing U.K. economist Michael Ben-Gad as Dutch colleague faces similar harassment in Rotterdam. The post Activists rally behind Israeli academics facing threats abroad appeared first on JNS.org .",https://www.jns.org/activists-rally-behind-israeli-academics-facing-threats-abroad/,JNS,Canaan Lidor,2025-10-28T12:39:17,2025-10-28 13:17:13.152919,https://www.jns.org/?p=599376
Pennsylvania Dem decries ‘hatred in all its forms’ marking anniversary of deadly synagogue attack,"""On this painful day, let us honor the memory of those we lost by doubling down on our efforts to build a world of understanding, respect and unity,"" Summer Lee said. The post Pennsylvania Dem decries &#8216;hatred in all its forms&#8217; marking anniversary of deadly synagogue attack appeared first on JNS.org .",https://www.jns.org/pennsylvania-dem-decries-hatred-in-all-its-forms-marking-anniversary-of-deadly-synagogue-attack/,JNS,,2025-10-28T13:00:00,2025-10-28 13:17:13.152873,https://www.jns.org/?p=599235
"Saudi ‘Davos in the Desert’ kicks off, with focus on AI, urban megaprojects","Future Investment Initiative conference comes ahead of Crown Prince Mohammed Bin Salman's first trip to the US since 2018 and as talk ramps up of Saudi-Israel normalization The post Saudi &#8216;Davos in the Desert&#8217; kicks off, with focus on AI, urban megaprojects appeared first on The Times of Israel .",https://www.timesofisrael.com/saudi-davos-in-the-desert-kicks-off-with-focus-on-ai-urban-megaprojects/,Times of Israel,,2025-10-28T12:26:54,2025-10-28 13:17:07.097194,https://www.timesofisrael.com/?p=3675469
Woman convicted for fleeing scene of 2023 hit-and-run that killed 4-year-old boy,"Carol Fessler, 81, found guilty of leaving accident site, was not indicted for causing Rafael Adana's death; case sparked protests in Israeli-Ethiopian community The post Woman convicted for fleeing scene of 2023 hit-and-run that killed 4-year-old boy appeared first on The Times of Israel .",https://www.timesofisrael.com/woman-convicted-for-fleeing-scene-of-2023-hit-and-run-that-killed-4-year-old-boy/,Times of Israel,,2025-10-28T12:38:36,2025-10-28 13:17:07.097153,https://www.timesofisrael.com/?post_type=liveblog_entry&p=3675516
"As Nostra Aetate turns 60, Oct. 7 has pushed Jewish-Catholic ties to new ‘crossroads’","Amid events in Vatican celebrating document that reshaped relations with Jews, Israeli expert Karma Ben-Johanan says ties are affected by Church's shifting focus to Global South The post As Nostra Aetate turns 60, Oct. 7 has pushed Jewish-Catholic ties to new &#8216;crossroads&#8217; appeared first on The Times of Israel .",https://www.timesofisrael.com/as-nostra-aetate-turns-60-oct-7-has-pushed-jewish-catholic-ties-to-new-crossroads/,Times of Israel,,2025-10-28T13:06:58,2025-10-28 13:17:07.097108,https://www.timesofisrael.com/?p=3675181
Neo-Nazis raise money for Georgia man wearing Nazi uniform who allegedly assaulted UGA student,"The University of Georgia denounced the incident as ""heinous antisemitic behavior."" -- The post Neo-Nazis raise money for Georgia man wearing Nazi uniform who allegedly assaulted UGA student appeared first on Jewish Telegraphic Agency .",https://www.jta.org/2025/10/28/united-states/neo-nazis-raise-money-for-georgia-man-wearing-nazi-uniform-who-allegedly-assaulted-uga-student,JTA,Grace Gilson,2025-10-28T13:09:59,2025-10-28 13:17:01.797485,https://www.jta.org/?p=1891396
"Asian Jewish students celebrate intersecting identities, gather for landmark Shabbaton at Yale","The table setting at the inaugural Asian Jewish Shabbaton at Yale University Hillel last Friday night — challah and chopsticks — straddled more than just culinary worlds. It also served as a tangible bridge linking the intersecting identities of the 450 students from 15 universities in attendance. The two-day inaugural Asian Jewish Shabbaton, organized by... Read More The post Asian Jewish students celebrate intersecting identities, gather for landmark Shabbaton at Yale appeared first on eJewishPhilanthropy .",https://ejewishphilanthropy.com/asian-jewish-students-celebrate-intersecting-identities-gather-for-landmark-shabbaton-at-yale/,eJewish Philanthropy,Haley Cohen,2025-10-28T12:48:39,2025-10-28 13:16:59.344810,https://ejewishphilanthropy.com/?p=165162
End of Gaza war offers a historic opportunity to reengage young Jews worldwide,"The agreement ending the Gaza war sparked by the Oct. 7 attacks offers a rare chance to reengage young Jews and heal the rift that has widened in recent years. Over the past five years, a deep physical and emotional disconnect has grown between Israel and the Jewish world. The COVID-19 pandemic and the Gaza... Read More The post End of Gaza war offers a historic opportunity to reengage young Jews worldwide appeared first on eJewishPhilanthropy .",https://ejewishphilanthropy.com/end-of-gaza-war-offers-a-historic-opportunity-to-reengage-young-jews-worldwide/,eJewish Philanthropy,Gidi Mark,2025-10-28T13:11:58,2025-10-28 13:16:59.344748,https://ejewishphilanthropy.com/?p=165127
Judges in Netanyahu's trial agree to shorten session due to 'security developments',"The court accepted the prime minister's request to shorten the testimony to 1:30 P.M. instead of 4 P.M., as Netanyahu plans to meet with defense officials at 2 P.M. to discuss Hamas' cease-fire violations after it returned remains of a body already recovered in 2023",https://www.haaretz.com/israel-news/2025-10-28/ty-article/.premium/judges-in-netanyahus-trial-agree-to-shorten-session-due-to-security-developments/0000019a-2a85-d36c-a3bf-bed533d90000,Haaretz,Yael Freidson,2025-10-28T11:39:48,2025-10-28 12:15:18.807598,https://www.haaretz.com/israel-news/2025-10-28/ty-article/.premium/judges-in-netanyahus-trial-agree-to-shorten-session-due-to-security-developments/0000019a-2a85-d36c-a3bf-bed533d90000
German broadcaster cuts ties with Gaza-based production company over Hamas links,"ZDF production worker Ahmed Abu Mutair, who was killed on Oct. 19, was reportedly a platoon commander in the Izz ad-Din al-Qassam Brigades, The post German broadcaster cuts ties with Gaza-based production company over Hamas links appeared first on JNS.org .",https://www.jns.org/german-broadcaster-cuts-ties-with-gaza-based-production-company-over-hamas-links/,JNS,JNS Staff,2025-10-28T11:18:00,2025-10-28 12:15:10.934989,https://www.jns.org/?p=599353
"Jerusalem won’t accept Turkish armed forces in Gaza, says Israeli FM","""Countries that want or are ready to send armed forces should be at least fair to Israel,"" said the foreign minister. The post Jerusalem won’t accept Turkish armed forces in Gaza, says Israeli FM appeared first on JNS.org .",https://www.jns.org/jerusalem-wont-accept-turkish-armed-forces-in-gaza-says-israeli-fm/,JNS,Akiva Van Koningsveld and Amelie Botbol,2025-10-28T11:56:23,2025-10-28 12:15:10.934948,https://www.jns.org/?p=599346
"Casket returned by Hamas had remains of hostage whose body IDF recovered in 2023, Israel says","Troops recovered Ofir Tzarfati's body soon after war began; Hamas said to stage 'discovery' of remains; Israel weighs widening control of Gaza; far-right calls for destruction of Hamas The post Casket returned by Hamas had remains of hostage whose body IDF recovered in 2023, Israel says appeared first on The Times of Israel .",https://www.timesofisrael.com/casket-returned-by-hamas-had-remains-of-hostage-whose-body-idf-recovered-in-2023-israel-says/,Times of Israel,,2025-10-28T11:29:25,2025-10-28 12:15:04.268893,https://www.timesofisrael.com/?p=3675538
Daily Briefing Oct. 28: Day 753 – US and ceasefire partners debate what’s next in Gaza,US bureau chief Jacob Magid discusses different approaches to moving forward in Gaza and the US anger over a West Bank annexation vote in the Knesset The post Daily Briefing Oct. 28: Day 753 &#8211; US and ceasefire partners debate what&#8217;s next in Gaza appeared first on The Times of Israel .,https://www.timesofisrael.com/daily-briefing-oct-28-day-753-us-and-ceasefire-partners-debate-whats-next-in-gaza/,Times of Israel,,2025-10-28T11:45:59,2025-10-28 12:15:04.268845,https://www.timesofisrael.com/?p=3675502&preview=true&preview_id=3675502
"Saving Jerusalem nightlife: 'For some people, their pub is like their synagogue'","With three iconic bars set to close, Jerusalemites are launching a community campaign to buy and run them as a shared enterprise",https://www.haaretz.com/life/2025-10-28/ty-article-magazine/.premium/saving-jerusalem-nightlife-for-some-people-their-pub-is-like-their-synagogue/0000019a-264c-d36c-a3bf-b65dafbf0000,Haaretz,Eitan Leshem,2025-10-28T10:16:33,2025-10-28 11:09:13.822333,https://www.haaretz.com/life/2025-10-28/ty-article-magazine/.premium/saving-jerusalem-nightlife-for-some-people-their-pub-is-like-their-synagogue/0000019a-264c-d36c-a3bf-b65dafbf0000
Israeli study identifies new form of trauma among families of hostages,"Living between hope and despair, relatives describe crippling anxiety, deep sadness, and sleepless nights. The researchers propose a holistic ""socio-ecological"" approach to treating them",https://www.haaretz.com/israel-news/2025-10-28/ty-article/.premium/israeli-study-identifies-new-form-of-trauma-among-families-of-hostages/0000019a-2a2f-ddf1-a1db-feff7a620000,Haaretz,Ido Efrati,2025-10-28T10:21:59,2025-10-28 11:09:13.822287,https://www.haaretz.com/israel-news/2025-10-28/ty-article/.premium/israeli-study-identifies-new-form-of-trauma-among-families-of-hostages/0000019a-2a2f-ddf1-a1db-feff7a620000
Creative use of bullshit: Why right-wing populist 'journalist' Amit Segal calls Haaretz Israel's greatest threat,The Channel 12 pundit's latest tirade against Haaretz isn't about journalism – it's about silencing criticism against Netanyahu's government and whitewashing settler violence,https://www.haaretz.com/opinion/2025-10-28/ty-article-opinion/.premium/creative-bullshit-why-journalist-amit-segal-calls-haaretz-israels-greatest-threat/0000019a-29b9-d36c-a3bf-bdfdeb670000,Haaretz,Yoana Gonen,2025-10-28T10:44:12,2025-10-28 11:09:13.822254,https://www.haaretz.com/opinion/2025-10-28/ty-article-opinion/.premium/creative-bullshit-why-journalist-amit-segal-calls-haaretz-israels-greatest-threat/0000019a-29b9-d36c-a3bf-bdfdeb670000
Israel has forgotten its natural dimensions. The U.S. is here to remind it,"The Americans recognized that Israel had gone too far. But it kept treating it leniently and embracingly, at a time when what was actually needed was bullying. To force a bully to give in, you have to be a bigger bully. And ""King"" Trump is the king of bullies",https://www.haaretz.com/opinion/2025-10-28/ty-article-opinion/.premium/if-you-want-to-know-what-will-happen-in-israel-wait-for-a-white-house-announcement/0000019a-2995-db3e-affa-bf9519630000,Haaretz,Odeh Bisharat,2025-10-28T10:57:04,2025-10-28 11:09:13.822213,https://www.haaretz.com/opinion/2025-10-28/ty-article-opinion/.premium/if-you-want-to-know-what-will-happen-in-israel-wait-for-a-white-house-announcement/0000019a-2995-db3e-affa-bf9519630000
The Myth of Israeli Innovation - Israel has long relied on Western patrons for arms and backing—even as it has cast itself as a security “innovator” the West can’t afford to do without.,,https://jewishcurrents.org/the-myth-of-israeli-innovation,Jewish Currents,Rhys Machold,2025-10-27T15:00:00,2025-10-28 11:09:10.910008,https://jewishcurrents.org/the-myth-of-israeli-innovation
IDF website shows Hamas use of civilian sites for terror in Gaza,"Schools, mosques, children’s bedrooms and hospitals were used by the terror group, according to the Israeli military. The post IDF website shows Hamas use of civilian sites for terror in Gaza appeared first on JNS.org .",https://www.jns.org/idf-website-shows-hamas-use-of-civilian-sites-for-terror-in-gaza/,JNS,JNS Staff,2025-10-28T10:06:00,2025-10-28 11:09:05.892342,https://www.jns.org/?p=599340
Qatari Foreign Ministry spokesperson praised terror before 2022 appointment,Majed Al-Ansari glorified Palestinian suicide bombings and rocket attacks on Israeli civilian population centers. The post Qatari Foreign Ministry spokesperson praised terror before 2022 appointment appeared first on JNS.org .,https://www.jns.org/qatari-foreign-ministry-spokesperson-praised-terror-before-2022-appointment/,JNS,JNS Staff,2025-10-28T10:36:48,2025-10-28 11:09:05.892281,https://www.jns.org/?p=599328
US soldiers stationed in Kiryat Gat turn sleepy Israeli city into an unexpected hotspot,"(JTA) — At one of Kiryat Gat’s main shopping complexes, U.S. Army camouflage does everything but blend in. American troops in fatigues move between shawarma stands and sports-shoe stores, a new presence in the southern industrial city, part of a multinational civil-military coordination center set up to monitor the Gaza ceasefire. The center, housed in... The post US soldiers stationed in Kiryat Gat turn sleepy Israeli city into an unexpected hotspot appeared first on The Forward .",https://forward.com/fast-forward/779056/us-soldiers-stationed-in-kiryat-gat-turn-sleepy-israeli-city-into-an-unexpected-hotspot/,The Forward,Deborah Danan,2025-10-28T10:35:33,2025-10-28 11:08:56.589800,https://forward.com/?p=779056
"A contentious World Zionist Congress kicks off in Jerusalem with slates expected to duke it out over budgets, positions and resolutions","The 39th World Zionist Congress kicks off in Jerusalem on Tuesday, with roughly 2,500 people — voting delegates, observers and staff members — in attendance. Over the course of three days, the congress will debate and vote on the budgets, appointments, committee makeups and resolutions that will guide the so-called National Institutions over the next five years.... Read More The post A contentious World Zionist Congress kicks off in Jerusalem with slates expected to duke it out over budgets, positions and resolutions appeared first on eJewishPhilanthropy .",https://ejewishphilanthropy.com/a-contentious-world-zionist-congress-kicks-off-in-jerusalem-with-slates-expected-to-duke-it-out-over-budgets-positions-and-resolutions/,eJewish Philanthropy,Judah Ari Gross,2025-10-28T10:27:02,2025-10-28 11:08:51.485330,https://ejewishphilanthropy.com/?p=165133
IDF says Israeli forces killed three terrorists in operation in northern West Bank,"According to a joint statement by the IDF and Shin Bet, two of the militants were shot dead by snipers from the police's Special Anti-Terror Unit, while in a cave in the area of the village of Kafr Qud, near Jenin. The attack was followed by an Israel Air Force strike",https://www.haaretz.com/israel-news/2025-10-28/ty-article/.premium/idf-says-forces-killed-three-terrorists-killed-in-operation-in-northern-west-bank/0000019a-29d9-d36c-a3bf-bddd7dea0000,Haaretz,Yaniv Kubovich,2025-10-28T09:15:16,2025-10-28 10:10:35.622142,https://www.haaretz.com/israel-news/2025-10-28/ty-article/.premium/idf-says-forces-killed-three-terrorists-killed-in-operation-in-northern-west-bank/0000019a-29d9-d36c-a3bf-bddd7dea0000
Freed hostages open Fashion Week in Tel Aviv,Captivity survivor Eli Sharabi was embraced warmly by the audience as he walked down the runway with a white suit. The post Freed hostages open Fashion Week in Tel Aviv appeared first on JNS.org .,https://www.jns.org/freed-hostages-open-fashion-week-in-tel-aviv/,JNS,JNS Staff,2025-10-28T09:30:00,2025-10-28 10:10:28.798365,https://www.jns.org/?p=599323
Israeli official: Reconstruction of Gaza can begin immediately in areas held by IDF,Current 'Yellow Line' sees Israel in control of around 53% of Strip; Smotrich insists 'war is not over yet' and rehabilitation cannot begin until Hamas is 'completely dismantled' The post Israeli official: Reconstruction of Gaza can begin immediately in areas held by IDF appeared first on The Times of Israel .,https://www.timesofisrael.com/israeli-official-reconstruction-of-gaza-can-begin-immediately-in-areas-held-by-idf/,Times of Israel,,2025-10-28T09:52:03,2025-10-28 10:10:24.374894,https://www.timesofisrael.com/?post_type=liveblog_entry&p=3675429
Panama launches parliamentary Israel caucus,"“Nations must decide whether they stand with truth, democracy, and the forces of progress, or with the forces of hate and distortion,"" said Panama’s Ambassador to Israel Ezra Cohen. The post Panama launches parliamentary Israel caucus appeared first on JNS.org .",https://www.jns.org/panama-launches-parliamentary-israel-caucus/,JNS,Etgar Lefkovits,2025-10-28T08:35:00,2025-10-28 09:10:19.831474,https://www.jns.org/?p=599281
"IDF preparing plans for renewed fighting in Gaza Strip, Smotrich tells JNS","President Donald Trump ""often used the word 'violent,' so I like that word,"" said Smotrich. ""It will be very violent, forceful and quick."" The post IDF preparing plans for renewed fighting in Gaza Strip, Smotrich tells JNS appeared first on JNS.org .",https://www.jns.org/idf-preparing-plans-for-renewed-fighting-in-gaza-strip-smotrich-tells-jns/,JNS,Akiva Van Koningsveld and Amelie Botbol,2025-10-28T08:57:00,2025-10-28 09:10:19.831429,https://www.jns.org/?p=599282
Experience Powerful Israeli and Palestinian Stories Through Film - Sponsored Content,"Join The Other Israel Film Festival for bold films and real human stories exploring identity, conflict, and hope. Screenings + panels with filmmakers—tickets now available! The post Experience Powerful Israeli and Palestinian Stories Through Film appeared first on The Times of Israel .",https://toi.li/5E9A35,Times of Israel,,2025-10-28T08:29:02,2025-10-28 09:10:14.400269,https://www.timesofisrael.com/?post_type=spotlight&p=3675486
Coalition set to advance bill that would gut attorney general position,"Legislation pushed by Levin and Rothman would divide the current AG job into three separate roles, with each appointed by politicians The post Coalition set to advance bill that would gut attorney general position appeared first on The Times of Israel .",https://www.timesofisrael.com/coalition-set-to-advance-bill-that-would-gut-attorney-general-position/,Times of Israel,,2025-10-28T08:42:03,2025-10-28 09:10:14.400222,https://www.timesofisrael.com/?post_type=liveblog_entry&p=3675382
"Jordan’s king says international forces in Gaza should ‘keep,’ but not ‘enforce,’ peace","Abdullah says Amman 'too close' to the conflict to send troops, but that Qatar and Egypt are 'very optimistic' Hamas will disarm; Queen Rania lauds Trump for pressuring Netanyahu The post Jordan&#8217;s king says international forces in Gaza should &#8216;keep,&#8217; but not &#8216;enforce,&#8217; peace appeared first on The Times of Israel .",https://www.timesofisrael.com/jordans-king-says-international-forces-in-gaza-should-keep-but-not-enforce-peace/,Times of Israel,,2025-10-28T08:59:26,2025-10-28 09:10:14.400175,https://www.timesofisrael.com/?p=3675419
Leverage the potential of legacy giving to sustain Jewish communities,"At a time marked by uncertainty and rapid change, Jewish organizations face unprecedented challenges in sustaining their missions and serving their communities. While organizations must always plan for the future, the events of the last few months more than ever require institutions to think creatively about long-term financial stability. In this landscape, securing the future... Read More The post Leverage the potential of legacy giving to sustain Jewish communities appeared first on eJewishPhilanthropy .",https://ejewishphilanthropy.com/leverage-the-potential-of-legacy-giving-to-sustain-jewish-communities/,eJewish Philanthropy,Michelle Friedman,2025-10-28T08:30:00,2025-10-28 09:10:06.732163,https://ejewishphilanthropy.com/?p=165045
Palestinian Authority caught hiding terror payments despite claims of reform,"The P.A. attempted to mask the fact that it is still making payments to terrorists after announcing it was stopping the practice last month, according to Palestinian Media Watch. The post Palestinian Authority caught hiding terror payments despite claims of reform appeared first on JNS.org .",https://www.jns.org/palestinian-authority-caught-hiding-terror-payments-despite-claims-of-reform/,JNS,David Isaac,2025-10-28T07:45:49,2025-10-28 08:12:27.709173,https://www.jns.org/?p=599048
Trump said to withdraw nominee for State Department Middle East role,"After committee hearing in May, Joel Rayburn, a former envoy for Syria accused of not sufficiently supporting Trump, was seen as unlikely to win confirmation in full Senate The post Trump said to withdraw nominee for State Department Middle East role appeared first on The Times of Israel .",https://www.timesofisrael.com/trump-said-to-withdraw-nominee-for-state-department-middle-east-role/,Times of Israel,,2025-10-28T07:59:03,2025-10-28 08:12:22.255915,https://www.timesofisrael.com/?p=3675394
It’s not too late for post-Oct. 7 leadership do-overs,"Two years ago, when Hamas murdered 1,200 and kidnapped 251 Israelis and foreign nationals, the reality for leaders of Jewish organizations around the United States suddenly transformed. They now had to manage day-to-day business, meet their missions and navigate the impact of the trauma of the Oct. 7 terrorist attacks on their staff, including the... Read More The post It’s not too late for post-Oct. 7 leadership do-overs appeared first on eJewishPhilanthropy .",https://ejewishphilanthropy.com/its-not-too-late-for-post-oct-7-leadership-do-overs/,eJewish Philanthropy,Ilana Kaufman,2025-10-28T08:00:00,2025-10-28 08:12:14.932430,https://ejewishphilanthropy.com/?p=165090
The ‘unprecedented’ US-Israeli coordination center for Gaza,"The center features floors for hundreds of American-only and Israeli-only personnel, and an international floor for personnel from multiple countries. The post The ‘unprecedented’ US-Israeli coordination center for Gaza appeared first on JNS.org .",https://www.jns.org/the-unprecedented-us-israeli-coordination-center-for-gaza/,JNS,Yaakov Lappin,2025-10-28T06:13:21,2025-10-28 07:09:58.367390,https://www.jns.org/?p=599241
"IAF strikes cave outside Jenin, eliminating three terrorists","Defense Minister Katz said he instructed the IDF to take ""all necessary measures"" to combat terrorism in Judea and Samaria. The post IAF strikes cave outside Jenin, eliminating three terrorists appeared first on JNS.org .",https://www.jns.org/iaf-strikes-terrorist-structure-near-jenin/,JNS,JNS Staff,2025-10-28T06:24:44,2025-10-28 07:09:58.367353,https://www.jns.org/?p=599251
"Israel now region’s ‘strongest power,’ says Netanyahu","The Jewish state has “changed the entire balance of deterrence and power” thanks to the steadfastness of its people,"" its prime minister said. The post Israel now region&#8217;s &#8216;strongest power,&#8217; says Netanyahu appeared first on JNS.org .",https://www.jns.org/israel-now-regions-strongest-power-say-netanyahu/,JNS,JNS Staff,2025-10-28T06:34:34,2025-10-28 07:09:58.367310,https://www.jns.org/?p=599112
"3 terror operatives are killed by snipers, airstrike in West Bank, IDF says","Police's Yamam counter-terror unit acts on intelligence provided by Shin Bet; military carries out rare airstrike against cave in Kafr Qud, from which the operatives had emerged The post 3 terror operatives are killed by snipers, airstrike in West Bank, IDF says appeared first on The Times of Israel .",https://www.timesofisrael.com/3-terror-operatives-planning-attack-are-killed-by-snipers-in-west-bank-police-say/,Times of Israel,,2025-10-28T06:39:38,2025-10-28 07:09:53.343029,https://www.timesofisrael.com/?post_type=liveblog_entry&p=3675388
Don’t fall for Mamdani’s Islamophobia gaslighting,The mainstream media is trying to help the Democrats’ mayoral candidate silence criticism of his antisemitism and attempts to rewrite the narrative of the 9/11 attacks. The post Don’t fall for Mamdani’s Islamophobia gaslighting appeared first on JNS.org .,https://www.jns.org/dont-fall-for-mamdanis-islamophobia-gaslighting/,JNS,Jonathan S. Tobin,2025-10-28T05:50:59,2025-10-28 06:13:29.340629,https://www.jns.org/?p=599243
The new political parties that could shape Israel’s next elections,"A crowded field of new parties, including those led by prominent former officials, could influence whether the opposition unseats Netanyahu or whether he again wins reelection The post The new political parties that could shape Israel’s next elections appeared first on The Times of Israel .",https://www.timesofisrael.com/the-new-political-parties-that-could-shape-israels-next-elections/,Times of Israel,,2025-10-28T05:54:56,2025-10-28 06:13:24.972551,https://www.timesofisrael.com/?p=3654157
