title,description,link,source,author,published,scraped_at,guid
Why 'reform' Israel's judiciary when you can simply defy it?,"'Do not abide by the decisions of the High Court,' a lawmaker said this week, adding to the cacophony of calls from inside the government to disobey court orders it doesn't like",https://www.haaretz.com/israel-news/haaretz-today/2026-01-14/ty-article/.highlight/why-reform-israels-judiciary-when-you-can-simply-defy-it/0000019b-bd97-decf-a99f-bfffc2fc0000,Haaretz,Vera Weidenbach,2026-01-14T20:23:26,2026-01-14 21:10:16.450257,https://www.haaretz.com/israel-news/haaretz-today/2026-01-14/ty-article/.highlight/why-reform-israels-judiciary-when-you-can-simply-defy-it/0000019b-bd97-decf-a99f-bfffc2fc0000
"US Declares Start of Phase Two of Gaza Peace Plan, Warns Hamas to ‘Comply Fully’",US special envoy Steve Witkoff on Wednesday announced the launch of phase two of President Donald Trump&#8217;s plan to end...,https://www.algemeiner.com/2026/01/14/us-declares-start-phase-two-gaza-peace-plan-warns-hamas-comply-fully/,Algemeiner,Algemeiner Staff,2026-01-14T20:54:41,2026-01-14 21:10:10.784448,https://www.algemeiner.com/?p=762890
"LA Police Offer $10,000 for Information About Antisemitic Vandalism of Synagogue Destroyed in Wildfires","Los Angeles County Supervisor Kathryn Barger announced on Tuesday a $10,000 reward for information leading to the arrest and conviction...",https://www.algemeiner.com/2026/01/14/la-police-offer-10000-information-antisemitic-vandalism-synagogue-destroyed-wildfires/,Algemeiner,Shiryn Ghermezian,2026-01-14T21:01:22,2026-01-14 21:10:10.784407,https://www.algemeiner.com/?p=762825
Knesset votes down bill to restrict Jewish registry to Orthodox conversions,"The ""Who is a Jew Bill,"" introduced by lawmaker Avi Maoz, of the right-wing opposition Noam Party, was opposed by 60 of 120 Knesset members. The post Knesset votes down bill to restrict Jewish registry to Orthodox conversions appeared first on JNS.org .",https://www.jns.org/knesset-votes-down-bill-to-restrict-jewish-registry-to-orthodox-conversions/,JNS,JNS Staff,2026-01-14T20:30:16,2026-01-14 21:10:08.288776,https://www.jns.org/?p=627239
Hope After Revolution: Iran + Israel = BFFs?,Almost everyone gets key facts wrong about the Middle East. And these mistakes make it harder for western outsiders to truly grasp the incredible promise of this moment. The post Hope After Revolution: Iran + Israel = BFFs? appeared first on Jewish Journal .,https://jewishjournal.com/commentary/opinion/386338/hope-after-revolution-iran-israel-bffs/,Jewish Journal,Van Jones,2026-01-14T20:56:54,2026-01-14 21:10:05.952683,https://jewishjournal.com/?p=386338
US launches Gaza plan’s 2nd phase as Palestinian technocratic government unveiled,"Last hostage's mom says move jeopardizes efforts to return her son, as Witkoff warns Hamas on matter, Netanyahu says 'declarative' move to stage 2 won't harm repatriation efforts The post US launches Gaza plan’s 2nd phase as Palestinian technocratic government unveiled appeared first on The Times of Israel .",https://www.timesofisrael.com/us-launches-gaza-plans-2nd-phase-as-palestinian-technocratic-government-unveiled/,Times of Israel,,2026-01-14T20:23:31,2026-01-14 21:10:02.875032,https://www.timesofisrael.com/?post_type=liveblog_entry&p=3733969
Iran’s regime still looks likely to survive protests but has no answers for public anger,Massive unrest comes as regime is weak and vulnerable but doesn't yet show signs of cracking; the main question now is how Trump enforces his red lines The post Iran&#8217;s regime still looks likely to survive protests but has no answers for public anger appeared first on The Times of Israel .,https://www.timesofisrael.com/irans-regime-still-looks-likely-to-survive-protests-but-has-no-answers-for-public-anger/,Times of Israel,,2026-01-14T20:57:04,2026-01-14 21:10:02.874982,https://www.timesofisrael.com/?p=3731433
Jewish creators made a satirical cartoon. Then the Mississippi synagogue arson supsect shared it,"Stephen Spencer Pittman, who confessed to setting fire to Beth Israel Congregation in Mississippi, shared a cartoon on Instagram mocking Jews on the day of the attack. What Pittman may not have realized: He was sharing a satirical cartoon made by Jewish creators. The video clip Pittman posted shows a character named Princess Clara, who... The post Jewish creators made a satirical cartoon. Then the Mississippi synagogue arson supsect shared it appeared first on The Forward .",https://forward.com/news/797331/beth-israel-synagogue-arson-drawn-together-mississippi-antisemitism/,The Forward,Hannah Feuer,2026-01-14T20:59:36,2026-01-14 21:10:00.719568,https://forward.com/?p=797331
American Jews can’t agree about anything — except Iran,"Jews around the world have set aside their deep differences and come together in support of the protests in Iran. “This never happens,” Rachel Sumekh, an Iranian-American nonprofit consultant in Los Angeles, told me. “You never had a coalition this diverse, because people get so stuck in politics.” It’s easy to see why the protests... The post American Jews can&#8217;t agree about anything — except Iran appeared first on The Forward .",https://forward.com/opinion/797316/iran-protests-american-jews-israel/,The Forward,Rob Eshman,2026-01-14T21:00:55,2026-01-14 21:10:00.719516,https://forward.com/?p=797316
Israeli security sources say they expect advance warning for U.S. strike on Iran; IDF chief orders defensive preparations,"Southern Israeli municipalities said they were opening public bomb shelters, as the Lufthansa Group said it will operate flights to and from Tel Aviv as day flights only, citing the Middle East situation and the need for crews to return to base without overnight stays in Israel",https://www.haaretz.com/israel-news/2026-01-14/ty-article/.premium/israel-expects-advance-warning-of-u-s-strike-on-iran-idf-orders-defensive-preparations/0000019b-bdf8-d641-a9bf-bff8e18d0000,Haaretz,Yaniv Kubovich,2026-01-14T19:57:21,2026-01-14 20:09:23.694932,https://www.haaretz.com/israel-news/2026-01-14/ty-article/.premium/israel-expects-advance-warning-of-u-s-strike-on-iran-idf-orders-defensive-preparations/0000019b-bdf8-d641-a9bf-bff8e18d0000
Israel temporarily shuts UNRWA clinic in Jerusalem as agency fears permanent closure,"Part of a wider campaign against UNRWA, the move follows new laws banning its activity in Israel and orders to cut water and power to remaining Jerusalem sites. UNRWA warns clinics, schools and centers serving hundreds of refugee youths could shut, ending its decades-long presence in the city",https://www.haaretz.com/israel-news/2026-01-14/ty-article/.premium/israel-temporarily-shuts-unrwa-clinic-in-jerusalem-as-agency-fears-permanent-closure/0000019b-bdb2-d810-a99f-fff63b030000,Haaretz,Nir Hasson,2026-01-14T20:06:02,2026-01-14 20:09:23.694892,https://www.haaretz.com/israel-news/2026-01-14/ty-article/.premium/israel-temporarily-shuts-unrwa-clinic-in-jerusalem-as-agency-fears-permanent-closure/0000019b-bdb2-d810-a99f-fff63b030000
Raising Resilient Jews,"Michael Dickson, who serves as the Executive Director of Stand With Us, and I were grabbing coffee in the Rova...",https://www.algemeiner.com/2026/01/14/raising-resilient-jews/,Algemeiner,Jamie Geller,2026-01-14T19:37:34,2026-01-14 20:09:19.017690,https://www.algemeiner.com/?p=762578
Jewish America’s Future Depends on All Its Communities — Not Just the Coasts,"American Jewish life has long been anchored in a small number of powerful metropolitan centers. New York, Los Angeles, Chicago,...",https://www.algemeiner.com/2026/01/14/jewish-americas-future-depends-on-all-its-communities-not-just-the-coasts/,Algemeiner,Samuel J. Abrams,2026-01-14T19:43:44,2026-01-14 20:09:19.017663,https://www.algemeiner.com/?p=762550
"Iran Warns of Retaliation if Trump Strikes, US Withdraws Some Personnel From Bases","The United States is withdrawing some personnel from bases in the Middle East, a US official said on Wednesday, after...",https://www.algemeiner.com/2026/01/14/iran-warns-retaliation-trump-strikes-us-withdraws-some-personnel-bases/,Algemeiner,Reuters and Algemeiner Staff,2026-01-14T20:05:33,2026-01-14 20:09:19.017620,https://www.algemeiner.com/?p=762883
Israel’s 53% victory in Gaza,"Since the October ceasefire, Hamas has been said to have revived its tax system, expanded revenues and redirected funds to rebuild military infrastructure, including tunnels. The post Israel’s 53% victory in Gaza appeared first on JNS.org .",https://www.jns.org/israels-53-victory-in-gaza/,JNS,Mitchell Bard,2026-01-14T19:00:48,2026-01-14 20:09:16.612249,https://www.jns.org/?p=627329
"CENTCOM establishes air, missile defense operations cell in Qatar","“This is a significant step forward in strengthening regional defense cooperation,” CENTCOM commander Adm. Brad Cooper stated. The post CENTCOM establishes air, missile defense operations cell in Qatar appeared first on JNS.org .",https://www.jns.org/centcom-establishes-air-missile-defense-operations-cell-in-qatar/,JNS,,2026-01-14T19:14:31,2026-01-14 20:09:16.612213,https://www.jns.org/?p=627334
Congressman asks IRS to review CAIR-CA’s tax-exempt status,"Rep. Jason Smith (R-Calif.) questioned the chapter’s handling of federal refugee legal-aid funding, as well as its “connections to Hamas.” The post Congressman asks IRS to review CAIR-CA’s tax-exempt status appeared first on JNS.org .",https://www.jns.org/congressman-asks-irs-to-review-cair-cas-tax-exempt-status/,JNS,,2026-01-14T19:37:51,2026-01-14 20:09:16.612175,https://www.jns.org/?p=627343
"US to ‘pause’ immigrant visas from 75 countries, including Iran, Somalia","“The freeze will remain active until the U.S. can ensure that new immigrants will not extract wealth from the American people,” the department stated. The post US to ‘pause’ immigrant visas from 75 countries, including Iran, Somalia appeared first on JNS.org .",https://www.jns.org/us-to-pause-immigrant-visas-from-75-countries-including-iran-somalia/,JNS,JNS Staff,2026-01-14T19:41:04,2026-01-14 20:09:16.612136,https://www.jns.org/?p=627345
"Majority of US voters say Washington should stay out of Iran, Quinnipiac poll suggests","“Talk of the U.S. military potentially intervening in Iran’s internal chaos gets a vigorous thumbs down,” Quinnipiac polling analyst Tim Malloy stated. The post Majority of US voters say Washington should stay out of Iran, Quinnipiac poll suggests appeared first on JNS.org .",https://www.jns.org/majority-of-us-voters-say-washington-should-stay-out-of-iran-quinnipiac-poll-suggests/,JNS,,2026-01-14T19:58:05,2026-01-14 20:09:16.612088,https://www.jns.org/?p=627347
Deborah Lipstadt has second thoughts about tying Jackson synagogue arsonist to ‘Globalize the Intifada’,"By prematurely suggesting that an arson attack was linked to pro-Palestinian activism, the former antisemitism envoy highlighted the broader challenge of confronting bigotry from across the ideological spectrum. -- The post Deborah Lipstadt has second thoughts about tying Jackson synagogue arsonist to ‘Globalize the Intifada’ appeared first on Jewish Telegraphic Agency .",https://www.jta.org/2026/01/14/default/deborah-lipstadt-has-second-thoughts-about-tying-jackson-synagogue-arsonist-to-globalize-the-intifada,JTA,Andrew Lapin,2026-01-14T19:18:39,2026-01-14 20:09:06.704470,https://www.jta.org/?p=1895219
"U.S. withdrawing troops from key Middle East bases as precaution, American official says","Tehran has warned regional allies it will strike U.S. bases if Washington attacks, as Iran faces its deadliest unrest since 1979. Qatar confirms personnel drawdowns at Al Udeid Air Base, while officials warn U.S. military intervention could come soon",https://www.haaretz.com/middle-east-news/2026-01-14/ty-article/.premium/u-s-withdrawing-troops-from-key-middle-east-bases-as-precaution-american-official-says/0000019b-bd39-d641-a9bf-bfb96eb60000,Haaretz,Reuters,2026-01-14T18:16:11,2026-01-14 19:09:45.603294,https://www.haaretz.com/middle-east-news/2026-01-14/ty-article/.premium/u-s-withdrawing-troops-from-key-middle-east-bases-as-precaution-american-official-says/0000019b-bd39-d641-a9bf-bfb96eb60000
"Beijing Tells Chinese Firms to Stop Using US and Israeli Cybersecurity Software, Sources Say","Chinese authorities have told domestic companies to stop using cybersecurity software made by roughly a dozen firms from the US and Israel due to national security concerns, two people briefed...",https://www.algemeiner.com/2026/01/14/beijing-tells-chinese-firms-stop-using-us-israeli-cybersecurity-software-sources-say/,Algemeiner,Reuters and Algemeiner Staff,2026-01-14T18:17:48,2026-01-14 19:09:40.844425,https://www.algemeiner.com/?p=762871
Witkoff announces start of Phase 2 of Gaza peace plan,"“Phase two establishes a transitional technocratic Palestinian administration in Gaza,” the envoy stated. The post Witkoff announces start of Phase 2 of Gaza peace plan appeared first on JNS.org .",https://www.jns.org/witkoff-announces-start-of-phase-2-of-gaza-peace-plan/,JNS,,2026-01-14T18:19:25,2026-01-14 19:09:38.522563,https://www.jns.org/?p=627317
L’chaim! Israel’s wine industry raises a glass to recovery,"Israeli wine lovers gathered in Tel Aviv for Sommelier, the country’s largest annual winery exhibition, signaling renewed momentum across the sector. The post L’chaim! Israel’s wine industry raises a glass to recovery appeared first on JNS.org .",https://www.jns.org/lechaim-israels-wine-industry-raises-a-glass-to-recovery/,JNS,Linda Gradstein,2026-01-14T18:23:00,2026-01-14 19:09:38.522502,https://www.jns.org/?p=626906
DePaul University suspends Students for Justice in Palestine chapter,"“While on suspension, student organizations do not have access to university funds or space reservations,” a spokesman for the Chicago school told JNS. The post DePaul University suspends Students for Justice in Palestine chapter appeared first on JNS.org .",https://www.jns.org/depaul-university-suspends-students-for-justice-in-palestine-chapter/,JNS,Aaron Bandler,2026-01-14T18:50:57,2026-01-14 19:09:38.522458,https://www.jns.org/?p=627324
Playtika cuts 15% of its workforce amid shift to leaner teams that rely on AI,Israeli-founded online gaming developer lays off about 500 of its employees in Israel and abroad to invest in a pipeline of new games and focus on talent density The post Playtika cuts 15% of its workforce amid shift to leaner teams that rely on AI appeared first on The Times of Israel .,https://www.timesofisrael.com/playtika-cuts-15-of-its-workforce-amid-shift-to-leaner-teams-that-rely-on-ai/,Times of Israel,,2026-01-14T18:17:10,2026-01-14 19:09:33.873971,https://www.timesofisrael.com/?p=3733775
"With clock ticking, Israel moves to resolve passport crisis for Winter Olympians","Knesset okays cabinet decision to grant Netanyahu temporary powers of interior minister in order to issue passports to 3 athletes caught in bureaucratic and political quagmire The post With clock ticking, Israel moves to resolve passport crisis for Winter Olympians appeared first on The Times of Israel .",https://www.timesofisrael.com/with-clock-ticking-israel-moves-to-resolve-passport-crisis-for-winter-olympians/,Times of Israel,,2026-01-14T18:31:22,2026-01-14 19:09:33.873929,https://www.timesofisrael.com/?p=3733931
French publisher withdraws textbooks that called Oct. 7 victims ‘Jewish settlers’,Macron criticizes the books for 'falsification of the facts' as publishers launch internal investigation into the incident The post French publisher withdraws textbooks that called Oct. 7 victims &#8216;Jewish settlers&#8217; appeared first on The Times of Israel .,https://www.timesofisrael.com/french-publisher-withdraws-textbooks-that-called-oct-7-victims-jewish-settlers/,Times of Israel,,2026-01-14T18:55:46,2026-01-14 19:09:33.873882,https://www.timesofisrael.com/?p=3733991
Strong start for Virginia’s first Yiddish culture festival,"It’s not every day that you encounter a man in a Stetson hat singing Yiddish folksongs in the former capital of the Confederacy. Yet that wasn’t the most unexpected thing this reporter experienced over Richmond Yiddish Week’s opening weekend. The grassroots Yiddish cultural festival, which began on Saturday, got off to an energetic, well-attended start.... The post Strong start for Virginia’s first Yiddish culture festival appeared first on The Forward .",https://forward.com/yiddish-world/797304/yiddish-festival-richmond-virginia/,The Forward,David Zakalik,2026-01-14T18:54:58,2026-01-14 19:09:31.696864,https://forward.com/?p=797304
"Cameron Kasky, Gen-Z Israel critic, quits congressional race to focus on West Bank activism","Plus, the crypto token launched by Eric Adams to fight antisemitism crashes minutes after its launch. -- The post Cameron Kasky, Gen-Z Israel critic, quits congressional race to focus on West Bank activism appeared first on Jewish Telegraphic Agency .",https://www.jta.org/2026/01/14/ny/cameron-kasky-gen-z-israel-critic-quits-congressional-race-to-focus-on-west-bank-activism,JTA,New York Jewish Week Staff,2026-01-14T18:14:49,2026-01-14 19:09:29.123123,https://www.jta.org/?p=1895211
Iraqi Officials Arrest Man Wanted by Australian Police in Connection to Synagogue Arson Attack,"Iraqi officials have arrested a man wanted by Australian Federal Police as a person of interest in the investigation into a spate of firebombings, including an antisemitic attack on...",https://www.algemeiner.com/2026/01/14/iraqi-officials-arrest-man-wanted-australian-police-connection-synagogue-arson-attack/,Algemeiner,Reuters and Algemeiner Staff,2026-01-14T17:50:07,2026-01-14 18:14:36.258574,https://www.algemeiner.com/?p=762854
"US to Suspend Visa Processing for 75 Nations, State Department Says","The Trump administration is suspending all visa processing for applicants from 75 countries, a State Department spokesperson said on Wednesday. The spokesperson did not elaborate...",https://www.algemeiner.com/2026/01/14/us-suspend-visa-processing-75-nations-state-department-says/,Algemeiner,Reuters and Algemeiner Staff,2026-01-14T17:53:50,2026-01-14 18:14:36.258543,https://www.algemeiner.com/?p=762856
France Explores Sending Eutelsat Terminals to Iran Amid Internet Blackout,France is looking into sending Eutelsat satellite terminals to Iran to help citizens after Iranian authorities imposed a blackout of internet services in a bid to quell the country&#8217;s most violent domestic unrest...,https://www.algemeiner.com/2026/01/14/france-explores-sending-eutelsat-terminals-iran-internet-blackout/,Algemeiner,Reuters and Algemeiner Staff,2026-01-14T17:58:01,2026-01-14 18:14:36.258510,https://www.algemeiner.com/?p=762859
"German-Israel Deal Strengthens Cyber Defense, German Minister Says","A new German-Israel agreement aims to counter cyber threats and enhance security infrastructure, German Interior Minister Alexander Dobrindt told parliament...",https://www.algemeiner.com/2026/01/14/german-israel-deal-strengthens-cyber-defense-german-minister-says/,Algemeiner,Reuters and Algemeiner Staff,2026-01-14T18:03:30,2026-01-14 18:14:36.258454,https://www.algemeiner.com/?p=762864
UK Prosecutors Try to Reinstate Terrorism Charge Against Kneecap Rapper,British prosecutors sought to reinstate a terrorism charge against a member of Irish rap group Kneecap on Wednesday for displaying a flag of Iran-backed Lebanese terrorist group Hezbollah...,https://www.algemeiner.com/2026/01/14/uk-prosecutors-try-reinstate-terrorism-charge-against-kneecap-rapper/,Algemeiner,Reuters and Algemeiner Staff,2026-01-14T18:08:40,2026-01-14 18:14:36.258419,https://www.algemeiner.com/?p=762868
"Trump ‘out on a limb’ in support of Iranian protesters, former US envoy says","“The options are complicated, not so easy to execute and of uncertain capability to actually achieve meaningful results,” Daniel Shapiro said. The post Trump ‘out on a limb’ in support of Iranian protesters, former US envoy says appeared first on JNS.org .",https://www.jns.org/trump-out-on-a-limb-in-support-of-iranian-protesters-former-us-envoy-says/,JNS,Jonathan D. Salant,2026-01-14T17:28:58,2026-01-14 18:14:33.898408,https://www.jns.org/?p=627286
Washington state bill to bar police from training with ‘foreign’ military faces scrutiny at public hearing,"“If we prohibited our Washingtonian law enforcement to go to get the best training in the world, don’t you think that that might be a risk?” a state rep said. “Israelis do that pretty much better than anybody in the world.” The post Washington state bill to bar police from training with ‘foreign’ military faces scrutiny at public hearing appeared first on JNS.org .",https://www.jns.org/washington-state-bill-to-bar-police-from-training-with-foreign-military-faces-scrutiny-at-public-hearing/,JNS,Jessica Russak-Hoffman,2026-01-14T17:39:43,2026-01-14 18:14:33.898361,https://www.jns.org/?p=627293
Anger in UK as police chief blames AI for false evidence used to ban Israeli soccer fans,West Midlands top officer admits to lawmakers that content citing nonexistent Maccabi Tel Aviv game was generated by Microsoft Copilot; findings on matter set to be presented The post Anger in UK as police chief blames AI for false evidence used to ban Israeli soccer fans appeared first on The Times of Israel .,https://www.timesofisrael.com/anger-in-uk-as-police-chief-blames-ai-for-false-evidence-used-to-ban-israeli-soccer-fans/,Times of Israel,,2026-01-14T17:24:14,2026-01-14 18:14:29.339994,https://www.timesofisrael.com/?p=3733727
IDF says 6 gunmen killed Tuesday in Rafah firefight after ‘serious violation’ of truce,"Weapons found on bodies of suspects after they approached forces on the Israel-controlled side of the Yellow Line, sparking a clash and airstrikes in the area The post IDF says 6 gunmen killed Tuesday in Rafah firefight after &#8216;serious violation&#8217; of truce appeared first on The Times of Israel .",https://www.timesofisrael.com/idf-says-6-gunmen-killed-tuesday-in-rafah-firefight-after-serious-violation-of-truce/,Times of Israel,,2026-01-14T18:01:46,2026-01-14 18:14:29.339950,https://www.timesofisrael.com/?p=3733799&preview=true&preview_id=3733799
German police arrest man suspected of trying to torch synagogue,Footage shows suspect performing Nazi salute before igniting pile of cardboard boxes in front of building; entrance to synagogue damaged The post German police arrest man suspected of trying to torch synagogue appeared first on The Times of Israel .,https://www.timesofisrael.com/german-police-arrest-man-suspected-of-trying-to-torch-synagogue/,Times of Israel,,2026-01-14T18:08:39,2026-01-14 18:14:29.339898,https://www.timesofisrael.com/?post_type=liveblog_entry&p=3733915
Israeli government-sponsored antisemitism confab will present Charlie Kirk with posthumous award,"The award for Kirk's 'contribution to the global fight against antisemitism' will be presented at a gala dinner attended by Prime Minister Benjamin Netanyahu, senior Israeli political figures and international guests",https://www.haaretz.com/israel-news/2026-01-14/ty-article/.premium/israeli-govt-sponsored-antisemitism-confab-to-present-charlie-kirk-with-posthumous-award/0000019b-bd39-d641-a9bf-bfb93a750000,Haaretz,Judy Maltz,2026-01-14T16:28:29,2026-01-14 17:14:00.526957,https://www.haaretz.com/israel-news/2026-01-14/ty-article/.premium/israeli-govt-sponsored-antisemitism-confab-to-present-charlie-kirk-with-posthumous-award/0000019b-bd39-d641-a9bf-bfb93a750000
AIPAC's worst nightmare? Why Netanyahu said Israel doesn't want U.S. military aid,,https://www.haaretz.com/israel-news/podcasts/2026-01-14/ty-article-podcast/aipacs-worst-nightmare-why-netanyahu-said-israel-doesnt-want-u-s-military-aid/0000019b-bcbf-d484-a9bf-feff74520000,Haaretz,Haaretz Podcast,2026-01-14T16:46:42,2026-01-14 17:14:00.526922,https://www.haaretz.com/israel-news/podcasts/2026-01-14/ty-article-podcast/aipacs-worst-nightmare-why-netanyahu-said-israel-doesnt-want-u-s-military-aid/0000019b-bcbf-d484-a9bf-feff74520000
Egypt says consensus reached on Gaza technocratic committee as sources say most members not Hamas or PA,"The fifteen-member panel, made up largely of Gaza-based professionals, will oversee civilian portfolios ranging from finance to health under a U.S.-backed plan. Officials say key details – including funding, legal authority, and Hamas' cooperation – remain unclear",https://www.haaretz.com/gaza/2026-01-14/ty-article/.premium/gaza-technocratic-committee-agreed-on-sources-most-members-not-hamas-or-pa/0000019b-bce1-d641-a9bf-bff188d10000,Haaretz,Jack Khoury,2026-01-14T17:08:17,2026-01-14 17:14:00.526884,https://www.haaretz.com/gaza/2026-01-14/ty-article/.premium/gaza-technocratic-committee-agreed-on-sources-most-members-not-hamas-or-pa/0000019b-bce1-d641-a9bf-bff188d10000
"New Year, Same Terrorism: Palestinian Authority’s Ruling Party Keeps Promoting Violence","Fatah, the ruling party of the Palestinian Authority (PA), continues to promote terrorism as legitimate, necessary, and inevitable. This comes...",https://www.algemeiner.com/2026/01/14/new-year-same-terrorism-palestinian-authoritys-ruling-party-keeps-promoting-violence/,Algemeiner,Ephraim D. Tepler,2026-01-14T17:06:41,2026-01-14 17:13:55.709331,https://www.algemeiner.com/?p=762548
"The History of the Jews of South Florida: Antisemitism, Resilience, and Hope (PART ONE)","The Jewish population of South Florida is about 650,000. It has the third largest concentration of Jews in the country...",https://www.algemeiner.com/2026/01/14/the-history-of-the-jews-of-south-florida-antisemitism-resilience-and-hope-part-one/,Algemeiner,Menachem Levine,2026-01-14T17:12:57,2026-01-14 17:13:55.709278,https://www.algemeiner.com/?p=762552
