title,description,link,source,author,published,scraped_at,guid
"Sa’ar: Hamas disarmament ‘at heart’ of Gaza peace plan, Israel won’t compromise","""Hamas must be disarmed. Gaza must be demilitarized,"" Jerusalem's top diplomat declared during a visit to India. The post Sa&#8217;ar: Hamas disarmament &#8216;at heart&#8217; of Gaza peace plan, Israel won&#8217;t compromise appeared first on JNS.org .",https://www.jns.org/saar-hamas-disarmament-at-heart-of-gaza-peace-plan-israel-wont-compromise/,JNS,JNS Staff,2025-11-04T07:49:26,2025-11-04 08:12:30.828306,https://www.jns.org/?p=602005
Draft UN resolution would grant US and partners two-year mandate to govern Gaza,"Resolution slated for debate in Security Council aims to see first troops in International Stabilization Force, who'll coordinate with Egypt and Israel, deployed in Strip by January The post Draft UN resolution would grant US and partners two-year mandate to govern Gaza appeared first on The Times of Israel .",https://www.timesofisrael.com/draft-un-resolution-would-grant-us-and-partners-two-year-mandate-to-govern-gaza/,Times of Israel,,2025-11-04T07:56:57,2025-11-04 08:12:26.029409,https://www.timesofisrael.com/?post_type=liveblog_entry&p=3680696
"IDF officials warn Hezbollah is rebuilding its arsenal, say Israel may expand strikes",IDF intelligence has sounded the alarm in recent weeks that the organization is aggressively working to restore its military capabilities and security officials believe Hezbollah is aiming to maintain its status as Lebanon's most powerful military force,https://www.haaretz.com/middle-east-news/2025-11-04/ty-article/.premium/defense-officials-warn-of-hezbollah-rearmament-say-israel-could-widen-operations/0000019a-4b6b-dda1-a99e-cfff147d0000,Haaretz,Yaniv Kubovich,2025-11-04T04:00:02,2025-11-04 07:10:25.883541,https://www.haaretz.com/middle-east-news/2025-11-04/ty-article/.premium/defense-officials-warn-of-hezbollah-rearmament-say-israel-could-widen-operations/0000019a-4b6b-dda1-a99e-cfff147d0000
"In Poland, European Jews sound alarm on ‘existential’ threat","At a Krakow summit, Jewish leaders and politicians, including Boris Johnson, warned that anti-Israel hate endangered Europe’s Jewish future. The post In Poland, European Jews sound alarm on &#8216;existential&#8217; threat appeared first on JNS.org .",https://www.jns.org/in-poland-european-jews-sound-alarm-on-existential-threat/,JNS,Canaan Lidor,2025-11-04T06:35:29,2025-11-04 07:10:17.807609,https://www.jns.org/?p=601939
The legal scandal roiling Israel’s unelected oligarchy,"Israel's former military advocate general, Yifat Tomer-Yerushalmi, deceived the Supreme Court as she pretended to oversee a bogus investigation. Were others involved? The post The legal scandal roiling Israel&#8217;s unelected oligarchy appeared first on JNS.org .",https://www.jns.org/the-legal-scandal-roiling-israels-unelected-oligarchy/,JNS,A. Amos Fried,2025-11-04T06:43:49,2025-11-04 07:10:17.807570,https://www.jns.org/?p=601788
"US circulates draft UN resolution seeking two-year mandate to govern Gaza, provide security","The White House reportedly seeks to deploy its International Stabilization Force as early as January. The post US circulates draft UN resolution seeking two-year mandate to govern Gaza, provide security appeared first on JNS.org .",https://www.jns.org/us-circulates-draft-un-resolution-seeking-two-year-mandate-to-govern-gaza-provide-security/,JNS,JNS Staff,2025-11-04T07:01:01,2025-11-04 07:10:17.807529,https://www.jns.org/?p=601986
NYC mayoral candidates make final push ahead of Election Day,"Trump tacitly backs Cuomo, threatens to withhold federal funds from the city if anti-Israel Mamdani wins, as candidates blitz the five boroughs The post NYC mayoral candidates make final push ahead of Election Day appeared first on The Times of Israel .",https://www.timesofisrael.com/nyc-mayoral-candidates-make-final-push-ahead-of-election-day/,Times of Israel,,2025-11-04T06:41:20,2025-11-04 07:10:12.255039,https://www.timesofisrael.com/?p=3680694
"Three decades on, a return to Rabin Square gives the slain premier’s right-hand man hope","Early November was once hard on Shimon Sheves, one of Yitzhak Rabin's closest aides. But as young people honor his legacy and Trump pushes a 'repackaged' Oslo, things are looking up The post Three decades on, a return to Rabin Square gives the slain premier&#8217;s right-hand man hope appeared first on The Times of Israel .",https://www.timesofisrael.com/three-decades-on-a-return-to-rabin-square-gives-the-slain-premiers-right-hand-man-hope/,Times of Israel,,2025-11-04T06:49:38,2025-11-04 07:10:12.254993,https://www.timesofisrael.com/?p=3679912
Surging Global Antisemitism Threaten to Drown Pope Leo XIV’s Embrace of Jews and Judaism in a Sea of Hate,"We pray that today, Catholics will follow Nostra Aetate and serve as friends and allies to help their Jewish neighbors in these perilous times. The post Surging Global Antisemitism Threaten to Drown Pope Leo XIV’s Embrace of Jews and Judaism in a Sea of Hate appeared first on Jewish Journal .",https://jewishjournal.com/commentary/opinion/384719/surging-global-antisemitism-threaten-to-drown-pope-leo-xivs-embrace-of-jews-and-judaism-in-a-sea-of-hate/,Jewish Journal,Abraham Cooper,2025-11-04T05:36:24,2025-11-04 06:13:28.456268,https://jewishjournal.com/?p=384719
"Gubernatorial contests in NJ and Virginia, NYC mayoral race among major US elections on Tuesday","Elections across country will be first since Trump returned to White House earlier this year, with the American president featuring prominently in many races The post Gubernatorial contests in NJ and Virginia, NYC mayoral race among major US elections on Tuesday appeared first on The Times of Israel .",https://www.timesofisrael.com/gubernatorial-contests-in-nj-and-virginia-nyc-mayoral-race-among-major-us-elections-on-tuesday/,Times of Israel,,2025-11-04T04:46:27,2025-11-04 05:09:41.518309,https://www.timesofisrael.com/?p=3680685
Who wants to be a Minyanaire: How WhatsApp saved our minyan,"In his book Relational Judaism: Using the Power of Relationships to Transform the Jewish Community (Jewish Lights Publishing, 2013), Rabbi Ron Wolfson suggests that the success of Jewish religious institutions depends on their success in fostering the relationships that offer meaning, purpose and the sense of belonging to a community. In his conversations with senior... Read More The post Who wants to be a Minyanaire: How WhatsApp saved our minyan appeared first on eJewishPhilanthropy .",https://ejewishphilanthropy.com/who-wants-to-be-a-minyanaire-how-whatsapp-saved-our-minyan/,eJewish Philanthropy,Susan Rich,2025-11-04T03:00:00,2025-11-04 05:09:34.513866,https://ejewishphilanthropy.com/?p=165473
"Report: Israel strikes in southern Lebanon, hours after killing Hezbollah commander",,https://www.haaretz.com/israel-news/2025-11-04/ty-article-live/report-israel-strikes-in-southern-lebanon-hours-after-killing-hezbollah-commander/0000019a-4cec-dda1-a99e-cffc14e00000,Haaretz,Haaretz,2025-11-04T03:41:02,2025-11-04 04:10:49.611852,https://www.haaretz.com/israel-news/2025-11-04/ty-article-live/report-israel-strikes-in-southern-lebanon-hours-after-killing-hezbollah-commander/0000019a-4cec-dda1-a99e-cffc14e00000
Two of NYC’s public pension funds are vulnerable to an Israel divestment push by mayor,"Likely next comptroller says Mamdani 'just doesn’t have the votes' to divest from Israeli assets, though if he wins mayoral race he'll be able to stack boards of 2 of the 5 public funds The post Two of NYC’s public pension funds are vulnerable to an Israel divestment push by mayor appeared first on The Times of Israel .",https://www.timesofisrael.com/two-of-nycs-public-pension-funds-are-vulnerable-to-an-israel-divestment-push-by-mayor/,Times of Israel,,2025-11-04T03:32:42,2025-11-04 04:10:37.001845,https://www.timesofisrael.com/?p=3680682
"Trump backs Cuomo, threatens to withhold federal funds if Mamdani wins NYC mayoral race","'Whether you personally like Andrew Cuomo or not, you really have no choice,' US president declares day before election, denounces the anti-Israel frontrunner as a communist The post Trump backs Cuomo, threatens to withhold federal funds if Mamdani wins NYC mayoral race appeared first on The Times of Israel .",https://www.timesofisrael.com/trump-backs-cuomo-threatens-to-withhold-federal-funds-if-mamdani-wins-nyc-mayoral-race/,Times of Israel,,2025-11-04T02:36:27,2025-11-04 03:27:37.195740,https://www.timesofisrael.com/?p=3680673
"As NY assemblyman, Mamdani pushed bill barring nonprofits from ‘supporting Israeli settlement activity’","'Not On Our Dime' failed to pass in New York State Assembly, though some Jewish residents of NYC are asking whether the anti-Israel candidate will seek to advance similar measure as mayor The post As NY assemblyman, Mamdani pushed bill barring nonprofits from &#8216;supporting Israeli settlement activity&#8217; appeared first on The Times of Israel .",https://www.timesofisrael.com/as-ny-assemblyman-mamdani-pushed-bill-barring-nonprofits-from-supporting-israeli-settlement-activity/,Times of Israel,,2025-11-04T01:49:03,2025-11-04 02:40:04.318581,https://www.timesofisrael.com/?p=3680664
Jewish exodus underway from Heritage Foundation’s antisemitism initiative over Tucker Carlson,"Project Esther, launched as a conservative strategy to fight antisemitism, appears to be unraveling after Heritage's president defended Carlson’s friendly interview with white nationalist Nick Fuentes. -- The post Jewish exodus underway from Heritage Foundation’s antisemitism initiative over Tucker Carlson appeared first on Jewish Telegraphic Agency .",https://www.jta.org/2025/11/03/united-states/jewish-exodus-underway-from-heritage-foundations-antisemitism-initiative-over-tucker-carlson,JTA,Asaf Elia-Shalev,2025-11-04T02:08:50,2025-11-04 02:39:59.239229,https://www.jta.org/?p=1891832
“Unpacking Israeli History” Live Podcast Making a Stop in LA with Terrorism Expert Ronen Bergman,"For those who listen to “Unpacking Israeli History” and attend the upcoming Sinai Temple event, Weissman aims to give them a more nuanced look at the important topics that impact the Jewish community. The post “Unpacking Israeli History” Live Podcast Making a Stop in LA with Terrorism Expert Ronen Bergman appeared first on Jewish Journal .",https://jewishjournal.com/community/384716/unpacking-israeli-history-live-podcast-making-a-stop-in-la-with-terrorism-expert-ronen-bergman/,Jewish Journal,Kylie Ora Lobell,2025-11-04T01:36:55,2025-11-04 01:37:17.191465,https://jewishjournal.com/?p=384716
‘Really don’t remember’: IDF’s former top lawyer said to have approved leak in group chat,Police probe additional suspects as TV report says Tomer-Yerushalmi told investigators she can't recall what happened to her phone or where she was during hours-long disappearance The post &#8216;Really don&#8217;t remember&#8217;: IDF&#8217;s former top lawyer said to have approved leak in group chat appeared first on The Times of Israel .,https://www.timesofisrael.com/really-dont-remember-idfs-former-top-lawyer-said-to-have-approved-leak-in-group-chat/,Times of Israel,,2025-11-04T00:59:04,2025-11-04 01:37:13.872575,https://www.timesofisrael.com/?p=3680584
Mamdani Remains Favorite on Eve of New York City Mayoral Election Despite Struggling With Jewish Voters,"New York City mayoral candidate Zohran Mamdani remains the favorite heading into Election Day on Tuesday, polling indicates, despite the...",https://www.algemeiner.com/2025/11/03/mamdani-remains-favorite-eve-new-york-city-mayoral-election-despite-struggling-jewish-voters/,Algemeiner,Corey Walker,2025-11-03T23:28:24,2025-11-04 00:35:51.988651,https://www.algemeiner.com/?p=756805
"‘Some sense of relief,’ US, Israeli officials say after liberation of Omer Neutra’s body","“The Neutras so deserve the opportunity for closure and the opportunity to bury Omer,” stated Ted Deutch, of the American Jewish Committee. “Now, they’ll finally have that.” The post ‘Some sense of relief,’ US, Israeli officials say after liberation of Omer Neutra’s body appeared first on JNS.org .",https://www.jns.org/some-sense-of-relief-us-israeli-officials-say-after-liberation-of-omer-neutras-body/,JNS,JNS Staff,2025-11-04T00:09:10,2025-11-04 00:35:49.510937,https://www.jns.org/?p=601965
BRAVE-ish at AdWeek NYC: The Power of The Female Quotient Lounge,[&#8230;] The post BRAVE-ish at AdWeek NYC: The Power of The Female Quotient Lounge appeared first on Jewish Journal .,https://jewishjournal.com/culture/travel/384694/brave-ish-at-adweek-nyc-the-power-of-the-female-quotient-lounge/,Jewish Journal,Lisa Ellen Niver,2025-11-03T23:00:59,2025-11-04 00:35:46.939125,https://jewishjournal.com/?p=384694
Likud minister’s contentious media regulation bill passes first reading in Knesset,"Legislation to give the government significant control over broadcasters advances despite AG's objections, with ultra-Orthodox parties lending their support in political trade-off The post Likud minister’s contentious media regulation bill passes first reading in Knesset appeared first on The Times of Israel .",https://www.timesofisrael.com/likud-ministers-contentious-media-regulation-bill-passes-first-reading-in-knesset/,Times of Israel,,2025-11-03T23:27:24,2025-11-04 00:35:43.760079,https://www.timesofisrael.com/?p=3680352&preview=true&preview_id=3680352
Haaretz Cartoon,,https://www.haaretz.com/opinion/daily-cartoon/2025-11-04/ty-article-opinion/haaretz-cartoon/0000019a-4bbf-dda1-a99e-cfbf40920000,Haaretz,Amos Biderman,2025-11-03T22:06:13,2025-11-03 23:09:11.420927,https://www.haaretz.com/opinion/daily-cartoon/2025-11-04/ty-article-opinion/haaretz-cartoon/0000019a-4bbf-dda1-a99e-cfbf40920000
Marwan Barghouti is a murderer. Israel should free him anyway,"Marwan Barghouti is the only person popular enough to unify the Palestinian factions under the Palestinian Authority in postwar Gaza and the West Bank. Yes, he's a convicted murderer – but the alternative is Hamas",https://www.haaretz.com/israel-news/2025-11-04/ty-article-opinion/.premium/marwan-barghouti-is-a-murderer-israel-should-free-him-anyway/0000019a-49bc-da6e-afff-c9fe545d0000,Haaretz,Nir Eisikovits,2025-11-03T22:19:21,2025-11-03 23:09:11.420894,https://www.haaretz.com/israel-news/2025-11-04/ty-article-opinion/.premium/marwan-barghouti-is-a-murderer-israel-should-free-him-anyway/0000019a-49bc-da6e-afff-c9fe545d0000
"Iran’s Influence in France Surges Amid Gaza War, Targeting Institutions and Public Discourse, Report Finds","The Iranian regime has long worked to infiltrate French society, leveraging political networks, media, and social platforms to expand its...",https://www.algemeiner.com/2025/11/03/irans-influence-france-surges-gaza-war-targeting-institutions-public-discourse-report-finds/,Algemeiner,Ailin Vilches Arguello,2025-11-03T22:36:14,2025-11-03 23:09:05.757490,https://www.algemeiner.com/?p=756809
Trump urges Orthodox Jews in New Jersey to vote for Republican nominee for NJ governor,"“I need all of my supporters in the Orthodox community in Lakewood and its surrounding towns to vote in HUGE numbers for Jack Ciattarelli,” the U.S. president wrote. The post Trump urges Orthodox Jews in New Jersey to vote for Republican nominee for NJ governor appeared first on JNS.org .",https://www.jns.org/trump-urges-orthodox-jews-in-new-jersey-to-vote-for-republican-nominee-for-nj-governor/,JNS,,2025-11-03T22:15:10,2025-11-03 23:09:03.396779,https://www.jns.org/?p=601924
"‘Earliest known,’ $4 million kiddush cup bound for Ohio museum","Sotheby’s said that the silver ritual cup set a record for most expensive ceremonial Judaic object. The post ‘Earliest known,’ $4 million kiddush cup bound for Ohio museum appeared first on JNS.org .",https://www.jns.org/earliest-known-4-million-kiddush-cup-bound-for-ohio-museum/,JNS,JNS Staff,2025-11-03T22:43:13,2025-11-03 23:09:03.396734,https://www.jns.org/?p=601940
"The unraveling consensus: Israel between faith, fear and fatigue","Two surveys by the Dor Moriah Center—one on the Arab-Israeli conflict and the other on Trump’s Gaza plan—expose a profound identity fracture. The post The unraveling consensus: Israel between faith, fear and fatigue appeared first on JNS.org .",https://www.jns.org/the-unraveling-consensus-israel-between-faith-fear-and-fatigue/,JNS,Rachel Avraham,2025-11-03T22:51:30,2025-11-03 23:09:03.396690,https://www.jns.org/?p=601943
Rabbis of LA | What Rabbi Cohen Learned From His Father-in-Law,[&#8230;] The post Rabbis of LA | What Rabbi Cohen Learned From His Father-in-Law appeared first on Jewish Journal .,https://jewishjournal.com/community/rabbis-of-la/384713/what-rabbi-cohen-learned-from-his-father-in-law/,Jewish Journal,Ari L. Noonan,2025-11-03T22:58:33,2025-11-03 23:09:00.636184,https://jewishjournal.com/?p=384713
"Iran reportedly arrests three leftist government critics, summons another","Iranian media says authorities confiscated electronic devices of journalist, sociologist, translator and economist, one of whom called for dissolving the theocracy The post Iran reportedly arrests three leftist government critics, summons another appeared first on The Times of Israel .",https://www.timesofisrael.com/iran-reportedly-arrests-three-leftist-government-critics-summons-another/,Times of Israel,,2025-11-03T22:23:39,2025-11-03 23:08:58.406091,https://www.timesofisrael.com/?p=3680621
Likud minister’s contentious media regulation bill passes first reading in Knesset,"Legislation would give the government significant control over broadcasters, with AG warning it will 'endanger the free press' * US national intel chief visits US ceasefire HQ in Kiryat Gat The post Likud minister’s contentious media regulation bill passes first reading in Knesset appeared first on The Times of Israel .",https://www.timesofisrael.com/liveblog-november-04-2025/,Times of Israel,,2025-11-03T22:45:31,2025-11-03 23:08:58.406040,https://www.timesofisrael.com/?p=3680641
"Thirty years on, Israel is led by the men who incited against and destroyed Rabin",,https://www.haaretz.com/opinion/2025-11-03/ty-article-opinion/.premium/thirty-years-on-israel-is-led-by-the-men-who-incited-against-and-destroyed-rabin/0000019a-4ae2-d298-a7db-faead6f90000,Haaretz,Nehemia Shtrasler,2025-11-03T21:17:29,2025-11-03 22:09:16.564820,https://www.haaretz.com/opinion/2025-11-03/ty-article-opinion/.premium/thirty-years-on-israel-is-led-by-the-men-who-incited-against-and-destroyed-rabin/0000019a-4ae2-d298-a7db-faead6f90000
From equality of opportunity to education for democracy: Israel must learn from Rabin's legacy,,https://www.haaretz.com/opinion/2025-11-03/ty-article-opinion/.premium/from-equal-opportunities-to-education-for-democracy-israel-must-learn-from-rabins-legacy/0000019a-4ae2-d298-a7db-faead57e0000,Haaretz,Naama Lazimi,2025-11-03T21:23:12,2025-11-03 22:09:16.564793,https://www.haaretz.com/opinion/2025-11-03/ty-article-opinion/.premium/from-equal-opportunities-to-education-for-democracy-israel-must-learn-from-rabins-legacy/0000019a-4ae2-d298-a7db-faead57e0000
No good government can exist in Israel without Jewish-Arab cooperation,,https://www.haaretz.com/opinion/2025-11-03/ty-article-opinion/.premium/no-good-government-can-exist-in-israel-without-jewish-arab-cooperation/0000019a-4a7e-dda1-a99e-cffebff60000,Haaretz,Michal Sella,2025-11-03T21:31:19,2025-11-03 22:09:16.564766,https://www.haaretz.com/opinion/2025-11-03/ty-article-opinion/.premium/no-good-government-can-exist-in-israel-without-jewish-arab-cooperation/0000019a-4a7e-dda1-a99e-cffebff60000
"As Netanyahu's government pounces on the IDF video controversy, Israelis should remember what it's about: crimes, not the leak",,https://www.haaretz.com/opinion/2025-11-03/ty-article-opinion/.premium/israelis-should-remember-what-the-idf-video-controversy-is-about-abuse-not-the-leak/0000019a-4a7e-dd6e-a7db-5fffbfbf0000,Haaretz,Noa Limone,2025-11-03T21:35:04,2025-11-03 22:09:16.564739,https://www.haaretz.com/opinion/2025-11-03/ty-article-opinion/.premium/israelis-should-remember-what-the-idf-video-controversy-is-about-abuse-not-the-leak/0000019a-4a7e-dd6e-a7db-5fffbfbf0000
"A racist, mandatory death penalty law would be an indelible stain on Israel",,https://www.haaretz.com/opinion/editorial/2025-11-03/ty-article-opinion/a-racist-mandatory-death-penalty-law-would-be-an-indelible-stain-on-israel/0000019a-4b6a-dda1-a99e-cffe54480000,Haaretz,Haaretz Editorial,2025-11-03T21:39:56,2025-11-03 22:09:16.564704,https://www.haaretz.com/opinion/editorial/2025-11-03/ty-article-opinion/a-racist-mandatory-death-penalty-law-would-be-an-indelible-stain-on-israel/0000019a-4b6a-dda1-a99e-cffe54480000
Jewish Conservatives Revolt After ‘Unfit’ Heritage Head Defends Tucker Carlson’s Embrace of Neo-Nazi Nick Fuentes,The decision by Heritage Foundation President Kevin Roberts to release a video statement on social media opposing efforts to rebuke...,https://www.algemeiner.com/2025/11/03/jewish-conservatives-revolt-unfit-heritage-head-defends-tucker-carlsons-embrace-neo-nazi-nick-fuentes/,Algemeiner,David Swindle,2025-11-03T21:27:31,2025-11-03 22:09:11.327653,https://www.algemeiner.com/?p=756800
"US, Israel Pressure Lebanon as Hezbollah Rebuilds Military Arsenal, Risk of Renewed Conflict Looms","With Hezbollah reportedly rebuilding its military arsenal, the United States and Israel are intensifying pressure on the Lebanese government to...",https://www.algemeiner.com/2025/11/03/us-israel-pressure-lebanon-hezbollah-rebuilds-military-arsenal-risk-renewed-conflict-looms/,Algemeiner,Ailin Vilches Arguello,2025-11-03T22:07:03,2025-11-03 22:09:11.327612,https://www.algemeiner.com/?p=756741
"2 Hezbollah operatives killed in Israeli airstrikes in southern Lebanon, says IDF","Military lists one target as commander in terror group's elite Radwan Force, second as unnamed operative who carried out surveillance on Israeli troops The post 2 Hezbollah operatives killed in Israeli airstrikes in southern Lebanon, says IDF appeared first on The Times of Israel .",https://www.timesofisrael.com/2-hezbollah-operatives-killed-in-israeli-airstrikes-in-southern-lebanon-says-idf/,Times of Israel,,2025-11-03T21:22:09,2025-11-03 22:09:04.634870,https://www.timesofisrael.com/?p=3680556
Families of deceased hostages still in Gaza demand Netanyahu ‘look us in the eye’,"Relatives urge PM to meet them, reassert commitment to bring back all 8 remaining bodies; Elad Or to ToI: 'If this deal breaks, we’ll be like Hadar Goldin' The post Families of deceased hostages still in Gaza demand Netanyahu &#8216;look us in the eye&#8217; appeared first on The Times of Israel .",https://www.timesofisrael.com/families-of-deceased-hostages-still-in-gaza-demand-netanyahu-look-us-in-the-eye/,Times of Israel,,2025-11-03T21:47:07,2025-11-03 22:09:04.634823,https://www.timesofisrael.com/?post_type=liveblog_entry&p=3680548
"What to know about ‘Not On Our Dime,’ Zohran Mamdani’s bill targeting donations to Israeli settlements","(JTA) — In May 2023, a member of the New York State Assembly introduced a bill aimed at blocking nonprofits from funding Israeli settlements in the West Bank. It was swiftly rebuked by his colleagues and never came to a vote. That bill was called “Not on our dime!: Ending New York funding of Israeli... The post What to know about ‘Not On Our Dime,’ Zohran Mamdani’s bill targeting donations to Israeli settlements appeared first on The Forward .",https://forward.com/fast-forward/780892/what-to-know-about-not-on-our-dime-zohran-mamdanis-bill-targeting-donations-to-israeli-settlements/,The Forward,Shira Li Bartov,2025-11-03T21:27:29,2025-11-03 22:09:02.444477,https://forward.com/?p=780892
2 of NYC’s 5 public pension funds are vulnerable to a mayor-backed Israel divestment push,"(JTA) — The man who is likely to be New York City’s top finance watchdog under Zohran Mamdani — assuming they both win their races on Tuesday — has said he does not believe Mamdani could divest the city’s pension funds of their investments in Israel. “Just doesn’t have the votes for that,” Mark Levine, the likely... The post 2 of NYC’s 5 public pension funds are vulnerable to a mayor-backed Israel divestment push appeared first on The Forward .",https://forward.com/fast-forward/780889/2-of-nycs-5-public-pension-funds-are-vulnerable-to-a-mayor-backed-israel-divestment-push/,The Forward,Joseph Strauss,2025-11-03T21:29:59,2025-11-03 22:09:02.444408,https://forward.com/?p=780889
Yitzhak Rabin was killed 30 years ago this week. Has the Jewish world forgotten?,A new play and a poetry collection insist on the relevance of a prime minister who died for championing peace. -- The post Yitzhak Rabin was killed 30 years ago this week. Has the Jewish world forgotten? appeared first on Jewish Telegraphic Agency .,https://www.jta.org/2025/11/03/culture/yitzhak-rabin-was-killed-30-years-ago-this-week-has-the-jewish-world-forgotten,JTA,Andrew Silow-Carroll,2025-11-03T21:55:29,2025-11-03 22:08:59.916434,https://www.jta.org/?p=1891817
"With the latest scandal, Netanyahu aims to whitewash crimes against Palestinians and find a scapegoat for his failures in Gaza","The serious allegations against the IDF's military advocate general are being exploited by Netanyahu's government to attack the rule of law and erase IDF wrongdoing. Along the way, they're trying to cover up the failures of October 7 and influence Netanyahu's criminal trial",https://www.haaretz.com/israel-news/2025-11-03/ty-article/.premium/with-the-latest-scandal-netanyahu-finds-a-distraction-for-his-gaza-failures/0000019a-4b3d-dda1-a99e-cfbd994a0000,Haaretz,Amos Harel,2025-11-03T21:01:17,2025-11-03 21:09:07.826179,https://www.haaretz.com/israel-news/2025-11-03/ty-article/.premium/with-the-latest-scandal-netanyahu-finds-a-distraction-for-his-gaza-failures/0000019a-4b3d-dda1-a99e-cfbd994a0000
