title,description,link,source,author,published,scraped_at,guid
"Turkey, Hamas Team Discuss Next Gaza Plan Phases, Security Sources Say","Turkey&#8216;s MIT intelligence agency chief met Hamas&#8216;s negotiating team head Khalil Al-Hayya on Wednesday, and they discussed the path to be followed in implementing...",https://www.algemeiner.com/2025/11/05/turkey-hamas-team-discuss-next-gaza-plan-phases-security-sources-say/,Algemeiner,Reuters and Algemeiner Staff,2025-11-05T18:46:11,2025-11-05 19:08:54.042649,https://www.algemeiner.com/?p=757024
I Have Worked With the Heritage Foundation — but Embracing Antisemitism Will Doom America,The Heritage Foundation is the country’s leading conservative think tank. President Donald Trump’s last campaign platform was partly dreamed up...,https://www.algemeiner.com/2025/11/05/i-have-worked-heritage-foundation-embracing-antisemitism-will-doom-america/,Algemeiner,Georgia L. Gilholy,2025-11-05T19:01:19,2025-11-05 19:08:54.042609,https://www.algemeiner.com/?p=756962
ZOA threatens to end ties with Heritage Foundation,The lies spread against Jews and Israel by Carlson’s guests on his podcast are reminiscent of that same Nazi propaganda that led to the Holocaust. The post ZOA threatens to end ties with Heritage Foundation appeared first on JNS.org .,https://www.jns.org/zoa-threatens-to-end-ties-with-heritage-foundation/,JNS,Morton A. Klein,2025-11-05T18:00:26,2025-11-05 19:08:51.243852,https://www.jns.org/?p=602797
FIFA announces new peace prize to be awarded at World Cup soccer draw in Washington,"Award's announcement doesn't name its recipients, but comes as US President Donald Trump, who has a close relationship with FiFA's chief, was passed over for the Nobel Peace Prize The post FIFA announces new peace prize to be awarded at World Cup soccer draw in Washington appeared first on The Times of Israel .",https://www.timesofisrael.com/fifa-announces-new-peace-prize-to-be-awarded-at-world-cup-soccer-draw-in-washington/,Times of Israel,,2025-11-05T18:11:27,2025-11-05 19:08:45.106546,https://www.timesofisrael.com/?p=3682033
IDF drone strike in southern Lebanon kills operative in Hezbollah’s Radwan force,"Hussein Jaber Dib 'advanced terror attacks against the State of Israel and its citizens,' says military, after hitting car near town of Burj Rahal; Lebanon says another wounded The post IDF drone strike in southern Lebanon kills operative in Hezbollah&#8217;s Radwan force appeared first on The Times of Israel .",https://www.timesofisrael.com/idf-drone-strike-in-southern-lebanon-kills-operative-in-hezbollahs-radwan-force/,Times of Israel,,2025-11-05T18:11:51,2025-11-05 19:08:45.106501,https://www.timesofisrael.com/?p=3682077
Join the Z3 Conference from anywhere in the world - Sponsored Content,"Explore the biggest questions facing Israel, the Diaspora, and the Jewish future through bold conversations and dynamic panels. The post Join the Z3 Conference from anywhere in the world appeared first on The Times of Israel .",https://toi.li/tXVcxI,Times of Israel,,2025-11-05T18:55:36,2025-11-05 19:08:45.106448,https://www.timesofisrael.com/?post_type=spotlight&p=3682158
"Mamdani wins 33% of the Jewish vote in NYC, compared to 63% for Cuomo, exit poll shows","The poll found that 68% of all voters weighed Israel at the ballot box. -- The post Mamdani wins 33% of the Jewish vote in NYC, compared to 63% for Cuomo, exit poll shows appeared first on Jewish Telegraphic Agency .",https://www.jta.org/2025/11/05/politics/mamdani-wins-33-of-the-jewish-vote-in-nyc-compared-to-63-for-cuomo-exit-poll-shows,JTA,Shira Li Bartov,2025-11-05T18:42:57,2025-11-05 19:08:40.043636,https://www.jta.org/?p=1891948
'Corruption and cronyism': Lapid withdraws Yesh Atid from World Zionist Congress deal,"This comes a day after the main factions in the World Zionist Congress, including Lapid's party, reached a power-sharing agreement, which was overshadowed by controversy over Likud's failed attempt to secure a high-paying position for Prime Minister Netanyahu's son in a leading Zionist institution",https://www.haaretz.com/israel-news/2025-11-05/ty-article/.premium/corruption-and-cronyism-lapid-withdraws-yesh-atid-from-world-zionist-congress-deal/0000019a-54f9-db4c-a5fb-dffb76a10000,Haaretz,Noa Shpigel,2025-11-05T17:22:28,2025-11-05 18:12:42.312614,https://www.haaretz.com/israel-news/2025-11-05/ty-article/.premium/corruption-and-cronyism-lapid-withdraws-yesh-atid-from-world-zionist-congress-deal/0000019a-54f9-db4c-a5fb-dffb76a10000
"Germany bans Muslim group, citing incitement of 'hatred' against Israelis and Jews","Berlin outlawed the group Muslim Interaktiv, saying they were 'pushing a caliphate and rejecting Israel's existence.' Raids in Hamburg, Berlin, and Hesse seized cash and data as authorities probe two linked movements accused of spreading 'modern TikTok Islamism'",https://www.haaretz.com/world-news/europe/2025-11-05/ty-article/germany-bans-muslim-group-citing-incitement-of-hatred-against-israelis-and-jews/0000019a-54b3-db4c-a5fb-dfbb9ba40000,Haaretz,DPA,2025-11-05T17:44:17,2025-11-05 18:12:42.312579,https://www.haaretz.com/world-news/europe/2025-11-05/ty-article/germany-bans-muslim-group-citing-incitement-of-hatred-against-israelis-and-jews/0000019a-54b3-db4c-a5fb-dfbb9ba40000
"Thirty years after Rabin's murder, Israelis must stop fearing peace and start fearing life without it","Back in the '90s, Netanyahu realized that the only way to defeat the left was to eliminate the possibility of a Jewish-Arab partnership. After these terrible two years, we must say with courage that this path must be condemned",https://www.haaretz.com/opinion/2025-11-05/ty-article-opinion/.premium/thirty-years-after-rabins-murder-israelis-must-stop-fearing-peace/0000019a-54de-d2eb-afda-d6dfc0920000,Haaretz,Ayman Odeh,2025-11-05T18:04:51,2025-11-05 18:12:42.312542,https://www.haaretz.com/opinion/2025-11-05/ty-article-opinion/.premium/thirty-years-after-rabins-murder-israelis-must-stop-fearing-peace/0000019a-54de-d2eb-afda-d6dfc0920000
The World’s Moral Collapse and Israel’s Light,"Our foundation, Time To Stand Up For Israel, usually focuses on one central mission: defending Israel and her people. But...",https://www.algemeiner.com/2025/11/05/the-worlds-moral-collapse-and-israels-light/,Algemeiner,Sabine Sterk,2025-11-05T17:17:41,2025-11-05 18:12:37.265490,https://www.algemeiner.com/?p=756967
The Problem with ‘Business as Usual’ in Philanthropy,"Many of today’s non-profit humanitarian organizations &#8212; well-funded, well-staffed, and highly visible &#8212; aren’t built for crisis. Their models are...",https://www.algemeiner.com/2025/11/05/the-problem-with-business-as-usual-in-philanthropy/,Algemeiner,Teddy Raskin and Jordan Fried,2025-11-05T17:26:55,2025-11-05 18:12:37.265450,https://www.algemeiner.com/?p=756969
Exit poll finds one-third of NYC Jews backed far-left Mamdani; Cuomo took Jewish areas,"CNN polling shows Cuomo received 63% of Jewish support in Tuesday’s mayoral election, compared with 33% for the mayor-elect and 3% for Sliwa The post Exit poll finds one-third of NYC Jews backed far-left Mamdani; Cuomo took Jewish areas appeared first on The Times of Israel .",https://www.timesofisrael.com/exit-poll-finds-one-third-of-nyc-jews-backed-far-left-mamdani-cuomo-took-jewish-areas/,Times of Israel,,2025-11-05T17:31:57,2025-11-05 18:12:29.816593,https://www.timesofisrael.com/?p=3682023
"Israel’s Oscar entry is, once again, about Palestinians","The distance between the Mediterranean Sea and Ramallah is about 40 linear miles. For a Palestinian in the West Bank to get there is anything but straightforward. In Shai Carmeli-Pollak’s film The Sea, 12-year-old Khaled (Muhammad Gazawi) is going on a school trip to the beach. His hurried morning, typical of an adolescent, begins with... The post Israel’s Oscar entry is, once again, about Palestinians appeared first on The Forward .",https://forward.com/culture/film-tv/781606/the-sea-shai-carmeli-pollak-palestinian-israeli-boycott/,The Forward,PJ Grisar,2025-11-05T17:11:13,2025-11-05 18:12:27.698780,https://forward.com/?p=781606
Mamdani’s victory worries many Jewish leaders,"דער אַרטיקל איז אַ פֿאַרקירצטער נוסח פֿונעם ענגלישן אַרטיקל, וואָס געפֿינט זיך דאָ. ווען זאָכראַן מאַמדאַני, אַ שאַרפֿער קריטיקער פֿון ישׂראל, האָט דינסטיק געוווּנען די ווײַלן פֿאַר ניו־יאָרקער בירגער־מײַסטער, האָבן אַ צאָל ייִדישע פֿירער אויסגעדריקט זאָרג בעת אַנדערע האָבן רעאַגירט מיט באַגײַסטערונג און אָפּטימיזם. מאַמדאַני, וואָס וועט ווערן דער ערשטער מוסולמענישער בירגער־מײַסטער פֿון ניו־יאָרק, האָט... The post Mamdani’s victory worries many Jewish leaders appeared first on The Forward .",https://forward.com/yiddish/781633/mamdanis-victory-worries-many-jewish-leaders/,The Forward,אליעזר קין,2025-11-05T17:21:28,2025-11-05 18:12:27.698734,https://forward.com/?p=781633
"The Jewish vote for NYC mayor went to Cuomo, but the Israel vote went to Mamdani, exit polls show","Zohran Mamdani clinched the New York City mayoral race in a decisive victory last night, but Jewish voters favored former Gov. Andrew Cuomo by a nearly two-to-one margin. A CNN exit poll showed 63% of Jews voted for Cuomo, 33% for Mamdani, and 3% for Republican nominee Curtis Sliwa. Those numbers suggest Cuomo performed better... The post The Jewish vote for NYC mayor went to Cuomo, but the Israel vote went to Mamdani, exit polls show appeared first on The Forward .",https://forward.com/fast-forward/781675/mamdani-cuomo-jewish-voters-nyc-mayoral-election/,The Forward,Hannah Feuer,2025-11-05T17:46:42,2025-11-05 18:12:27.698685,https://forward.com/?p=781675
Mamdani quoted Eugene Debs in his victory speech — there’s a long Jewish history there,"“The sun may have set over our city this evening,” Zohran Mamdani said from a stage at the Brooklyn Paramount Theater late Tuesday night. “But as Eugene Debs once said, ‘I can see the dawn of a better day for humanity.’” This was the first sentence of the new mayor-elect’s victory speech, which gave pride... The post Mamdani quoted Eugene Debs in his victory speech — there&#8217;s a long Jewish history there appeared first on The Forward .",https://forward.com/culture/781654/mamdani-eugene-debs-socialism-forverts-ab-cahan-jewish/,The Forward,Mira Fox,2025-11-05T18:11:17,2025-11-05 18:12:27.698630,https://forward.com/?p=781654
"Israel’s Yesh Atid Party drops out of World Zionist Organization, calling it ‘corrupt’","In a bombshell announcement, Yair Lapid, Israel’s opposition leader, said on Wednesday that he was pulling his centrist Yesh Atid party out of the World Zionist Organization and called for the immediate nationalization of the Keren Kayemeth LeIsrael-Jewish National Fund, which controls more than 10% of the land of Israel, describing the so-called National Institutions... Read More The post Israel&#8217;s Yesh Atid Party drops out of World Zionist Organization, calling it &#8216;corrupt&#8217; appeared first on eJewishPhilanthropy .",https://ejewishphilanthropy.com/israels-yesh-atid-party-drops-out-of-world-zionist-organization-calling-it-corrupt/,eJewish Philanthropy,Judah Ari Gross,2025-11-05T17:28:42,2025-11-05 18:12:22.494866,https://ejewishphilanthropy.com/?p=165618
CNN’s New Qatar-Based Studio Raises Eyebrows — and Questions,"CNN’s latest series, produced in its new Doha-based studio, is causing quite a stir. Not only has the first installment...",https://www.algemeiner.com/2025/11/05/cnns-new-qatar-based-studio-raises-eyebrows-and-questions/,Algemeiner,Chaim Lax,2025-11-05T17:09:22,2025-11-05 17:09:25.678988,https://www.algemeiner.com/?p=756976
"Forsake public safety and we’ll be your ‘worst enemy,’ Sliwa tells Mamdani","“You let the chips fall where they may,” New York voter Jay Etzel told JNS at Sliwa’s Election Night watch party. “But at least you had the hero ready. Heroes don’t back out.” The post Forsake public safety and we’ll be your ‘worst enemy,’ Sliwa tells Mamdani appeared first on JNS.org .",https://www.jns.org/forsake-public-safety-and-well-be-your-worst-enemy-sliwa-tells-mamdani/,JNS,Rikki Zagelbaum,2025-11-05T16:31:11,2025-11-05 17:09:23.361756,https://www.jns.org/?p=602774
Man arrested for plot to supply arms for attack on Jewish targets in Germany,"Authorities say Afghan suspect, arrested in Denmark, offered to supply weapons for an Iran-linked plot targeting Jews in Berlin The post Man arrested for plot to supply arms for attack on Jewish targets in Germany appeared first on The Times of Israel .",https://www.timesofisrael.com/man-arrested-for-plot-to-supply-arms-for-attack-on-jewish-targets-in-germany/,Times of Israel,,2025-11-05T16:33:07,2025-11-05 17:09:18.976952,https://www.timesofisrael.com/?p=3681936
Your Daily Phil: What Livingstone’s London can teach Jews in Mamdani’s New York,The post Your Daily Phil: What Livingstone’s London can teach Jews in Mamdani’s New York appeared first on eJewishPhilanthropy .,https://ejewishphilanthropy.com/your-daily-phil-what-livingstones-london-can-teach-jews-in-mamdanis-new-york/,eJewish Philanthropy,EJP,2025-11-05T16:40:54,2025-11-05 17:09:11.876766,https://ejewishphilanthropy.com/?p=165616
'At odds with our mission': Amsterdam concert hall cancels Hanukkah concert over IDF cantor,"Israeli Diaspora Minister posted on X, 'On the eve of the 87th anniversary of Kristallnacht, Jews are once again being excluded in Amsterdam' in response to the hall's decision, which said that the IDF is 'involved in a controversial war' and the singer 'is a visible representative of it'",https://www.haaretz.com/jewish/2025-11-05/ty-article/amsterdams-royal-concert-hall-cancels-annual-hanukkah-concert-citing-singers-idf-ties/0000019a-5487-d5d0-a59f-74ef4e400000,Haaretz,JTA,2025-11-05T15:55:16,2025-11-05 16:11:20.214985,https://www.haaretz.com/jewish/2025-11-05/ty-article/amsterdams-royal-concert-hall-cancels-annual-hanukkah-concert-citing-singers-idf-ties/0000019a-5487-d5d0-a59f-74ef4e400000
"From Ghost to Terminator 2, Israeli cinematographer Adam Greenberg was a sensitive giant","Adam Greenberg, who died last month at 89, enjoyed an unprecedented success in Hollywood, working with the likes of James Cameron, Arnold Schwarzenegger, Kathryn Bigelow and Jerry Zucker. 'He was a strong man, a giant, but full of sensitivity and love'",https://www.haaretz.com/life/2025-11-05/ty-article-magazine/.premium/from-ghost-to-terminator-2-israeli-cinematographer-adam-greenberg-was-a-sensitive-giant/0000019a-4fa5-d22e-a39b-6ffd41dc0000,Haaretz,Nirit Anderman,2025-11-05T16:04:34,2025-11-05 16:11:20.214948,https://www.haaretz.com/life/2025-11-05/ty-article-magazine/.premium/from-ghost-to-terminator-2-israeli-cinematographer-adam-greenberg-was-a-sensitive-giant/0000019a-4fa5-d22e-a39b-6ffd41dc0000
U.S. pushes U.N. to lift Syria sanctions before Trump hosts Syria's leader at White House,"The U.S. draft would lift sanctions on President al-Sharaa and his interior minister ahead of the Syrian leader's White House visit, signaling Washington's push to ease restrictions, though a Security Council veto could still block it",https://www.haaretz.com/middle-east-news/2025-11-05/ty-article/u-s-pushes-u-n-to-lift-syria-sanctions-before-trump-hosts-syrias-leader-at-white-house/0000019a-546f-df58-ad9e-d4ff32f40000,Haaretz,Reuters,2025-11-05T16:06:05,2025-11-05 16:11:20.214904,https://www.haaretz.com/middle-east-news/2025-11-05/ty-article/u-s-pushes-u-n-to-lift-syria-sanctions-before-trump-hosts-syrias-leader-at-white-house/0000019a-546f-df58-ad9e-d4ff32f40000
Derailing the terror label: Lessons derived from multiple train attacks,"If mass-casualty attacks exploit fear as effectively as political terror, should the law not respond with similar severity regardless of motive? The post Derailing the terror label: Lessons derived from multiple train attacks appeared first on JNS.org .",https://www.jns.org/derailing-the-terror-label-lessons-derived-from-multiple-train-attacks/,JNS,Anna Stanley,2025-11-05T15:15:00,2025-11-05 16:11:13.096500,https://www.jns.org/?p=602319
Jewish fire commissioner of NYC resigns day after Mamdani win,"Sources told the ""New York Post"" that Robert Tucker will return to running a security firm. The post Jewish fire commissioner of NYC resigns day after Mamdani win appeared first on JNS.org .",https://www.jns.org/jewish-fire-commissioner-of-nyc-resigns-day-after-mamdani-win/,JNS,,2025-11-05T15:57:49,2025-11-05 16:11:13.096456,https://www.jns.org/?p=602755
Judge extends ex-IDF legal chief’s remand after suspicions against her strengthen,"Coalition MKs accuse AG of taking part in ‘deep state’ cover-up of Sde Teiman abuse video leak in Knesset meeting; former IDF chief prosecutor to be released, though still a suspect The post Judge extends ex-IDF legal chief&#8217;s remand after suspicions against her strengthen appeared first on The Times of Israel .",https://www.timesofisrael.com/judge-extends-ex-idf-legal-chiefs-remand-after-suspicions-against-her-strengthen/,Times of Israel,,2025-11-05T15:02:53,2025-11-05 16:11:08.605620,https://www.timesofisrael.com/?p=3681776
Is Phase Two of the Gaza Deal Possible? - Sponsored Content,"Former U.S. Ambassador to Israel Dan Shapiro joins Yaakov to discuss the fragile Gaza ceasefire, what a real “phase two” could mean, and whether paths to normalization can be revived. The post Is Phase Two of the Gaza Deal Possible? appeared first on The Times of Israel .",https://toi.li/Y21YKS,Times of Israel,,2025-11-05T15:28:41,2025-11-05 16:11:08.605573,https://www.timesofisrael.com/?post_type=spotlight&p=3681993
"What NYC Mayor-elect Zohran Mamdani has actually said about Jews, Israel and antisemitism","His key statements, from his reaction to the October 7 massacre to his bill targeting settlement funding and his stance on the phrase 'Globalize the intifada' The post What NYC Mayor-elect Zohran Mamdani has actually said about Jews, Israel and antisemitism appeared first on The Times of Israel .",https://www.timesofisrael.com/what-nyc-mayor-elect-zohran-mamdani-has-actually-said-about-jews-israel-and-antisemitism/,Times of Israel,,2025-11-05T15:38:13,2025-11-05 16:11:08.605526,https://www.timesofisrael.com/?p=3681920
Israeli couple arrested in Thailand over public sex at popular waterfall,Tourists charged with public obscenity after clip on social media shows them having midday sex on Ko Pha Ngan island The post Israeli couple arrested in Thailand over public sex at popular waterfall appeared first on The Times of Israel .,https://www.timesofisrael.com/israeli-couple-arrested-in-thailand-over-public-sex-at-popular-waterfall/,Times of Israel,,2025-11-05T15:51:27,2025-11-05 16:11:08.605475,https://www.timesofisrael.com/?p=3681932
"Mamdani Created a Left-Liberal Coalition on Israel/Palestine - The surprising story of the New York mayoral campaign is not liberal Zionist opposition to Mamdani’s campaign, but their support.",,https://jewishcurrents.org/mamdani-created-a-left-liberal-coalition-on-israel-palestine,Jewish Currents,Peter Beinart,2025-11-05T14:00:00,2025-11-05 15:10:34.712312,https://jewishcurrents.org/mamdani-created-a-left-liberal-coalition-on-israel-palestine
"ADL to launch ‘Mamdani monitor,’ Jew-hatred tipline","""We expect the mayor of the city with the largest Jewish population in the world to stand unequivocally against antisemitism in all its varied forms,"" the nonprofit said. The post ADL to launch &#8216;Mamdani monitor,&#8217; Jew-hatred tipline appeared first on JNS.org .",https://www.jns.org/adl-to-launch-mamdani-monitor-jew-hatred-tipline/,JNS,,2025-11-05T14:34:13,2025-11-05 15:10:30.154647,https://www.jns.org/?p=602711
Antisemitism charge kicked around as Maccabi Tel Aviv fans barred from UK match,"While Birmingham police say they blocked ticket sales to Israelis for Thursday's game at Aston Villa over concerns for fans' security, many believe the reason is more insidious The post Antisemitism charge kicked around as Maccabi Tel Aviv fans barred from UK match appeared first on The Times of Israel .",https://www.timesofisrael.com/antisemitism-charge-kicked-around-as-maccabi-tel-aviv-fans-barred-from-uk-match/,Times of Israel,,2025-11-05T14:12:13,2025-11-05 15:10:25.841859,https://www.timesofisrael.com/?p=3680112
US Jewish groups bail from Heritage Foundation’s antisemitism initiative over Tucker Carlson,"Project Esther, launched as conservative strategy to fight Jew-hatred, appears to be unraveling after foundation's president defended TV personality's friendly interview with antisemite Nick Fuentes The post US Jewish groups bail from Heritage Foundation&#8217;s antisemitism initiative over Tucker Carlson appeared first on The Times of Israel .",https://www.timesofisrael.com/us-jewish-groups-bail-from-heritage-foundations-antisemitism-initiative-over-tucker-carlson/,Times of Israel,,2025-11-05T14:14:49,2025-11-05 15:10:25.841811,https://www.timesofisrael.com/?p=3681638
US public safety firm buys Israel’s AI emergency response startup Carbyne for $625m,"Carbyne's emergency communication management tech provides real-time information to 911 responders and police officers, using live video chat, incident mapping, and other AI tools The post US public safety firm buys Israel&#8217;s AI emergency response startup Carbyne for $625m appeared first on The Times of Israel .",https://www.timesofisrael.com/us-public-safety-firm-buys-israels-ai-emergency-response-startup-carbyne-for-625m/,Times of Israel,,2025-11-05T14:16:06,2025-11-05 15:10:25.841767,https://www.timesofisrael.com/?p=3681662
"Media bill won’t give government direct editorial control, but risks putting press in biased, moneyed hands","Expert Tehilla Shwartz Altshuler says Karhi’s proposal could severely damage independent journalism. While regulation reform is needed, this bill ‘can’t be divorced’ from coalition’s hostility to press The post Media bill won&#8217;t give government direct editorial control, but risks putting press in biased, moneyed hands appeared first on The Times of Israel .",https://www.timesofisrael.com/media-bill-wont-give-government-direct-editorial-control-but-risks-putting-press-in-biased-moneyed-hands/,Times of Israel,,2025-11-05T14:41:06,2025-11-05 15:10:25.841719,https://www.timesofisrael.com/?p=3681700
Does it really matter that New York’s Mayor-elect Mamdani loathes and demonizes Israel?,There's an argument to be made that Zohran Mamdani's decisive victory is all about local issues. It's delusional The post Does it really matter that New York&#8217;s Mayor-elect Mamdani loathes and demonizes Israel? appeared first on The Times of Israel .,https://www.timesofisrael.com/does-it-really-matter-that-new-yorks-mayor-elect-mamdani-loathes-and-demonizes-israel/,Times of Israel,,2025-11-05T14:53:16,2025-11-05 15:10:25.841661,https://www.timesofisrael.com/?p=3681596
A German museum aimed to honor Jewish wit. The result is downright demeaning.,"Kibbizter, kvetcher, nudnick, nebbish, nudzh, meshugener, alter kocker, pisher, plosher, platke-macher These ten Yiddish/Yinglish insults are mounted on the cornice of the Haus der Kunst art museum in Munich, Germany. The installation, entitled The Joys of Yiddish (2021), is the final iteration of a work by the late conceptual artist Mel Bochner (1940–2025). According to... The post A German museum aimed to honor Jewish wit. The result is downright demeaning. appeared first on The Forward .",https://forward.com/yiddish-world/781513/german-munich-museum-munich-jewish-yiddish-wit-humor/,The Forward,David Zakalik,2025-11-05T14:46:00,2025-11-05 15:10:23.682793,https://forward.com/?p=781513
Controversial Israeli film ‘The Sea’ makes its North American premiere in NYC,"The Arabic-language film, Israel’s Academy Award submission this year, has ignited criticism on the left and the right. On Thursday, it opens the Other Israel Film Festival in Manhattan. -- The post Controversial Israeli film &#8216;The Sea&#8217; makes its North American premiere in NYC appeared first on Jewish Telegraphic Agency .",https://www.jta.org/2025/11/05/ny/controversial-israeli-film-the-sea-makes-its-north-american-premiere-in-nyc,JTA,Jackie Hajdenberg,2025-11-05T14:15:59,2025-11-05 15:10:21.214470,https://www.jta.org/?p=1891699
What Ken Livingstone’s London can teach Jews living in Zohran Mamdani’s New York,"The city with the largest Jewish population in the world elected Democrat Zohran Mamdani as its mayor last night, following an election that deeply divided the Jewish community and is poised to continue to influence Jewish communal politics and priorities into the future. Mamdani, a democratic socialist, was staunchly opposed throughout his campaign by the... Read More The post What Ken Livingstone&#8217;s London can teach Jews living in Zohran Mamdani&#8217;s New York appeared first on eJewishPhilanthropy .",https://ejewishphilanthropy.com/what-ken-livingstones-london-can-teach-jews-living-in-zohran-mamdanis-new-york/,eJewish Philanthropy,Judah Ari Gross,2025-11-05T14:11:21,2025-11-05 15:10:18.898582,https://ejewishphilanthropy.com/?p=165612
