title,description,link,source,author,published,scraped_at,guid
Forget the old clichés,A new U.S.-Israel strategy is reshaping the Middle East in which Egypt is taking a leading role. The post Forget the old clichés appeared first on JNS.org .,https://www.jns.org/forget-the-old-cliches/,JNS,Fiamma Nirenstein,2025-10-26T19:39:48,2025-10-26 20:09:09.927768,https://www.jns.org/?p=598935
"‘So good you’re home’: Discharged from hospital, ex-hostages welcomed home by masses","Crowds across Israel wave flags and sing as Evyatar David, Guy Gilboa-Dalal, Eitan Mor, Segev Kalfon and Bar Kuperstein make triumphant return to their homes The post &#8216;So good you&#8217;re home&#8217;: Discharged from hospital, ex-hostages welcomed home by masses appeared first on The Times of Israel .",https://www.timesofisrael.com/so-good-youre-home-discharged-from-hospital-ex-hostages-welcomed-home-by-masses/,Times of Israel,,2025-10-26T19:37:12,2025-10-26 20:09:04.643944,https://www.timesofisrael.com/?post_type=liveblog_entry&p=3674208
Taking the battle to social media,"The release of the hostages this month and the subsequent fragile peace that has ensued has marked for many the end of the war and the opportunity to move beyond the conflict to focus on other pressing issues. But for us at Alpha Epsilon Pi and TalkIsrael, this moment marks an important inflection point for... Read More The post Taking the battle to social media appeared first on eJewishPhilanthropy .",https://ejewishphilanthropy.com/taking-the-battle-to-social-media/,eJewish Philanthropy,Maya Vorobyov,2025-10-26T19:59:40,2025-10-26 20:08:57.298624,https://ejewishphilanthropy.com/?p=165091
Why Netanyahu's vicious 'poison machine' is now attacking Israeli hostage families,"Since the hostages' return, several families who played a meaningful role in the struggle to bring back their loved ones have been in the crosshairs of thousands of social media accounts, some of them verified and many anonymous, who spread pro-Netanyahu messaging. It's all part of a larger effort by the PM to shield himself from accountability",https://www.haaretz.com/israel-news/haaretz-today/2025-10-26/ty-article/.premium/why-netanyahu-vicious-poison-machine-is-now-attacking-israeli-hostage-families/0000019a-2169-d037-abfa-2dff588a0000,Haaretz,Amir Tibon,2025-10-26T17:33:38,2025-10-26 19:08:41.953855,https://www.haaretz.com/israel-news/haaretz-today/2025-10-26/ty-article/.premium/why-netanyahu-vicious-poison-machine-is-now-attacking-israeli-hostage-families/0000019a-2169-d037-abfa-2dff588a0000
Figures behind Israeli universities as new academic year begins: minority targets remain unmet,Women make up 60% of student population but also overrepresented among fields associated with lower salaries; Arab Israelis and Haredi students underrepresented overall while concentrated in teacher training programs,https://www.haaretz.com/israel-news/2025-10-26/ty-article/.premium/figures-behind-israeli-universities-as-new-academic-year-begins/0000019a-2155-dd96-af9b-395de4780000,Haaretz,Lior Dattel,2025-10-26T18:25:24,2025-10-26 19:08:41.953818,https://www.haaretz.com/israel-news/2025-10-26/ty-article/.premium/figures-behind-israeli-universities-as-new-academic-year-begins/0000019a-2155-dd96-af9b-395de4780000
'I've been waiting for two years': Four freed Israeli hostages return home from hospital,"Guy thanked the crowd that came to welcome him. 'This day has finally arrived, I'm excited to see everyone,' he said. Eitan Mor's father: 'We pray that there will never again be a Returning Hostages Ward in the State of Israel, and that we will be the last parents to have their children abducted'",https://www.haaretz.com/israel-news/2025-10-26/ty-article-magazine/ive-been-waiting-for-two-years-four-freed-israeli-hostages-return-home-from-hospital/0000019a-2128-d037-abfa-2dff8e1c0000,Haaretz,Haaretz,2025-10-26T18:26:27,2025-10-26 19:08:41.953776,https://www.haaretz.com/israel-news/2025-10-26/ty-article-magazine/ive-been-waiting-for-two-years-four-freed-israeli-hostages-return-home-from-hospital/0000019a-2128-d037-abfa-2dff8e1c0000
Israeli Military Says It Conducted ‘Targeted Strike’ in Central Gaza,"Israeli forces carried out a &#8220;targeted strike&#8221; on an individual in central Gaza who was planning to attack Israeli troops,...",https://www.algemeiner.com/2025/10/26/israeli-military-says-it-conducted-targeted-strike-in-central-gaza/,Algemeiner,Reuters and Algemeiner Staff,2025-10-26T18:20:25,2025-10-26 19:08:36.934262,https://www.algemeiner.com/?p=756171
"Mossad Reveals Foiled Iranian Terror Plots in Australia, Greece, and Germany",i24 News &#8211; The Mossad announced on Sunday that it had uncovered the mechanisms behind several Iranian-led terrorist plots thwarted...,https://www.algemeiner.com/2025/10/26/mossad-reveals-foiled-iranian-terror-plots-in-australia-greece-and-germany/,Algemeiner,i24 News and Algemeiner Staff,2025-10-26T18:38:39,2025-10-26 19:08:36.934232,https://www.algemeiner.com/?p=756176
‘Dirty looks?’ VP Vance Criticizes Mamdani’s 9/11 Remarks About Muslim Aunt,i24 News &#8211; Vice President JD Vance sharply criticized mayoral candidate Zohran Mamdani after Mamdani shared a personal story about...,https://www.algemeiner.com/2025/10/26/dirty-looks-vp-vance-criticizes-mamdanis-9-11-remarks-about-muslim-aunt/,Algemeiner,i24 News and Algemeiner Staff,2025-10-26T18:56:00,2025-10-26 19:08:36.934196,https://www.algemeiner.com/?p=756179
Jewish extremists boast of attacks against Palestinians in public WhatsApp channel,"Graffiti in village targeted by settlers Friday night reads 'Greetings from Anshei Shlomeinu,' the group's members laud attacks against Palestinian civilians by 'true soldiers' The post Jewish extremists boast of attacks against Palestinians in public WhatsApp channel appeared first on The Times of Israel .",https://www.timesofisrael.com/jewish-extremists-boast-of-attacks-against-palestinians-in-public-whatsapp-channel/,Times of Israel,,2025-10-26T18:53:37,2025-10-26 19:08:27.802547,https://www.timesofisrael.com/?p=3674213
"Three Turkish citizens charged with arms smuggling, entering Israel illegally","One defendant accused of trafficking arms from Iranian dealer to be used in terror attacks, recruiting two others into gun-smuggling ring; all 3 suspects arrested in September The post Three Turkish citizens charged with arms smuggling, entering Israel illegally appeared first on The Times of Israel .",https://www.timesofisrael.com/three-turkish-citizens-charged-with-arms-smuggling-entering-israel-illegally/,Times of Israel,,2025-10-26T18:57:13,2025-10-26 19:08:27.802506,https://www.timesofisrael.com/?post_type=liveblog_entry&p=3673932
JD Vance mocks Zohran Mamdani for focusing on indignities suffered by Muslims after 9-11,"'According to Zohran the real victim of 9/11 was his auntie who got some (allegedly) bad looks,' Vance says after NYC candidate said aunt was afraid to ride subway after attacks The post JD Vance mocks Zohran Mamdani for focusing on indignities suffered by Muslims after 9-11 appeared first on The Times of Israel .",https://www.timesofisrael.com/jd-vance-mocks-zohran-mamdani-for-focusing-on-indignities-suffered-by-muslims-after-9-11/,Times of Israel,,2025-10-26T18:57:42,2025-10-26 19:08:27.802458,https://www.timesofisrael.com/?p=3674176
Four hostage protesters charged with arson moved to house arrest after over a month in custody,"The four are accused of plotting to set recycling bins on fire at six locations in Jerusalem, creating a 'ring of fire' around the prime minister's residence to protest the 700th day of the war and demand the release of hostages",https://www.haaretz.com/israel-news/2025-10-26/ty-article/.premium/four-hostage-protesters-charged-with-arson-put-under-house-arrest-after-month-in-custody/0000019a-2140-dd96-af9b-395d29380000,Haaretz,Josh Breiner,2025-10-26T17:06:24,2025-10-26 18:11:28.347596,https://www.haaretz.com/israel-news/2025-10-26/ty-article/.premium/four-hostage-protesters-charged-with-arson-put-under-house-arrest-after-month-in-custody/0000019a-2140-dd96-af9b-395d29380000
"Hostage mother says families targeted by political campaign, alluding to Netanyahu's 'poison machine'","According to Einav Zangauler, the campaign's goal is to 'rewrite history' and 'tarnish the struggle that caused Trump to force a deal on Netanyahu and Hamas'",https://www.haaretz.com/israel-news/2025-10-26/ty-article/.premium/hostage-mother-says-political-campaign-targets-families-alluding-to-pms-poison-machine/0000019a-20ef-dd5f-afda-38ffee230000,Haaretz,Bar Peleg,2025-10-26T17:28:59,2025-10-26 18:11:28.347562,https://www.haaretz.com/israel-news/2025-10-26/ty-article/.premium/hostage-mother-says-political-campaign-targets-families-alluding-to-pms-poison-machine/0000019a-20ef-dd5f-afda-38ffee230000
Why Netanyahu is siccing his vicious 'poison machine' on Israeli hostage families,"Since the hostages' return, several families who played a meaningful role in the struggle to bring back their loved ones have been in the crosshairs of thousands of social media accounts, some of them verified and many anonymous, who spread pro-Netanyahu messaging. It's all part of a larger effort by the PM to shield himself from accountability",https://www.haaretz.com/israel-news/haaretz-today/2025-10-26/ty-article/.premium/why-netanyahu-is-siccing-his-vicious-poison-machine-on-israeli-hostage-families/0000019a-2169-d037-abfa-2dff588a0000,Haaretz,Amir Tibon,2025-10-26T17:33:38,2025-10-26 18:11:28.347527,https://www.haaretz.com/israel-news/haaretz-today/2025-10-26/ty-article/.premium/why-netanyahu-is-siccing-his-vicious-poison-machine-on-israeli-hostage-families/0000019a-2169-d037-abfa-2dff588a0000
Einav Zangauker: Netanyahu’s allies waging campaign to besmirch ex-hostages’ families,Outspoken mother of released hostage Matan Zangauker says 'poison machine' trying to 'rewrite history' after Likud member baselessly hints she misused funds raised for campaign The post Einav Zangauker: Netanyahu&#8217;s allies waging campaign to besmirch ex-hostages&#8217; families appeared first on The Times of Israel .,https://www.timesofisrael.com/einav-zangauker-netanyahus-allies-waging-campaign-to-besmirch-ex-hostages-families/,Times of Israel,,2025-10-26T17:27:06,2025-10-26 18:11:14.991774,https://www.timesofisrael.com/?p=3674096
Ministerial committee advances bill aimed at hampering Bennett electoral campaign,Bennett says government fears him and is using 'anti-democratic' law to block his run; panel also delays decision on bill allowing lawmakers to halt PM's ongoing criminal trial The post Ministerial committee advances bill aimed at hampering Bennett electoral campaign appeared first on The Times of Israel .,https://www.timesofisrael.com/ministerial-committee-advances-bill-aimed-at-hampering-bennett-electoral-campaign/,Times of Israel,,2025-10-26T17:58:07,2025-10-26 18:11:14.991723,https://www.timesofisrael.com/?p=3674226
"Israel allows Red Cross, Egyptian teams in IDF-held Gaza areas to recover hostage bodies","Searches for the bodies of hostages are reportedly taking place in Rafah and Khan Yunis, using heavy equipment. Hamas has repeatedly said efforts to retrieve remains face challenges because of the massive destruction",https://www.haaretz.com/israel-news/2025-10-26/ty-article/.premium/israel-allows-red-cross-egyptian-teams-in-idf-held-gaza-areas-to-recover-hostage-bodies/0000019a-2101-dd96-af9b-391d08fc0000,Haaretz,Rawan Suleiman,2025-10-26T16:47:28,2025-10-26 17:08:52.218499,https://www.haaretz.com/israel-news/2025-10-26/ty-article/.premium/israel-allows-red-cross-egyptian-teams-in-idf-held-gaza-areas-to-recover-hostage-bodies/0000019a-2101-dd96-af9b-391d08fc0000
"Radiohead’s Thom Yorke says he won’t play Israel under Netanyahu, but slams BDS movement","Alt-rock icons have faced anti-Israel calls before; guitarist Jonny Greenwood, whose wife is Israeli and who plays with Arab and Israeli artists, rejects boycott in Sunday Times interview The post Radiohead&#8217;s Thom Yorke says he won&#8217;t play Israel under Netanyahu, but slams BDS movement appeared first on The Times of Israel .",https://www.timesofisrael.com/radioheads-thom-yorke-says-he-wont-play-israel-under-netanyahu-but-slams-boycott-calls/,Times of Israel,,2025-10-26T16:23:44,2025-10-26 17:08:39.721831,https://www.timesofisrael.com/?p=3673792
"Israel reveals Iran’s Guards leader behind attacks on Jewish sites in Europe, Australia","Senior IRGC Quds Force commander Sardar Ammar directed plots in Greece, Australia and Germany, says Mossad, though the attackers' follow-through has often been bumbling The post Israel reveals Iran&#8217;s Guards leader behind attacks on Jewish sites in Europe, Australia appeared first on The Times of Israel .",https://www.timesofisrael.com/israel-reveals-irans-guards-leader-behind-attacks-on-jewish-sites-in-europe-australia/,Times of Israel,,2025-10-26T16:53:05,2025-10-26 17:08:39.721786,https://www.timesofisrael.com/?p=3674025
Two Hezbollah operatives killed in Lebanon strikes — IDF,"Attacks on terror group in Naqoura, Beqaa Valley, come as defense minister, US deputy envoy to Mideast tour border The post Two Hezbollah operatives killed in Lebanon strikes &#8212; IDF appeared first on The Times of Israel .",https://www.timesofisrael.com/two-hezbollah-operatives-killed-in-lebanon-strikes-idf/,Times of Israel,,2025-10-26T16:53:46,2025-10-26 17:08:39.721734,https://www.timesofisrael.com/?p=3674128&preview=true&preview_id=3674128
'We act at our discretion': Netanyahu says Israel strikes Gaza without U.S. approval,"Netanyahu said he was responding to claims that the U.S. 'controls' him and 'dictates Israel's security policy,' after Haaretz reported that Washington expects Israel to notify it in advance before any exceptional IDF strikes in Gaza, including airstrikes",https://www.haaretz.com/israel-news/2025-10-26/ty-article/we-act-at-our-discretion-netanyahu-says-israel-strikes-gaza-without-u-s-approval/0000019a-208d-dd5f-afda-38df63010000,Haaretz,Jonathan Lis,2025-10-26T15:26:05,2025-10-26 16:09:47.349402,https://www.haaretz.com/israel-news/2025-10-26/ty-article/we-act-at-our-discretion-netanyahu-says-israel-strikes-gaza-without-u-s-approval/0000019a-208d-dd5f-afda-38df63010000
"NIS 1.4 billion housing plan passed to boost construction, increase foreign workers","Government approves program that looks to accelerate building, strengthen local authorities, and expand the supply of affordable homes across the country The post NIS 1.4 billion housing plan passed to boost construction, increase foreign workers appeared first on The Times of Israel .",https://www.timesofisrael.com/nis-1-4-billion-housing-plan-passed-to-boost-construction-increase-foreign-workers/,Times of Israel,,2025-10-26T15:48:16,2025-10-26 16:09:32.513554,https://www.timesofisrael.com/?p=3673959
Does that Trump Time Magazine cover really reference a Nazi war criminal?,"As Adolf Hitler’s armies rampaged across Europe and the Soviet Union, they were followed by German industrialists who plundered the occupied countries —seizing raw materials, dismantling factories and exploiting civilians as forced laborers. Private enterprise became embedded in the machinery of conquest and genocide. Among them, few wielded more power than Alfried Krupp, owner and... The post Does that Trump Time Magazine cover really reference a Nazi war criminal? appeared first on The Forward .",https://forward.com/opinion/778765/trump-alfried-krupp-time-cover-arnold-newman/,The Forward,Terrence Petty,2025-10-26T15:28:14,2025-10-26 16:09:30.386962,https://forward.com/?p=778765
IDF says it struck Islamic Jihad militant who planned to attack Israeli soldiers in central Gaza,"Amid the cease-fire between Hamas and Israel in the Gaza Strip, the IDF said forces deployed in the Nnusierat area conducted a targeted strike against an unnamed terrorist from the Islamic Jihad in Gaza, 'to remove any immediate threat'",https://www.haaretz.com/gaza/2025-10-25/ty-article/.premium/idf-says-it-struck-islamic-jihad-militant-who-planned-to-attack-israeli-soldiers-in-gaza/0000019a-1ca6-de9d-adbe-fce7ccd10000,Haaretz,Yaniv Kubovich,2025-10-25T19:16:51,2025-10-26 15:09:01.334427,https://www.haaretz.com/gaza/2025-10-25/ty-article/.premium/idf-says-it-struck-islamic-jihad-militant-who-planned-to-attack-israeli-soldiers-in-gaza/0000019a-1ca6-de9d-adbe-fce7ccd10000
"Hamas says search for hostage bodies in Gaza to expand, as Trump gives 48-hour warning","The organization's top negotiator Khalil al-Hayya reiterated the group's efforts to locate the bodies, as Trump hinted that Hamas is not returning some they can return, and warned that other countries involved in the peace agreement could take action if Hamas does not cooperate",https://www.haaretz.com/gaza/2025-10-26/ty-article/.premium/hamas-says-search-for-hostage-bodies-in-gaza-to-expand-as-trump-gives-48-hour-warning/0000019a-1f36-d69a-a7bb-df77d6aa0000,Haaretz,Haaretz,2025-10-26T08:03:20,2025-10-26 15:09:01.334371,https://www.haaretz.com/gaza/2025-10-26/ty-article/.premium/hamas-says-search-for-hostage-bodies-in-gaza-to-expand-as-trump-gives-48-hour-warning/0000019a-1f36-d69a-a7bb-df77d6aa0000
Are we alone in the universe? Most classic ancient philosophers didn't think so,"Alien life isn't a modern concept. Speculation about multiple worlds and extraterrestrials can be traced back to ancient Greece and earlier, but not all the great philosophers were on board",https://www.haaretz.com/archaeology/2025-10-26/ty-article/are-we-alone-in-the-universe-most-ancient-philosophers-didnt-think-so/0000019a-20ee-dd96-af9b-38fff88d0000,Haaretz,Terry Madenholm,2025-10-26T14:57:28,2025-10-26 15:09:01.334295,https://www.haaretz.com/archaeology/2025-10-26/ty-article/are-we-alone-in-the-universe-most-ancient-philosophers-didnt-think-so/0000019a-20ee-dd96-af9b-38fff88d0000
‘The Forward’ takes education backward,"By every relevant statistic, Chassidic education is markedly superior to anything offered in New York City public schools. The post ‘The Forward’ takes education backward appeared first on JNS.org .",https://www.jns.org/the-forward-takes-education-backward/,JNS,Rabbi Yaakov Menken,2025-10-26T14:30:00,2025-10-26 15:08:54.509406,https://www.jns.org/?p=598443
How it feels to be Israeli right now - Sponsored Content,So much of what we read about Israel is politics and war. But this episode explores a different angle: what does it feel like to live through this moment? The post How it feels to be Israeli right now appeared first on The Times of Israel .,https://toi.li/ZWGFrf,Times of Israel,,2025-10-26T14:08:06,2025-10-26 15:08:50.111161,https://www.timesofisrael.com/?post_type=spotlight&p=3674089
"US chipmaker Nvidia scouts for Israeli AI talent, in expansion of R&D hub in south","Chip giant seeks to hire hundreds of employees as it plans to move its Beersheba premises to a new site nearby, triple the size of its current facility, in mid-2026 The post US chipmaker Nvidia scouts for Israeli AI talent, in expansion of R&#038;D hub in south appeared first on The Times of Israel .",https://www.timesofisrael.com/us-chipmaker-nvidia-scouts-for-israeli-ai-talent-in-expansion-of-rd-hub-in-south/,Times of Israel,,2025-10-26T14:10:17,2025-10-26 15:08:50.111122,https://www.timesofisrael.com/?p=3673869
All in the Family: A Jewish Meditation on Identity - Sponsored Content,"Drawing on Torah stories from Genesis and insights from family-systems pioneer Salvador Minuchin, Rabbi Josh explores how family is both something we inherit and something we create. The post All in the Family: A Jewish Meditation on Identity appeared first on The Times of Israel .",https://toi.li/WgnD9x,Times of Israel,,2025-10-26T14:19:19,2025-10-26 15:08:50.111079,https://www.timesofisrael.com/?post_type=spotlight&p=3674102
Holding Hope in a Fragile Peace - Sponsored Content,"We sit with Abigail Pogrebin to reflect on the return of the hostages, the complex roles of Trump and Netanyahu, and the dueling priorities of Israeli and American Jews. The post Holding Hope in a Fragile Peace appeared first on The Times of Israel .",https://www.timesofisrael.com/spotlight/holding-hope-in-a-fragile-peace/,Times of Israel,,2025-10-26T14:26:24,2025-10-26 15:08:50.111036,https://www.timesofisrael.com/?post_type=spotlight&p=3674107
Netanyahu denies Washington dictating actions in Gaza: ‘Israel is a sovereign state’,Prime minister insists that Jerusalem is still calling the shots over how it acts in Palestinian enclave amid reports of close US oversight and control The post Netanyahu denies Washington dictating actions in Gaza: &#8216;Israel is a sovereign state&#8217; appeared first on The Times of Israel .,https://www.timesofisrael.com/netanyahu-denies-washington-dictating-actions-in-gaza-israel-is-a-sovereign-state/,Times of Israel,,2025-10-26T14:33:49,2025-10-26 15:08:50.110988,https://www.timesofisrael.com/?p=3673963
Israel struggles to advance return of hostage bodies amid U.S. restraints on action against Hamas,"Despite fearing a deliberate delay by Hamas in returning the bodies of hostages still held in Gaza, Israel cannot independently determine that Hamas is violating the cease-fire, and international parties are rushing to expedite the search before moving on to the next phase of Trump's plan for Gaza",https://www.haaretz.com/gaza/2025-10-26/ty-article/.premium/all-parties-work-to-locate-bodies-of-slain-hostages-before-phase-two-of-trump-plan/0000019a-1ccd-d2fc-a79a-9edfb46b0000,Haaretz,Jonathan Lis,2025-10-26T02:21:24,2025-10-26 14:09:14.602910,https://www.haaretz.com/gaza/2025-10-26/ty-article/.premium/all-parties-work-to-locate-bodies-of-slain-hostages-before-phase-two-of-trump-plan/0000019a-1ccd-d2fc-a79a-9edfb46b0000
"Egypt paving way to Palestinian consensus and direct involvement in Gaza, but still hasn't ousted Hamas","Hamas and Fatah back a new apolitical committee to govern Gaza, giving legitimacy to civilian components of the Trump plan. Egypt positions itself as the region's 'custodian' of Palestinian affairs, seeking influence over postwar reconstruction and a potential multinational force",https://www.haaretz.com/gaza/2025-10-26/ty-article/.premium/egypt-brokers-gaza-technocrats-deal-boosting-palestinian-consensus/0000019a-1ce5-d2fc-a79a-9ef72e6e0000,Haaretz,Zvi Bar'el,2025-10-26T06:14:54,2025-10-26 14:09:14.602873,https://www.haaretz.com/gaza/2025-10-26/ty-article/.premium/egypt-brokers-gaza-technocrats-deal-boosting-palestinian-consensus/0000019a-1ce5-d2fc-a79a-9ef72e6e0000
"Israeli army dumps construction waste and rubble inside Gaza, footage shows","The waste consists of vast quantities of construction debris and garbage left behind by the IDF during the war. 'We'll have mountains of garbage right in front of our homes for the rest of our lives,' said a soldier who lives near the border",https://www.haaretz.com/gaza/2025-10-26/ty-article/.premium/israeli-army-dumps-construction-waste-and-rubble-inside-gaza-footage-shows/0000019a-2032-d582-a39e-7af61a870000,Haaretz,Yaniv Kubovich,2025-10-26T12:27:10,2025-10-26 14:09:14.602826,https://www.haaretz.com/gaza/2025-10-26/ty-article/.premium/israeli-army-dumps-construction-waste-and-rubble-inside-gaza-footage-shows/0000019a-2032-d582-a39e-7af61a870000
Neanderthal extinction and dog domestication tied into sweeping new theory of human evolution,"Energetics-based model by Israeli researchers ties up more loose ends, including the extinction of alternative humans and our embrace of a dangerous wild animal in the world's first joint venture",https://www.haaretz.com/archaeology/2025-10-26/ty-article/neanderthal-extinction-and-dog-domestication-tied-into-sweeping-theory-of-human-evolution/0000019a-2002-d69a-a7bb-f873bda90000,Haaretz,Ruth Schuster,2025-10-26T13:12:39,2025-10-26 14:09:14.602793,https://www.haaretz.com/archaeology/2025-10-26/ty-article/neanderthal-extinction-and-dog-domestication-tied-into-sweeping-theory-of-human-evolution/0000019a-2002-d69a-a7bb-f873bda90000
The Israeli filmmaker who lets her sex toy do the talking,"In her new movie, Rachel Ben Zaken not only takes off all her clothes but acknowledges her desire to be a man – and her insistence on remaining a woman",https://www.haaretz.com/israel-news/culture/movies/2025-10-26/ty-article-magazine/.premium/the-israeli-filmmaker-who-lets-her-sex-toy-do-the-talking/0000019a-200b-d77b-a3ff-27eb66d50000,Haaretz,Nirit Anderman,2025-10-26T13:20:54,2025-10-26 14:09:14.602758,https://www.haaretz.com/israel-news/culture/movies/2025-10-26/ty-article-magazine/.premium/the-israeli-filmmaker-who-lets-her-sex-toy-do-the-talking/0000019a-200b-d77b-a3ff-27eb66d50000
"Who is the 'fucking superpower' now, Bibi? How Trump became the first U.S. president to force Netanyahu to capitulate","From Clinton's exasperation to Biden's restraint, every U.S. president has struggled with Israel's Prime Minister Benjamin Netanyahu: Trump's hard line toward him marks an unprecedented break. Will he keep the pressure up to see his Gaza plan through?",https://www.haaretz.com/opinion/2025-10-26/ty-article-opinion/.premium/who-is-the-fucking-superpower-now-bibi-how-trump-forced-netanyahu-to-capitulate/0000019a-206a-d582-a39e-7afe35e00000,Haaretz,Aaron David Miller,2025-10-26T13:22:41,2025-10-26 14:09:14.602721,https://www.haaretz.com/opinion/2025-10-26/ty-article-opinion/.premium/who-is-the-fucking-superpower-now-bibi-how-trump-forced-netanyahu-to-capitulate/0000019a-206a-d582-a39e-7afe35e00000
