title,description,link,source,author,published,scraped_at,guid
"PEN America president quits over anti-BDS article on 'exclusion' of Israelis, Jews in publishing","Ethiopian American author Dinaw Mengestu resigned last week, reportedly calling it 'unethical' for the free speech group to take a position against BDS. PEN had published interviews with 30+ Jewish and Israeli literary professionals on the industry's post-October 7 'hostility'",https://www.haaretz.com/life/2026-07-12/ty-article-magazine/.premium/pen-america-head-quits-after-article-against-cultural-boycott-of-israelis/0000019f-5591-d6c0-a9df-dd9f12d50000,Haaretz,Etan Nechin,2026-07-12T15:14:09,2026-07-12 16:00:20.024340,https://www.haaretz.com/life/2026-07-12/ty-article-magazine/.premium/pen-america-head-quits-after-article-against-cultural-boycott-of-israelis/0000019f-5591-d6c0-a9df-dd9f12d50000
Which bills are the Netanyahu coalition racing to pass before the election recess,"The government is rushing to pass bills curbing the attorney general's powers, advancing a media overhaul, enshrining Torah study in a semi-constitutional law and shielding ultra-Orthodox draft dodgers from arrest. It remains unclear how many can pass in a week",https://www.haaretz.com/israel-news/elections/2026-07-12/ty-article/.premium/which-bills-are-the-netanyahu-coalition-racing-to-pass-before-election-recess/0000019f-55e6-d38b-afbf-5ff609a30000,Haaretz,Noa Shpigel,2026-07-12T15:41:40,2026-07-12 16:00:20.024306,https://www.haaretz.com/israel-news/elections/2026-07-12/ty-article/.premium/which-bills-are-the-netanyahu-coalition-racing-to-pass-before-election-recess/0000019f-55e6-d38b-afbf-5ff609a30000
Atop the Beaufort came the boast: 'Hezbollah is dismantled.' Reality will put it to the test,The IDF took journalists to southern Lebanon to argue that retaking Beaufort Castle justified its heavy cost. But the army's preparations suggest it expects to remain there in the upcoming winter,https://www.haaretz.com/israel-news/israel-security/2026-07-12/ty-article-magazine/.premium/atop-the-beaufort-came-the-boast-hezbollah-is-dismantled-is-it-really/0000019f-567d-d6c0-a9df-dfffb6330000,Haaretz,Bar Peleg,2026-07-12T15:46:27,2026-07-12 16:00:20.024266,https://www.haaretz.com/israel-news/israel-security/2026-07-12/ty-article-magazine/.premium/atop-the-beaufort-came-the-boast-hezbollah-is-dismantled-is-it-really/0000019f-567d-d6c0-a9df-dfffb6330000
"Lindsey Graham, 71, remembered for 'deep personal connection' to Israel, Jews","""Friends like Lindsey Graham come along once in a generation,"" stated William Daroff, CEO of the Conference of Presidents of Major American Jewish Organizations.",https://www.jns.org/news/u-s-news/lindsey-graham-71-remembered-for-deep-personal-connection-to-israel-jews,JNS,Menachem Wecker,2026-07-12T15:54:56,2026-07-12 16:00:13.225175,https://www.jns.org/news/u-s-news/lindsey-graham-71-remembered-for-deep-personal-connection-to-israel-jews
"Beneath Beaufort’s strategic bulwark, a Hezbollah lair built to attack Israel is unearthed","Built into rocky ridge below imposing Crusader fortress, massive tunnel system, complete with showers and operating room, allowed terror group to launch Iranian arms at Metula and elsewhere without detection, IDF says The post Beneath Beaufort&#8217;s strategic bulwark, a Hezbollah lair built to attack Israel is unearthed appeared first on The Times of Israel .",https://www.timesofisrael.com/beneath-beauforts-strategic-bulwark-a-hezbollah-lair-built-to-attack-israel-is-unearthed/,Times of Israel,,2026-07-12T15:00:52,2026-07-12 16:00:08.729889,https://www.timesofisrael.com/?p=3857308
Syria’s interim parliament meets for first time after Assad overthrow,"Syrian president calls on lawmakers to model 'responsibility and competence' at chamber's first session in Damascus, as three seats for Druze-majority Sweida remain empty The post Syria&#8217;s interim parliament meets for first time after Assad overthrow appeared first on The Times of Israel .",https://www.timesofisrael.com/syrias-interim-parliament-meets-for-first-time-after-assad-overthrow/,Times of Israel,,2026-07-12T15:16:45,2026-07-12 16:00:08.729836,https://www.timesofisrael.com/?p=3859699
Israel's Minister of Culture sends a dangerous message to Israeli artists,"A campaign ad by Likud Minister Miki Zohar seeks to redefine the boundaries of acceptable debate in Israel, and to change the role of government support for the arts in a troubling direction",https://www.haaretz.com/opinion/2026-07-12/ty-article-opinion/.premium/israels-minister-of-culture-sends-a-dangerous-message-to-israeli-artists/0000019f-5693-d7c8-a3df-5f979d390000,Haaretz,Libby Lenkinski,2026-07-12T14:11:54,2026-07-12 14:57:16.389465,https://www.haaretz.com/opinion/2026-07-12/ty-article-opinion/.premium/israels-minister-of-culture-sends-a-dangerous-message-to-israeli-artists/0000019f-5693-d7c8-a3df-5f979d390000
Netanyahu coalition announces Israel's 2026 election will take place on October 27,"Netanyahu's far-right coalition will become the first to serve a full term in four decades. The Knesset is expected to dissolve on Friday, and the coalition is seeking to secure as many political achievements as possible",https://www.haaretz.com/israel-news/elections/2026-07-12/ty-article/.premium/israels-2026-election-will-take-place-on-october-27-netanyahu-coalition-says/0000019f-56aa-d9b4-abdf-dfebadd60000,Haaretz,Noa Shpigel,2026-07-12T14:16:09,2026-07-12 14:57:16.389432,https://www.haaretz.com/israel-news/elections/2026-07-12/ty-article/.premium/israels-2026-election-will-take-place-on-october-27-netanyahu-coalition-says/0000019f-56aa-d9b4-abdf-dfebadd60000
CENTCOM: Strait of Hormuz open despite 'arbitrary' Iranian declarations,"""Iran does not control the strait. Traffic is flowing,"" stated U.S. Central Command.",https://www.jns.org/news/u-s-news/centcom-strait-of-hormuz-open-despite-arbitrary-iranian-declarations,JNS,JNS Staff,2026-07-12T13:49:06,2026-07-12 14:57:03.322451,https://www.jns.org/news/u-s-news/centcom-strait-of-hormuz-open-despite-arbitrary-iranian-declarations
Should Turkey get the F-35? Israel says no,"“The Meira K Show” brings a fresh, unfiltered look at society and politics in Israel and the Middle East. With her trademark energy and candor, she tackles stories too often ignored or distorted by mainstream media—offering clarity, courage and context in real time. Whether it’s breaking news, border tensions, political drama or cultural shifts, Meira delivers the facts and emotion behind the headlines with honesty and heart. Fast-paced, fearless and fiercely authentic, “The Meira K Show” gives viewers a frontline perspective on Israel’s most pressing challenges and inspiring moments. Each episode captures the urgency of the moment while keeping it grounded in truth and humanity. If you want to stay informed, inspired and connected to the real Israel, this is the show to watch. See more at: @JNS_TV and subscribe to our YouTube channel.",https://www.jns.org/jns-tv/meira-k-show/should-turkey-get-the-f-35-israel-says-no,JNS,Meira K,2026-07-12T14:20:24,2026-07-12 14:57:03.322419,https://www.jns.org/jns-tv/meira-k-show/should-turkey-get-the-f-35-israel-says-no
I was there when the lights went out and New York was plunged into darkness,"I&#8217;m the lifelong resident of a vast and complicated metropolis that smugly prides itself on never stopping. Subways, buses and cabs running day and night, bodegas and diners open 24/7, hundreds of thousands of people at work or out partying somewhere, bike couriers and truck drivers making deliveries — all in a town with a... The post I was there when the lights went out and New York was plunged into darkness appeared first on The Forward .",https://forward.com/culture/837395/new-york-blackout-july-1977-threepenny-opera-central-park/,The Forward,Allan Neuwirth,2026-07-12T14:00:46,2026-07-12 14:56:56.515771,https://forward.com/?p=837395
"Qatar's former ruler Sheikh Hamad bin Khalifa Al Thani died at age 74, state news agency says","Sheikh Hamad transformed Qatar into a global diplomatic, media and investment power before voluntarily handing power to his son in 2013",https://www.haaretz.com/middle-east-news/2026-07-12/ty-article/qatars-former-ruler-sheikh-hamad-bin-khalifa-al-thani-died-at-age-74/0000019f-55b9-d7c8-a3df-5fbf24390000,Haaretz,The Associated Press,2026-07-12T12:14:57,2026-07-12 13:20:58.229178,https://www.haaretz.com/middle-east-news/2026-07-12/ty-article/qatars-former-ruler-sheikh-hamad-bin-khalifa-al-thani-died-at-age-74/0000019f-55b9-d7c8-a3df-5fbf24390000
Israeli research offers new hope for overcoming one of the deadliest brain cancers,"Instead of replacing existing drugs, future therapies could focus on blocking the mechanisms that allow tumors to resist them, researchers said.",https://www.jns.org/news/israel-news/israeli-research-offers-new-hope-for-overcoming-one-of-the-deadliest-brain-cancers,JNS,Pesach Benson/TPS-IL,2026-07-12T12:17:31,2026-07-12 13:20:50.489988,https://www.jns.org/news/israel-news/israeli-research-offers-new-hope-for-overcoming-one-of-the-deadliest-brain-cancers
Melbourne court rules against pro-Palestinian pianist,"""I find that there is a custom or practice that classical musicians do not make statements on sensitive political or social issues from the stage without approval of the host,"" said Justice Graeme Hill.",https://www.jns.org/news/world/melbourne-court-rules-against-pro-palestinian-pianist,JNS,David Isaac,2026-07-12T13:07:36,2026-07-12 13:20:50.489954,https://www.jns.org/news/world/melbourne-court-rules-against-pro-palestinian-pianist
"Iran attacks Jordan, Kuwait, Oman, and Qatar with drones and missiles after US strikes","Three people including child hurt by falling debris in Kuwait; Qatar condemns 'dangerous escalation' after it is hit for first time since April; Iranian soldier killed in US attacks The post Iran attacks Jordan, Kuwait, Oman, and Qatar with drones and missiles after US strikes appeared first on The Times of Israel .",https://www.timesofisrael.com/iran-attacks-jordan-kuwait-oman-and-qatar-with-drones-and-missiles-after-us-strikes/,Times of Israel,,2026-07-12T12:13:44,2026-07-12 13:20:46.027767,https://www.timesofisrael.com/?p=3859562
IDF said to present probe into fatal 2024 Lebanon incident to slain soldier’s family,Grandfather of Sgt. Gur Kehati says commanders acknowledged no operational need for researcher Ze'ev Erlich to join mission but stopped short of accepting responsibility The post IDF said to present probe into fatal 2024 Lebanon incident to slain soldier&#8217;s family appeared first on The Times of Israel .,https://www.timesofisrael.com/idf-said-to-present-probe-into-fatal-2024-lebanon-incident-to-slain-soldiers-family/,Times of Israel,,2026-07-12T12:19:18,2026-07-12 13:20:46.027726,https://www.timesofisrael.com/?p=3859576
Otzma Yehudit minister suggests far-right party may woo Shas voters,Comments by Heritage Minister Amichay Eliyahu follow Haredi party's refusal to pledge support for another Netanyahu-led coalition until draft exemption law is passed The post Otzma Yehudit minister suggests far-right party may woo Shas voters appeared first on The Times of Israel .,https://www.timesofisrael.com/otzma-yehudit-minister-suggests-far-right-party-may-woo-shas-voters/,Times of Israel,,2026-07-12T13:04:31,2026-07-12 13:20:46.027684,https://www.timesofisrael.com/?p=3859601
Israel’s under-20 women’s basketball team makes history with first European final,EuroBasket squad already notched a first by reaching semis; 78-69 victory over Belgium sets up squad for championship game against France on Sunday The post Israel&#8217;s under-20 women’s basketball team makes history with first European final appeared first on The Times of Israel .,https://www.timesofisrael.com/israels-under-20-womens-basketball-team-makes-history-with-first-european-final/,Times of Israel,,2026-07-12T13:05:13,2026-07-12 13:20:46.027636,https://www.timesofisrael.com/?p=3859615
"Lindsey Graham, pro-Israel Trump confidant in the Senate, dies suddenly at 71","(JTA) — Sen. Lindsey Graham, a Republican from South Carolina who has been one of Israel’s staunchest supporters in Congress, has died at 71. Graham’s office announced his death in a statement early Sunday morning, saying that he had died late Saturday after “a brief and sudden illness.” Graham had returned from Ukraine, where he... The post Lindsey Graham, pro-Israel Trump confidant in the Senate, dies suddenly at 71 appeared first on The Forward .",https://forward.com/fast-forward/837572/lindsey-graham-pro-israel-trump-confidant-in-the-senate-dies-suddenly-at-71/,The Forward,JTA Staff,2026-07-12T12:48:27,2026-07-12 13:20:43.921377,https://forward.com/?p=837572
Likud officials fear Netanyahu push for power over party's slate,"According to senior party officials, Likud primaries could be scrapped and the current Knesset slate retained if both proposed frameworks for selecting candidates face opposition. In that scenario, they said, the prime minister could place candidates in reserved slots",https://www.haaretz.com/israel-news/elections/2026-07-12/ty-article/.premium/likud-members-fear-netanyahus-push-for-influence-on-partys-makeup/0000019f-55cb-d6c0-a9df-dddfcf560000,Haaretz,Michael Hauser Tov,2026-07-12T11:12:11,2026-07-12 12:00:26.867587,https://www.haaretz.com/israel-news/elections/2026-07-12/ty-article/.premium/likud-members-fear-netanyahus-push-for-influence-on-partys-makeup/0000019f-55cb-d6c0-a9df-dddfcf560000
The missing Palestinian debate: why can't we talk about our collective trauma?,The silence became the story: There is little space for public conversations about the wars and their lingering traumas among Palestinian citizens of Israel and other minorities. The most painful questions remain unspoken,https://www.haaretz.com/opinion/2026-07-12/ty-article-opinion/.premium/the-missing-palestinian-debate-why-cant-we-talk-about-our-collective-trauma/0000019f-1937-dc51-afbf-db7793be0000,Haaretz,Sheren Falah Saab,2026-07-12T11:23:00,2026-07-12 12:00:26.867552,https://www.haaretz.com/opinion/2026-07-12/ty-article-opinion/.premium/the-missing-palestinian-debate-why-cant-we-talk-about-our-collective-trauma/0000019f-1937-dc51-afbf-db7793be0000
"PM Netanyahu, Israeli officials mourn longtime U.S. senator Lindsey Graham","Sen. Lindsey Graham, who passed away at the age of 71, was a known Iran hawk and supporter of the Netanyahu government, 'understood that the security of Israel and America are inseparable,' the PM wrote",https://www.haaretz.com/us-news/2026-07-12/ty-article/.premium/pm-netanyahu-israeli-officials-mourn-longtime-u-s-senator-lindsey-graham/0000019f-5606-d38b-afbf-5f1605390000,Haaretz,Liza Rozovsky,2026-07-12T11:48:11,2026-07-12 12:00:26.867490,https://www.haaretz.com/us-news/2026-07-12/ty-article/.premium/pm-netanyahu-israeli-officials-mourn-longtime-u-s-senator-lindsey-graham/0000019f-5606-d38b-afbf-5f1605390000
IDF declassifies first operational order of Second Lebanon War,"""The IDF is preparing for massive Katyusha rocket fire on the home front,"" the order reads.",https://www.jns.org/news/israel-news/idf-declassifies-first-operational-order-of-second-lebanon-war,JNS,JNS Staff,2026-07-12T11:14:09,2026-07-12 12:00:19.840137,https://www.jns.org/news/israel-news/idf-declassifies-first-operational-order-of-second-lebanon-war
IDF strikes Hezbollah terrorists transferring weapons in Southern Lebanon,"""Following the strike, secondary explosions were identified, confirming the presence of weapons,"" the military said.",https://www.jns.org/news/israel-news/idf-strikes-hezbollah-terrorists-transferring-weapons-in-southern-lebanon,JNS,JNS Staff,2026-07-12T11:35:00,2026-07-12 12:00:19.840105,https://www.jns.org/news/israel-news/idf-strikes-hezbollah-terrorists-transferring-weapons-in-southern-lebanon
"Israel’s leaders mourn passing of Lindsey Graham, ‘one of its greatest friends’","GOP senator lauded as American patriot, defender of free world and US-Israel relationship; Netanyahu said to consider attending funeral The post Israel&#8217;s leaders mourn passing of Lindsey Graham, &#8216;one of its greatest friends&#8217; appeared first on The Times of Israel .",https://www.timesofisrael.com/israels-leaders-mourn-passing-of-lindsey-graham-one-of-its-greatest-friends/,Times of Israel,,2026-07-12T10:39:53,2026-07-12 12:00:14.432359,https://www.timesofisrael.com/?p=3859531
"As two-state hopes fade, more Jews are open to a one-state future for the Middle East","Nearly half of Jews under 35 now support a binational state, a poll finds — reviving an idea seen by many as anti-Zionist heresy. -- The post As two-state hopes fade, more Jews are open to a one-state future for the Middle East appeared first on Jewish Telegraphic Agency .",https://www.jta.org/2026/07/12/ideas/as-two-state-hopes-fade-more-jews-are-open-to-a-one-state-future-for-the-middle-east,JTA,Andrew Silow-Carroll,2026-07-12T10:45:33,2026-07-12 12:00:09.479830,https://www.jta.org/?p=1904233
Hamas disarmament and Israeli withdrawal dominate Cairo talks on Gaza's future,"The two main stumbling blocks in the Egypt-mediated talks are Hamas' obligations to pay Gaza's civil servants and the group's disarmament. Palestinian sources say the first issue appears solvable, but no solution is in sight for the second as long as Israel remains in Gaza",https://www.haaretz.com/gaza/2026-07-12/ty-article/.premium/mediators-cite-progress-with-hamas-but-gaza-talks-remain-stuck-on-disarmament/0000019f-52ed-d9b4-abdf-dbed24620000,Haaretz,Liza Rozovsky,2026-07-12T08:26:58,2026-07-12 10:28:28.264201,https://www.haaretz.com/gaza/2026-07-12/ty-article/.premium/mediators-cite-progress-with-hamas-but-gaza-talks-remain-stuck-on-disarmament/0000019f-52ed-d9b4-abdf-dbed24620000
Israel Prison Service restricts Red Cross visits to Palestinian prisoners despite High Court ruling,"A month after the High Court struck down a blanket ban on visits placed after Hamas' October 7, 2023 attack, the Israel Prison Service introduced new rules hindering their implementation",https://www.haaretz.com/middle-east-news/palestinians/2026-07-12/ty-article/.premium/israel-restricts-red-cross-visits-to-palestinian-prisoners-despite-court-ruling/0000019f-5568-d6c0-a9df-ddff34110000,Haaretz,Chen Maanit,2026-07-12T09:57:13,2026-07-12 10:28:28.264168,https://www.haaretz.com/middle-east-news/palestinians/2026-07-12/ty-article/.premium/israel-restricts-red-cross-visits-to-palestinian-prisoners-despite-court-ruling/0000019f-5568-d6c0-a9df-ddff34110000
"The bad, the mad and the functional: Three ways of thinking about the Jew",What we call antisemitism is not a single phenomenon. The functional Jew is a figure the mind reaches for when it needs an object on which to test its own capacity to think. The question is why the mind so often needs a figure outside itself to bear what is unthinkable,https://www.haaretz.com/jewish/2026-07-12/ty-article-magazine/.premium/bad-mad-and-functional-three-ways-of-thinking-about-the-jew/0000019f-1938-d799-abdf-1d3d1d9d0000,Haaretz,Eran Rolnik,2026-07-12T10:25:49,2026-07-12 10:28:28.264125,https://www.haaretz.com/jewish/2026-07-12/ty-article-magazine/.premium/bad-mad-and-functional-three-ways-of-thinking-about-the-jew/0000019f-1938-d799-abdf-1d3d1d9d0000
'Israel has lost one of its greatest friends': Netanyahu mourns Lindsey Graham,"""I have lost a beloved friend,"" said the Israeli premier.",https://www.jns.org/news/israel-news/israel-has-lost-one-of-its-greatest-friends-netanyahu-mourns-lindsey-graham,JNS,JNS Staff,2026-07-12T08:28:30,2026-07-12 10:28:21.704697,https://www.jns.org/news/israel-news/israel-has-lost-one-of-its-greatest-friends-netanyahu-mourns-lindsey-graham
Mojtaba Khamenei vows to avenge father's killing,"Those responsible ""will carry their dream of a peaceful death in bed to the grave,"" the supreme leader warned.",https://www.jns.org/news/world/mojtaba-khamenei-vows-to-avenge-fathers-killing,JNS,,2026-07-12T08:42:00,2026-07-12 10:28:21.704672,https://www.jns.org/news/world/mojtaba-khamenei-vows-to-avenge-fathers-killing
From despair to hope: Mideast moderation,"First, I encountered Muslim antisemitism, and then, a Muslim cleric who unequivocally rejects it.",https://www.jns.org/opinion/rabbi-stuart-weinblatt/from-despair-to-hope-mideast-moderation,JNS,Rabbi Stuart Weinblatt,2026-07-12T09:05:00,2026-07-12 10:28:21.704642,https://www.jns.org/opinion/rabbi-stuart-weinblatt/from-despair-to-hope-mideast-moderation
Technical glitch triggers false missile warning in central Israel,"The military stressed that there was no suspicion of an attack, and the incident is being reviewed.",https://www.jns.org/news/israel-news/technical-glitch-triggers-false-missile-warning-in-central-israel,JNS,TPS-IL Staff,2026-07-12T09:05:56,2026-07-12 10:28:21.704616,https://www.jns.org/news/israel-news/technical-glitch-triggers-false-missile-warning-in-central-israel
Israeli gov't votes to extend nationwide emergency measures through July 28,"The resolution does not affect Israeli civilians directly, but enables the IDF to quickly decide on new restrictions.",https://www.jns.org/news/israel-news/israeli-govt-votes-to-extend-nationwide-emergency-measures-through-july-28,JNS,JNS Staff,2026-07-12T09:40:37,2026-07-12 10:28:21.704580,https://www.jns.org/news/israel-news/israeli-govt-votes-to-extend-nationwide-emergency-measures-through-july-28
Qatar’s transformative former ruler Sheikh Hamad bin Khalifa Al Thani dies at 74,"State news agency gives no cause for passing of sports-loving leader who made tiny Persian Gulf nation a global player in diplomacy, media and investment, then handed over power to son The post Qatar&#8217;s transformative former ruler Sheikh Hamad bin Khalifa Al Thani dies at 74 appeared first on The Times of Israel .",https://www.timesofisrael.com/qatars-transformative-former-ruler-sheikh-hamad-bin-khalifa-al-thani-dies-at-74/,Times of Israel,,2026-07-12T09:01:24,2026-07-12 10:28:17.333744,https://www.timesofisrael.com/?p=3859411
Netanyahu ordered Shin Bet chief to probe Channel 12 over Iran leak — report,"As agency seeks to investigate network for having prior knowledge of opening strikes on Iran, pro-government Channel 14 journalists also accused of hinting at other operations in advance The post Netanyahu ordered Shin Bet chief to probe Channel 12 over Iran leak &#8212; report appeared first on The Times of Israel .",https://www.timesofisrael.com/netanyahu-ordered-shin-bet-chief-to-probe-channel-12-over-iran-leak-report/,Times of Israel,,2026-07-12T09:38:10,2026-07-12 10:28:17.333704,https://www.timesofisrael.com/?p=3859439
Daily Briefing July 12 – IDF on standby to rejoin Iran fight,"Military correspondent Emanuel Fabian on the military's limited role in keeping peace in the West Bank, an imminent drawdown from southern Lebanon, and an uptick in picking off Hamas commanders The post Daily Briefing July 12 &#8211; IDF on standby to rejoin Iran fight appeared first on The Times of Israel .",https://www.timesofisrael.com/daily-briefing-july-12-idf-on-standby-to-rejoin-iran-fight/,Times of Israel,,2026-07-12T09:39:07,2026-07-12 10:28:17.333664,https://www.timesofisrael.com/?p=3859482&preview=true&preview_id=3859482
“You are going to war. I don’t know whether you will return.” - Sponsored Content,"After surviving the battlefield, Eitan faced a new fight at home. Read how one wounded veteran finally found justice, and why thousands still need your help. The post &#8220;You are going to war. I don’t know whether you will return.&#8221; appeared first on The Times of Israel .",https://www.timesofisrael.com/spotlight/you-are-going-to-war-i-dont-know-whether-you-will-return/,Times of Israel,,2026-07-12T09:57:48,2026-07-12 10:28:17.333577,https://www.timesofisrael.com/?post_type=spotlight&p=3859557
"Sen. Lindsey Graham, outspoken backer of US-Israel relationship, dies at 71","Longtime Republican lawmaker helped shape Trump's foreign policy on Iran and regularly visited Israel; Netanyahu sends condolences, saying state 'lost one of its greatest friends' The post Sen. Lindsey Graham, outspoken backer of US-Israel relationship, dies at 71 appeared first on The Times of Israel .",https://www.timesofisrael.com/sen-lindsey-graham-outspoken-backer-of-us-israel-relationship-dies-at-71/,Times of Israel,,2026-07-12T10:03:41,2026-07-12 10:28:17.333522,https://www.timesofisrael.com/?p=3859480
"Top GOP senator Lindsey Graham dies at 71 after sudden illness, office announces","Graham passed away at the age of 71 on Saturday, according to his office. The South Carolina senator was often viewed as a close Trump ally and a supporter of Israel, who had been vocal about his support for the U.S. and Israel's war in Iran and efforts to bring about regime change in Iran",https://www.haaretz.com/us-news/2026-07-12/ty-article/.premium/top-gop-senator-lindsey-graham-dies-at-71-after-sudden-illness-office-announces/0000019f-54fa-d7c8-a3df-5ffe29530000,Haaretz,Haaretz,2026-07-12T06:28:38,2026-07-12 08:29:28.678114,https://www.haaretz.com/us-news/2026-07-12/ty-article/.premium/top-gop-senator-lindsey-graham-dies-at-71-after-sudden-illness-office-announces/0000019f-54fa-d7c8-a3df-5ffe29530000
