title,description,link,source,author,published,scraped_at,guid
IDF chief warned Netanyahu gov't months ago: Hezbollah rearming faster than expected,"IDF officials noted that, while Israeli and Lebanese operations slowed Hezbollah's rebuilding, they were not moving the group toward disarmament, and proposed a targeted strike – which political leadership rejected",https://www.haaretz.com/israel-news/israel-security/2026-03-19/ty-article/.premium/idf-chief-warned-govt-months-ago-hezbollah-rearming-faster-than-expected/0000019d-028c-d088-a5fd-b28dd5cb0000,Haaretz,Michael Hauser Tov,2026-03-19T04:00:08,2026-03-19 04:47:01.202153,https://www.haaretz.com/israel-news/israel-security/2026-03-19/ty-article/.premium/idf-chief-warned-govt-months-ago-hezbollah-rearming-faster-than-expected/0000019d-028c-d088-a5fd-b28dd5cb0000
"U.S. and Israel raise the stakes, hoping to push Iran to breaking point","While Trump acts as if he has all the time in the world, it's important to end the war before Israelis and the Gulf states run out of patience - and interceptors",https://www.haaretz.com/israel-news/israel-security/2026-03-19/ty-article/.premium/u-s-and-israel-raise-the-stakes-hoping-to-push-iran-to-breaking-point/0000019d-0367-d088-a5fd-b36f40fd0000,Haaretz,Amos Harel,2026-03-19T04:00:40,2026-03-19 04:47:01.202109,https://www.haaretz.com/israel-news/israel-security/2026-03-19/ty-article/.premium/u-s-and-israel-raise-the-stakes-hoping-to-push-iran-to-breaking-point/0000019d-0367-d088-a5fd-b36f40fd0000
Kuwait says 10 Hezbollah operatives nabbed for alleged plot to attack ‘vital installations’,Announcement marks second time this week that the Gulf state has arrested a cell affiliated with the Iran-backed Lebanese terror group The post Kuwait says 10 Hezbollah operatives nabbed for alleged plot to attack ‘vital installations’ appeared first on The Times of Israel .,https://www.timesofisrael.com/kuwait-says-10-hezbollah-operatives-nabbed-for-alleged-plot-to-attack-vital-installations/,Times of Israel,,2026-03-19T03:50:09,2026-03-19 04:46:49.871390,https://www.timesofisrael.com/?p=3781760
"Despite war, Israel ranks 8th in global happiness survey, same as last year","Findings reflect overall satisfaction with society and life, says Bar-Ilan University researcher Anat Fanti, but concurrent rise in distress levels also show psychological cost of conflict The post Despite war, Israel ranks 8th in global happiness survey, same as last year appeared first on The Times of Israel .",https://www.timesofisrael.com/despite-war-israel-ranks-8th-in-global-happiness-survey-same-as-last-year/,Times of Israel,,2026-03-19T04:02:07,2026-03-19 04:46:49.871333,https://www.timesofisrael.com/?p=3781198
"Iranian cluster bombs kill foreign worker in central Israel, 3 West Bank Palestinians","Two women and girl killed near Hebron are first Palestinian casualties of Iran war; Hezbollah fires at Gaza border area, in apparent first since renewing attacks on Israel from Lebanon The post Iranian cluster bombs kill foreign worker in central Israel, 3 West Bank Palestinians appeared first on The Times of Israel .",https://www.timesofisrael.com/iranian-cluster-bombs-kill-foreign-worker-in-central-israel-3-west-bank-palestinians/,Times of Israel,,2026-03-19T01:46:47,2026-03-19 03:13:13.056512,https://www.timesofisrael.com/?post_type=liveblog_entry&p=3781682
Trump: Israel won’t again strike Iranian gas field but US will if Qatari energy sites attacked,Qatar reports ‘extensive’ damage at its main LNG hub as Iran keeps up attacks on Gulf states * Kuwait announces arrest of 10 Hezbollah operatives for alleged plot to attack ‘vital installations’ The post Trump: Israel won&#8217;t again strike Iranian gas field but US will if Qatari energy sites attacked appeared first on The Times of Israel .,https://www.timesofisrael.com/liveblog-march-19-2026/,Times of Israel,,2026-03-19T02:10:08,2026-03-19 03:13:13.056458,https://www.timesofisrael.com/?p=3781741
Trump official who quit over Iran war: U.S. could have threatened Israel aid to prevent unilateral attack,"Joe Kent, who stepped down as director of the National Counterterrorism Center, told Tucker Carlson the U.S. should have used military aid as leverage to block Israel's offensive and questioned the influence of pro-Israel lobbyists on America First policy",https://www.haaretz.com/us-news/2026-03-19/ty-article/.premium/joe-kent-u-s-could-have-threatened-israel-aid-to-prevent-unilateral-attack/0000019d-03a5-d088-a5fd-b3ad3d2c0000,Haaretz,Ben Samuels,2026-03-19T01:28:44,2026-03-19 01:43:10.929154,https://www.haaretz.com/us-news/2026-03-19/ty-article/.premium/joe-kent-u-s-could-have-threatened-israel-aid-to-prevent-unilateral-attack/0000019d-03a5-d088-a5fd-b3ad3d2c0000
Transmitting Something Real from Generation to Generation,Between memory and motion lies the work every tradition must perform. The post Transmitting Something Real from Generation to Generation appeared first on Jewish Journal .,https://jewishjournal.com/judaism/387646/transmitting-something-real-from-generation-to-generation/,Jewish Journal,Samuel J. Abrams,2026-03-19T01:12:03,2026-03-19 01:43:01.813671,https://jewishjournal.com/?p=387646
"US intel official: Iran regime is marred but intact, will seek to rebuild if it survives","Gabbard tells lawmakers Iran didn't reconstitute 'obliterated' nuclear program after June strikes, contradicting Trump, who cited Tehran's efforts to do so as a justification for the war The post US intel official: Iran regime is marred but intact, will seek to rebuild if it survives appeared first on The Times of Israel .",https://www.timesofisrael.com/us-intel-official-iran-regime-is-marred-but-intact-will-seek-to-rebuild-if-it-survives/,Times of Israel,,2026-03-19T01:16:45,2026-03-19 01:42:59.178032,https://www.timesofisrael.com/?p=3781600
Longing for the way secular Jews used to be,"איך זיץ דאָ און הער זיך צו צום קול פֿון מײַן פֿעטער יונה ז״ל ווי ער ריכט אָפּ דעם פּסח־סדר אינעם יאָר 1962… און איך קוועל דערפֿון. יונה גאָטעסמאַן איז געווען אַ סעקולערער ייִד, אָדער ווי מע פֿלעג עס רופֿן אין יענע יאָרן — אַ וועלטלעכער. ער האָט נישט געהיט שבת אָדער כּשרות, און טאַקע... The post Longing for the way secular Jews used to be appeared first on The Forward .",https://forward.com/yiddish/813589/longing-for-the-way-secular-jews-used-to-be/,The Forward,שׂרה־רחל שעכטער,2026-03-19T01:14:15,2026-03-19 01:42:57.030865,https://forward.com/?p=813589
"Iranian barrages kill at least four Palestinians in West Bank, one man in Israel, emergency services say","The strike on the West Bank town of Beit Awa, near Hebron, also wounded six other women, the Red Crescent said. Emergency services reported that one foreign worker was killed in central Israel, while several others were lightly wounded in the Arab town of Jaljulya and Tel Aviv",https://www.haaretz.com/west-bank/2026-03-19/ty-article/.premium/iranian-barrages-kill-at-least-four-palestinians-in-west-bank-one-man-in-israel/0000019d-02e2-da5c-a3bd-0ee231080000,Haaretz,Jack Khoury,2026-03-18T23:24:04,2026-03-19 00:50:38.970304,https://www.haaretz.com/west-bank/2026-03-19/ty-article/.premium/iranian-barrages-kill-at-least-four-palestinians-in-west-bank-one-man-in-israel/0000019d-02e2-da5c-a3bd-0ee231080000
Trump administration considers deploying thousands more U.S. troops to Middle East,Options include securing Strait of Hormuz and Kharg Island - although deployment of ground forces would anger parts of Trump's base,https://www.haaretz.com/israel-news/israel-security/2026-03-19/ty-article/trump-administration-considers-deploying-thousands-more-u-s-troops-to-mideast/0000019d-035b-d46f-affd-93dfa3ed0000,Haaretz,Reuters,2026-03-19T00:04:47,2026-03-19 00:50:38.970263,https://www.haaretz.com/israel-news/israel-security/2026-03-19/ty-article/trump-administration-considers-deploying-thousands-more-u-s-troops-to-mideast/0000019d-035b-d46f-affd-93dfa3ed0000
"‘Somebody came into my house to shoot my babies’: Temple Israel, Federation call for federal security measures after attack","“This could have been the greatest terrorist tragedy in America since 9/11,” Eric Fingerhut, president and CEO of the Jewish Federations of North America, told JNS.",https://www.jns.org/news/u-s-news/somebody-came-into-my-house-to-shoot-my-babies-temple-israel-federation-call-for-federal-security-measures-after-attack,JNS,Andrew Bernard,2026-03-18T23:29:05,2026-03-19 00:50:28.381095,https://www.jns.org/news/u-s-news/somebody-came-into-my-house-to-shoot-my-babies-temple-israel-federation-call-for-federal-security-measures-after-attack
"Yes, It’s Anti-Semitism","The anti-hyphen warriors claim to be merely calling out a hate movement. The post Yes, It&#8217;s Anti-Semitism appeared first on Jewish Journal .",https://jewishjournal.com/commentary/columnist/387635/yes-its-anti-semitism/,Jewish Journal,Karen Lehrman Bloch,2026-03-18T23:19:51,2026-03-19 00:50:26.010978,https://jewishjournal.com/?p=387635
How Can Empathy Be Bad?,"A number of philosophers, psychologists and other commentators have argued that empathy can actually be harmful. The post How Can Empathy Be Bad? appeared first on Jewish Journal .",https://jewishjournal.com/commentary/opinion/387638/how-can-empathy-be-bad/,Jewish Journal,Gary Saul Morson and Morton Schapiro,2026-03-18T23:25:42,2026-03-19 00:50:26.010947,https://jewishjournal.com/?p=387638
Respecting Both Tradition and Equality at the Kotel,"The Kotel does not belong to one denomination or one interpretation of Judaism. It belongs to the Jewish people, in Israel, in the Diaspora, across all movements, backgrounds and traditions. The post Respecting Both Tradition and Equality at the Kotel appeared first on Jewish Journal .",https://jewishjournal.com/commentary/opinion/387640/respecting-both-tradition-and-equality-at-the-kotel/,Jewish Journal,Rabbi Yoshi Zweiback,2026-03-18T23:58:11,2026-03-19 00:50:26.010915,https://jewishjournal.com/?p=387640
Rosner’s Domain | Operation Chronic Disease,"Will the war against Iran turn from a one-time, life-saving surgical operation into ongoing treatment for a chronic disease? The post Rosner&#8217;s Domain | Operation Chronic Disease appeared first on Jewish Journal .",https://jewishjournal.com/rosnersdomain/387642/operation-chronic-disease/,Jewish Journal,Shmuel Rosner,2026-03-19T00:42:33,2026-03-19 00:50:26.010874,https://jewishjournal.com/?p=387642
"IDF chief: Settler violence ‘unacceptable,’ results in ‘extraordinary strategic damage’","After settlers rampage in Palestinian village following razing of outpost, Zamir and Bennett condemn attack, maintain that the perpetrators don't represent most settlers The post IDF chief: Settler violence &#8216;unacceptable,&#8217; results in &#8216;extraordinary strategic damage&#8217; appeared first on The Times of Israel .",https://www.timesofisrael.com/idf-chief-settler-violence-unacceptable-results-in-extraordinary-strategic-damage/,Times of Israel,,2026-03-18T23:05:59,2026-03-19 00:50:23.213744,https://www.timesofisrael.com/?p=3781644
Israel said threatening Iranian officers on the phone as part of efforts to stir unrest,"Mossad agent tells senior cop he's on a 'blacklist,' augurs his demise in taped call obtained by WSJ, as Israel hopes crippling of domestic security forces will help lead to uprising The post Israel said threatening Iranian officers on the phone as part of efforts to stir unrest appeared first on The Times of Israel .",https://www.timesofisrael.com/israel-said-threatening-iranian-officers-on-the-phone-as-part-of-efforts-to-stir-unrest/,Times of Israel,,2026-03-18T23:45:07,2026-03-19 00:50:23.213693,https://www.timesofisrael.com/?p=3781540
Disposable labor: Israel fails those it calls 'essential',"The irrelevance of life-saving safety instructions issued by the Home Front Command to tens of thousands of workers in construction, agriculture and home care reflects a policy that prioritizes the interests of employers and the government, which define these workers as ""essential"" without ensuring their personal safety",https://www.haaretz.com/opinion/editorial/2026-03-19/ty-article-opinion/disposable-labor-israel-fails-those-it-calls-essential/0000019d-02ae-d088-a5fd-b2af3f1d0000,Haaretz,Haaretz Editorial,2026-03-18T22:36:03,2026-03-18 23:15:25.386666,https://www.haaretz.com/opinion/editorial/2026-03-19/ty-article-opinion/disposable-labor-israel-fails-those-it-calls-essential/0000019d-02ae-d088-a5fd-b2af3f1d0000
Arab-Israeli Journalist Lucy Aharish honored by ADL amid far-right harassment campaign against her,"Aharish was awarded the Anti-Defamation League's Abraham Award for her efforts to promote unity and fight antisemitism, weeks after facing harassment from pro-Netanyahu government agitators outside her home",https://www.haaretz.com/israel-news/2026-03-19/ty-article/.premium/arab-israeli-journalist-lucy-aharish-honored-by-adl-amid-far-right-harassment/0000019d-0270-da5c-a3bd-0e7255db0000,Haaretz,Etan Nechin,2026-03-18T22:49:03,2026-03-18 23:15:25.386631,https://www.haaretz.com/israel-news/2026-03-19/ty-article/.premium/arab-israeli-journalist-lucy-aharish-honored-by-adl-amid-far-right-harassment/0000019d-0270-da5c-a3bd-0e7255db0000
The Israeli consensus: Living without a war is bad,,https://www.haaretz.com/opinion/2026-03-19/ty-article-opinion/.premium/the-israeli-consensus-living-without-a-war-is-bad/0000019d-0215-d088-a5fd-b21da1370000,Haaretz,Uri Misgav,2026-03-18T23:01:06,2026-03-18 23:15:25.386597,https://www.haaretz.com/opinion/2026-03-19/ty-article-opinion/.premium/the-israeli-consensus-living-without-a-war-is-bad/0000019d-0215-d088-a5fd-b21da1370000
Netanyahu the mafia boss takes pride in what he ought to be ashamed of,,https://www.haaretz.com/opinion/2026-03-19/ty-article-opinion/.premium/netanyahu-the-mafia-boss-takes-pride-in-what-he-ought-to-be-ashamed-of/0000019d-0215-d46f-affd-929f90770000,Haaretz,Gideon Levy,2026-03-18T23:05:44,2026-03-18 23:15:25.386570,https://www.haaretz.com/opinion/2026-03-19/ty-article-opinion/.premium/netanyahu-the-mafia-boss-takes-pride-in-what-he-ought-to-be-ashamed-of/0000019d-0215-d46f-affd-929f90770000
"Israeli prosecutors reject plea deal for prime suspect in Bibileaks, Qatargate cases",Urich expressed his willingness to admit to lesser charges than the ones attributed to him and do community service. Senior prosecutors believe that such a penalty is insufficient and that there is a reasonable chance for conviction on graver charges,https://www.haaretz.com/israel-news/israel-politics/2026-03-19/ty-article/.premium/israeli-prosecutors-reject-plea-deal-for-suspect-in-bibileaks-qatargate-cases/0000019d-0213-d65b-abfd-935f558d0000,Haaretz,Gidi Weitz,2026-03-18T23:12:27,2026-03-18 23:15:25.386535,https://www.haaretz.com/israel-news/israel-politics/2026-03-19/ty-article/.premium/israeli-prosecutors-reject-plea-deal-for-suspect-in-bibileaks-qatargate-cases/0000019d-0213-d65b-abfd-935f558d0000
All six anti-Israel candidates seen as potential ‘Squad’ members lose Illinois primaries,"The outcomes of the primaries show that “being pro-America, pro-Israel is good policy and good politics,” the Republican Jewish Coalition told JNS.",https://www.jns.org/news/u-s-news/all-six-anti-israel-candidates-seen-as-potential-squad-members-lose-illinois-primaries,JNS,Jessica Russak-Hoffman,2026-03-18T22:55:10,2026-03-18 23:15:17.252386,https://www.jns.org/news/u-s-news/all-six-anti-israel-candidates-seen-as-potential-squad-members-lose-illinois-primaries
Shrinking Center Hurting Jews,"Too many voices on both the left and the right disparage Israel for how its military has been deployed in Gaza, without raising similar questions about Hamas’ terrorism, which began and continues the war. The post Shrinking Center Hurting Jews appeared first on Jewish Journal .",https://jewishjournal.com/commentary/columnist/387630/shrinking-center-hurting-jews/,Jewish Journal,Dan Schnur,2026-03-18T22:55:07,2026-03-18 23:15:15.098679,https://jewishjournal.com/?p=387630
It’s Time to Tell Your Family Legacy Story,"I encourage you to document the stories of your parents, grandparents, and older loved ones. I wish I’d had the opportunity to sit down with my grandparents and do this. The post It&#8217;s Time to Tell Your Family Legacy Story appeared first on Jewish Journal .",https://jewishjournal.com/commentary/columnist/387633/its-time-to-tell-your-family-legacy-story/,Jewish Journal,Kylie Ora Lobell,2026-03-18T22:57:52,2026-03-18 23:15:15.098633,https://jewishjournal.com/?p=387633
Don’t pass over them this Pesach - Sponsored Content,Ensure Israel’s most vulnerable can celebrate the holiday with dignity and joy. Join the Jaffa Institute’s Pesach food package drive. The post Don’t pass over them this Pesach appeared first on The Times of Israel .,https://www.timesofisrael.com/spotlight/dont-pass-over-them-this-pesach-2/,Times of Israel,,2026-03-18T22:08:25,2026-03-18 23:15:12.223391,https://www.timesofisrael.com/?post_type=spotlight&p=3781658
Haaretz Cartoon,,https://www.haaretz.com/opinion/daily-cartoon/2026-03-18/ty-article-opinion/haaretz-cartoon/0000019d-02cd-df92-a9df-ebcd08100000,Haaretz,Amos Biderman,2026-03-18T21:34:23,2026-03-18 22:16:12.943133,https://www.haaretz.com/opinion/daily-cartoon/2026-03-18/ty-article-opinion/haaretz-cartoon/0000019d-02cd-df92-a9df-ebcd08100000
Only the shelves remain: Inside a shattered Tel Aviv wine bar,"After hip locale Flor suffered a hit at the start of the war, its owners aren't waiting for government help as they strive to rebuild the minimalist mood that's as much Paris as Tel Aviv",https://www.haaretz.com/food/2026-03-19/ty-article-magazine/.premium/only-the-shelves-remain-inside-a-shattered-tel-aviv-wine-bar/0000019d-0082-df92-a9df-e9c2c14a0000,Haaretz,Mor Daniel,2026-03-18T22:05:15,2026-03-18 22:16:12.943101,https://www.haaretz.com/food/2026-03-19/ty-article-magazine/.premium/only-the-shelves-remain-inside-a-shattered-tel-aviv-wine-bar/0000019d-0082-df92-a9df-e9c2c14a0000
"Iran War Increases Threat to Sweden, Security Service Says","Sweden&#8216;s Security Service (SAPO) warned on Wednesday of increased threats to the Nordic nation from the war in Iran, including risks to Jewish targets, as it released its...",https://www.algemeiner.com/2026/03/18/iran-war-increases-threat-sweden-security-service-says/,Algemeiner,Reuters and Algemeiner Staff,2026-03-18T21:20:46,2026-03-18 22:16:08.438074,https://www.algemeiner.com/?p=768221
Passenger limits reimposed on outbound flights after private jets hit by missile debris,"El Al cancels all non-repatriation flights until March 27 as US airlines Delta and United extend suspensions until May, June as Iran war seems set to drag on The post Passenger limits reimposed on outbound flights after private jets hit by missile debris appeared first on The Times of Israel .",https://www.timesofisrael.com/passenger-limits-reimposed-on-outbound-flights-after-private-jets-hit-by-missile-debris/,Times of Israel,,2026-03-18T21:21:25,2026-03-18 22:16:00.839768,https://www.timesofisrael.com/?p=3781555
"‘Patently Antisemitic’: US Counterterror Chief Quits, Under Fire for Claiming Israel Tricked Trump Into Iran War","Joe Kent, head of the US National Counterterrorism Center who had ties to white nationalist figures, stepped down on Tuesday...",https://www.algemeiner.com/2026/03/18/patently-antisemitic-us-counterterror-chief-quits-under-fire-claiming-israel-tricked-trump-iran-war/,Algemeiner,Debbie Weiss,2026-03-18T20:31:46,2026-03-18 21:18:17.171059,https://www.algemeiner.com/?p=768206
"Israel Ramps Up Strikes on Iran’s Leadership, Repression Apparatus","Israel has intensified a sweeping campaign targeting Iran&#8217;s leadership and internal security machinery, in what officials say is a bid...",https://www.algemeiner.com/2026/03/18/israel-ramps-up-strikes-irans-leadership-repression-apparatus/,Algemeiner,Ailin Vilches Arguello,2026-03-18T20:59:36,2026-03-18 21:18:17.171022,https://www.algemeiner.com/?p=768203
Syria Unveils Plan to Eliminate Assad’s Chemical Weapons,Syria on Wednesday launched a plan supported by Washington to rid the Middle Eastern country of legacy chemical weapons that were used against its people by...,https://www.algemeiner.com/2026/03/18/syria-unveils-plan-eliminate-assads-chemical-weapons/,Algemeiner,Reuters and Algemeiner Staff,2026-03-18T21:09:31,2026-03-18 21:18:17.170992,https://www.algemeiner.com/?p=768214
"Israel Doubles Troops in Hezbollah Fight, Searches Homes in South Lebanon",Israel has more than doubled the number of troops along its border with Lebanon since March 1 and they are searching homes in southern Lebanese villages that...,https://www.algemeiner.com/2026/03/18/israel-doubles-troops-hezbollah-fight-searches-homes-south-lebanon/,Algemeiner,Reuters and Algemeiner Staff,2026-03-18T21:15:40,2026-03-18 21:18:17.170957,https://www.algemeiner.com/?p=768219
California GOP memo warns of ‘America First’ extremist faction,The memo calls on the party to be aware of “the strategic goal of groypers across the nation” to take over the Republican party from within.,https://www.jns.org/news/u-s-news/california-gop-memo-warns-of-america-first-extremist-faction,JNS,Jessica Russak-Hoffman,2026-03-18T20:25:13,2026-03-18 21:18:14.886875,https://www.jns.org/news/u-s-news/california-gop-memo-warns-of-america-first-extremist-faction
"Estonia is ready to discuss Hormuz mission with US, foreign minister tells TOI","In Israel to discuss growing defense ties, Margus Tsahkna says that his country firmly backs the war against Iran, praises the spirit of the Israeli people The post Estonia is ready to discuss Hormuz mission with US, foreign minister tells TOI appeared first on The Times of Israel .",https://www.timesofisrael.com/estonia-is-ready-to-discuss-hormuz-mission-with-us-foreign-minister-tells-toi/,Times of Israel,,2026-03-18T20:21:39,2026-03-18 21:18:10.289839,https://www.timesofisrael.com/?p=3780264
"Amid claims of looming interceptor shortage, experts dismiss alarm over finite defenses","Reports of Jerusalem running low on air defense munitions fuel concern, but experts say modern wars inevitably drain stockpiles -- and Israel likely planned for it The post Amid claims of looming interceptor shortage, experts dismiss alarm over finite defenses appeared first on The Times of Israel .",https://www.timesofisrael.com/amid-claims-of-looming-interceptor-shortage-experts-dismiss-alarm-over-finite-defenses/,Times of Israel,,2026-03-18T20:35:25,2026-03-18 21:18:10.289794,https://www.timesofisrael.com/?p=3779218
Rabbi Sharon Brous: We must ‘rehumanize’ each other,"Rabbi Sharon Brous has spent much of her career asking a deceptively simple question: How do we keep our humanity in a world that often pushes us toward isolation, fear [&#8230;]",https://jweekly.com/2026/03/18/rabbi-sharon-brous-we-must-rehumanize-each-other-in-an-inhumane-world/,J. Weekly,Lea Loeb,2026-03-18T20:34:15,2026-03-18 21:18:01.053452,https://jweekly.com/?p=301253
"IDF chief condemns settler violence, calls on Israeli authorities to combat it","IDF Chief of Staff Zamir said settler violence causes strategic damage, but claimed those responsible are a minority who do not represent the settlement movement. Seven Palestinians have been killed in settler attacks since the beginning of the month",https://www.haaretz.com/west-bank/2026-03-18/ty-article/.premium/idf-chief-condemns-settler-violence-calls-on-israeli-authorities-to-combat-it/0000019d-01e3-d66c-ad9d-8de384710000,Haaretz,Yaniv Kubovich,2026-03-18T19:40:13,2026-03-18 20:19:43.326148,https://www.haaretz.com/west-bank/2026-03-18/ty-article/.premium/idf-chief-condemns-settler-violence-calls-on-israeli-authorities-to-combat-it/0000019d-01e3-d66c-ad9d-8de384710000
"Emirati official: Iran's attacks on Gulf states will strengthen ties with Israel, U.S.","Anwar Gargash, the senior political adviser to the president of the United Arab Emirates, estimated that Iran would take Israel's place as the biggest threat to Gulf states. He also announced that his country is prepared to participate in a U.S.-led international effort to secure the Strait of Hormuz",https://www.haaretz.com/middle-east-news/2026-03-18/ty-article/.premium/emirati-official-irans-attacks-on-gulf-will-strengthen-ties-with-israeli-u-s/0000019d-00e4-d17b-adff-3cf76bc80000,Haaretz,Liza Rozovsky,2026-03-18T20:18:50,2026-03-18 20:19:43.326111,https://www.haaretz.com/middle-east-news/2026-03-18/ty-article/.premium/emirati-official-irans-attacks-on-gulf-will-strengthen-ties-with-israeli-u-s/0000019d-00e4-d17b-adff-3cf76bc80000
Netanyahu: IDF ‘watching from above’ as Persians celebrate new year,"Israeli Air Force strikes on the Iranian regime are ""meant to enable the brave people of Iran to celebrate the Festival of Fire,"" Netanyahu said.",https://www.jns.org/israel-news/netanyahu-idf-watching-from-above-as-persians-celebrate-new-year,JNS,Akiva Van Koningsveld,2026-03-18T07:48:00,2026-03-18 20:19:35.267399,https://www.jns.org/israel-news/netanyahu-idf-watching-from-above-as-persians-celebrate-new-year
IAF strikes ‘foundations of Iranian terror regime’ across Tehran,Among the targeted infrastructures were the Islamic Revolutionary Guard Corps headquarters responsible for repressing anti-regime protests.,https://www.jns.org/israel-news/iaf-strikes-foundations-of-iranian-terror-regime-across-tehran,JNS,JNS Staff,2026-03-18T08:24:00,2026-03-18 20:19:35.267372,https://www.jns.org/israel-news/iaf-strikes-foundations-of-iranian-terror-regime-across-tehran
