title,description,link,source,author,published,scraped_at,guid
Trump Says Iran Deal Averted ‘Economic Catastrophe’ but Says He Could Still Restart War,"US President Donald Trump on Wednesday defended his interim agreement with Iran, saying it had averted a global economic catastrophe, while warning he could launch fresh attacks...",https://www.algemeiner.com/2026/06/17/trump-says-iran-deal-averted-economic-catastrophe-says-could-restart-war/,Algemeiner,Reuters and Algemeiner Staff,2026-06-17T18:45:19,2026-06-17 19:02:21.432595,https://www.algemeiner.com/?p=774692
Senior US official reveals text of Iran MOU for first time,"A senior U.S. official read aloud the text of the Trump administration’s deal with Iran in a call with reporters, revealing the full text for the first time.",https://www.jns.org/news/u-s-news/senior-us-official-reveals-text-of-iran-mou-for-first-time,JNS,Andrew Bernard,2026-06-17T17:57:38,2026-06-17 19:02:18.712742,https://www.jns.org/news/u-s-news/senior-us-official-reveals-text-of-iran-mou-for-first-time
The warning on the table for 30 years now,"Why has it taken so long to respond to antisemitism in America, and what has that delay cost?",https://www.jns.org/opinion/melissa-brodsky/the-warning-on-the-table-for-30-years-now,JNS,Melissa Brodsky,2026-06-17T18:15:00,2026-06-17 19:02:18.712710,https://www.jns.org/opinion/melissa-brodsky/the-warning-on-the-table-for-30-years-now
In full comptrol: Why Netanyahu fought so hard over the state comptroller election,Critics of Michael Rabello's appointment argue Netanyahu's longtime lawyer and adviser may adopt a politically partisan approach over what he does and does not audit The post In full comptrol: Why Netanyahu fought so hard over the state comptroller election appeared first on The Times of Israel .,https://www.timesofisrael.com/in-full-comptrol-why-netanyahu-fought-so-hard-over-the-state-comptroller-election/,Times of Israel,,2026-06-17T18:14:21,2026-06-17 19:02:13.511763,https://www.timesofisrael.com/?p=3844889
Knesset grants Likud MK Gotliv immunity for exposing Shin Bet agent’s identity,Vote follows chaotic hearings in which coalition lawmakers rally behind firebrand colleague; opposition lawmakers decry move as 'disgrace' and 'slap in the face' to security forces The post Knesset grants Likud MK Gotliv immunity for exposing Shin Bet agent&#8217;s identity appeared first on The Times of Israel .,https://www.timesofisrael.com/knesset-grants-likud-mk-gotliv-immunity-for-exposing-shin-bet-agents-identity/,Times of Israel,,2026-06-17T18:39:03,2026-06-17 19:02:13.511727,https://www.timesofisrael.com/?post_type=liveblog_entry&p=3844995
North Americans are most likely to move to Israel in the summer. Here’s why.,A recent aliyah party in New Jersey sends off some 450 new immigrants in style. -- The post North Americans are most likely to move to Israel in the summer. Here&#8217;s why. appeared first on Jewish Telegraphic Agency .,https://www.jta.org/2026/06/17/israel/north-americans-are-most-likely-to-move-to-israel-in-the-summer-heres-why,JTA,Peter Ephross,2026-06-17T18:30:55,2026-06-17 19:02:08.841458,https://www.jta.org/?p=1903068
Vance leads a U.S. embrace of Iran. Israel and Netanyahu's allies are noticing,"In the Trump administration's early months, Vance bridged the GOP's foreign-policy divide. Now he's touting 'victory' in Iran, and his target has turned to Netanyahu",https://www.haaretz.com/us-news/2026-06-17/ty-article/.premium/vance-leads-a-u-s-embrace-of-iran-israel-and-netanyahus-allies-are-noticing/0000019e-d562-d27c-a39e-d5624f2b0000,Haaretz,Ben Samuels,2026-06-17T16:55:06,2026-06-17 17:59:25.344998,https://www.haaretz.com/us-news/2026-06-17/ty-article/.premium/vance-leads-a-u-s-embrace-of-iran-israel-and-netanyahus-allies-are-noticing/0000019e-d562-d27c-a39e-d5624f2b0000
"Netanyahu's mouthpieces turn on Trump, revealing a deeper Israeli ingratitude","After Netanyahu's most vocal cheerleader called him a 'scumbag' over the Iran deal, JD Vance correctly observed that Israel's right wing would 'want this to go on until every Iranian is dead.' It's time for the U.S. to reckon with Israel's recklessness",https://www.haaretz.com/israel-news/haaretz-today/2026-06-17/ty-article/.highlight/netanyahus-mouthpieces-turn-on-trump-revealing-a-deeper-israeli-ingratitude/0000019e-d583-d6a3-a5be-f5f3bde60000,Haaretz,David Issacharoff,2026-06-17T17:23:01,2026-06-17 17:59:25.344965,https://www.haaretz.com/israel-news/haaretz-today/2026-06-17/ty-article/.highlight/netanyahus-mouthpieces-turn-on-trump-revealing-a-deeper-israeli-ingratitude/0000019e-d583-d6a3-a5be-f5f3bde60000
The Deal Trump Warned About Is Apparently Now His Own,"For years, Donald Trump hammered what he saw as the central flaw in the Obama administration’s nuclear deal with Iran:...",https://www.algemeiner.com/2026/06/17/the-deal-trump-warned-about-is-apparently-now-his-own/,Algemeiner,Micha Danzig,2026-06-17T16:25:36,2026-06-17 17:59:19.858441,https://www.algemeiner.com/?p=774653
UK-Iranian National Charged With Arson at London Memorial Wall,A man who holds both British and Iranian nationality has been charged with an arson attack in April on a memorial wall in a north London area that is home to...,https://www.algemeiner.com/2026/06/17/uk-iranian-national-charged-arson-london-memorial-wall/,Algemeiner,Reuters and Algemeiner Staff,2026-06-17T17:57:18,2026-06-17 17:59:19.858407,https://www.algemeiner.com/?p=774686
United Hatzalah New York Gala honors Ron Dermer with Hero of Israel award,"“Hatzalah has become an integral part of our national resilience,” Netanyahu adviser Ron Dermer told supporters at the organization’s annual fundraiser.",https://www.jns.org/feature/united-hatzalah-new-york-gala-honors-ron-dermer-with-hero-of-israel-award,JNS,Steve Linde,2026-06-17T17:49:01,2026-06-17 17:59:15.638662,https://www.jns.org/feature/united-hatzalah-new-york-gala-honors-ron-dermer-with-hero-of-israel-award
Trump’s Surrender to Iran is Evident in First Sentence of Ceasefire Deal,"Trump may have the bluster, but the mullahs know they hold the cards. The post Trump’s Surrender to Iran is Evident in First Sentence of Ceasefire Deal appeared first on Jewish Journal .",https://jewishjournal.com/commentary/columnist/editors-note/389292/trumps-surrender-to-iran-is-evident-in-first-sentence-of-ceasefire-deal/,Jewish Journal,David Suissa,2026-06-17T17:54:49,2026-06-17 17:59:12.731241,https://jewishjournal.com/?p=389292
Settlers set fire to two West Bank mosques overnight,Graffiti reading 'Revenge' and 'Hi from the Hilltop Youth' scrawled on mosque damaged by fire in village north of Ramallah; IDF says forces searched for suspects but they fled The post Settlers set fire to two West Bank mosques overnight appeared first on The Times of Israel .,https://www.timesofisrael.com/settlers-set-fire-to-two-west-bank-mosques-overnight/,Times of Israel,,2026-06-17T16:44:28,2026-06-17 17:59:08.617773,https://www.timesofisrael.com/?p=3844985
"After more than 50 years, US engine-maker Pratt & Whitney is shutting down Israel factory","Following four years of struggle to prevent the closure of the plant, formerly owned by the Wertheimer family, BTL's 600 workers in the country's north will be laid off The post After more than 50 years, US engine-maker Pratt &#038; Whitney is shutting down Israel factory appeared first on The Times of Israel .",https://www.timesofisrael.com/after-more-than-50-years-us-engine-maker-pratt-whitney-is-shutting-down-israel-factory/,Times of Israel,,2026-06-17T16:58:57,2026-06-17 17:59:08.617729,https://www.timesofisrael.com/?p=3844913
Slovenia’s last Jewish institution endures through desecration and decay,"On a Saturday morning last July, Robert Baruh Waltl watched two processions converge on central Ljubljana. From one direction, near the river, came a column of neo-Nazis chanting nationalist slogans chanting “Long live Slovenia.” From the other came pro-Palestinian marchers singing “from the river to the sea”. The city, he notes drily, is very small.... The post Slovenia’s last Jewish institution endures through desecration and decay appeared first on The Forward .",https://forward.com/news/832148/slovenia-jewish-cultural-center-ljubljana/,The Forward,Alan Grabinsky,2026-06-17T17:17:38,2026-06-17 17:59:06.282645,https://forward.com/?p=832148
I’ve spent a decade building acceptance for LGBTQ Orthodox Jews. Now I’m watching it unravel.,"Only compassion can resist the political and cultural trends making our institutions less welcoming, writes an educator at Eshel. -- The post I&#8217;ve spent a decade building acceptance for LGBTQ Orthodox Jews. Now I&#8217;m watching it unravel. appeared first on Jewish Telegraphic Agency .",https://www.jta.org/2026/06/17/ideas/ive-spent-a-decade-building-acceptance-for-lgbtq-orthodox-jews-now-im-watching-it-unravel,JTA,Saundra Sterling Epstein,2026-06-17T16:55:02,2026-06-17 17:59:03.215596,https://www.jta.org/?p=1902716
FIRST PERSON | This pattern of personal plagues perplexes me,"I know Passover has receded quickly in your rearview mirror, but I’m living through a series of personal plagues. They’re not biblical in proportion, but for mere mortal me, they’re [&#8230;]",https://jweekly.com/2026/06/17/this-pattern-of-personal-plagues-perpetually-perplexes-me/,J. Weekly,Karen Galatz,2026-06-17T16:00:00,2026-06-17 17:58:58.154393,https://jweekly.com/?p=306416
OPINION | Cultural boycotts of Israel just reached peak absurdity,This story was originally published in the Forward. Click here to get the Forward&#8217;s free email newsletters delivered to your inbox. Nadav Lapid is a filmmaker whose work has become [&#8230;],https://jweekly.com/2026/06/17/cultural-boycotts-of-israel-just-reached-peak-absurdity/,J. Weekly,A.J. Goldmann,2026-06-17T17:00:00,2026-06-17 17:58:58.154359,https://jweekly.com/?p=306407
Feds investigating antisemitism at American Psychological Association,"(JTA) — The U.S. Department of Health and Human Services is opening an antisemitism investigation into the American Psychological Association, the largest professional organization for mental health professionals, the agency [&#8230;]",https://jweekly.com/2026/06/17/feds-investigating-antisemitism-allegations-at-american-psychological-association/,J. Weekly,Andrew Lapin,2026-06-17T17:10:41,2026-06-17 17:58:58.154319,https://jweekly.com/?p=306412
Toronto police link gun-for-hire networks to shootings at U.S. Consulate and synagogues,"'There's been a lot of reporting about criminal groups and foreign actors,' said the Toronto Police chief. 'What I can tell you is that we are still working actively to investigate who is responsible for orchestrating these criminal acts'",https://www.haaretz.com/jewish/2026-06-17/ty-article/toronto-police-link-gun-for-hire-networks-to-shootings-at-synagogues-consulate/0000019e-d586-deca-ab9e-ddf729df0000,Haaretz,The Associated Press,2026-06-17T14:30:05,2026-06-17 16:23:53.163081,https://www.haaretz.com/jewish/2026-06-17/ty-article/toronto-police-link-gun-for-hire-networks-to-shootings-at-synagogues-consulate/0000019e-d586-deca-ab9e-ddf729df0000
Knesset grants Likud lawmaker immunity after she exposed identity of Shin Bet agent,The Knesset granted Tally Gotliv immunity after she was accused of disclosing classified information by revealing that the partner of an anti-government activist was a member of the security service. The Shin Bet agent filed a High Court petition seeking to overturn the decision,https://www.haaretz.com/israel-news/elections/2026-06-17/ty-article/.premium/knesset-grants-likud-mk-immunity-after-she-exposed-identity-of-shin-bet-agent/0000019e-d5ab-d2be-abbf-ffef7a130000,Haaretz,Noa Shpigel,2026-06-17T14:55:04,2026-06-17 16:23:53.163051,https://www.haaretz.com/israel-news/elections/2026-06-17/ty-article/.premium/knesset-grants-likud-mk-immunity-after-she-exposed-identity-of-shin-bet-agent/0000019e-d5ab-d2be-abbf-ffef7a130000
Israel summons Belarusian envoy over Lukashenko's Gaza Holocaust comment,The director general of the foreign ministry summoned Ambassador Yuri Yarusevich over the Belarusian president's 'outrageous' remarks,https://www.haaretz.com/world-news/europe/2026-06-17/ty-article/.premium/israel-summons-belarusian-envoy-over-lukashenkos-gaza-holocaust-comment/0000019e-d58f-d6a3-a5be-f5ff5bb50000,Haaretz,Liza Rozovsky,2026-06-17T15:14:34,2026-06-17 16:23:53.163018,https://www.haaretz.com/world-news/europe/2026-06-17/ty-article/.premium/israel-summons-belarusian-envoy-over-lukashenkos-gaza-holocaust-comment/0000019e-d58f-d6a3-a5be-f5ff5bb50000
Israel Police chief questioned under caution on suspicion of witness harassment,"Investigators suspect Israel Prison Service Commissioner Kobi Yaakobi sent a senior subordinate to secretly record and extract information from the head of the police spokesperson's unit, the key witness in the case against him",https://www.haaretz.com/israel-news/israel-security/2026-06-17/ty-article/.premium/israel-police-chief-questioned-under-caution-on-suspicion-of-witness-harassment/0000019e-d524-dd9c-a19f-ff2c25ae0000,Haaretz,Josh Breiner,2026-06-17T16:23:14,2026-06-17 16:23:53.162986,https://www.haaretz.com/israel-news/israel-security/2026-06-17/ty-article/.premium/israel-police-chief-questioned-under-caution-on-suspicion-of-witness-harassment/0000019e-d524-dd9c-a19f-ff2c25ae0000
The War for the Sea Routes: The Lesson from the Hormuz Crisis,"For decades, the West has treated the world&#8217;s oceans as an open domain governed by universal norms emphasizing freedom of...",https://www.algemeiner.com/2026/06/17/the-war-for-the-sea-routes-the-lesson-from-the-hormuz-crisis/,Algemeiner,Sagiv Steinberg,2026-06-17T16:09:09,2026-06-17 16:23:48.097368,https://www.algemeiner.com/?p=774481
"The Iran Deal Is a Short-Term Fix; Unlike the War in Gaza, That Won’t Be Enough","The Israeli public and many others are looking at the US-Iran memorandum of understanding and seeing a massive, dangerous departure...",https://www.algemeiner.com/2026/06/17/the-iran-deal-is-a-short-term-fix-unlike-the-war-in-gaza-that-wont-be-enough/,Algemeiner,David Weissmann,2026-06-17T16:18:35,2026-06-17 16:23:48.097341,https://www.algemeiner.com/?p=774575
"In Iran, Christians Are Prosecuted as ‘Zionist Traitors’",It takes little to be branded a traitor in the eyes of the Islamic Republic of Iran. But since the...,https://www.algemeiner.com/2026/06/17/in-iran-christians-are-prosecuted-as-zionist-traitors/,Algemeiner,Mariam Wahba,2026-06-17T16:19:30,2026-06-17 16:23:48.097305,https://www.algemeiner.com/?p=774656
Who will stand with Israel against a new Iran deal?,"Back in 2015, the GOP and most Americans opposed Obama’s appeasement of Tehran. Now, Democrats are against Israel on any issue, and Republicans will not defy Trump.",https://www.jns.org/opinion/column/jonathan-s-tobin/who-will-stand-with-israel-against-a-new-iran-deal,JNS,Jonathan S. Tobin,2026-06-17T14:30:00,2026-06-17 16:23:45.812290,https://www.jns.org/opinion/column/jonathan-s-tobin/who-will-stand-with-israel-against-a-new-iran-deal
"HHS to investigate American Psychological Association over alleged Jew-hatred, anti-Israel bias","“Our hope is that HHS will ensure that if APA is going to continue to be a recipient of federal funds, that it comes into compliance with its obligations under the federal civil rights law,” Rebecca Harris of the Brandeis Center told JNS.",https://www.jns.org/news/u-s-news/hhs-to-investigate-american-psychological-association-over-alleged-jew-hatred-anti-israel-bias,JNS,Aaron Bandler,2026-06-17T15:04:58,2026-06-17 16:23:45.812260,https://www.jns.org/news/u-s-news/hhs-to-investigate-american-psychological-association-over-alleged-jew-hatred-anti-israel-bias
The day the Democrats endorsed antisemitism,What was once disqualifying gradually became acceptable in mainstream political discourse.,https://www.jns.org/opinion/column/mitchell-bard/the-day-the-democrats-endorsed-antisemitism,JNS,Mitchell Bard,2026-06-17T15:15:00,2026-06-17 16:23:45.812222,https://www.jns.org/opinion/column/mitchell-bard/the-day-the-democrats-endorsed-antisemitism
Van Jones joins Genesis Prize Advisory Board,"Civil rights advocate and senior CNN political commentator joins Genesis Prize Advisory Board of the Genesis Prize, dubbed the ""Jewish Nobel"" by Time magazine, to help build alliances against hate and combat antisemitism.",https://www.jns.org/wire/The-Genesis-Prize-Foundation/van-jones-joins-genesis-prize-advisory-board,JNS,,2026-06-17T15:30:01,2026-06-17 16:23:45.812189,https://www.jns.org/wire/The-Genesis-Prize-Foundation/van-jones-joins-genesis-prize-advisory-board
Katz touts years-long ‘under the radar’ ties in meeting with Somaliland president,Defense minister says two nations seeking to take security ties to 'new heights'; his Somaliland counterpart dispels 'rumors' Israel in talks to build military base in country The post Katz touts years-long &#8216;under the radar&#8217; ties in meeting with Somaliland president appeared first on The Times of Israel .,https://www.timesofisrael.com/katz-touts-years-long-under-the-radar-ties-in-meeting-with-somaliland-president/,Times of Israel,,2026-06-17T14:05:32,2026-06-17 16:23:41.018464,https://www.timesofisrael.com/?post_type=liveblog_entry&p=3844790
Jerusalem police probe baby food laced with sedatives after 4 infants hospitalized,Health Ministry closes two branches of Zol veGadol stores in the city; public urged to check that all purchased products are sealed and intact The post Jerusalem police probe baby food laced with sedatives after 4 infants hospitalized appeared first on The Times of Israel .,https://www.timesofisrael.com/jerusalem-police-probe-baby-food-laced-with-sedatives-after-4-infants-hospitalized/,Times of Israel,,2026-06-17T14:06:01,2026-06-17 16:23:41.018415,https://www.timesofisrael.com/?p=3844746
"Trump’s deal is a catastrophic capitulation to Iran’s aggressors, leaves Israel vulnerable and constrained","In the US president's reality-challenged view, Israel is an ingrate and a warmonger, while Iran's mass-murdering leaders are 'very rational.' They are indeed all too rational, and he, clearly, is not The post Trump&#8217;s deal is a catastrophic capitulation to Iran&#8217;s aggressors, leaves Israel vulnerable and constrained appeared first on The Times of Israel .",https://www.timesofisrael.com/trumps-deal-is-a-catastrophic-capitulation-to-irans-aggressors-leaves-israel-vulnerable-and-constrained/,Times of Israel,,2026-06-17T14:27:35,2026-06-17 16:23:41.018378,https://www.timesofisrael.com/?p=3843530
Teacher accused of indecent acts against students in northern city Safed,"Moshe Saada, 65, charged with abusing seven children aged 9 to 12 over a period of 16 years; police believe there may be other victims, appeal for them to come forward The post Teacher accused of indecent acts against students in northern city Safed appeared first on The Times of Israel .",https://www.timesofisrael.com/teacher-accused-of-indecent-acts-against-students-in-northern-city-safed/,Times of Israel,,2026-06-17T14:30:32,2026-06-17 16:23:41.018333,https://www.timesofisrael.com/?p=3844824
US feds probing antisemitism allegations at American Psychological Association,Investigation stems from allegations by Jewish and Israeli psychologists alleging group promoted or failed to discipline anti-Israel activism among some of its affinity groups The post US feds probing antisemitism allegations at American Psychological Association appeared first on The Times of Israel .,https://www.timesofisrael.com/us-feds-probing-antisemitism-allegations-at-american-psychological-association/,Times of Israel,,2026-06-17T14:42:03,2026-06-17 16:23:41.018295,https://www.timesofisrael.com/?p=3844858
Pastor who says Antichrist will be Jewish heads to runoff for Oklahoma congressional seat,"Jackson Lahmeyer, who is backed by Trump, says he supports Israel and claims Muslims trying to establish sharia law in US, faces off against more traditional conservative The post Pastor who says Antichrist will be Jewish heads to runoff for Oklahoma congressional seat appeared first on The Times of Israel .",https://www.timesofisrael.com/pastor-who-says-antichrist-will-be-jewish-heads-to-runoff-for-oklahoma-congressional-seat/,Times of Israel,,2026-06-17T14:42:24,2026-06-17 16:23:41.018257,https://www.timesofisrael.com/?p=3844859
The Iran Deal: Crisis or opportunity? - Sponsored Content,"We unpack what is actually in the deal, how dangerous it could be, why President Trump has turned so sharply against Netanyahu, and whether there is any reason to see a silver lining. The post The Iran Deal: Crisis or opportunity? appeared first on The Times of Israel .",https://toi.li/qw233t,Times of Israel,,2026-06-17T15:25:36,2026-06-17 16:23:41.018209,https://www.timesofisrael.com/?post_type=spotlight&p=3844992
"Your Daily Phil: LGBT Jews want more than a Pride Shabbat, JFNA survey shows","The post Your Daily Phil: LGBT Jews want more than a Pride Shabbat, JFNA survey shows appeared first on eJewishPhilanthropy .",https://ejewishphilanthropy.com/your-daily-phil-lgbt-jews-want-more-than-a-pride-shabbat-jfna-survey-shows/,eJewish Philanthropy,EJP,2026-06-17T14:25:38,2026-06-17 16:23:34.119232,https://ejewishphilanthropy.com/?p=176025
Trump threatens resumption in bombing campaign if Iran deal falls short,The U.S. president said the still-unpublished agreement is not final and warned Washington could 'go back to shooting' and 'dropping bombs' on Iran if he is dissatisfied with its terms,https://www.haaretz.com/middle-east-news/iran/2026-06-17/ty-article/trump-threatens-resumption-in-bombing-campaign-if-iran-deal-falls-short/0000019e-d54f-d2be-abbf-ffcfc3410000,Haaretz,Reuters,2026-06-17T12:36:36,2026-06-17 14:18:13.135748,https://www.haaretz.com/middle-east-news/iran/2026-06-17/ty-article/trump-threatens-resumption-in-bombing-campaign-if-iran-deal-falls-short/0000019e-d54f-d2be-abbf-ffcfc3410000
"Somaliland, Israel deny reports of IDF base in region during Israel visit","During a visit to Israel by the president of Somaliland, a breakaway region recognized as a country only by Israel, Israel's defense minister said Jerusalem would strengthen ties with Somaliland",https://www.haaretz.com/israel-news/israel-security/2026-06-17/ty-article/.premium/somaliland-israel-deny-reports-of-idf-base-in-region-during-israel-visit/0000019e-d51a-db7a-a9bf-ddded3fe0000,Haaretz,Yaniv Kubovich,2026-06-17T12:41:12,2026-06-17 14:18:13.135720,https://www.haaretz.com/israel-news/israel-security/2026-06-17/ty-article/.premium/somaliland-israel-deny-reports-of-idf-base-in-region-during-israel-visit/0000019e-d51a-db7a-a9bf-ddded3fe0000
"66 years after its last Vatican visit, NY's Jewish federation returns to meet Pope Leo XIV","Eric Goldstein, the outgoing CEO of the UJA-Federation of New York, thanked Leo for his 'moral leadership' in combatting antisemitism and asked him to consider appointing a 'special papal envoy to combat global antisemitism'",https://www.haaretz.com/jewish/2026-06-17/ty-article/new-yorks-jewish-federation-returns-to-meet-pope-leo-xiv/0000019e-d4ee-db7a-a9bf-ddfed3c80000,Haaretz,JTA,2026-06-17T13:27:13,2026-06-17 14:18:13.135690,https://www.haaretz.com/jewish/2026-06-17/ty-article/new-yorks-jewish-federation-returns-to-meet-pope-leo-xiv/0000019e-d4ee-db7a-a9bf-ddfed3c80000
"Meet Al Shami, the Syrian singer giving voice to Arab gen Z","At 24, Syrian singer Abdul Rahman Fawaz has become a social media superstar and a voice for a generation shaped by war and exile",https://www.haaretz.com/middle-east-news/2026-06-17/ty-article-magazine/.premium/meet-al-shami-the-syrian-singer-giving-voice-to-arab-gen-z/0000019e-d53f-d34c-a9be-d7bfcd1b0000,Haaretz,Sheren Falah Saab,2026-06-17T14:10:27,2026-06-17 14:18:13.135654,https://www.haaretz.com/middle-east-news/2026-06-17/ty-article-magazine/.premium/meet-al-shami-the-syrian-singer-giving-voice-to-arab-gen-z/0000019e-d53f-d34c-a9be-d7bfcd1b0000
EU mulls targeting trade with Israel over Judea and Samaria — report,The European Commission is reportedly preparing options after member states failed to reach consensus on broader sanctions against Israel.,https://www.jns.org/news/world/eu-mulls-targeting-trade-with-israel-over-judea-and-samaria-report,JNS,JNS Staff,2026-06-17T12:49:48,2026-06-17 14:18:06.288025,https://www.jns.org/news/world/eu-mulls-targeting-trade-with-israel-over-judea-and-samaria-report
Washington state Republican raises concern over rival's refusal to label Hamas a terror group,"Natalie Poulson told JNS that Democratic candidate Luc Jasmin III's comments are ""discrediting"" and pointed to an increase in antisemitic incidents of Jew-hatred in the state.",https://www.jns.org/news/u-s-news/washington-state-republican-raises-concern-over-rivals-refusal-to-label-hamas-a-terror-group,JNS,Jessica Russak-Hoffman,2026-06-17T13:00:00,2026-06-17 14:18:06.287995,https://www.jns.org/news/u-s-news/washington-state-republican-raises-concern-over-rivals-refusal-to-label-hamas-a-terror-group
Samaria communities connected to Gush Dan wastewater treatment plant,"""This is a victory of vision, perseverance and Zionism, and another step on the path to the development of Samaria and a million residents,” said Samaria Regional Council Chairman Yossi Dagan.",https://www.jns.org/news/israel-news/samaria-communities-connected-to-gush-dan-wastewater-treatment-plant,JNS,,2026-06-17T13:11:25,2026-06-17 14:18:06.287960,https://www.jns.org/news/israel-news/samaria-communities-connected-to-gush-dan-wastewater-treatment-plant
