title,description,link,source,author,published,scraped_at,guid
"Irish Music, Arts and Wellness Festival Bans Current or Former IDF Soldiers","An Irish music, arts, and wellness festival has banned all current and former members of the Israel Defense Forces (IDF)...",https://www.algemeiner.com/2026/07/15/irish-music-arts-and-wellness-festival-bans-current-or-former-idf-soldiers/,Algemeiner,Shiryn Ghermezian,2026-07-15T16:26:48,2026-07-15 18:08:29.789142,https://www.algemeiner.com/?p=776172
The Colonizer Claim Against Israel Fails History,"If you try to defend Israel online or in the public sphere today, one of the first things you&#8217;ll hear...",https://www.algemeiner.com/2026/07/15/the-colonizer-claim-against-israel-fails-history/,Algemeiner,Micha Danzig,2026-07-15T16:49:54,2026-07-15 18:08:29.789092,https://www.algemeiner.com/?p=776164
"Hakeem Jeffries Announces He Will Not House Minority Leader Hakeem Jeffries (D-NY) has come out against a bid to cut off US military aid to Israel, while calling for a “major reset” of Washington’s relationship with the Jewish state. In a “Dear Colleague” letter to fellow Democrats on Tuesday, Jeffries said he would vote against an amendment led by Rep. Thomas Massie (R-KY), and co-sponsored by Rep. Ro Khanna (D-CA), that would strip roughly $3.3 billion in annual military financing for Israel — while preserving $500 million for missile-defense programs such as Iron Dome — from the fiscal 2027 National Security, Department of State, and Related Programs Appropriations Act. The House could vote on the measure as early as this week. Aligning himself with the ranking Democrats on the Appropriations and Foreign Affairs committees, Reps. Rosa DeLauro (D-CT) and Gregory Meeks (D-NY), as well as the advocacy group J Street, Jeffries called the proposal too sweeping. “As written, it is overly broad in that it prohibits or would limit the use of funds for longstanding initiatives related to humanitarian aid, refugee resettlement, peace-building and US Embassy operations,” he wrote, adding that the “so-called Massie amendment” would restrict US efforts to confront Hamas, Hezbollah “and other terrorist organizations in the region who are sworn enemies of both the United States and Israel.” Citing deep divisions within the party over Israel, Jeffries said leadership would not pressure members to follow his lead. “There are good faith reasons that will result in Members voting in a variety of different ways with respect to the amendment,” he wrote, noting that the caucus was not whipping the vote. At the same time, Jeffries argued that US policy toward the region “must change,” tying his call for a “major reset” to criticism of what he termed the “far-right Netanyahu government.” He wrote that America’s commitment to “Israel’s right to exist as a Jewish and democratic state and homeland for the Jewish people must remain ironclad,” while urging strong US support for the creation of an independent Palestinian state. Israeli governments have long rejected the establishment of a Palestinian state along Israel’s borders, warning that it would pose an existential security threat and leave major population centers exposed to attack. Jeffries also said Gaza must undergo “complete reconstruction and modernization” and that “Hamas must be disarmed and removed from power.” Jeffries further signaled that the next US-Israel aid agreement should require Israel to cover more of its own defense costs. The current 10-year memorandum of understanding, signed under President Barack Obama in 2016, provides Israel about $3.8 billion annually — $3.3 billion in military financing and $500 million for missile defense — and expires in 2028. “Israel has an advanced economy and is capable of paying for its own sophisticated weapons, as the Prime Minister recently acknowledged,” Jeffries wrote, adding that any future arrangement should mirror US defense agreements with other Western allies and “strictly adhere to our human rights laws and values.” His stance placed him between the two poles of a party increasingly split over Israel. Hours after his letter circulated, the chair of the Congressional Progressive Caucus, Rep. Greg Casar (D-TX), sent a competing letter urging Democrats to back the Massie amendment, and progressives including Rep. Alexandria Ocasio-Cortez (D-NY) said they would vote to cut the aid. Support for Israel among Democratic voters has fallen sharply during the war in Gaza. An Associated Press-NORC poll conducted in June found that 52 percent of Democrats say Israel has committed genocide against Palestinians, while a Pew Research Center survey found that roughly 80 percent of Democrats hold a negative view of Israel. In April, a majority of Senate Democrats — 40 of the caucus’s 47 members — voted for at least one of two resolutions to block certain arms sales to Israel, though the measures failed. Supporters of continued assistance say it preserves Israel’s qualitative military edge and bolsters a key US partner against Iran-backed groups, while critics want aid conditioned on Israeli policy changes, particularly over the conduct of the war in Gaza. The upcoming vote is expected to underscore the widening gap between the party’s pro-Israel wing and its growing bloc of aid critics. for Amendment to Strip Israel Aid","House Minority Leader Hakeem Jeffries (D-NY) has come out against a bid to cut off US military aid to Israel,...",https://www.algemeiner.com/2026/07/15/hakeem-jeffries-announces-he-will-not-house-minority-leader-hakeem-jeffries-d-ny-has-come-out-against-a-bid-to-cut-off-us-military-aid-to-israel-while-calling-for-a-major-reset-of-washingtons/,Algemeiner,Corey Walker,2026-07-15T17:09:31,2026-07-15 18:08:29.789057,https://www.algemeiner.com/?p=776142
"US-Iranian citizen from Massachusetts convicted in Iran export scheme, faces up to 60 years, $1 million fine",A federal jury convicted Mahdi Mohammad Sadeghi for illegally exporting sensitive U.S. information to the Islamic Republic.,https://www.jns.org/news/u-s-news/us-iranian-citizen-from-massachusetts-convicted-in-iran-export-scheme-faces-up-to-60-years-1-million-fine,JNS,Rebecca Szlechter,2026-07-15T17:13:01,2026-07-15 18:08:27.445499,https://www.jns.org/news/u-s-news/us-iranian-citizen-from-massachusetts-convicted-in-iran-export-scheme-faces-up-to-60-years-1-million-fine
Rahm Emanuel’s fifth campaign against Benjamin Netanyahu,The spectacle of Obama’s former chief of staff rejecting his father’s legacy is of almost Shakespearean dimensions.,https://www.jns.org/opinion/julio-messer/rahm-emanuels-fifth-campaign-against-benjamin-netanyahu,JNS,Julio Messer,2026-07-15T17:30:00,2026-07-15 18:08:27.445462,https://www.jns.org/opinion/julio-messer/rahm-emanuels-fifth-campaign-against-benjamin-netanyahu
A fortress won’t save American Jews,"Jews have found themselves at the center of politics over the past few years — not a place we want to be, at least not like this. Anton Jäger, a historian at Oxford University, has argued that since the Covid-19 pandemic spurred more government intervention into the lives of ordinary citizens, many Western countries have... The post A fortress won’t save American Jews appeared first on The Forward .",https://forward.com/news/antisemitism-decoded/838175/a-fortress-wont-save-american-jews/,The Forward,Arno Rosenfeld,2026-07-15T17:51:02,2026-07-15 18:08:20.928838,https://forward.com/?p=838175
Cuba delegation's long road to the Maccabiah Games in Israel,"(JTA) — Nearly three decades after Hella Eskenazi’s first trip from her home in Cuba to the Maccabiah Games in Israel, the journey hasn’t gotten much easier. This time, she [&#8230;]",https://jweekly.com/2026/07/15/five-countries-over-four-days-how-cubas-maccabiah-games-delegation-made-it-to-israel/,J. Weekly,Jacob Gurvis,2026-07-15T16:40:21,2026-07-15 18:08:13.837545,https://jweekly.com/?p=307311
What are the links between 'The Odyssey' and the Hebrew Bible?,"(JTA) — Even before its release on Friday, buzz over Christopher Nolan’s much-anticipated film adaptation, “The Odyssey,” is introducing a new generation to Homer’s tale of shipwrecks, monsters, gods and [&#8230;]",https://jweekly.com/2026/07/15/as-christopher-nolan-revives-the-odyssey-a-scholar-finds-links-between-homer-and-the-hebrew-bible/,J. Weekly,Andrew Silow-Carroll,2026-07-15T16:48:38,2026-07-15 18:08:13.837500,https://jweekly.com/?p=307317
A genius encumbered by loss: A haunted Jewish poet is brought back to life,,https://www.haaretz.com/life/books/2026-07-15/ty-article-review/.premium/a-genius-encumbered-by-loss-a-haunted-jewish-poet-is-brought-back-to-life/0000019f-60b6-d72f-afff-79bed8180000,Haaretz,Megan Peck Shub,2026-07-15T14:56:34,2026-07-15 16:22:49.416859,https://www.haaretz.com/life/books/2026-07-15/ty-article-review/.premium/a-genius-encumbered-by-loss-a-haunted-jewish-poet-is-brought-back-to-life/0000019f-60b6-d72f-afff-79bed8180000
Rep. Ro Khanna: 'Israel has lost Americans under 50. Bibi Netanyahu has antagonized an entire generation',"Read Haaretz's full conversation with Rep. Ro Khanna on settler violence, Gaza and AIPAC",https://www.haaretz.com/us-news/2026-07-15/ty-article-magazine/.premium/israel-has-lost-americans-under-50-netanyahu-antagonized-an-entire-generation/0000019f-65e7-df91-a7df-eff79d3b0000,Haaretz,Allison Kaplan Sommer,2026-07-15T15:35:02,2026-07-15 16:22:49.416835,https://www.haaretz.com/us-news/2026-07-15/ty-article-magazine/.premium/israel-has-lost-americans-under-50-netanyahu-antagonized-an-entire-generation/0000019f-65e7-df91-a7df-eff79d3b0000
"Netanyahu to visit Trump, attend Sen. Graham's funeral in Washington next week","Netanyahu's aides viewed the funeral as an opportunity to schedule an anticipated meeting with Trump. Lebanese President Joseph Aoun is also expected to travel to the United States next week for a meeting with Trump, but said he would leave the room should Netanyahu enter",https://www.haaretz.com/israel-news/israel-politics/2026-07-15/ty-article/.premium/netanyahu-to-visit-trump-attend-sen-grahams-funeral-in-washington-next-week/0000019f-65f3-db3a-a1ff-67f7303c0000,Haaretz,Jonathan Lis,2026-07-15T15:38:52,2026-07-15 16:22:49.416810,https://www.haaretz.com/israel-news/israel-politics/2026-07-15/ty-article/.premium/netanyahu-to-visit-trump-attend-sen-grahams-funeral-in-washington-next-week/0000019f-65f3-db3a-a1ff-67f7303c0000
Five stubborn Jewish newspapers that have lived through it all,"Haaretz speaks to five Jewish publications around the world, from Russia and Turkey to Poland, the Netherlands and Switzerland. They print in a variety of languages, including Yiddish and even Ladino, and have survived the fall of multiple regimes",https://www.haaretz.com/jewish/2026-07-15/ty-article-magazine/.premium/five-stubborn-jewish-newspapers-that-have-lived-through-it-all/0000019e-3b0b-d8f5-adde-3bdf23320000,Haaretz,Netta Ahituv,2026-07-15T16:02:01,2026-07-15 16:22:49.416779,https://www.haaretz.com/jewish/2026-07-15/ty-article-magazine/.premium/five-stubborn-jewish-newspapers-that-have-lived-through-it-all/0000019e-3b0b-d8f5-adde-3bdf23320000
"Israel agrees to withdraw military from two Lebanon pilot zones, U.S. official says","U.S. official says sides will move to technical talks after Rome meeting, with Israel and Lebanon seeking to implement June framework deal. Israeli envoy Yechiel Leiter said withdrawal would depend on whether Hezbollah is removed from the area and Lebanese forces can take control",https://www.haaretz.com/israel-news/israel-security/2026-07-15/ty-article/.premium/israel-agrees-to-withdraw-idf-from-two-lebanon-pilot-zones-u-s-official-says/0000019f-6655-dc96-afdf-6ed501b70000,Haaretz,Liza Rozovsky,2026-07-15T16:13:21,2026-07-15 16:22:49.416743,https://www.haaretz.com/israel-news/israel-security/2026-07-15/ty-article/.premium/israel-agrees-to-withdraw-idf-from-two-lebanon-pilot-zones-u-s-official-says/0000019f-6655-dc96-afdf-6ed501b70000
Cold-Blooded Murderer Is Praised as a Hero By Palestinian Leaders and Media,Israeli Arab terrorist Maher Yunes and his cousin Karim Younes kidnapped Israeli soldier Avraham Bromberg while he was on leave...,https://www.algemeiner.com/2026/07/15/cold-blooded-murderer-is-praised-as-a-hero-by-palestinian-leaders-and-media/,Algemeiner,Itamar Marcus,2026-07-15T15:38:00,2026-07-15 16:22:44.063635,https://www.algemeiner.com/?p=776166
Is Belief in God Irrational?,"On more than one occasion, atheists have told me that belief in God is irrational. The certainty with which they...",https://www.algemeiner.com/2026/07/15/is-belief-in-god-irrational/,Algemeiner,Steve Wenick,2026-07-15T15:38:15,2026-07-15 16:22:44.063598,https://www.algemeiner.com/?p=776162
"Bipartisan House bill calling for UNRWA to be dismantled permanently, replaced ‘long overdue,’ expert says","“This is not a case of a few bad apples,” Yoni Tobin, senior policy analyst at JINSA, told JNS. “It’s a case of a rotten tree.”",https://www.jns.org/news/u-s-news/bipartisan-house-bill-calling-for-unrwa-to-be-dismantled-permanently-replaced-long-overdue-expert-says,JNS,Rikki Zagelbaum,2026-07-15T15:18:16,2026-07-15 16:22:41.704268,https://www.jns.org/news/u-s-news/bipartisan-house-bill-calling-for-unrwa-to-be-dismantled-permanently-replaced-long-overdue-expert-says
Is Trump finally done negotiating with Iran?,"“The Quad” is a dynamic weekly panel show hosted by Fleur Hassan-Nahoum, Israel’s innovation envoy and former deputy mayor of Jerusalem. The series brings together a powerhouse lineup of bold, insightful women to tackle the most pressing stories from Israel, the Middle East and the Jewish world. With Fleur at the helm, “The Quad” features regular co-hosts, including Shoshana Keats-Jaskel, founder of Chochmat Nashim; journalist and human-rights activist Emily Schrader and other leading voices shaping conversation and change. Through sharp analysis, diverse perspectives and unapologetic commentary, “The Quad” confronts the complex political, cultural and social challenges facing Israel and the Jewish people. Each episode cuts through noise and narrative spin to deliver insight and debate, and to empower female perspectives on issues that define our time. Bold, informed and refreshingly authentic, “The Quad” redefines how Israel and the Middle East are discussed, one conversation at a time. See more at: @JNS_TV and subscribe to our YouTube channel.",https://www.jns.org/jns-tv/the-quad/is-trump-finally-done-negotiating-with-iran,JNS,Emily Schrader,2026-07-15T15:27:33,2026-07-15 16:22:41.704233,https://www.jns.org/jns-tv/the-quad/is-trump-finally-done-negotiating-with-iran
Andrew Burnham’s anti-Israel rhetoric is deeply unsavory,The British prime minister in waiting makes a mockery of professed concerns about antisemitism.,https://www.jns.org/opinion/jeremy-havardi/andrew-burnhams-anti-israel-rhetoric-is-deeply-unsavory,JNS,Jeremy Havardi,2026-07-15T16:00:00,2026-07-15 16:22:41.704149,https://www.jns.org/opinion/jeremy-havardi/andrew-burnhams-anti-israel-rhetoric-is-deeply-unsavory
"Professor sues Northwestern University for job loss, pointing to political pressure",Steven Thrasher alleges that he was denied tenure as a result of his participation in anti-Israel activities on campus post-Oct. 7.,https://www.jns.org/news/u-s-news/professor-sues-northwestern-university-for-job-loss-pointing-to-political-pressure,JNS,,2026-07-15T16:14:06,2026-07-15 16:22:41.704115,https://www.jns.org/news/u-s-news/professor-sues-northwestern-university-for-job-loss-pointing-to-political-pressure
"AOC urges Clavicular, who visited Tel Aviv, to ‘shed some light’ on the plight of the Palestinians","(JTA) — Rep. Alexandria Ocasio-Cortez said the influencer Clavicular should be informing his followers about the plight of Palestinians, in a sign of how widely Clavicular’s trip this week to Tel Aviv has registered among both Israelis and Israel’s critics. Ocasio-Cortez, who has been sharply critical of Israel, was asked about Clavicular by a reporter... The post AOC urges Clavicular, who visited Tel Aviv, to &#8216;shed some light&#8217; on the plight of the Palestinians appeared first on The Forward .",https://forward.com/fast-forward/838127/aoc-urges-clavicular-who-visited-tel-aviv-to-shed-some-light-on-the-plight-of-the-palestinians/,The Forward,Philissa Cramer,2026-07-15T14:52:45,2026-07-15 16:22:34.033074,https://forward.com/?p=838127
"As Christopher Nolan revives ‘The Odyssey,’ a scholar finds links between Homer and the Hebrew Bible","(JTA) — Even before its release on Friday, buzz over Christopher Nolan’s much-anticipated film adaptation, “The Odyssey,” is introducing a new generation to Homer’s tale of shipwrecks, monsters, gods and the long road home. But what does an ancient Greek epic have to do with Jewish readers — or with the Hebrew Bible? Quite a... The post As Christopher Nolan revives &#8216;The Odyssey,&#8217; a scholar finds links between Homer and the Hebrew Bible appeared first on The Forward .",https://forward.com/culture/838136/as-christopher-nolan-revives-the-odyssey-a-scholar-finds-links-between-homer-and-the-hebrew-bible/,The Forward,Andrew Silow-Carroll,2026-07-15T15:47:13,2026-07-15 16:22:34.033017,https://forward.com/?p=838136
Israel Police fatally shoot suspect during pursuit in Arab village,"Another person was lightly to moderately wounded during the incident. The shooting comes as an ongoing dispute between two families in the village has escalated in recent weeks. Separately, a woman in her 30s was seriously wounded in a shooting Tuesday evening in the central Israeli city of Ramle",https://www.haaretz.com/israel-news/israel-crime/2026-07-15/ty-article/.premium/israel-police-fatally-shoot-suspect-during-pursuit-in-arab-village/0000019f-64a8-d638-adff-f4bb1c210000,Haaretz,Adi Hashmonai,2026-07-15T12:59:38,2026-07-15 14:51:12.589759,https://www.haaretz.com/israel-news/israel-crime/2026-07-15/ty-article/.premium/israel-police-fatally-shoot-suspect-during-pursuit-in-arab-village/0000019f-64a8-d638-adff-f4bb1c210000
U.S. launches new strikes on Iran as Tehran threatens more shipping disruption,"The U.S. military announced a new wave of strikes after it said it hit dozens of military sites along Iran's coastline overnight ■ In response, Iran said it attacked U.S. bases in Bahrain, Kuwait and Jordan ■ Trump warned the United States would 'knock out' all of Iran's power plants and bridges next week, 'unless they get to the table and negotiate'",https://www.haaretz.com/us-news/2026-07-15/ty-article/u-s-launches-new-strikes-on-iran-as-tehran-threatens-more-shipping-disruption/0000019f-640c-d40b-afbf-e41e51220000,Haaretz,Ben Samuels,2026-07-15T14:45:11,2026-07-15 14:51:12.589719,https://www.haaretz.com/us-news/2026-07-15/ty-article/u-s-launches-new-strikes-on-iran-as-tehran-threatens-more-shipping-disruption/0000019f-640c-d40b-afbf-e41e51220000
Orthodox Jews confront Israel's moral and democratic challenges at London conference,"The conference brought together observant Jews from across the religious and political spectrum to discuss questions of war, power, democracy, religion and ethics in a halachic setting.",https://www.jns.org/wire/Ner-Yisrael/orthodox-jews-confront-israels-moral-and-democratic-challenges-at-london-conference,JNS,,2026-07-15T12:27:35,2026-07-15 14:51:05.673344,https://www.jns.org/wire/Ner-Yisrael/orthodox-jews-confront-israels-moral-and-democratic-challenges-at-london-conference
Irish music festival bans current and former IDF soldiers,"Organizers face accusations of discrimination against citizens of Israel, where military service is mandatory.",https://www.jns.org/news/antisemitism/irish-music-festival-bans-current-and-former-idf-soldiers,JNS,JNS Staff,2026-07-15T12:27:37,2026-07-15 14:51:05.673313,https://www.jns.org/news/antisemitism/irish-music-festival-bans-current-and-former-idf-soldiers
"Balad Knesset candidate eulogizes terrorist murderer, renewing scrutiny of party","The Arab Israeli party previously expressed support for the killer, who murdered an IDF soldier in 1980.",https://www.jns.org/news/israel-news/balad-knesset-candidate-eulogizes-terrorist-murderer-renewing-scrutiny-of-party,JNS,David Isaac,2026-07-15T12:54:45,2026-07-15 14:51:05.673267,https://www.jns.org/news/israel-news/balad-knesset-candidate-eulogizes-terrorist-murderer-renewing-scrutiny-of-party
Oct. 7 pushed lifelong Dem to run as a Republican for Washington state office,"Sarah Mittelman, a former chair of the Clark County Democratic Women, told JNS that she was motivated by Jew-hatred in the Democratic Party.",https://www.jns.org/news/u-s-news/oct-7-pushed-lifelong-dem-to-run-as-a-republican-for-washington-state-office,JNS,Jessica Russak-Hoffman,2026-07-15T13:00:00,2026-07-15 14:51:05.673241,https://www.jns.org/news/u-s-news/oct-7-pushed-lifelong-dem-to-run-as-a-republican-for-washington-state-office
High Court temporarily blocks law protecting Haredi draft dodgers from arrest,The justices intervened a day after the Knesset passed the legislation by a vote of 58-54.,https://www.jns.org/news/israel-news/high-court-temporarily-blocks-law-protecting-haredi-draft-dodgers-from-arrest,JNS,JNS Staff,2026-07-15T13:27:56,2026-07-15 14:51:05.673212,https://www.jns.org/news/israel-news/high-court-temporarily-blocks-law-protecting-haredi-draft-dodgers-from-arrest
The Haredi challenge is becoming Israel’s national security crisis,"Demographics, not missiles or terrorists, may pose the greatest threat to the future of the Jewish state.",https://www.jns.org/opinion/column/mitchell-bard/the-haredi-challenge-is-becoming-israels-national-security-crisis,JNS,Mitchell Bard,2026-07-15T13:30:00,2026-07-15 14:51:05.673179,https://www.jns.org/opinion/column/mitchell-bard/the-haredi-challenge-is-becoming-israels-national-security-crisis
Orthodox Jewish groups warn House-passed daylight saving bill would disrupt religious practice,"“This isn't just an inconvenience—it would affect daily life and halachic practice for a large segment of the population,” Rabbi Yaakov Menken of the Coalition for Jewish Values told JNS.",https://www.jns.org/news/u-s-news/orthodox-jewish-groups-warn-house-passed-daylight-saving-bill-would-disrupt-religious-practice,JNS,Aaron Bandler,2026-07-15T14:00:22,2026-07-15 14:51:05.673151,https://www.jns.org/news/u-s-news/orthodox-jewish-groups-warn-house-passed-daylight-saving-bill-would-disrupt-religious-practice
"The strong shekel, not the rise of AI, is killing Israeli high-tech",The government’s inaction is driving software development to India and Eastern Europe.,https://www.jns.org/opinion/tamir-dortal/the-strong-shekel-not-the-rise-of-ai-is-killing-israeli-high-tech,JNS,Tamir Dortal,2026-07-15T14:04:10,2026-07-15 14:51:05.673117,https://www.jns.org/opinion/tamir-dortal/the-strong-shekel-not-the-rise-of-ai-is-killing-israeli-high-tech
Israel limits US aerial refueling aircraft at Ben-Gurion Airport,The tankers created a bottleneck at the airport due to a shortage of room to park planes.,https://www.jns.org/news/israel-news/israel-limits-us-aerial-refueling-aircraft-at-ben-gurion-airport,JNS,Etgar Lefkovits,2026-07-15T14:05:52,2026-07-15 14:51:05.673082,https://www.jns.org/news/israel-news/israel-limits-us-aerial-refueling-aircraft-at-ben-gurion-airport
"AOC urges Clavicular, who visited Tel Aviv, to ‘shed some light’ on the plight of the Palestinians","An Israeli soldier has drawn penalties for appearing with the ""looksmaxxing influencer."" -- The post AOC urges Clavicular, who visited Tel Aviv, to &#8216;shed some light&#8217; on the plight of the Palestinians appeared first on Jewish Telegraphic Agency .",https://www.jta.org/2026/07/15/israel/aoc-urges-clavicular-who-visited-tel-aviv-to-shed-some-light-on-the-plight-of-the-palestinians,JTA,Philissa Cramer,2026-07-15T13:06:54,2026-07-15 14:50:56.419235,https://www.jta.org/?p=1904598
"As Christopher Nolan revives ‘The Odyssey,’ a scholar finds links between Homer and the Hebrew Bible","What do a wily Greek king and the heroes and heroines of Genesis have in common? More than you might think, says Jacob Howland. -- The post As Christopher Nolan revives ‘The Odyssey,’ a scholar finds links between Homer and the Hebrew Bible appeared first on Jewish Telegraphic Agency .",https://www.jta.org/2026/07/15/ideas/as-christopher-nolan-revives-the-odyssey-a-scholar-explains-why-jews-should-read-homer-and-see-the-film,JTA,Andrew Silow-Carroll,2026-07-15T14:00:07,2026-07-15 14:50:56.419189,https://www.jta.org/?p=1904548
Your Daily Phil: Jewish aid groups get warm welcome in Venezuela despite its frosty ties with Israel,The post Your Daily Phil: Jewish aid groups get warm welcome in Venezuela despite its frosty ties with Israel appeared first on eJewishPhilanthropy .,https://ejewishphilanthropy.com/your-daily-phil-jewish-aid-groups-get-warm-welcome-in-venezuela-despite-its-frosty-ties-with-israel/,eJewish Philanthropy,EJP,2026-07-15T13:50:36,2026-07-15 14:50:54.120148,https://ejewishphilanthropy.com/?p=177330
Rep. Ro Khanna to Haaretz: 'I'm more disturbed by Israel's lies than being detained in West Bank',,https://www.haaretz.com/israel-news/podcasts/2026-07-15/ty-article-podcast/im-more-disturbed-by-israels-lies-than-being-detained-in-west-bank/0000019f-6566-df91-a7df-ef7640a30000,Haaretz,Haaretz Podcast,2026-07-15T11:21:02,2026-07-15 12:15:40.154737,https://www.haaretz.com/israel-news/podcasts/2026-07-15/ty-article-podcast/im-more-disturbed-by-israels-lies-than-being-detained-in-west-bank/0000019f-6566-df91-a7df-ef7640a30000
