title,description,link,source,author,published,scraped_at,guid
Hamas demanding guarantees of IDF withdrawal before discussing disarmament,The terrorist organization presented several demands and proposed amendments to the Board of Peace's plans.,https://www.jns.org/news/israel-news/hamas-demanding-guarantees-of-idf-withdrawal-before-discussing-disarmament,JNS,JNS Staff,2026-04-02T18:22:14,2026-04-02 18:28:53.717299,https://www.jns.org/news/israel-news/hamas-demanding-guarantees-of-idf-withdrawal-before-discussing-disarmament
"Influencer Myron Gaines performs Nazi salute, denies Holocaust death toll at Ohio University event","(JTA) — The influencer Myron Gaines visited Ohio University last Thursday as part of a national campus tour, performing a Nazi salute and claiming that the Holocaust’s death toll had been purposefully distorted. Seated at a table on the campus of Ohio University wearing a hoodie that read “Let Em Cook – Oy Vey,” a... The post Influencer Myron Gaines performs Nazi salute, denies Holocaust death toll at Ohio University event appeared first on The Forward .",https://forward.com/fast-forward/816697/influencer-myron-gaines-performs-nazi-salute-denies-holocaust-death-toll-at-ohio-university-event/,The Forward,Grace Gilson,2026-04-02T18:24:19,2026-04-02 18:28:46.388429,https://forward.com/?p=816697
"Tzruya 'Suki' Lahav, Israeli artist and Bruce Springsteen violinist, dies at 74","Lahav wrote lyrics for legendary Israeli artists including Gidi Gov, Rita, and Yehudit Ravitz, as well as performed with Bruce Springsteen, studied theater in Los Angeles, participated in Israeli theater productions, and published several books",https://www.haaretz.com/israel-news/2026-04-02/ty-article/.premium/tzruya-suki-lahav-israeli-artist-and-bruce-springsteen-violinist-dies-at-74/0000019d-4d08-d483-a99d-cf2a08470000,Haaretz,Shay Ringel,2026-04-02T16:40:55,2026-04-02 17:24:26.151735,https://www.haaretz.com/israel-news/2026-04-02/ty-article/.premium/tzruya-suki-lahav-israeli-artist-and-bruce-springsteen-violinist-dies-at-74/0000019d-4d08-d483-a99d-cf2a08470000
Latin Patriarch holds limited prayers at Holy Sepulchre after Palm Sunday uproar,"Jerusalem church akin to 'womb of peace' in a world 'being torn apart,' Cardinal Pizzaballa tells clergymen and staff permitted to attend Holy Thursday rites amid Iran war The post Latin Patriarch holds limited prayers at Holy Sepulchre after Palm Sunday uproar appeared first on The Times of Israel .",https://www.timesofisrael.com/latin-patriarch-holds-limited-prayers-at-holy-sepulchre-after-palm-sunday-uproar/,Times of Israel,,2026-04-02T16:29:45,2026-04-02 17:24:14.101198,https://www.timesofisrael.com/?p=3793558
"Macron scoffs at Trump’s mockery of his marriage, says it ‘doesn’t merit a response’","After US president jokes that his French counterpart's wife 'treats him extremely badly,' Macron urges focus on important matters like Iran: 'This isn't a show' The post Macron scoffs at Trump&#8217;s mockery of his marriage, says it &#8216;doesn&#8217;t merit a response&#8217; appeared first on The Times of Israel .",https://www.timesofisrael.com/macron-scoffs-at-trumps-mockery-of-his-marriage-says-it-doesnt-merit-a-response/,Times of Israel,,2026-04-02T17:14:33,2026-04-02 17:24:14.101148,https://www.timesofisrael.com/?p=3793586
"IDF reoccupies Lebanon areas it held before 2024 Hezbollah cease-fire, as Lebanese Army withdraws","Israeli strikes killed 27 people in Lebanon on Thursday, wounding a further 105, the country's Health Ministry said. According to the ministry, Israeli fire has killed 1,345 in Lebanon since the beginning of the Iran war in late February, including 125 children",https://www.haaretz.com/israel-news/israel-security/2026-04-02/ty-article/.premium/idf-reoccupies-lebanon-areas-it-held-before-2024-hezbollah-cease-fire/0000019d-4e85-d257-a5dd-6e9742cf0000,Haaretz,Rawan Suleiman,2026-04-02T16:13:38,2026-04-02 16:29:02.391169,https://www.haaretz.com/israel-news/israel-security/2026-04-02/ty-article/.premium/idf-reoccupies-lebanon-areas-it-held-before-2024-hezbollah-cease-fire/0000019d-4e85-d257-a5dd-6e9742cf0000
"Trump Speech Unleashes More Pain on US Consumers with $5 Gasoline, Record Diesel in Sight","US President Donald Trump&#8217;s address to the nation on Wednesday, in which he vowed more aggressive strikes on Iran, has...",https://www.algemeiner.com/2026/04/02/trump-speech-unleashes-more-pain-on-us-consumers-with-5-gasoline-record-diesel-in-sight/,Algemeiner,Reuters and Algemeiner Staff,2026-04-02T16:12:59,2026-04-02 16:28:56.676340,https://www.algemeiner.com/?p=769396
Iran Promises ‘Crushing’ Attacks Against the US and Israel,i24 News &#8211; Iran has issued a stark warning of “crushing” retaliatory attacks against the United States and Israel following...,https://www.algemeiner.com/2026/04/02/iran-promises-crushing-attacks-against-the-us-and-israel/,Algemeiner,i24 News and Algemeiner Staff,2026-04-02T16:18:29,2026-04-02 16:28:56.676310,https://www.algemeiner.com/?p=769399
Britain Says 40 Countries Discuss Reopening Strait of Hormuz After Iran Blockade,About 40 countries are discussing joint action to reopen the Strait of Hormuz to stop Iran holding &#8220;the global economy...,https://www.algemeiner.com/2026/04/02/britain-says-40-countries-discuss-reopening-strait-of-hormuz-after-iran-blockade/,Algemeiner,Reuters and Algemeiner Staff,2026-04-02T16:24:56,2026-04-02 16:28:56.676268,https://www.algemeiner.com/?p=769401
"Israelis celebrate Passover under barrages of missiles from Lebanon, Iran",Hezbollah launched some 100 rockets coupled with drones at the Jewish state since the start of the holiday.,https://www.jns.org/news/israel-news/israelis-celebrate-passover-under-barrages-of-missiles-from-lebanon-iran,JNS,JNS Staff,2026-04-02T14:40:03,2026-04-02 15:30:05.336159,https://www.jns.org/news/israel-news/israelis-celebrate-passover-under-barrages-of-missiles-from-lebanon-iran
"Print Issue: Reflections | April 3, 2026","How does the Exodus story, Judaism’s foundational narrative of freedom, speak to the present? We asked local leaders, including rabbis, educators and podcasters, to weigh in. The post Print Issue: Reflections | April 3, 2026 appeared first on Jewish Journal .",https://jewishjournal.com/print-issue/387966/reflcations-april-3-2026/,Jewish Journal,Jewish Journal Staff,2026-04-02T14:42:12,2026-04-02 15:30:02.999012,https://jewishjournal.com/?p=387966
"Sailing Tahiti on The Jet Set TV: Why Windstar Cruises Delivers Small Ships, Big Experiences","[&#8230;] The post Sailing Tahiti on The Jet Set TV: Why Windstar Cruises Delivers Small Ships, Big Experiences appeared first on Jewish Journal .",https://jewishjournal.com/culture/travel/387854/sailing-tahiti-on-the-jet-set-tv-why-windstar-cruises-delivers-small-ships-big-experiences/,Jewish Journal,Lisa Ellen Niver,2026-04-02T15:00:27,2026-04-02 15:30:02.998958,https://jewishjournal.com/?p=387854
Tehran vows ‘crushing’ blows to US after Trump threats to send Iran to ‘stone age’,Iran launches missiles at Tel Aviv; US president says a few more weeks of bombing needed before any ceasefire The post Tehran vows &#8216;crushing&#8217; blows to US after Trump threats to send Iran to &#8216;stone age&#8217; appeared first on The Times of Israel .,https://www.timesofisrael.com/tehran-vows-crushing-blows-to-us-after-trump-threats-to-send-iran-to-stone-age/,Times of Israel,,2026-04-02T14:56:22,2026-04-02 15:29:58.239161,https://www.timesofisrael.com/?p=3793515
'We've returned to the Stone Age': Bombing of south Lebanon bridges cuts off residents,"Without access to medical services, goods or family members remaining on the other side of the Litani River, residents in south Lebanon tell Haaretz of an isolated reality – and their fear that the situation will prolong indefinitely",https://www.haaretz.com/middle-east-news/2026-04-02/ty-article-magazine/.premium/how-idf-bombing-of-litani-bridges-has-cut-off-south-lebanon/0000019d-4db0-dd10-adfd-cdf28b550000,Haaretz,Jack Khoury,2026-04-02T14:20:28,2026-04-02 14:35:11.277332,https://www.haaretz.com/middle-east-news/2026-04-02/ty-article-magazine/.premium/how-idf-bombing-of-litani-bridges-has-cut-off-south-lebanon/0000019d-4db0-dd10-adfd-cdf28b550000
"Hezbollah will pay heavy price for rocket fire during Passover, Katz vows","The Iranian-backed group attacked Israelis as they marked the Exodus, just as the Amalekites attacked the Israelites when they left Egypt, the defense minister said.",https://www.jns.org/news/israel-news/hezbollah-will-pay-heavy-price-for-rocket-fire-during-passover-katz-vows,JNS,JNS Staff,2026-04-02T14:05:10,2026-04-02 14:35:04.005889,https://www.jns.org/news/israel-news/hezbollah-will-pay-heavy-price-for-rocket-fire-during-passover-katz-vows
UAE wishes the ‘people of Israel’ a happy Passover,The Gulf state accompanied its X post with an image of a Seder plate and matza.,https://www.jns.org/news/israel-news/uae-wishes-the-people-of-israel-a-happy-passover,JNS,JNS Staff,2026-04-02T14:20:00,2026-04-02 14:35:04.005848,https://www.jns.org/news/israel-news/uae-wishes-the-people-of-israel-a-happy-passover
"Dust storm turns Israel’s skies gray on Passover, drives up pollution","Environmental Protection Ministry warns sensitive populations to reduce physical activity The post Dust storm turns Israel&#8217;s skies gray on Passover, drives up pollution appeared first on The Times of Israel .",https://www.timesofisrael.com/dust-storm-turns-israels-skies-gray-on-passover-drives-up-pollution/,Times of Israel,,2026-04-02T13:42:06,2026-04-02 14:34:58.719599,https://www.timesofisrael.com/?p=3793482
Oil prices jump over 7% after Trump vows to continue strikes on Iran,"Brent crude futures head for biggest daily gains in weeks, as markets fear Strait of Hormuz will remain closed The post Oil prices jump over 7% after Trump vows to continue strikes on Iran appeared first on The Times of Israel .",https://www.timesofisrael.com/oil-prices-jump-over-7-after-trump-vows-to-continue-strikes-on-iran/,Times of Israel,,2026-04-02T13:42:09,2026-04-02 14:34:58.719564,https://www.timesofisrael.com/?p=3793468
US banks in Paris ramp up security after cops thwart suspected Iran-linked attack,Citigroup orders staff in Paris and Frankfurt to work remotely 'as a precautionary measure' after four people detained in connection with explosive placed outside Bank of America The post US banks in Paris ramp up security after cops thwart suspected Iran-linked attack appeared first on The Times of Israel .,https://www.timesofisrael.com/us-banks-in-paris-ramp-up-security-after-cops-thwart-suspected-iran-linked-attack/,Times of Israel,,2026-04-02T13:58:30,2026-04-02 14:34:58.719527,https://www.timesofisrael.com/?p=3793507
A 19th-century drama hit with post-Oct. 7 fallout: Award-winning ‘Yentl’ goes to London,"Running through April 12, an acclaimed Australian adaptation of the classic Isaac Bashevis Singer story travels abroad, despite what its writer describes as a global aversion to Jewish art The post A 19th-century drama hit with post-Oct. 7 fallout: Award-winning &#8216;Yentl&#8217; goes to London appeared first on The Times of Israel .",https://www.timesofisrael.com/a-19th-century-drama-hit-with-post-oct-7-fallout-award-winning-yentl-goes-to-london/,Times of Israel,,2026-04-02T14:08:43,2026-04-02 14:34:58.719482,https://www.timesofisrael.com/?p=3791907
"Stitched in faith, woven in memory, these precious artifacts bind Jews to their history","The red stitching has long since faded, and the hand-woven linen has softened from white to ivory. Embroidered with a menorah, a double-headed eagle, a lion, and a Magen David, the 18th-century Torah binder is simple in design yet rich in history. The binder is among 25 artifacts from London’s Memorial Scrolls Trust making their... The post Stitched in faith, woven in memory, these precious artifacts bind Jews to their history appeared first on The Forward .",https://forward.com/culture/art/816307/binders-of-the-covenant-jewish-ritual-objects-torah-fordham-exhibit/,The Forward,Cathryn J. Prince,2026-04-02T14:00:53,2026-04-02 14:34:56.590344,https://forward.com/?p=816307
"Democrats to weigh resolution condemning AIPAC, fueling concerns about ‘undercurrent of antisemitism’","(JTA) — The Democratic National Committee is set to consider a resolution at a meeting next week that “condemns the growing influence” of AIPAC. The resolution also condemns large-scale outside spending in elections generally but calls out only the pro-Israel lobby specifically, even as other lobbies are pouring similar sums into trying to influence election... The post Democrats to weigh resolution condemning AIPAC, fueling concerns about &#8216;undercurrent of antisemitism&#8217; appeared first on The Forward .",https://forward.com/fast-forward/816667/democrats-to-weigh-resolution-condemning-aipac-fueling-concerns-about-undercurrent-of-antisemitism/,The Forward,Joseph Strauss,2026-04-02T14:11:37,2026-04-02 14:34:56.590286,https://forward.com/?p=816667
"IDF launches podcast available on Apple, Spotify, Youtube","The episodes will “reveal fascinating stories,” IDF Spokesperson Brig. Gen. Effie Defrin said.",https://www.jns.org/news/israel-news/idf-launches-podcast-available-on-apple-spotify-youtube,JNS,JNS Staff,2026-04-02T13:04:00,2026-04-02 13:39:45.963526,https://www.jns.org/news/israel-news/idf-launches-podcast-available-on-apple-spotify-youtube
IDF locates burial site of fallen War of Independence soldier after 78 years,"Dov Parmet was killed in a battle in Malkia on Israel's border with Lebanon in June 1948. According to the Israeli military, Parmet was buried in a mass grave in Ma'oz Haim, along with 16 other fallen soldiers from the 1948 Malkia battles",https://www.haaretz.com/israel-news/israel-security/2026-04-02/ty-article/.premium/idf-locates-burial-site-of-fallen-war-of-independence-soldier-after-78-years/0000019d-4d6c-d72c-a5ff-dffc1e290000,Haaretz,Ofer Aderet,2026-04-02T11:51:59,2026-04-02 12:32:27.477612,https://www.haaretz.com/israel-news/israel-security/2026-04-02/ty-article/.premium/idf-locates-burial-site-of-fallen-war-of-independence-soldier-after-78-years/0000019d-4d6c-d72c-a5ff-dffc1e290000
"We seek escape, we drink, we feel rage: You can say Israelis have lost it","Israel is at war with Iran again, and time stands still. Tunnels of rage form within me",https://www.haaretz.com/israel-news/culture/2026-04-02/ty-article-magazine/.highlight/we-seek-escape-we-drink-we-feel-rage-you-can-say-israelis-have-lost-it/0000019d-4d6c-d905-a39d-ddef13cb0000,Haaretz,Tahel Frosh,2026-04-02T12:00:23,2026-04-02 12:32:27.477563,https://www.haaretz.com/israel-news/culture/2026-04-02/ty-article-magazine/.highlight/we-seek-escape-we-drink-we-feel-rage-you-can-say-israelis-have-lost-it/0000019d-4d6c-d905-a39d-ddef13cb0000
CENTCOM chief: ‘We are making undeniable progress’ in Iran,"“Their air and missile defense systems have largely been destroyed,” Adm. Brad Cooper stated.",https://www.jns.org/news/u-s-news/centcom-chief-we-are-making-undeniable-progress-in-iran,JNS,,2026-04-02T11:42:55,2026-04-02 12:32:20.671729,https://www.jns.org/news/u-s-news/centcom-chief-we-are-making-undeniable-progress-in-iran
Rubio: War on Iran ‘our last best chance’ to prevent nuclear push,The U.S. secretary of state said Tehran was on the verge of having too many missiles and drones to stop its nuclear weapons program in the future.,https://www.jns.org/news/u-s-news/rubio-war-on-iran-our-last-best-chance-to-prevent-nuclear-push,JNS,JNS Staff,2026-04-02T12:03:00,2026-04-02 12:32:20.671696,https://www.jns.org/news/u-s-news/rubio-war-on-iran-our-last-best-chance-to-prevent-nuclear-push
WATCH: Trump wishes the Jewish people ‘a very happy Passover’,"“This week we are reminded that with true faith, eternal hope and the power of prayer, nothing can stop the people of God.”",https://www.jns.org/news/u-s-news/watch-trump-wishes-the-jewish-people-a-very-happy-passover,JNS,JNS Staff,2026-04-02T12:23:00,2026-04-02 12:32:20.671659,https://www.jns.org/news/u-s-news/watch-trump-wishes-the-jewish-people-a-very-happy-passover
Eight Muslim countries slam Israel’s new death penalty law as risk to regional stability,"Statement by FMs, many from countries which also enforce death penalty, decries law's discriminatory nature toward Palestinians, says it risks 'exacerbating tensions' The post Eight Muslim countries slam Israel’s new death penalty law as risk to regional stability appeared first on The Times of Israel .",https://www.timesofisrael.com/eight-muslim-countries-slam-israels-new-death-penalty-law-as-risk-to-regional-stability/,Times of Israel,,2026-04-02T11:45:46,2026-04-02 12:32:16.049319,https://www.timesofisrael.com/?p=3793402
Iran executes man accused of attacking military site on Israel’s behalf during protests,"Amir-Hossein Hatami is found ​guilty of entering a restricted military facility in ⁠Tehran, damaging and setting fire to the facility, ​and attempting to seize weapons and ammunition The post Iran executes man accused of attacking military site on Israel’s behalf during protests appeared first on The Times of Israel .",https://www.timesofisrael.com/iran-executes-man-accused-of-attacking-military-site-on-israels-behalf-during-protests/,Times of Israel,,2026-04-02T12:09:30,2026-04-02 12:32:16.049274,https://www.timesofisrael.com/?p=3793436
Hezbollah fires around 80 rockets at north on 1st day of Passover; 2 lightly injured,"Men wounded when rocket hit Kiryat Shmona building; properties damaged in northern towns; IDF says over 40 Hezbollah operatives killed in Lebanon strikes, clashes over past day The post Hezbollah fires around 80 rockets at north on 1st day of Passover; 2 lightly injured appeared first on The Times of Israel .",https://www.timesofisrael.com/hezbollah-fires-around-80-rockets-at-north-on-1st-day-of-passover-2-lightly-injured/,Times of Israel,,2026-04-02T12:11:41,2026-04-02 12:32:16.049217,https://www.timesofisrael.com/?post_type=liveblog_entry&p=3793435
"Arab, Muslim-majority countries condemn Israel's death penalty bill for Palestinian convicts","The UAE, Jordan, Turkey, Egypt, Indonesia, Pakistan, Saudi Arabia and Qatar in a joint statement condemned a new bill passed by Israel's Knesset which designates a death penalty almost exclusively for Palestinians convicted of deadly acts of terrorism",https://www.haaretz.com/middle-east-news/2026-04-02/ty-article/.premium/muslim-countries-condemn-israels-death-penalty-bill-for-palestinian-convicts/0000019d-4d6d-db3c-a3df-cdede7720000,Haaretz,Rawan Suleiman,2026-04-02T11:02:23,2026-04-02 11:23:49.841288,https://www.haaretz.com/middle-east-news/2026-04-02/ty-article/.premium/muslim-countries-condemn-israels-death-penalty-bill-for-palestinian-convicts/0000019d-4d6d-db3c-a3df-cdede7720000
"Israelis spend Passover under shadow of Iran war, as businesses cling to survival","Yael Ben Cnaan struggles to keep Tel Aviv flower store afloat during what is meant to be peak period, as Finance Ministry says economy losing at least 4.3 billion shekels per week The post Israelis spend Passover under shadow of Iran war, as businesses cling to survival appeared first on The Times of Israel .",https://www.timesofisrael.com/israelis-spend-passover-under-shadow-of-iran-war-as-businesses-cling-to-survival/,Times of Israel,,2026-04-02T10:24:37,2026-04-02 11:23:38.670864,https://www.timesofisrael.com/?p=3793350
Daily Briefing April 2: Picassos and other veiled masterpieces in Iran,Archaeology and religions reporter Rossella Tercatin reports on art collection amassed by Queen Farah Pahlavi and a Passover Haggadah that examines influence of Egyptian culture The post Daily Briefing April 2: Picassos and other veiled masterpieces in Iran appeared first on The Times of Israel .,https://www.timesofisrael.com/daily-briefing-april-2-picassos-and-other-veiled-masterpieces-in-iran/,Times of Israel,,2026-04-02T10:27:46,2026-04-02 11:23:38.670824,https://www.timesofisrael.com/?p=3791898&preview=true&preview_id=3791898
UK to gather more than 30 countries to discuss methods of reopening Strait of Hormuz,Starmer says talks to assess 'all viable diplomatic and political measures' to restore waterway's use; US not participating; Bahrain's Hormuz resolution runs into fresh obstacles at UN The post UK to gather more than 30 countries to discuss methods of reopening Strait of Hormuz appeared first on The Times of Israel .,https://www.timesofisrael.com/uk-to-gather-more-than-30-countries-to-discuss-methods-of-reopening-strait-of-hormuz/,Times of Israel,,2026-04-02T11:00:01,2026-04-02 11:23:38.670776,https://www.timesofisrael.com/?p=3793380
U.K. gathers over 30 countries for talks on reopening Strait of Hormuz,"As the Iranian blockade of the Strait of Hormuz disrupts the global economy and sends oil prices skyrocketing, countries are trying to figure out how to reestablish trade flows without militarily forcing open the strait and without U.S. support",https://www.haaretz.com/middle-east-news/iran/2026-04-02/ty-article/u-k-gathers-over-30-countries-to-plan-strategy-for-reopening-strait-of-hormuz/0000019d-4d40-d99c-a7bd-7d5af1330000,Haaretz,The Associated Press,2026-04-02T09:32:05,2026-04-02 10:28:00.369516,https://www.haaretz.com/middle-east-news/iran/2026-04-02/ty-article/u-k-gathers-over-30-countries-to-plan-strategy-for-reopening-strait-of-hormuz/0000019d-4d40-d99c-a7bd-7d5af1330000
Northern Shield: Israel renovates public bomb shelters near Lebanese border,A new medical center has opened in Kiryat Shmona to provide daytime care during wartime.,https://www.jns.org/news/israel-news/northern-shield-israel-renovates-public-bomb-shelters-near-lebanese-border,JNS,JNS Staff,2026-04-02T10:11:00,2026-04-02 10:27:53.016078,https://www.jns.org/news/israel-news/northern-shield-israel-renovates-public-bomb-shelters-near-lebanese-border
Bondi terrorist loses bid to prevent media from reporting on his family,Naveed Akram's lawyer says his family fears for their safety; court hears his mother gave interview to press; judge notes any order would be ineffective as wouldn't cover social media The post Bondi terrorist loses bid to prevent media from reporting on his family appeared first on The Times of Israel .,https://www.timesofisrael.com/bondi-terrorist-loses-bid-to-prevent-media-from-reporting-on-his-family/,Times of Israel,,2026-04-02T09:35:04,2026-04-02 10:27:47.601939,https://www.timesofisrael.com/?p=3793358
"Trump’s address to the nation: We are on the cusp of ending Iran’s sinister threat to America, the world","'Core strategic objectives' of war 'nearing completion,' president says, with 2-3 weeks to go. 'If we see them make a move' to retrieve their enriched uranium, 'we’ll hit them again' The post Trump&#8217;s address to the nation: We are on the cusp of ending Iran’s sinister threat to America, the world appeared first on The Times of Israel .",https://www.timesofisrael.com/trumps-address-to-the-nation-we-are-on-the-cusp-of-ending-irans-sinister-threat-to-america-the-world/,Times of Israel,,2026-04-02T09:46:03,2026-04-02 10:27:47.601896,https://www.timesofisrael.com/?p=3793400
"US op to seize Iran’s uranium would take weeks, require building a runway — report","Trump reportedly briefed on risky plan, which would require airlift of up to thousands of troops and heavy equipment to extract material all while forces would be exposed to fire The post US op to seize Iran&#8217;s uranium would take weeks, require building a runway &#8212; report appeared first on The Times of Israel .",https://www.timesofisrael.com/us-op-to-seize-irans-uranium-would-take-weeks-require-building-a-runway-report/,Times of Israel,,2026-04-02T09:57:50,2026-04-02 10:27:47.601835,https://www.timesofisrael.com/?post_type=liveblog_entry&p=3793371
81 killed in 90 days: Man fatally shot in Arab city Baka al-Garbiyeh,"Police said that criminal motives were behind the killing of Odai Ayyat, a man in his 30s and a resident of Baka al-Garbiyeh in northern Israel's so-called Triangle area of Arab towns in central Israel",https://www.haaretz.com/israel-news/israel-security/2026-04-02/ty-article/.premium/81-killed-in-90-days-man-fatally-shot-in-arab-city-baka-al-garbiyeh/0000019d-4c91-d098-a3dd-cc99ec4d0000,Haaretz,Deiaa Haj Yahia,2026-04-02T08:45:25,2026-04-02 09:30:38.595342,https://www.haaretz.com/israel-news/israel-security/2026-04-02/ty-article/.premium/81-killed-in-90-days-man-fatally-shot-in-arab-city-baka-al-garbiyeh/0000019d-4c91-d098-a3dd-cc99ec4d0000
Fellowship to give 45 million shekels in Passover aid amid war,"The International Fellowship of Christians and Jews will provide relief to 200,000 Israelis as the country endures ongoing war.",https://www.jns.org/news/israel-news/fellowship-to-give-45-million-shekels-in-passover-aid-amid-war,JNS,JNS Staff,2026-04-02T08:40:00,2026-04-02 09:30:31.469131,https://www.jns.org/news/israel-news/fellowship-to-give-45-million-shekels-in-passover-aid-amid-war
Likud files police complaint against reporter for incitement against PM,"""Such rampant incitement in the midst of a war, which receives expression and backing from 'Channel 12,' is not only a criminal offense but also a dangerous attempt to weaken the spirit of the people.""",https://www.jns.org/news/israel-news/likud-files-police-complaint-against-reporter-for-incitement-against-pm,JNS,David Isaac,2026-04-02T08:11:00,2026-04-02 08:31:54.216366,https://www.jns.org/news/israel-news/likud-files-police-complaint-against-reporter-for-incitement-against-pm
