title,description,link,source,author,published,scraped_at,guid
"U.S. hits bridges, airport in expanded Iran strikes; Seven killed, Iranian media says","Iran targeted regional countries in response, including Qatar, a key mediator in negotiations. In primetime address to the American public, Trump insisted the war was going well, saying U.S. is 'winning big in Iran, and you will see the fruits of that labor very, very shortly'",https://www.haaretz.com/middle-east-news/iran/2026-07-17/ty-article/u-s-hits-more-bridges-in-iran-in-an-expansion-of-its-airstrike-campaign/0000019f-6e1a-d784-abff-efde5a330000,Haaretz,The Associated Press,2026-07-17T03:32:01,2026-07-17 08:10:43.756632,https://www.haaretz.com/middle-east-news/iran/2026-07-17/ty-article/u-s-hits-more-bridges-in-iran-in-an-expansion-of-its-airstrike-campaign/0000019f-6e1a-d784-abff-efde5a330000
"Israel's Knesset approves its dissolution, Netanyahu votes in favor",Dissolution vote passes 62-0 as Netanyahu coalition advances judicial overhaul and ultra-Orthodox-backed laws before the Knesset breaks up,https://www.haaretz.com/israel-news/elections/2026-07-17/ty-article/.premium/israels-knesset-approves-its-dissolution-netanyahu-votes-in-favor/0000019f-6e98-de95-afff-ffb947490000,Haaretz,Noa Shpigel,2026-07-17T07:46:55,2026-07-17 08:10:43.756594,https://www.haaretz.com/israel-news/elections/2026-07-17/ty-article/.premium/israels-knesset-approves-its-dissolution-netanyahu-votes-in-favor/0000019f-6e98-de95-afff-ffb947490000
"Knesset votes to dissolve, sets Oct. 27 election date",Israeli lawmakers approved the measure unanimously after the coalition passed legislation keeping mandatory military service at 32 months.,https://www.jns.org/news/israel-news/knesset-votes-to-dissolve-formally-sets-oct-27-election-date,JNS,JNS,2026-07-17T06:01:11,2026-07-17 08:10:36.482773,https://www.jns.org/news/israel-news/knesset-votes-to-dissolve-formally-sets-oct-27-election-date
"Iran unveils 'enemies list,' includes JNS host","The file is the first in connection with the ‘Law on Intensifying Punishment for Espionage and Cooperation with the Zionist Regime and Hostile States,’ passed by Tehran’s parliament in the fall of 2025.",https://www.jns.org/news/israel-news/iran-unveils-enemies-list-includes-jns-host,JNS,David Isaac,2026-07-17T06:09:35,2026-07-17 08:10:36.482746,https://www.jns.org/news/israel-news/iran-unveils-enemies-list-includes-jns-host
Herzog visits Oct. 7 exhibit telling the story of Israel’s ‘agony and resilience’,The exhibit on the roof of the Azrieli Mall in Tel Aviv involves 11 large-scale installations of photos and poems.,https://www.jns.org/news/israel-news/herzog-visits-oct-7-exhibit-telling-the-story-of-israels-agony-and-resilience,JNS,JNS,2026-07-17T06:43:08,2026-07-17 08:10:36.482715,https://www.jns.org/news/israel-news/herzog-visits-oct-7-exhibit-telling-the-story-of-israels-agony-and-resilience
"Behind the front lines, Sar-El volunteers help keep the IDF running","At a Tel Aviv gathering, volunteers hear the story of an Ethiopian immigrant’s journey to Israel as the organization seeks to strengthen its growing community beyond IDF bases.",https://www.jns.org/feature/behind-the-front-lines-sar-el-volunteers-help-keep-the-idf-running,JNS,Howard Blas,2026-07-17T06:55:53,2026-07-17 08:10:36.482686,https://www.jns.org/feature/behind-the-front-lines-sar-el-volunteers-help-keep-the-idf-running
Could the World Cup final be decided by an Israeli innovation?,Yosef Dagan championed the penalty shootout after Israel’s elimination from the 1968 Olympics by the drawing of lots.,https://www.jns.org/feature/could-the-world-cup-final-be-decided-by-an-israeli-innovation,JNS,Steve Linde,2026-07-17T07:01:36,2026-07-17 08:10:36.482655,https://www.jns.org/feature/could-the-world-cup-final-be-decided-by-an-israeli-innovation
Israeli legal group urges US to investigate Hind Rajab Foundation,"The complaint urges the Justice Department to determine “who funds, directs, coordinates, services and benefits” from the group's work, and to sanction it for its alleged terror ties.",https://www.jns.org/news/israel-news/israeli-legal-group-urges-us-to-investigate-hind-rajab-foundation,JNS,Etgar Lefkovits,2026-07-17T07:26:09,2026-07-17 08:10:36.482624,https://www.jns.org/news/israel-news/israeli-legal-group-urges-us-to-investigate-hind-rajab-foundation
"IDF acquires new amphibious landing craft, weighs future Turkish threat","If Israel is forced to prepare for a military confrontation with Ankara, it would require a fundamental rebuilding of the Israel Defense Forces, especially on the naval front, a process that could take years.",https://www.jns.org/news/israel-news/idf-acquires-new-amphibious-landing-craft-weighs-future-turkish-threat,JNS,Lilach Shoval,2026-07-17T07:50:11,2026-07-17 08:10:36.482578,https://www.jns.org/news/israel-news/idf-acquires-new-amphibious-landing-craft-weighs-future-turkish-threat
Why JD Vance Awkwardly Dances Around Israel,"Vance is aware of the truth, but he has no reason to say so if it won’t help him politically. The post Why JD Vance Awkwardly Dances Around Israel appeared first on Jewish Journal .",https://jewishjournal.com/commentary/opinion/390264/why-jd-vance-awkwardly-dances-around-israel/,Jewish Journal,Alan Zeitlin,2026-07-17T07:13:48,2026-07-17 08:10:34.215215,https://jewishjournal.com/?p=390264
Mili Avital Never Let Hollywood Rewrite Her Script,She believes artists have an obligation not only to entertain but also to tell stories that preserve humanity when politics often fails. The post Mili Avital Never Let Hollywood Rewrite Her Script appeared first on Jewish Journal .,https://jewishjournal.com/culture/arts/film/390268/mili-avital-never-let-hollywood-rewrite-her-script/,Jewish Journal,Micha Keynan,2026-07-17T07:18:39,2026-07-17 08:10:34.215178,https://jewishjournal.com/?p=390268
Rabbis of LA | Being a Pioneer Is Not a Smooth Path,Second of three parts The post Rabbis of LA | Being a Pioneer Is Not a Smooth Path appeared first on Jewish Journal .,https://jewishjournal.com/community/rabbis-of-la/390287/being-a-pioneer-is-not-a-smooth-path/,Jewish Journal,Ari L. Noonan,2026-07-17T07:45:40,2026-07-17 08:10:34.215144,https://jewishjournal.com/?p=390287
"Israel Bonds Holds LA Events, 2026 Milken Scholars Include Local Jewish Students","Notable people and events in the Jewish LA community. The post Israel Bonds Holds LA Events, 2026 Milken Scholars Include Local Jewish Students appeared first on Jewish Journal .",https://jewishjournal.com/events/movers-shakers/390289/israel-bonds-holds-la-events-2026-milken-scholars-include-local-jewish-students/,Jewish Journal,Jewish Journal Staff,2026-07-17T07:51:01,2026-07-17 08:10:34.215108,https://jewishjournal.com/?p=390289
Complexity doesn’t just need to be embraced — we need the muscles to carry it,"I was engaged in a tense conversation with my teenage son as we made our way to a doctor’s appointment in Jerusalem. “No,” I said to him, “we cant ‘just rid Israel of all Palestinians’ because it will make life easier for us.” Using the healthy argument tools I know so well from being an... Read More The post Complexity doesn’t just need to be embraced — we need the muscles to carry it appeared first on eJewishPhilanthropy .",https://ejewishphilanthropy.com/complexity-doesnt-just-need-to-be-embraced-we-need-the-muscles-to-carry-it/,eJewish Philanthropy,Abi Dauber Sterne,2026-07-17T06:23:04,2026-07-17 08:10:25.351779,https://ejewishphilanthropy.com/?p=177414
The AMIA tragedy does not belong to the past,"July 18 marks one of the most painful chapters in Argentina’s history. Thirty-two years ago this week, the headquarters of the Argentine Israelite Mutual Association (AMIA) was attacked when a suicide bomber drove a car filled with explosives into the building, killing 85 people and wounding more than 300. It was the deadliest terrorist attack... Read More The post The AMIA tragedy does not belong to the past appeared first on eJewishPhilanthropy .",https://ejewishphilanthropy.com/the-amia-tragedy-does-not-belong-to-the-past/,eJewish Philanthropy,Marina Rosenberg,2026-07-17T07:38:00,2026-07-17 08:10:25.351719,https://ejewishphilanthropy.com/?p=177384
Clothes like homes: Sasson Kedem's oversized vision finds a new generation,"Veteran Israeli fashion designer Sasson Kedem and his son Liam, a survivor of the Nova festival massacre, have launched Albi, a menswear label for a generation still searching for solid ground",https://www.haaretz.com/israel-news/culture/2026-07-17/ty-article-magazine/.premium/clothes-like-homes-sasson-kedems-oversized-vision-finds-a-new-generation/0000019f-6a70-df91-a7df-eb70695b0000,Haaretz,Ofir Hovav,2026-07-17T02:55:54,2026-07-17 05:43:17.015495,https://www.haaretz.com/israel-news/culture/2026-07-17/ty-article-magazine/.premium/clothes-like-homes-sasson-kedems-oversized-vision-finds-a-new-generation/0000019f-6a70-df91-a7df-eb70695b0000
Netanyahu hopes political harikari will keep his bloc – and his grip on power – alive,"The final week of the 25th Knesset's was the prime minister's last opportunity to act like a statesman - but he sidelined bills on which there is a consensus in favor of legislation that the Israeli public simply detests ■ Meanwhile, Sara Netanyahu's demand for lifetime security proves that she, too, can read the writing on the wall",https://www.haaretz.com/israel-news/israel-politics/2026-07-17/ty-article/.premium/netanyahu-hopes-political-harikari-keeps-his-bloc-and-his-grip-on-power-alive/0000019f-6c8b-d34a-a99f-7dfbc0200000,Haaretz,Yossi Verter,2026-07-17T03:00:36,2026-07-17 05:43:17.015463,https://www.haaretz.com/israel-news/israel-politics/2026-07-17/ty-article/.premium/netanyahu-hopes-political-harikari-keeps-his-bloc-and-his-grip-on-power-alive/0000019f-6c8b-d34a-a99f-7dfbc0200000
U.S. hits more bridges in Iran in an expansion of its airstrike campaign,"In primetime address to the American public, Trump insisted the war was going well, saying U.S. is 'winning big in Iran, and you will see the fruits of that labor very, very shortly'",https://www.haaretz.com/israel-news/israel-security/2026-07-17/ty-article/u-s-hits-more-bridges-in-iran-in-an-expansion-of-its-airstrike-campaign/0000019f-6e1a-d784-abff-efde5a330000,Haaretz,The Associated Press,2026-07-17T03:32:01,2026-07-17 05:43:17.015413,https://www.haaretz.com/israel-news/israel-security/2026-07-17/ty-article/u-s-hits-more-bridges-in-iran-in-an-expansion-of-its-airstrike-campaign/0000019f-6e1a-d784-abff-efde5a330000
"IDF kills Oct. 7 infiltrator, Hamas platoon commander in Gaza",The military said Nihad Arouq trained terrorists throughout the war and continued planning attacks against Israeli forces and civilians.,https://www.jns.org/news/israel-news/idf-kills-oct-7-infiltrator-hamas-platoon-commander-in-gaza,JNS,JNS Staff,2026-07-17T05:24:30,2026-07-17 05:43:09.713784,https://www.jns.org/news/israel-news/idf-kills-oct-7-infiltrator-hamas-platoon-commander-in-gaza
Herzog: Peace with Saudi Arabia remains ‘my dream’,"In an interview with ""Al-Arabiya,"" the Israeli president praised the Saudi Crown Prince and warned Iran cannot be trusted to honor agreements.",https://www.jns.org/news/israel-news/herzog-peace-with-saudi-arabia-remains-my-dream,JNS,JNS Staff,2026-07-17T05:42:45,2026-07-17 05:43:09.713749,https://www.jns.org/news/israel-news/herzog-peace-with-saudi-arabia-remains-my-dream
Rahm Emanuel and the IHRA Definition of Antisemitism,Rahm Emanuel’s recent speech at Tel Aviv University proves that the IHRA definition does not silence Israel’s critics. The post Rahm Emanuel and the IHRA Definition of Antisemitism appeared first on Jewish Journal .,https://jewishjournal.com/commentary/opinion/390262/rahm-emanuel-and-the-ihra-definition-of-antisemitism/,Jewish Journal,Peter C. Herman,2026-07-17T05:28:09,2026-07-17 05:43:07.145567,https://jewishjournal.com/?p=390262
Maine Democratic Senate candidates echo Platner's anti-Israel rhetoric at debate,"All four candidates at Thursday's debate aligned with the former nominee's positions, accusing Israel of committing genocide in Gaza and pledging to halt U.S. military aid",https://www.haaretz.com/us-news/2026-07-17/ty-article/.premium/maine-democratic-senate-candidates-echo-platners-anti-israel-rhetoric-at-debate/0000019f-6d96-d784-abff-efd678620000,Haaretz,Etan Nechin,2026-07-17T01:23:36,2026-07-17 02:41:44.867307,https://www.haaretz.com/us-news/2026-07-17/ty-article/.premium/maine-democratic-senate-candidates-echo-platners-anti-israel-rhetoric-at-debate/0000019f-6d96-d784-abff-efd678620000
U.S. completes sixth night of strikes on Iran; Qatar says it thwarted missile attack,,https://www.haaretz.com/israel-news/israel-security/2026-07-17/ty-article-live/u-s-completes-sixth-night-of-strikes-on-iran-qatar-thwarts-missile-attack/0000019f-6dc2-d34a-a99f-7df3f6e60000,Haaretz,Haaretz,2026-07-17T02:02:33,2026-07-17 02:41:44.867262,https://www.haaretz.com/israel-news/israel-security/2026-07-17/ty-article-live/u-s-completes-sixth-night-of-strikes-on-iran-qatar-thwarts-missile-attack/0000019f-6dc2-d34a-a99f-7df3f6e60000
"Texas man indicted for threatening to blow up White House, 'kill some billionaire Jews'","Peter James Bloomfield faces up to five years in prison and up to $750,000 in fines on the three counts upon which he was indicted.",https://www.jns.org/news/u-s-news/texas-man-indicted-for-threatening-to-blow-up-white-house-kill-some-billionaire-jews,JNS,Jessica Russak-Hoffman,2026-07-17T02:21:28,2026-07-17 02:41:37.717360,https://www.jns.org/news/u-s-news/texas-man-indicted-for-threatening-to-blow-up-white-house-kill-some-billionaire-jews
US hits dozens of Iranian targets in sixth consecutive night of strikes,"U.S. Central Command said that the attack involved fighter jets, drones and warships.",https://www.jns.org/news/u-s-news/us-hits-dozens-of-iranian-targets-in-sixth-consecutive-night-of-strikes,JNS,,2026-07-17T02:28:28,2026-07-17 02:41:37.717323,https://www.jns.org/news/u-s-news/us-hits-dozens-of-iranian-targets-in-sixth-consecutive-night-of-strikes
Francesca Hong is dishing up a Wisconsin campaign that is about the working class and Israel,(JTA) — Meet Wisconsin’s Mamdani. Francesca Hong is running for governor of Wisconsin emphasizing affordability and opposition to U.S. support for Israel. Her message is one the Republican Governor’s Association hopes to boost ahead of the Democratic primary next month: It unveiled an ad on Thursday dubbing her “too liberal” for Wisconsin – set to... The post Francesca Hong is dishing up a Wisconsin campaign that is about the working class and Israel appeared first on The Forward .,https://forward.com/fast-forward/838814/francesca-hong-is-dishing-up-a-wisconsin-campaign-that-is-about-the-working-class-and-israel/,The Forward,Grace Gilson,2026-07-17T00:48:34,2026-07-17 02:41:31.108126,https://forward.com/?p=838814
"In the wake of Graham Platner’s success (and fall), a candidate to replace him changes his mind about ‘genocide’","(JTA) — When Jordan Wood vied last fall for the Democratic nomination for Maine’s U.S. Senate seat, he avoided accusing Israel of genocide, citing a link between rising antisemitism and “the language” that people use. Graham Platner, who went on to overwhelmingly win the nomination, did not stint on using the term. Platner is out... The post In the wake of Graham Platner’s success (and fall), a candidate to replace him changes his mind about ‘genocide’ appeared first on The Forward .",https://forward.com/fast-forward/838805/in-the-wake-of-graham-platners-success-and-fall-a-candidate-to-replace-him-changes-his-mind-about-genocide/,The Forward,Joseph Strauss,2026-07-17T00:51:39,2026-07-17 02:41:31.108075,https://forward.com/?p=838805
How a Trump attack on Jon Ossoff could fuel the first Jewish presidency,"(JTA) — Jon Ossoff, the Jewish senator from Georgia and the focus of speculation about a 2028 run for the presidency, is prepared to be the target of an address Thursday night by President Donald Trump. Ossoff told reporters that if Trump, as expected, questions his and Sen. Raphael Warnock’s 2021 election wins, then the... The post How a Trump attack on Jon Ossoff could fuel the first Jewish presidency appeared first on The Forward .",https://forward.com/fast-forward/838685/how-a-trump-attack-on-jon-ossoff-could-fuel-the-first-jewish-presidency/,The Forward,Joseph Strauss,2026-07-17T00:59:24,2026-07-17 02:41:31.108013,https://forward.com/?p=838685
Most NorCal House Democrats vote to cut off aid to Israel,"In a significant shift, more than half of House Democrats, including Rep. Nancy Pelosi and eight others from Northern California, voted to cut off all aid to Israel in a [&#8230;]",https://jweekly.com/2026/07/16/most-northern-california-house-democrats-vote-to-cut-off-aid-to-israel/,J. Weekly,Cayla Labgold-Carroll,2026-07-17T01:37:03,2026-07-17 02:41:23.938666,https://jweekly.com/?p=307411
Eisenkot allows Israelis to replace Netanyahu without changing who they are,,https://www.haaretz.com/opinion/2026-07-17/ty-article-opinion/.premium/eisenkot-allows-israelis-to-replace-netanyahu-without-changing-who-they-are/0000019f-6c88-d161-a5df-ecdaf6190000,Haaretz,Carolina Landsmann,2026-07-16T23:05:08,2026-07-16 23:59:55.579590,https://www.haaretz.com/opinion/2026-07-17/ty-article-opinion/.premium/eisenkot-allows-israelis-to-replace-netanyahu-without-changing-who-they-are/0000019f-6c88-d161-a5df-ecdaf6190000
Israel needs a ballox-box revolution to rid itself of Netanyahu,,https://www.haaretz.com/opinion/2026-07-17/ty-article-opinion/.premium/israel-needs-a-ballox-box-revolution-to-rid-itself-of-netanyahu/0000019f-6c89-da5c-ab9f-ffbd0c980000,Haaretz,Nehemia Shtrasler,2026-07-16T23:31:27,2026-07-16 23:59:55.579555,https://www.haaretz.com/opinion/2026-07-17/ty-article-opinion/.premium/israel-needs-a-ballox-box-revolution-to-rid-itself-of-netanyahu/0000019f-6c89-da5c-ab9f-ffbd0c980000
"Labor secretary nominee vows to combat religious discrimination, Jew-hatred","""It's a very important role for the federal government to play to protect workers and religions of all faith, and that's what you have my commitment to do,"" Keith Sonderling said.",https://www.jns.org/news/u-s-news/labor-secretary-nominee-vows-to-combat-religious-discrimination-jew-hatred,JNS,,2026-07-16T23:05:48,2026-07-16 23:59:47.542394,https://www.jns.org/news/u-s-news/labor-secretary-nominee-vows-to-combat-religious-discrimination-jew-hatred
All the Words — A poem for Parsha Devarim,I’m taking that phrase back – The river and the sea . . . The post All the Words — A poem for Parsha Devarim appeared first on Jewish Journal .,https://jewishjournal.com/judaism/390122/all-the-words-a-poem-for-parsha-devarim/,Jewish Journal,Rick Lupert,2026-07-16T23:00:52,2026-07-16 23:59:45.049226,https://jewishjournal.com/?p=390122
Francesca Hong is dishing up a Wisconsin campaign that is about the working class and Israel,Could this Midwestern battle ground state place a Democratic socialist at its helm? -- The post Francesca Hong is dishing up a Wisconsin campaign that is about the working class and Israel appeared first on Jewish Telegraphic Agency .,https://www.jta.org/2026/07/16/politics/francesca-hong-is-dishing-up-a-wisconsin-campaign-that-is-about-the-working-class-and-israel,JTA,Grace Gilson,2026-07-16T23:11:39,2026-07-16 23:59:38.339448,https://www.jta.org/?p=1904697
Jailed Gaza doctor Abu Safiya says he was beat and isolated in Israeli prison after lawyer's visit,"According to Physicians for Human Rights-Israel, detained Gaza hospital director Hussam Abu Safiya, who had been held without charge in Israeli prison since 2024, told his lawyers he is subjected to continuous beatings while masked guards stood within earshot",https://www.haaretz.com/israel-news/israel-security/2026-07-17/ty-article/.premium/jailed-gaza-doctor-says-he-was-beat-and-isolated-after-lawyers-previous-visit/0000019f-6b4b-d782-ad9f-fffb84bc0000,Haaretz,Nir Hasson,2026-07-16T21:17:22,2026-07-16 22:57:06.755572,https://www.haaretz.com/israel-news/israel-security/2026-07-17/ty-article/.premium/jailed-gaza-doctor-says-he-was-beat-and-isolated-after-lawyers-previous-visit/0000019f-6b4b-d782-ad9f-fffb84bc0000
Good riddance to a bad Knesset,,https://www.haaretz.com/opinion/editorial/2026-07-17/ty-article-opinion/good-riddance-to-a-bad-knesset/0000019f-6c89-da5c-ab9f-ffbdc6f00000,Haaretz,Haaretz Editorial,2026-07-16T22:02:49,2026-07-16 22:57:06.755538,https://www.haaretz.com/opinion/editorial/2026-07-17/ty-article-opinion/good-riddance-to-a-bad-knesset/0000019f-6c89-da5c-ab9f-ffbdc6f00000
Shin Bet chief Zini seeking to question Channel 12 reporters over Iran war leak,"A security source told Haaretz that the Shin Bet is trying to root out who leaked the timing of the Iran war's opening strike to the broadcaster. The greater effect, however, could be a chilling warning to any journalist criticizing the prime minister",https://www.haaretz.com/israel-news/2026-07-17/ty-article/.premium/shin-bet-chief-zini-seeking-to-question-channel-12-reporters-over-iran-war-leak/0000019f-6c73-d161-a5df-ecf368340000,Haaretz,Gidi Weitz,2026-07-16T22:17:50,2026-07-16 22:57:06.755510,https://www.haaretz.com/israel-news/2026-07-17/ty-article/.premium/shin-bet-chief-zini-seeking-to-question-channel-12-reporters-over-iran-war-leak/0000019f-6c73-d161-a5df-ecf368340000
Israel's Knesset recognizes IDF soldiers' PTSD as service-related disability,"The new Israeli law recognizes 'combat trauma survivors,' whom it defines as soldiers diagnosed with PTSD resulting from circumstances unique to military service. The Defense Ministry estimates that 50,000 Israelis will be treated for service-related mental health issues by 2028",https://www.haaretz.com/israel-news/israel-security/2026-07-17/ty-article/.premium/israels-knesset-recognizes-idf-soldiers-ptsd-as-service-related-disability/0000019f-6a96-d782-ad9f-fffeb0cb0000,Haaretz,Noa Shpigel,2026-07-16T22:23:06,2026-07-16 22:57:06.755476,https://www.haaretz.com/israel-news/israel-security/2026-07-17/ty-article/.premium/israels-knesset-recognizes-idf-soldiers-ptsd-as-service-related-disability/0000019f-6a96-d782-ad9f-fffeb0cb0000
The Netanyahu regime's black boxes must be revealed,"When it comes to two of the Israeli prime minister's most consequential decisions, the judicial overhaul and Israel's mass killing in Gaza, Netanyahu has concealed both how they were made and who was involved in making them",https://www.haaretz.com/opinion/2026-07-17/ty-article-opinion/.premium/the-netanyahu-regimes-black-boxes-must-be-revealed/0000019f-6c66-da5c-ab9f-fff76bc20000,Haaretz,Aluf Benn,2026-07-16T22:34:27,2026-07-16 22:57:06.755435,https://www.haaretz.com/opinion/2026-07-17/ty-article-opinion/.premium/the-netanyahu-regimes-black-boxes-must-be-revealed/0000019f-6c66-da5c-ab9f-fff76bc20000
103 House Democrats Back Measure Their Own Whip Said Could Cut Aid to Palestinians,More than 100 House Democrats voted Wednesday to eliminate U.S. funding for Israel—even after their party’s second-ranking House leader warned...,https://www.algemeiner.com/2026/07/16/103-house-democrats-back-measure-their-own-whip-said-could-cut-aid-to-palestinians/,Algemeiner,Corey Walker,2026-07-16T21:26:23,2026-07-16 22:57:02.178820,https://www.algemeiner.com/?p=776274
EXCLUSIVE: Irvine vice mayor resigns from Rotary leadership over new president’s alleged Jew-hatred,"“It’s the same thing if you asked me to be led by someone who openly hates black people or hates Asian people or a member of the KKK,” James Mai told JNS.",https://www.jns.org/news/u-s-news/exclusive-irvine-vice-mayor-resigns-from-rotary-leadership-over-new-presidents-alleged-jew-hatred,JNS,Aaron Bandler,2026-07-16T21:19:43,2026-07-16 22:56:59.801707,https://www.jns.org/news/u-s-news/exclusive-irvine-vice-mayor-resigns-from-rotary-leadership-over-new-presidents-alleged-jew-hatred
Battle of Haifa: The Indian cavalry that freed the city in 1918,"The Jodhpur and Mysore Lancers carried traditions older than most modern armies, and their courage shaped the destiny of a land far from their own.",https://www.jns.org/opinion/eliezer-avraham/battle-of-haifa-the-indian-cavalry-that-freed-the-city-in-1918,JNS,Eliezer Avraham,2026-07-16T22:00:00,2026-07-16 22:56:59.801666,https://www.jns.org/opinion/eliezer-avraham/battle-of-haifa-the-indian-cavalry-that-freed-the-city-in-1918
Rubio: US counterterrorism has overlooked far-left political violence,"New State Department visa restrictions on far-left terror groups aim to address a threat easily “dismissed as a partisan fiction,” the U.S. secretary of state said.",https://www.jns.org/news/u-s-news/rubio-us-counterterrorism-has-overlooked-far-left-political-violence,JNS,Mike Wagenheim,2026-07-16T22:49:35,2026-07-16 22:56:59.801630,https://www.jns.org/news/u-s-news/rubio-us-counterterrorism-has-overlooked-far-left-political-violence
"Leftist Jews Will Criticize their People, But Never Their Party","Criticizing their political party would mean betraying the identity that has defined most American Jews since the days of FDR. The post Leftist Jews Will Criticize their People, But Never Their Party appeared first on Jewish Journal .",https://jewishjournal.com/commentary/columnist/editors-note/390241/leftist-jews-will-criticize-their-people-but-never-their-party/,Jewish Journal,David Suissa,2026-07-16T21:15:35,2026-07-16 22:56:57.614596,https://jewishjournal.com/?p=390241
