title,description,link,source,author,published,scraped_at,guid
Israel shifts Hebron planning authority from PA to Civil Administration,"The change will centralize all civil planning approvals for construction, preservation and infrastructure in Israeli hands.",https://www.jns.org/news/israel-news/israel-shifts-hebron-planning-authority-from-pa-to-civil-administration,JNS,JNS Staff,2026-06-16T12:32:20,2026-06-16 12:41:50.075143,https://www.jns.org/news/israel-news/israel-shifts-hebron-planning-authority-from-pa-to-civil-administration
"'Just lots of questions,' experts say of reported terms of US deal with Iran","“Monitoring this agreement cannot be passive,” Daniel S. Mariaschin, CEO of B’nai B’rith International, told JNS.",https://www.jns.org/news/u-s-news/just-lots-of-questions-experts-say-of-reported-terms-of-us-deal-with-iran,JNS,Rikki Zagelbaum,2026-06-16T12:33:44,2026-06-16 12:41:50.075113,https://www.jns.org/news/u-s-news/just-lots-of-questions-experts-say-of-reported-terms-of-us-deal-with-iran
Israel approves national AI plan to become technology powerhouse,"“Our goal is clear: to establish Israel as a global leader in the field of artificial intelligence,"" Netanyahu said.",https://www.jns.org/news/israel-news/israel-approves-national-ai-plan-to-become-technology-powerhouse,JNS,Steve Linde,2026-06-16T12:36:40,2026-06-16 12:41:50.075073,https://www.jns.org/news/israel-news/israel-approves-national-ai-plan-to-become-technology-powerhouse
US has been using Iranian smuggling tactics to sneak Gulf oil past Hormuz blockade,"Sources tell Reuters US military has conducted dozens of risky ship-to-ship oil transfers, and reveal that the Apache helicopter downed last week was part of the operation The post US has been using Iranian smuggling tactics to sneak Gulf oil past Hormuz blockade appeared first on The Times of Israel .",https://www.timesofisrael.com/us-has-been-using-iranian-smuggling-tactics-to-sneak-gulf-oil-past-hormuz-blockade/,Times of Israel,,2026-06-16T10:34:13,2026-06-16 12:41:44.532825,https://www.timesofisrael.com/?p=3843927
"Supreme Court rejects appeal of Gaza hospital chief, a Hamas officer detained by Israel","Hussam Abu Safiya, who runs Kamal Adwan Hospital and is a colonel in Hamas Military Medical Services, has been in administrative detention since 2024, now in solitary confinement The post Supreme Court rejects appeal of Gaza hospital chief, a Hamas officer detained by Israel appeared first on The Times of Israel .",https://www.timesofisrael.com/supreme-court-rejects-appeal-of-gaza-hospital-chief-a-hamas-officer-detained-by-israel/,Times of Israel,,2026-06-16T11:05:01,2026-06-16 12:41:44.532784,https://www.timesofisrael.com/?p=3843970
"2,000 Years of Jewish Argument, Meet 250 Years of America - Sponsored Content","What do Jewish texts say about equality, liberty, rebellion, and the pursuit of happiness? Find out in Pardes’s Talmud of America commentary on the Declaration of Independence. The post 2,000 Years of Jewish Argument, Meet 250 Years of America appeared first on The Times of Israel .",https://toi.li/urAqjz,Times of Israel,,2026-06-16T11:35:48,2026-06-16 12:41:44.532741,https://www.timesofisrael.com/?post_type=spotlight&p=3844046
Iran executes two over anti-government protests,Javad Zamani and Abolfazl Saedi convicted of waging war against God and 'corruption on earth' for allegedly participating in January anti-regime rioting The post Iran executes two over anti-government protests appeared first on The Times of Israel .,https://www.timesofisrael.com/iran-executes-two-over-anti-government-protests/,Times of Israel,,2026-06-16T12:03:30,2026-06-16 12:41:44.532678,https://www.timesofisrael.com/?p=3844036
Trump made a deal with Iran. What will Netanyahu do?,,https://www.haaretz.com/israel-news/podcasts/2026-06-16/ty-article-podcast/trump-made-a-deal-with-iran-what-will-netanyahu-do/0000019e-cf6a-d45a-ab9e-cfea7c190000,Haaretz,Haaretz Podcast,2026-06-16T08:21:15,2026-06-16 10:46:23.320194,https://www.haaretz.com/israel-news/podcasts/2026-06-16/ty-article-podcast/trump-made-a-deal-with-iran-what-will-netanyahu-do/0000019e-cf6a-d45a-ab9e-cfea7c190000
Israeli airlines could be rocked by EU fuel rules as government stalls,"The use of sustainable aviation fuel across the world is rising, as Europe enacts legislation and the United States provides incentives ■ But in Israel, the lack of preparedness means that the aviation industry will once again be forced to remain at the mercy of countries that agree to export SAF",https://www.haaretz.com/israel-news/business/economy-finance/2026-06-16/ty-article/.premium/israeli-airlines-could-be-rocked-by-eu-fuel-rules-as-government-stalls/0000019e-cf30-dcd2-adbe-efbacc930000,Haaretz,Idan Binyamin,2026-06-16T10:19:44,2026-06-16 10:46:23.320166,https://www.haaretz.com/israel-news/business/economy-finance/2026-06-16/ty-article/.premium/israeli-airlines-could-be-rocked-by-eu-fuel-rules-as-government-stalls/0000019e-cf30-dcd2-adbe-efbacc930000
Israel's top court rejects appeal to release Gaza hospital head from solitary confinement,"Dr. Hussam Abu Safiya, director of Gaza's Kamal Adwan Hospital, has been held since 2024 under the Unlawful Combatants Law, which permits the arrest of foreign nationals alleged to belong to terrorist groups or to have taken part in hostile actions. Physicians for Human Rights called the ruling 'a profound moral failure'",https://www.haaretz.com/israel-news/israel-security/2026-06-16/ty-article/.premium/israels-top-court-rejects-appeal-for-release-of-gaza-doctor-held-without-charge/0000019e-cf8b-d9a8-a5de-dfeba04b0000,Haaretz,Nir Hasson,2026-06-16T10:40:29,2026-06-16 10:46:23.320125,https://www.haaretz.com/israel-news/israel-security/2026-06-16/ty-article/.premium/israels-top-court-rejects-appeal-for-release-of-gaza-doctor-held-without-charge/0000019e-cf8b-d9a8-a5de-dfeba04b0000
"Right-wing NGO pushes for new 'security outposts' in Negev, coordinates with IDF","Under the initiative, led by the Hashomer Hachadash and with the involvement of the Ramat HaNegev Regional Council and the army, young Israelis are recruited to establish a series of outposts along the border with Egypt, where 'stronger civilian presence' is needed to address crime, smuggling and other security challenges",https://www.haaretz.com/israel-news/israel-security/2026-06-16/ty-article/.premium/right-wing-ngo-pushes-for-new-security-outposts-in-negev-coordinates-with-idf/0000019e-cf01-d45a-ab9e-cfeb2d230000,Haaretz,Eden Solomon,2026-06-16T10:42:30,2026-06-16 10:46:23.320084,https://www.haaretz.com/israel-news/israel-security/2026-06-16/ty-article/.premium/right-wing-ngo-pushes-for-new-security-outposts-in-negev-coordinates-with-idf/0000019e-cf01-d45a-ab9e-cfeb2d230000
Araghchi: End of IDF ops in Lebanon 'inseparable' part of US deal,The Iranian foreign minister warned that any Israel Defense Forces actions in the country would be considered a violation of the MoU.,https://www.jns.org/news/world/araghchi-end-of-idf-ops-in-lebanon-inseparable-part-of-us-deal,JNS,JNS Staff,2026-06-16T09:01:43,2026-06-16 10:46:16.424562,https://www.jns.org/news/world/araghchi-end-of-idf-ops-in-lebanon-inseparable-part-of-us-deal
Israeli Supreme Court rejects challenge to detention of Gaza hospital chief,"Hussam Abu Safiya, a Hamas terrorist who ran the Kamal Adwan Hospital in the Strip, has been in custody since late 2024.",https://www.jns.org/news/israel-news/israeli-supreme-court-rejects-challenge-to-detention-of-gaza-hospital-chief,JNS,JNS Staff,2026-06-16T09:46:43,2026-06-16 10:46:16.424534,https://www.jns.org/news/israel-news/israeli-supreme-court-rejects-challenge-to-detention-of-gaza-hospital-chief
"Vance touts Iran deal, stresses compliance leverage","The U.S. vice president said that the memorandum of understanding mandates uranium stockpile destruction and verification, with no benefits if Tehran fails to comply.",https://www.jns.org/news/world/vance-touts-iran-deal-stresses-compliance-leverage,JNS,JNS Staff,2026-06-16T10:02:58,2026-06-16 10:46:16.424505,https://www.jns.org/news/world/vance-touts-iran-deal-stresses-compliance-leverage
"PA 'Martyrs Fund' remains active amid continued international funding, experts warn","Officials, watchdogs and victims’ advocates say the Palestinian Authority continues paying stipends to convicted terrorists and their families, and criticize loopholes in international donor funding and oversight mechanisms.",https://www.jns.org/feature/pa-martyrs-fund-remains-active-amid-continued-international-funding-experts-warn,JNS,Josh Hasten,2026-06-16T10:20:16,2026-06-16 10:46:16.424451,https://www.jns.org/feature/pa-martyrs-fund-remains-active-amid-continued-international-funding-experts-warn
"After 20 years bringing christian groups to Israel, one lesson stands above the rest - Sponsored Content","The post After 20 years bringing christian groups to Israel, one lesson stands above the rest appeared first on The Times of Israel .",https://www.timesofisrael.com/spotlight/after-20-years-bringing-christian-groups-to-israel-one-lesson-stands-above-the-rest/,Times of Israel,,2026-06-16T08:03:49,2026-06-16 10:46:11.850398,https://www.timesofisrael.com/?post_type=spotlight&p=3839587
"Israel Police spokesman calls Yair Golan a ‘destroyer of Israel,’ drawing backlash","Aryeh Doron later walks back remarks he made after opposition Democrats leader said he'd keep a close eye on police during coming election to ensure it isn't serving government The post Israel Police spokesman calls Yair Golan a &#8216;destroyer of Israel,&#8217; drawing backlash appeared first on The Times of Israel .",https://www.timesofisrael.com/israel-police-spokesman-calls-yair-golan-a-disturber-of-israel-drawing-backlash/,Times of Israel,,2026-06-16T08:35:53,2026-06-16 10:46:11.850365,https://www.timesofisrael.com/?p=3843829
"Vance ‘confident’ Israel will join deal, as US and Iran prepare for talks on Friday","Iran's FM says new nuclear talks to follow formal signing in Switzerland, with text of MOU still unreleased; Vance says uranium removal, IAEA inspections 'core part' of deal The post Vance &#8216;confident’ Israel will join deal, as US and Iran prepare for talks on Friday appeared first on The Times of Israel .",https://www.timesofisrael.com/vance-confident-israel-will-join-deal-as-us-and-iran-prepare-for-talks-on-friday/,Times of Israel,,2026-06-16T10:18:52,2026-06-16 10:46:11.850324,https://www.timesofisrael.com/?p=3843800
Daily Briefing June 16 – What’s in and out of Iran deal: A war of narratives,Diplomatic correspondent Lazar Berman on Netanyahu's press conference and Israel's stance on the memorandum of understanding that will be (re)signed on Friday The post Daily Briefing June 16 &#8211; What&#8217;s in and out of Iran deal: A war of narratives appeared first on The Times of Israel .,https://www.timesofisrael.com/daily-briefing-june-16-whats-in-and-out-of-iran-deal-a-war-of-narratives/,Times of Israel,,2026-06-16T10:21:58,2026-06-16 10:46:11.850268,https://www.timesofisrael.com/?p=3843932&preview=true&preview_id=3843932
Traumatized active-duty IDF soldiers need PTSD treatment - Sponsored Content,"After 300+ days of combat and witnessing severe trauma, a soldier on break appeals for therapy funding to heal for his family's sake before returning to active duty. The post Traumatized active-duty IDF soldiers need PTSD treatment appeared first on The Times of Israel .",https://toi.li/T8KAoQ,Times of Israel,,2026-06-16T10:24:47,2026-06-16 10:46:11.850220,https://www.timesofisrael.com/?post_type=spotlight&p=3843847
UK appeals court upholds ban on Palestine Action as a terrorist organization,"(JTA) — A British appeals court ruled Monday that the government acted lawfully in banning a prominent pro-Palestinian group as a terrorist organization. Jewish groups welcomed the decision to maintain the ban on Palestine Action, which has staged multiple destructive attacks on military installations and weapons manufacturers in Britain. The government banned Palestine Action in... The post UK appeals court upholds ban on Palestine Action as a terrorist organization appeared first on The Forward .",https://forward.com/fast-forward/831866/uk-appeals-court-upholds-ban-on-palestine-action-as-a-terrorist-organization/,The Forward,Kelly Hartog,2026-06-16T08:33:08,2026-06-16 10:46:09.787879,https://forward.com/?p=831866
Trump-backed Oklahoma congressional candidate supports Israel — and says the Antichrist will be Jewish,"(JTA) — A pro-Israel pastor who inveighs against “sharia law” and wants Jews to accept Jesus is the favored candidate in a crowded congressional primary in Oklahoma on Tuesday. Jackson Lahmeyer, the founder of Pastors for Trump and a political activist from the Tulsa area, secured the president’s endorsement ahead of Tuesday’s primary for the... The post Trump-backed Oklahoma congressional candidate supports Israel — and says the Antichrist will be Jewish appeared first on The Forward .",https://forward.com/fast-forward/831830/trump-backed-oklahoma-congressional-candidate-supports-israel-and-says-the-antichrist-will-be-jewish/,The Forward,"Andrew Lapin, Grace Gilson",2026-06-16T08:36:59,2026-06-16 10:46:09.787827,https://forward.com/?p=831830
Trump may be making a classic error in seeking peace with Iran,"An assumption has shaped Western thinking about Iran for decades: that the Islamic Republic has similar goals to those of the West, and can therefore be incentivized to integrate into a more stable regional order. Vice President JD Vance gave that assumption its latest expression when he said a potential new peace agreement between Iran... The post Trump may be making a classic error in seeking peace with Iran appeared first on The Forward .",https://forward.com/opinion/831842/iran-trump-israel/,The Forward,Peter Himmelman,2026-06-16T10:00:29,2026-06-16 10:46:09.787767,https://forward.com/?p=831842
When academic inquiry requires a police escort,"In April, the University of Cincinnati hosted a multi-day conference, proudly supported by the Academic Engagement Network, exploring the Abraham Accords and the possibilities for regional collaboration and cooperation that may emerge from those agreements. Diplomats, policymakers, academics and researchers gathered to discuss topics as wide-ranging as interfaith Zionism, developing an Abraham Accords curriculum and... Read More The post When academic inquiry requires a police escort appeared first on eJewishPhilanthropy .",https://ejewishphilanthropy.com/when-academic-inquiry-requires-a-police-escort/,eJewish Philanthropy,Raeefa Shams,2026-06-16T09:34:00,2026-06-16 10:46:04.956799,https://ejewishphilanthropy.com/?p=175938
"When it comes to legacy giving, success demands a decade","Jewish communities across North America are searching for sustainable financial models amid demographic shifts, leadership transitions, and growing competition for philanthropic dollars. Legacy giving, my area of expertise,is often cited as part of the solution. But here is the hard truth:Legacy success does not align with the short-term culture of Jewish philanthropy. For the pastdecade,I’veservedas... Read More The post When it comes to legacy giving, success demands a decade appeared first on eJewishPhilanthropy .",https://ejewishphilanthropy.com/when-it-comes-to-legacy-giving-success-demands-a-decade/,eJewish Philanthropy,Tamra L. Dollin,2026-06-16T10:09:00,2026-06-16 10:46:04.956746,https://ejewishphilanthropy.com/?p=175931
Fallen standing stone built into later house may show King Hezekiah reform,"Repurposing religious artifacts as bricks was not rare in the ancient world, but this particular case in Tel 'Eton may support the historicity of a biblical tale",https://www.haaretz.com/archaeology/2026-06-16/ty-article/fallen-standing-stone-built-into-later-house-may-show-king-hezekiah-reform/0000019e-cb83-d98a-a3be-efb34a350000,Haaretz,Ruth Schuster,2026-06-16T06:33:09,2026-06-16 08:15:35.459742,https://www.haaretz.com/archaeology/2026-06-16/ty-article/fallen-standing-stone-built-into-later-house-may-show-king-hezekiah-reform/0000019e-cb83-d98a-a3be-efb34a350000
"Iran's FM: Any Israeli strike on Lebanon, continued presence there violates interim deal",U.S. officials question Iran's willingness to comply with the framework even as Trump says Tehran agreed to 'never have a nuclear weapon.' JD Vance calls the memorandum a 'very general document',https://www.haaretz.com/middle-east-news/iran/2026-06-16/ty-article/report-billions-in-frozen-iranian-assets-may-be-released-under-u-s-deal/0000019e-cee1-d142-a19e-ffe3b3640000,Haaretz,Reuters,2026-06-16T06:58:01,2026-06-16 08:15:35.459713,https://www.haaretz.com/middle-east-news/iran/2026-06-16/ty-article/report-billions-in-frozen-iranian-assets-may-be-released-under-u-s-deal/0000019e-cee1-d142-a19e-ffe3b3640000
Some Jewish fans say date of Knicks' historic win is more than coincidence,The notable number in Jewish tradition already had a Knicks connection,https://www.haaretz.com/us-news/2026-06-16/ty-article/some-jewish-fans-say-date-of-knicks-historic-win-has-deeper-meaning/0000019e-cf5d-d9a8-a5de-df7f88850000,Haaretz,JTA,2026-06-16T08:01:13,2026-06-16 08:15:35.459676,https://www.haaretz.com/us-news/2026-06-16/ty-article/some-jewish-fans-say-date-of-knicks-historic-win-has-deeper-meaning/0000019e-cf5d-d9a8-a5de-df7f88850000
Israel rejects international claims it restricts medical aid to Gaza,"COGAT insists it ""continues to allow and facilitate the entry of humanitarian supplies on a large scale.""",https://www.jns.org/news/israel-news/israel-rejects-international-claims-it-restricts-medical-aid-to-gaza,JNS,David Isaac,2026-06-16T06:17:56,2026-06-16 08:15:28.835334,https://www.jns.org/news/israel-news/israel-rejects-international-claims-it-restricts-medical-aid-to-gaza
"2,700-year-old standing stone may offer new evidence of King Hezekiah’s religious reforms",A Bar-Ilan University researcher argues that a cultic stone found at Tel Eton could provide archaeological proof of religious change in Judah during the First Temple period.,https://www.jns.org/feature/2-700-year-old-standing-stone-may-offer-new-evidence-of-king-hezekiahs-religious-reforms,JNS,Steve Linde,2026-06-16T06:30:00,2026-06-16 08:15:28.835309,https://www.jns.org/feature/2-700-year-old-standing-stone-may-offer-new-evidence-of-king-hezekiahs-religious-reforms
Western Negev’s defiant lesson for the international community,"The area is no longer just Israel’s frontline of defense. Armed with world-class innovation, those working and living in this region are rebuilding the future.",https://www.jns.org/opinion/noam-bedein/western-negevs-defiant-lesson-for-the-international-community,JNS,Noam Bedein,2026-06-16T06:30:00,2026-06-16 08:15:28.835281,https://www.jns.org/opinion/noam-bedein/western-negevs-defiant-lesson-for-the-international-community
Trump: Iran agreed to 'never have a nuclear weapon',The president also denied reports that Tehran would be receiving $300 billion for reconstruction.,https://www.jns.org/news/u-s-news/trump-iran-agreed-to-never-have-a-nuclear-weapon,JNS,Amelie Botbol,2026-06-16T06:36:02,2026-06-16 08:15:28.835251,https://www.jns.org/news/u-s-news/trump-iran-agreed-to-never-have-a-nuclear-weapon
Sa'ar: Anti-Israel discrimination at Eurosatory trade fair due to fear of competition,"The Israeli foreign minister pointed to French Prime Minister Lecornu's recent statement that ""Israel is one of the biggest competitors of the French defense industry.""",https://www.jns.org/news/israel-news/saar-anti-israel-discrimination-at-eurosatory-trade-fair-due-to-fear-of-competition,JNS,JNS Staff,2026-06-16T06:46:42,2026-06-16 08:15:28.835227,https://www.jns.org/news/israel-news/saar-anti-israel-discrimination-at-eurosatory-trade-fair-due-to-fear-of-competition
Payoneer purchased by Canada's Nuvei for $2.75 billion,The deal valued the Israeli fintech company at a 21% premium to its Nasdaq closing price on Friday.,https://www.jns.org/news/israel-news/payoneer-purchased-by-canadas-nuvei-for-2-75-billion,JNS,JNS Staff,2026-06-16T07:06:57,2026-06-16 08:15:28.835200,https://www.jns.org/news/israel-news/payoneer-purchased-by-canadas-nuvei-for-2-75-billion
Fourth suspect nabbed in Dutch synagogue arson probe,Prosecutors are preparing indictments against three earlier suspects in the alleged plot targeting the Amsterdam-area temple.,https://www.jns.org/news/world/fourth-suspect-nabbed-in-dutch-synagogue-arson-probe,JNS,,2026-06-16T07:15:11,2026-06-16 08:15:28.835175,https://www.jns.org/news/world/fourth-suspect-nabbed-in-dutch-synagogue-arson-probe
Israeli forces destroy weapons-making lathes in Samaria counterterror raids,"The operations in the Nablus (Shechem) area also saw IDF troops confiscate weapon parts, per a statement.",https://www.jns.org/news/israel-news/israeli-forces-destroy-weapons-making-lathes-in-samaria-counterterror-raids,JNS,,2026-06-16T07:33:30,2026-06-16 08:15:28.835147,https://www.jns.org/news/israel-news/israeli-forces-destroy-weapons-making-lathes-in-samaria-counterterror-raids
Israeli Air Force chief confirms ‘broad strike’ on Iran called off at last minute,"The mission was stopped ""only one hour before departure for the sortie,"" said Maj. Gen. Omer Tishler.",https://www.jns.org/news/israel-news/israeli-air-force-chief-confirms-broad-strike-on-iran-called-off-at-last-minute,JNS,Pesach Benson/TPS-IL,2026-06-16T08:09:22,2026-06-16 08:15:28.835104,https://www.jns.org/news/israel-news/israeli-air-force-chief-confirms-broad-strike-on-iran-called-off-at-last-minute
"Iranian team draws boos, cheers at US World Cup debut as politics overshadows sports","Team secures 2-2 draw against New Zealand in LA, home to world's largest Iranian diaspora, less than 24 hours after deal inked with Washington to end months of war The post Iranian team draws boos, cheers at US World Cup debut as politics overshadows sports appeared first on The Times of Israel .",https://www.timesofisrael.com/iranian-team-draws-boos-cheers-at-us-world-cup-debut-as-politics-overshadows-sports/,Times of Israel,,2026-06-16T06:13:50,2026-06-16 08:15:24.396404,https://www.timesofisrael.com/?p=3843779
Rare cultic stone from Israelite mansion may testify to King Hezekiah’s biblical reform,"A massive 2,750-year-old artifact found at Tel 'Eton might have been repurposed after a clampdown on worship outside the Temple in Jerusalem The post Rare cultic stone from Israelite mansion may testify to King Hezekiah’s biblical reform appeared first on The Times of Israel .",https://www.timesofisrael.com/rare-cultic-stone-from-israelite-mansion-may-testify-to-king-hezekiahs-biblical-reform/,Times of Israel,,2026-06-16T06:32:56,2026-06-16 08:15:24.396364,https://www.timesofisrael.com/?p=3843185
Join us this Thursday for the 34th annual B’nai B’rith journalism awards - Sponsored Content,"Recognizing excellence in Diaspora reporting. With Keynote Speaker David Horovitz and Award Winners ToI's Zev Stub, Tamar Ish Shalom, Oren Nahari, &#038; Hanan Yovel. 6pm in Jerusalem. The post Join us this Thursday for the 34th annual B&#8217;nai B&#8217;rith journalism awards appeared first on The Times of Israel .",https://toi.li/FfK57j,Times of Israel,,2026-06-16T06:59:46,2026-06-16 08:15:24.396323,https://www.timesofisrael.com/?post_type=spotlight&p=3843816
"Trump-backed congressional candidate supports Israel, says Antichrist will be Jewish","Jackson Lahmeyer favored in Tuesday’s primary for solidly Republican Oklahoma district with large Jewish community, amid widening evangelical divide over Zionism The post Trump-backed congressional candidate supports Israel, says Antichrist will be Jewish appeared first on The Times of Israel .",https://www.timesofisrael.com/trump-backed-congressional-candidate-supports-israel-says-antichrist-will-be-jewish/,Times of Israel,,2026-06-16T07:21:27,2026-06-16 08:15:24.396282,https://www.timesofisrael.com/?p=3843748
Israeli Air Force chief confirms major strike on Iran was called off last week,"Maj. Gen. Omer Tischler says 'entire air force was ready for broad strike sortie' on hundreds of Iranian targets, but plans were halted 'one hour before departure' The post Israeli Air Force chief confirms major strike on Iran was called off last week appeared first on The Times of Israel .",https://www.timesofisrael.com/israeli-air-force-chief-confirms-major-strike-on-iran-was-called-off-last-week/,Times of Israel,,2026-06-16T07:32:37,2026-06-16 08:15:24.396231,https://www.timesofisrael.com/?post_type=liveblog_entry&p=3843826
"After years of growth, Project Shema officially becomes an independent nonprofit","After Oct. 7, the surge in antisemitism and anti-Zionism in progressive circles upended relationships between traditional liberal Jewish groups and those further to the left. Now that Project Shema — an antisemitism education group that deals specifically with that progressive community — has become an independent nonprofit, it stands poised to play a larger role... Read More The post After years of growth, Project Shema officially becomes an independent nonprofit appeared first on eJewishPhilanthropy .",https://ejewishphilanthropy.com/after-years-of-growth-project-shema-officially-becomes-an-independent-nonprofit/,eJewish Philanthropy,Jay Deitcher,2026-06-16T07:06:49,2026-06-16 08:15:17.682225,https://ejewishphilanthropy.com/?p=175916
