title,description,link,source,author,published,scraped_at,guid
Sa’ar invites Malta’s new FM to visit,"The Israeli foreign minister congratulated Chris Fearne on his new role, discussed strengthening bilateral ties.",https://www.jns.org/news/world/saar-invites-maltas-new-fm-to-visit,JNS,JNS Staff,2026-06-15T07:47:13,2026-06-15 08:22:23.430810,https://www.jns.org/news/world/saar-invites-maltas-new-fm-to-visit
France walls off Israeli booths at Paris defense show,"The Israeli Defense Ministry says Eurosatory blocked displays of defensive systems despite compliance with French restrictions, while offensive weapons remained on show.",https://www.jns.org/news/world/france-walls-off-israeli-booths-at-paris-defense-show,JNS,JNS Staff,2026-06-15T08:16:40,2026-06-15 08:22:23.430778,https://www.jns.org/news/world/france-walls-off-israeli-booths-at-paris-defense-show
The Knicks won on 6/13. Some Jewish fans think that’s more than a coincidence.,"New Yorkers, pointing out that the Torah has 613 commandments, celebrate 'miracle' of long-time-coming win for US's most Jewish city The post The Knicks won on 6/13. Some Jewish fans think that’s more than a coincidence. appeared first on The Times of Israel .",https://www.timesofisrael.com/the-knicks-won-on-6-13-some-jewish-fans-think-thats-more-than-a-coincidence/,Times of Israel,,2026-06-15T05:58:33,2026-06-15 08:22:18.721345,https://www.timesofisrael.com/?p=3842968
"Torn Iranian Americans plan protests, watch parties for team’s World Cup opener","Many are upset over FIFA rule barring pre-revolution lion-and-sun flag from stadiums; one fan says tournament doesn't represent the people of Iran: 'This is Team Islamic Republic' The post Torn Iranian Americans plan protests, watch parties for team&#8217;s World Cup opener appeared first on The Times of Israel .",https://www.timesofisrael.com/torn-iranian-americans-plan-protests-watch-parties-for-teams-world-cup-opener/,Times of Israel,,2026-06-15T06:25:13,2026-06-15 08:22:18.721298,https://www.timesofisrael.com/?p=3842972
The Knicks won on 6/13. Jewish fans think that’s more than a coincidence.,"(JTA) — For some Jewish fans of the New York Knicks, the most salient number related to the team’s NBA championship win on Saturday was not 94, the team’s final score, or 53, the number of years since the last title. It was 613. The number is meaningful in Jewish tradition because it signifies the... The post The Knicks won on 6/13. Jewish fans think that’s more than a coincidence. appeared first on The Forward .",https://forward.com/fast-forward/831488/the-knicks-won-on-6-13-jewish-fans-think-thats-more-than-a-coincidence/,The Forward,Philissa Cramer,2026-06-15T08:19:52,2026-06-15 08:22:16.483102,https://forward.com/?p=831488
"Iran deal doesn't mention missile program, proxies, Iranian media reports",,https://www.haaretz.com/israel-news/israel-security/2026-06-15/ty-article-live/iran-deal-doesnt-mention-missile-program-proxies-semi-official-mehr-reports/0000019e-c94b-d43d-a39f-ef7f90690000,Haaretz,Haaretz,2026-06-15T03:48:16,2026-06-15 06:01:07.891461,https://www.haaretz.com/israel-news/israel-security/2026-06-15/ty-article-live/iran-deal-doesnt-mention-missile-program-proxies-semi-official-mehr-reports/0000019e-c94b-d43d-a39f-ef7f90690000
Police enforce Sabbath protest ban near elected officials' homes for first time,"Officers confiscated sound equipment at a Jerusalem demonstration, citing a disputed interpretation of court-approved protest conditions that activists say do not authorize a ban on Sabbath protests",https://www.haaretz.com/israel-news/israel-security/2026-06-15/ty-article/.premium/police-enforce-sabbath-protest-ban-near-elected-officials-homes-for-first-time/0000019e-c764-d43d-a39f-e77d72a70000,Haaretz,Josh Breiner,2026-06-15T04:25:39,2026-06-15 06:01:07.891433,https://www.haaretz.com/israel-news/israel-security/2026-06-15/ty-article/.premium/police-enforce-sabbath-protest-ban-near-elected-officials-homes-for-first-time/0000019e-c764-d43d-a39f-e77d72a70000
"A doctor belongs in a hospital, not a prison cell: Free Abu Safiyah now","If Israel has evidence against Abu Safiya, it should indict him and present that evidence. If it doesn't have evidence against him, it needs to release him, and all the other jailed doctors, promptly",https://www.haaretz.com/opinion/editorial/2026-06-15/ty-article-opinion/a-doctor-belongs-in-a-hospital-not-a-prison-cell-free-abu-safiyah-now/0000019e-c7b5-d43d-a39f-e7fd7e100000,Haaretz,Haaretz Editorial,2026-06-15T04:30:06,2026-06-15 06:01:07.891404,https://www.haaretz.com/opinion/editorial/2026-06-15/ty-article-opinion/a-doctor-belongs-in-a-hospital-not-a-prison-cell-free-abu-safiyah-now/0000019e-c7b5-d43d-a39f-e7fd7e100000
The woman in the tank will win – that's what ultra-Orthodox rabbis fear,"Yeshivas declare they will discourage students from joining the IDF Armored Corps over its inclusion of women, marking another step in the nationalist ultra-Orthodox camp's campaign to determine the army's identity",https://www.haaretz.com/opinion/2026-06-15/ty-article-opinion/.premium/the-woman-in-the-tank-will-win-thats-what-ultra-orthodox-rabbis-fear/0000019e-c731-db50-a3df-e7fbd1b00000,Haaretz,Yagil Levy,2026-06-15T04:35:37,2026-06-15 06:01:07.891367,https://www.haaretz.com/opinion/2026-06-15/ty-article-opinion/.premium/the-woman-in-the-tank-will-win-thats-what-ultra-orthodox-rabbis-fear/0000019e-c731-db50-a3df-e7fbd1b00000
"Haredim, for the love of god, just join the army already","If what defines a contemporary Haredi person is his isolation, joining the army will necessarily change him. We must understand there is no possibility of being drafted as a Haredi and being demobilized as one, but that's a good thing",https://www.haaretz.com/opinion/2026-06-15/ty-article-opinion/.premium/haredim-for-the-love-of-god-just-join-the-army-already/0000019e-c731-d7bd-addf-ef370b610000,Haaretz,Neta Katz,2026-06-15T04:38:10,2026-06-15 06:01:07.891332,https://www.haaretz.com/opinion/2026-06-15/ty-article-opinion/.premium/haredim-for-the-love-of-god-just-join-the-army-already/0000019e-c731-d7bd-addf-ef370b610000
"Iran is playing chess, Israel is playing checkers and America owns the board","Israel left the game up to the Americans, who have their own agenda",https://www.haaretz.com/opinion/2026-06-15/ty-article-opinion/.premium/iran-is-playing-chess-israel-is-playing-checkers-and-america-owns-the-board/0000019e-c730-dd0a-a19f-d77c361d0000,Haaretz,Odeh Bisharat,2026-06-15T04:40:44,2026-06-15 06:01:07.891292,https://www.haaretz.com/opinion/2026-06-15/ty-article-opinion/.premium/iran-is-playing-chess-israel-is-playing-checkers-and-america-owns-the-board/0000019e-c730-dd0a-a19f-d77c361d0000
Israel debunks Tehran's version of events: Hezbollah struck first,"“The Iranian regime, as always, is lying. Iran’s proxy, Hezbollah, is the one that attacked Israel again this morning, completely unprovoked,” Israel’s Foreign Ministry posted to X.",https://www.jns.org/news/israel-news/israel-debunks-tehrans-version-of-events-hezbollah-struck-first,JNS,David Isaac,2026-06-15T05:05:49,2026-06-15 06:01:01.172150,https://www.jns.org/news/israel-news/israel-debunks-tehrans-version-of-events-hezbollah-struck-first
What does America get for $3.8 billion in Israel?,"Far from being a one-way transfer, U.S. military assistance to Israel delivers substantial strategic, economic and security returns to the United States.",https://www.jns.org/opinion/john-spencer/what-does-america-get-for-3-8-billion-in-israel,JNS,John Spencer,2026-06-15T05:28:02,2026-06-15 06:01:01.172111,https://www.jns.org/opinion/john-spencer/what-does-america-get-for-3-8-billion-in-israel
14 said arrested as hundreds of protesters clash at London Israeli real estate event,"Event held in synagogue drew opposition from lawmakers, activists who claimed event marketed settlement homes, which organizers deny; Board of Deputies: 'We are deeply disturbed' The post 14 said arrested as hundreds of protesters clash at London Israeli real estate event appeared first on The Times of Israel .",https://www.timesofisrael.com/14-arrested-as-hundreds-of-protesters-clash-at-london-israeli-real-estate-event/,Times of Israel,,2026-06-15T03:48:07,2026-06-15 06:00:56.423032,https://www.timesofisrael.com/?p=3842953
PA’s Abbas says oft-canceled presidential elections to be held in 2027,"Palestinian Authority's leader has now remained in power for 20 years, 15 years beyond the original date on which he was due to seek re-election The post PA&#8217;s Abbas says oft-canceled presidential elections to be held in 2027 appeared first on The Times of Israel .",https://www.timesofisrael.com/pas-abbas-says-oft-canceled-presidential-elections-to-be-held-in-2027/,Times of Israel,,2026-06-15T05:23:56,2026-06-15 06:00:56.422967,https://www.timesofisrael.com/?post_type=liveblog_entry&p=3842961
From the Jewish far right to violent crime: What will drive Arab voters in Israel to the polls?,"Israel's Arab community is preparing for a fight for voter turnout, in a bid to end four years of a far-right government that has seen rising deadly violence and institutional delegitimization. Some observers view this crisis as an opportunity",https://www.haaretz.com/israel-news/elections/2026-06-15/ty-article-magazine/from-jewish-far-right-to-crime-what-will-drive-arab-voters-to-the-polls/0000019e-c4de-d3a2-a3df-d6fe33440000,Haaretz,Jack Khoury,2026-06-15T02:00:44,2026-06-15 03:25:05.931397,https://www.haaretz.com/israel-news/elections/2026-06-15/ty-article-magazine/from-jewish-far-right-to-crime-what-will-drive-arab-voters-to-the-polls/0000019e-c4de-d3a2-a3df-d6fe33440000
Netanyahu campaign video warns against moves his own coalition is promoting,"Video warns that government led by Bennett and Eisenkot will try to fire Netanyahu appointees and shut down media outfits. Last week, however, the coalition moved ahead on three bills giving cabinet exclusive control over senior appointments",https://www.haaretz.com/israel-news/elections/2026-06-15/ty-article/.premium/netanyahu-campaign-video-warns-against-moves-his-own-coalition-is-promoting/0000019e-c8b1-d7bd-addf-eeb79f060000,Haaretz,Noa Shpigel,2026-06-15T02:56:18,2026-06-15 03:25:05.931363,https://www.haaretz.com/israel-news/elections/2026-06-15/ty-article/.premium/netanyahu-campaign-video-warns-against-moves-his-own-coalition-is-promoting/0000019e-c8b1-d7bd-addf-eeb79f060000
"As Netanyahu tries to hold off U.S.-Iran deal, his relations with Trump worsen","The strike on Beirut and renewed threats of Iranian retaliation underscore Israel's shrinking room for maneuver as Trump pushes toward a deal, raising concerns of recurring flare-ups while Washington increasingly dictates the regional agenda",https://www.haaretz.com/israel-news/israel-security/2026-06-15/ty-article/.premium/as-netanyahu-tries-to-hold-off-u-s-iran-deal-relations-with-trump-worsen/0000019e-c796-db50-a3df-e7fe51ea0000,Haaretz,Haaretz,2026-06-15T02:58:12,2026-06-15 03:25:05.931326,https://www.haaretz.com/israel-news/israel-security/2026-06-15/ty-article/.premium/as-netanyahu-tries-to-hold-off-u-s-iran-deal-relations-with-trump-worsen/0000019e-c796-db50-a3df-e7fe51ea0000
"Naked then, exposed now: The race Jews are still forced to run","It ends when their allies insist, consistently and publicly, that antisemitism is a moral failure that must be confronted wherever it appears.",https://www.jns.org/opinion/robert-m-soffer/naked-then-exposed-now-the-race-jews-are-still-forced-to-run,JNS,Robert M. Soffer,2026-06-15T03:00:00,2026-06-15 03:24:58.808185,https://www.jns.org/opinion/robert-m-soffer/naked-then-exposed-now-the-race-jews-are-still-forced-to-run
"US, Iran reach deal to end war, reportedly including Lebanon conflict; Trump: Hormuz to open","Deal's completion said to be spurred by recent Israel-Iran tension; agreement may include release of $12 billion to Iran; nuclear talks to begin after deal set to be signed Friday by Vance, Iran's Ghalibaf The post US, Iran reach deal to end war, reportedly including Lebanon conflict; Trump: Hormuz to open appeared first on The Times of Israel .",https://www.timesofisrael.com/us-iran-reach-deal-to-end-war-reportedly-including-lebanon-conflict-trump-hormuz-to-open/,Times of Israel,,2026-06-15T01:44:43,2026-06-15 03:24:54.254464,https://www.timesofisrael.com/?p=3842926
"Trump calls Netanyahu ‘very difficult guy,’ says attacks on Iran could resume if nuclear deal not reached","Iran’s military claims to have ‘humiliated’ US and Israel * Stanford anti-Zionist student protesters walk out of Google CEO’s commencement speech The post Trump calls Netanyahu ‘very difficult guy,’ says attacks on Iran could resume if nuclear deal not reached appeared first on The Times of Israel .",https://www.timesofisrael.com/liveblog-june-15-2026/,Times of Israel,,2026-06-15T01:54:34,2026-06-15 03:24:54.254419,https://www.timesofisrael.com/?p=3842936&preview=true&preview_id=3842936
Haredi protesters rally outside chief justice’s home to oppose draft dodger’s arrest,"Protest is latest to target a High Court official, after home of Amit's deputy Noam Sohlberg hit by riot earlier this month; mass Haredi demonstrations have also blocked roads The post Haredi protesters rally outside chief justice’s home to oppose draft dodger&#8217;s arrest appeared first on The Times of Israel .",https://www.timesofisrael.com/haredi-protesters-rally-outside-chief-justices-home-to-oppose-draft-dodgers-arrest/,Times of Israel,,2026-06-15T02:34:34,2026-06-15 03:24:54.254361,https://www.timesofisrael.com/?p=3842948
'Responsibility for genocide does not diminish with age or the passage of time',"Emir Suljagić survived the 1995 Srebrenica massacre, Europe's worst massacre since World War II. As director of the town's Genocide Memorial Center, he says justice remains elusive, but memory is nonnegotiable: 'We survived genocide. Then we had to find the bodies to prove it'",https://www.haaretz.com/magazine/2026-06-15/ty-article-magazine/.premium/responsibility-for-genocide-does-not-diminish-with-age-or-the-passage-of-time/0000019e-c4e6-dc49-a1df-cfeee8670000,Haaretz,Ran Levy Talbi,2026-06-14T23:42:28,2026-06-15 01:26:34.412266,https://www.haaretz.com/magazine/2026-06-15/ty-article-magazine/.premium/responsibility-for-genocide-does-not-diminish-with-age-or-the-passage-of-time/0000019e-c4e6-dc49-a1df-cfeee8670000
"Trump says peace deal with Iran completed, 'will bring peace and security to the whole region'","""I hereby fully authorize the toll free opening of the Strait of Hormuz, and, simultaneously herewith, authorize the immediate removal of the United States Naval blockade,"" the U.S. president said.",https://www.jns.org/news/u-s-news/trump-says-peace-deal-with-iran-completed-will-bring-peace-and-security-to-the-whole-region,JNS,JNS Staff,2026-06-15T00:32:25,2026-06-15 01:26:27.556414,https://www.jns.org/news/u-s-news/trump-says-peace-deal-with-iran-completed-will-bring-peace-and-security-to-the-whole-region
Palestinian media reports settlers tried to burn West Bank mosque with worshipers inside,"Head of West Bank village council tells PA news agency that worshipers put out the fire before it could spread beyond the entrance, as settlers fled the scene; no injuries reported The post Palestinian media reports settlers tried to burn West Bank mosque with worshipers inside appeared first on The Times of Israel .",https://www.timesofisrael.com/palestinian-media-reports-settlers-tried-to-burn-west-bank-mosque-with-worshipers-inside/,Times of Israel,,2026-06-14T23:51:52,2026-06-15 01:26:23.046426,https://www.timesofisrael.com/?p=3842864
Trump announces deal with Iran is ‘now complete’,"(JTA) — President Donald Trump announced Sunday that a deal to end the war with Iran and reopen the Strait of Hormuz is “now complete.” “Congratulations to all! I hereby fully authorize the toll free opening of the Strait of Hormuz, and, simultaneously herewith, authorize the immediate removal of the United States Naval blockade,” Trump... The post Trump announces deal with Iran is &#8216;now complete&#8217; appeared first on The Forward .",https://forward.com/fast-forward/831479/trump-announces-deal-with-iran-is-now-complete/,The Forward,Grace Gilson,2026-06-14T23:46:40,2026-06-15 01:26:20.962305,https://forward.com/?p=831479
The Knicks won on 6/13. Some Jewish fans think that’s more than a coincidence.,The notable number in Jewish tradition already had a Knicks connection. -- The post The Knicks won on 6/13. Some Jewish fans think that’s more than a coincidence. appeared first on Jewish Telegraphic Agency .,https://www.jta.org/2026/06/14/sports/the-knicks-won-on-6-13-jewish-fans-think-thats-more-than-a-coincidence,JTA,Philissa Cramer,2026-06-15T00:28:58,2026-06-15 01:26:18.622760,https://www.jta.org/?p=1902935
"U.S.-Iran deal reached, includes 'immediate termination' of fighting in Lebanon","The deal between Tehran and Washington came as Israel was on high alert for possible missile fire after Iran vowed to retaliate against an Israeli strike in Beirut's southern suburbs, also known as the Dahiyeh. Iran ultimately called off its planned missile strikes",https://www.haaretz.com/middle-east-news/iran/2026-06-15/ty-article/.premium/u-s-iran-deal-reached-includes-immediate-termination-of-fighting-in-lebanon/0000019e-c834-d7bd-addf-ee3620800000,Haaretz,Ben Samuels,2026-06-14T22:55:12,2026-06-14 23:35:32.613449,https://www.haaretz.com/middle-east-news/iran/2026-06-15/ty-article/.premium/u-s-iran-deal-reached-includes-immediate-termination-of-fighting-in-lebanon/0000019e-c834-d7bd-addf-ee3620800000
‘Bring light to the world’: Journalist preserves slain Bondi rabbi’s mission in joint book,Treatise on faith and purpose becomes a memorial for Rabbi Eli Schlanger after he was killed at the Hanukkah beach party he organized last December in Sydney The post &#8216;Bring light to the world&#8217;: Journalist preserves slain Bondi rabbi&#8217;s mission in joint book appeared first on The Times of Israel .,https://www.timesofisrael.com/bring-light-to-the-world-journalist-preserves-slain-bondi-rabbis-mission-in-joint-book/,Times of Israel,,2026-06-14T22:51:01,2026-06-14 23:35:20.338785,https://www.timesofisrael.com/?p=3835737
Trump announces deal with Iran is ‘now complete’,"Pakistan’s prime minister, a key mediator in the deal, said the official signing ceremony will take place Friday. -- The post Trump announces deal with Iran is ‘now complete&#8217; appeared first on Jewish Telegraphic Agency .",https://www.jta.org/2026/06/14/israel/trump-announces-deal-with-iran-is-now-complete,JTA,Grace Gilson,2026-06-14T23:32:53,2026-06-14 23:35:15.840252,https://www.jta.org/?p=1902929
Journalists should start calling Iran an empire,"Due to ignorance or misplaced sympathy, American media rarely turn the tables on the Islamic Republic, holding it to the same standards they hold great powers, like the United States and Russia.",https://www.jns.org/opinion/shay-khatiri/journalists-should-start-calling-iran-an-empire,JNS,Shay Khatiri,2026-06-14T21:15:00,2026-06-14 21:36:05.250708,https://www.jns.org/opinion/shay-khatiri/journalists-should-start-calling-iran-an-empire
"Turkish-Saudi rail that bypasses Israel to link to Jordan and Syria, minister says","Countries should be linked in 3-4 years, while Gulf states, and possibly Yemen, will later be added to route that would connect region with Europe, says Turkish transport minister The post Turkish-Saudi rail that bypasses Israel to link to Jordan and Syria, minister says appeared first on The Times of Israel .",https://www.timesofisrael.com/turkish-saudi-rail-that-bypasses-israel-to-link-to-jordan-and-syria-minister-says/,Times of Israel,,2026-06-14T20:52:50,2026-06-14 21:36:00.670975,https://www.timesofisrael.com/?p=3842838
Trump says Netanyahu ‘has no f**king judgment’ after Beirut strike – report,"US president says IDF shouldn't operate anywhere in Lebanon, reportedly leaving Israeli officials 'stunned,' as Washington tries to sweet-talk Iran out of retaliating The post Trump says Netanyahu &#8216;has no f**king judgment&#8217; after Beirut strike &#8211; report appeared first on The Times of Israel .",https://www.timesofisrael.com/trump-says-netanyahu-has-no-fking-judgment-after-beirut-strike-report/,Times of Israel,,2026-06-14T19:38:51,2026-06-14 20:37:49.927578,https://www.timesofisrael.com/?p=3842810
"Jane Yolen, children’s book author whose ‘The Devil’s Arithmetic’ became a Holocaust classic, dies at 87","(JTA) — Jane Yolen was already an award-winning author and illustrator of more than 100 titles for young readers when her editor suggested she write a Jewish children’s book. At first, she resisted the idea. Sure, she was Jewish. But she didn’t grow up in a religiously observant family, and she insisted she didn’t know... The post Jane Yolen, children&#8217;s book author whose ‘The Devil’s Arithmetic’ became a Holocaust classic, dies at 87 appeared first on The Forward .",https://forward.com/fast-forward/831392/jane-yolen-childrens-book-author-whose-the-devils-arithmetic-became-a-holocaust-classic-dies-at-87/,The Forward,Penny Schwartz,2026-06-14T20:27:28,2026-06-14 20:37:47.858437,https://forward.com/?p=831392
Two brothers attend Jewish sleepaway camp in 1980s Guatemala. What could go wrong?,"'Tarantula,' by Guatemalan-Jewish writer Eduardo Halfon, grapples with Nazism, inheritance, militarization and genocide",https://www.haaretz.com/life/books/2026-06-14/ty-article-review/.premium/two-brothers-at-jewish-sleepaway-camp-in-1980s-guatemala-what-could-go-wrong/0000019e-91f6-dddb-a9be-93f7e6d70000,Haaretz,Megan Peck Shub,2026-06-14T18:47:42,2026-06-14 19:38:46.798793,https://www.haaretz.com/life/books/2026-06-14/ty-article-review/.premium/two-brothers-at-jewish-sleepaway-camp-in-1980s-guatemala-what-could-go-wrong/0000019e-91f6-dddb-a9be-93f7e6d70000
Trump’s Iran gamble and Israel’s red lines,"As Washington pursues diplomacy with Tehran, Israel insists it will continue to defend itself against Hezbollah and Iran.",https://www.jns.org/opinion/column/fiamma-nirenstein/trumps-iran-gamble-and-israels-red-lines,JNS,Fiamma Nirenstein,2026-06-14T19:06:56,2026-06-14 19:38:39.902819,https://www.jns.org/opinion/column/fiamma-nirenstein/trumps-iran-gamble-and-israels-red-lines
Pressure grows to suspend Israeli Medical Association from global medical body,"A petition backed by international health groups alleges the Israeli group's complicity in violations against Palestinians and failure to uphold medical ethics. The IMA said it 'seems to confuse a government with its medical association, an extremely dangerous precedent'",https://www.haaretz.com/israel-news/2026-06-14/ty-article/.premium/pressure-grows-to-suspend-israeli-medical-association-from-global-medical-body/0000019e-c6bd-dd0a-a19f-d7fd21280000,Haaretz,Linda Dayan,2026-06-14T18:00:44,2026-06-14 18:41:56.810888,https://www.haaretz.com/israel-news/2026-06-14/ty-article/.premium/pressure-grows-to-suspend-israeli-medical-association-from-global-medical-body/0000019e-c6bd-dd0a-a19f-d7fd21280000
Why Trump suddenly changed his mind about Iran,"Welcome to “Straight Up,” the bold, unfiltered JNS news show hosted by former director of Israel’s Government Press Office, Danny Seaman. Drawing on decades at the forefront of Israeli media and public diplomacy, he delivers sharp, unapologetic analysis on the issues shaping Israel, the Middle East and the global news narrative. From dismantling myths about the Oslo Accords in the 1990s to the Abraham Accords of 2020 to exposing the Iran-Hezbollah-Hamas alliance and the Western media’s bias against Israel, Seaman’s commentary is fearless, factual and grounded in firsthand experience. His direct, authoritative voice cuts through propaganda to reveal what’s driving events in the region. Each week, “Straight Up” dives deep into the biggest stories in Israeli news, featuring in-depth conversations with journalists, security experts and policymakers who know the facts behind the headlines. Seaman’s no-spin approach sheds light on the moral, strategic and political challenges facing Israel—from countering terror and defending democracy to navigating its relationships with the United States and Arab world. Candid, uncompromising and deeply informed, “Straight Up” is the show for viewers who want to understand Israel and the Middle East as they truly are—without filters, without fear and straight to the point. See more at: @JNS_TV and subscribe to our YouTube channel.",https://www.jns.org/jns-tv/straight-up/why-trump-suddenly-changed-his-mind-about-iran,JNS,Daniel Seaman,2026-06-14T18:37:49,2026-06-14 18:41:49.942114,https://www.jns.org/jns-tv/straight-up/why-trump-suddenly-changed-his-mind-about-iran
"6 said killed in Gaza strikes as Hamas health ministry says war toll surpasses 73,000","Terror group says it responded to 15-point Board of Peace blueprint aiming to push ceasefire to next stage, although sources say disagreements remain over disarmament issue The post 6 said killed in Gaza strikes as Hamas health ministry says war toll surpasses 73,000 appeared first on The Times of Israel .",https://www.timesofisrael.com/6-said-killed-in-gaza-strikes-as-hamas-health-ministry-says-war-toll-surpasses-73000/,Times of Israel,,2026-06-14T18:08:52,2026-06-14 18:41:44.802190,https://www.timesofisrael.com/?p=3842767
