title,description,link,source,author,published,scraped_at,guid
Azerbaijan president lauds Trump as a global peacemaker,"A year after helping broker an agreement between Azerbaijan and Armenia, the U.S. president is uniquely positioned to resolve conflicts worldwide, Ilham Aliyev said.",https://www.jns.org/news/world/azerbaijan-president-lauds-trump-as-a-global-peacemaker,JNS,Etgar Lefkovits,2026-07-14T05:39:47,2026-07-14 08:05:49.089811,https://www.jns.org/news/world/azerbaijan-president-lauds-trump-as-a-global-peacemaker
Trump: MoU with Iran was a 'test' Tehran failed,"To the Iranian regime, ""deals are made to be broken,"" said the U.S. president.",https://www.jns.org/news/u-s-news/trump-mou-with-iran-was-test-tehran-failed,JNS,JNS Staff,2026-07-14T05:54:11,2026-07-14 08:05:49.089786,https://www.jns.org/news/u-s-news/trump-mou-with-iran-was-test-tehran-failed
CENTCOM: US naval blockade on Iranian ports to resume,"The United States will be “taking over” the Strait of Hormuz, said U.S. President Donald Trump.",https://www.jns.org/news/u-s-news/centcom-us-naval-blockade-on-iranian-ports-to-resume-on-tuesday,JNS,JNS Staff,2026-07-14T06:06:35,2026-07-14 08:05:49.089762,https://www.jns.org/news/u-s-news/centcom-us-naval-blockade-on-iranian-ports-to-resume-on-tuesday
WATCH: US uses sea drones in Iran strike for first time,"Unmanned surface vessels were used to strike a naval facility in Bandar Abbas, according to CENTCOM.",https://www.jns.org/news/world/watch-us-uses-sea-drones-in-iran-strike-for-first-time,JNS,JNS Staff,2026-07-14T06:07:04,2026-07-14 08:05:49.089737,https://www.jns.org/news/world/watch-us-uses-sea-drones-in-iran-strike-for-first-time
Netanyahu: 'Israel pulled off the greatest comeback in history',"In a wide-ranging interview with New York radio host Sid Rosenberg, the prime minister spoke of his sorrow at the loss of U.S. Sen. Lindsey Graham and Israel's strengthening position in the Middle East.",https://www.jns.org/news/israel-news/netanyahu-israel-pulled-off-the-greatest-comeback-in-history,JNS,David Isaac,2026-07-14T06:09:32,2026-07-14 08:05:49.089712,https://www.jns.org/news/israel-news/netanyahu-israel-pulled-off-the-greatest-comeback-in-history
Gibraltar to rename international airport after Jewish statesman Sir Joshua Hassan,"Fleur Hassan-Nahoum said the honor bestowed on her father celebrates “a legacy that belongs not only to Gibraltar, but also to the wider Jewish story.”",https://www.jns.org/news/world/gibraltar-to-rename-international-airport-after-jewish-statesman-sir-joshua-hassan,JNS,Steve Linde,2026-07-14T06:13:53,2026-07-14 08:05:49.089682,https://www.jns.org/news/world/gibraltar-to-rename-international-airport-after-jewish-statesman-sir-joshua-hassan
IDF strike kills Hamas naval commander in Gaza City,"In a separate strike in northern Gaza, the IDF eliminated three armed Hamas terrorists.",https://www.jns.org/news/israel-news/idf-strike-kills-hamas-naval-commander-in-gaza-city,JNS,JNS Staff,2026-07-14T06:32:16,2026-07-14 08:05:49.089653,https://www.jns.org/news/israel-news/idf-strike-kills-hamas-naval-commander-in-gaza-city
UN piles new anti-Israel lies atop a mountain of slander and corruption,"Agencies and representatives are plagued by biased reports, betrayal of their missions and unauthorized payouts to employees.",https://www.jns.org/opinion/james-sinkinson/un-piles-new-anti-israel-lies-atop-a-mountain-of-slander-and-corruption,JNS,James Sinkinson,2026-07-14T06:35:43,2026-07-14 08:05:49.089628,https://www.jns.org/opinion/james-sinkinson/un-piles-new-anti-israel-lies-atop-a-mountain-of-slander-and-corruption
Israir to offer subsidized Eilat flights for residents,Israel’s second-largest carrier will operate at least four daily flights connecting the Red Sea resort with central Israel at a reduced fare of about $33 for a one-way ticket for city residents.,https://www.jns.org/news/israel-news/israir-to-offer-subsidized-eilat-flights-for-residents,JNS,Etgar Lefkovits,2026-07-14T06:44:15,2026-07-14 08:05:49.089598,https://www.jns.org/news/israel-news/israir-to-offer-subsidized-eilat-flights-for-residents
Israeli envoy accuses Rep. Khanna of staged provocation,Amb. Yechiel Leiter said the U.S. congressman ignored coordination offers and used a brief military stop to spark an anti-Israel media frenzy.,https://www.jns.org/news/israel-news/israeli-envoy-accuses-rep-khanna-of-staged-provocation,JNS,JNS Staff,2026-07-14T07:10:00,2026-07-14 08:05:49.089567,https://www.jns.org/news/israel-news/israeli-envoy-accuses-rep-khanna-of-staged-provocation
Israel Police to hold massive emergency drill in Jerusalem,Intensive movement of security forces and patrol vehicles will be felt throughout the capital city.,https://www.jns.org/news/israel-news/israel-police-to-hold-massive-emergency-drill-in-jerusalem,JNS,TPS-IL Staff,2026-07-14T07:24:40,2026-07-14 08:05:49.089539,https://www.jns.org/news/israel-news/israel-police-to-hold-massive-emergency-drill-in-jerusalem
Israeli elections 2026—Meet the parliament: MK Benny Gantz,"For the coming decades, Israel should focus on confronting its enemies on all fronts, while building new alliances across the globe, becoming the strongest player in the region, Blue and White Party leader Benny Gantz told attendees at the JNS International Policy Summit last month. “It will stabilize the entire region. It is not only in the interest of Israel, but in the interest of the region and in the interest of the United States,” said Gantz in an onstage interview. “If we continue this eternal fight between us, we will get nowhere,” he added. Gantz, the 20th chief of staff of the Israel Defense Forces, served as the Israeli military’s top commander from 2011 to 2015 and held a series of senior positions during his 38-year military career. These posts included: commander of the Shaldag Unit, the Paratroopers Brigade, the Lebanon Liaison Unit, the Judea and Samaria Division, Northern Command and the Ground Forces. As chief of staff, Gantz led the IDF during Operation Pillar of Defense (2012), Operation Brother's Keeper (2014) and Operation Protective Edge (2014). The founder of the Blue and White Party, Gantz ended more than a year of political deadlock following the March 2020 elections by joining a unity government with Likud, later serving as alternate prime minister and defense minister. Following the Hamas-led terrorist attacks in southern Israel on Oct. 7, 2023, Gantz joined the emergency government, serving as a minister without portfolio and member of the War Cabinet until June 2024. Reflecting on one of the most significant decisions of his political career, Gantz recalled joining Israeli Prime Minister Benjamin Netanyahu’s emergency government in the aftermath of the Oct. 7 attack. The day before the massacre, Gantz had returned to Israel from the United States, where he had been discussing efforts to advance normalization with Saudi Arabia, then viewed as the leading candidate to join the Abraham Accords. “Here I am, back to Israel, waking up on Oct. 7, 2023, on probably the darkest day of the modern State of Israel since it was established,” Gantz recalled. “From my perspective, it was very clear that we had to get into the government, divert it from being just a government to an emergency one and create some kind of war cabinet to run the war from.” “I thought it was not the time for political considerations and I ordered my team to move forward with that,” he continued. “I met with the prime minister, and I told him that even if it is my last political move, we will join and support the country, and I think we did the right thing.” The first days after the attack focused on stabilizing the country from a security perspective, he said. He noted that the most consequential decision made by the War Cabinet came on Oct. 11, when it chose to concentrate military efforts in Gaza while maintaining an active defensive posture along the northern front. “In the speech I gave when we formed the emergency government, I declared that I was not coming in for political partnership. I was coming in because of shared reality, shared values, shared needs and destiny,” he continued. “Unfortunately, as time went by and we stabilized the situation on the security front, more political considerations moved into the room. I tried to stop it for a while, but once I saw that I was not succeeding, I had to pull out while still supporting the government when it came to security decisions, even though I was sort of on the opposition side of things,” he added. Overall, Gantz said Israel made the right decisions in its wars in Gaza, Lebanon and against Iran, though he believes the country could have moved more quickly in certain areas. “No one likes long wars. It jeopardizes so many things,” he said. “It’s very difficult to maintain long wars, and I thought we should act faster in the Gaza Strip, move forward into the Lebanese areas about a year before we did. I thought we should have tried to bring about the release of more hostages at a faster tempo. But there is no reverse in life, and I think we should look forward.” With a view to the future, Gantz stressed the importance of ensuring that Iran is never allowed to revive its nuclear program and of preventing Hezbollah and Hamas from rebuilding its military capabilities. “The nuclear issue is the first and foremost issue that we must make sure is not coming back,” he said. “All the other elements are important, as well. Their support for terror proxies is important, and so is their attempt to rebuild their ballistic arsenal that threatens not only the State of Israel but also Eastern Europe.” The second principle Israel must prioritize, Gantz argued, is preserving freedom of military action against emerging threats. “After Oct. 7, which is an event I believe we should seriously investigate—and I am saying it as someone who has to explain at least seven years out of the last 20—I think we have to look ourselves in the mirror and candidly and seriously explain how we allowed such a threat to develop,” he said. “Having said that, we must make sure that in the coming years we keep our freedom of operation on all fronts,” he added. “We must look at things as they are and not as we hope they would be.”",https://www.jns.org/feature/israeli-elections-2026-meet-the-parliament-mk-benny-gantz,JNS,Amelie Botbol,2026-07-14T07:39:46,2026-07-14 08:05:49.089490,https://www.jns.org/feature/israeli-elections-2026-meet-the-parliament-mk-benny-gantz
"EU ministers fail to reach deal on sanctions targeting Judea-Samaria towns, Sa'ar says",European foreign ministers had gathered in Brussels to discuss a possible ban on imports of goods.,https://www.jns.org/news/israel-news/eu-ministers-fail-to-reach-deal-on-sanctions-targeting-judea-samaria-towns-saar-says,JNS,JNS Staff,2026-07-14T07:44:54,2026-07-14 08:05:49.089172,https://www.jns.org/news/israel-news/eu-ministers-fail-to-reach-deal-on-sanctions-targeting-judea-samaria-towns-saar-says
Israeli Navy delegation wraps up US independence visit,"A group led by Rear Adm. Guy Levy met with American and global counterparts, and visited Annapolis to advance cooperation and cadet exchanges.",https://www.jns.org/news/israel-news/israeli-navy-delegation-wraps-up-us-independence-visit,JNS,JNS Staff,2026-07-14T07:52:08,2026-07-14 08:05:49.089138,https://www.jns.org/news/israel-news/israeli-navy-delegation-wraps-up-us-independence-visit
Sara Netanyahu said pushing to guarantee security detail for family for next 5 years,"PM and wife reportedly fear election loss could lead to loss of protection, but agencies see no reason to commit to specific time period; PM's office denies reports The post Sara Netanyahu said pushing to guarantee security detail for family for next 5 years appeared first on The Times of Israel .",https://www.timesofisrael.com/sara-netanyahu-said-pushing-to-guarantee-security-detail-for-family-for-next-5-years/,Times of Israel,,2026-07-14T06:34:03,2026-07-14 08:05:44.550599,https://www.timesofisrael.com/?post_type=liveblog_entry&p=3860753
Bnei Brak set to implement gender segregation on two main streets — report,"Following ruling by rabbis, city will put up signs and barriers segregating sidewalks, despite Supreme Court ban on practice in 2017 The post Bnei Brak set to implement gender segregation on two main streets &#8212; report appeared first on The Times of Israel .",https://www.timesofisrael.com/bnei-brak-set-to-implement-gender-segregation-on-two-main-streets-report/,Times of Israel,,2026-07-14T07:01:31,2026-07-14 08:05:44.550558,https://www.timesofisrael.com/?p=3860758
Pence denounces antisemitism after arson allegedly targets Israeli flag in hometown,"Fire in Zionsville, Indiana, causes $150,000 in damage to historic home; neighboring Indiana Jews join town's small community in rally condemning alleged attack The post Pence denounces antisemitism after arson allegedly targets Israeli flag in hometown appeared first on The Times of Israel .",https://www.timesofisrael.com/pence-denounces-antisemitism-after-arson-allegedly-targets-israeli-flag-in-hometown/,Times of Israel,,2026-07-14T07:03:00,2026-07-14 08:05:44.550498,https://www.timesofisrael.com/?p=3860777
EU seeks to advance trade ban on Israeli settlements,Israel’s foreign minister accused the EU foreign policy chief of an “obsessive campaign against Israel.” -- The post EU seeks to advance trade ban on Israeli settlements appeared first on Jewish Telegraphic Agency .,https://www.jta.org/2026/07/14/global/eu-seeks-to-advance-trade-ban-on-israeli-settlements,JTA,Shira Li Bartov,2026-07-14T07:52:59,2026-07-14 08:05:39.995682,https://www.jta.org/?p=1904530
‘We made history’: Israel’s U20 women return home to heroes’ welcome,"After becoming the first Israeli women’s national basketball team to win a European medal, the team reflected on the bond that fueled its remarkable run.",https://www.jns.org/feature/we-made-history-israels-u20-women-return-home-to-heroes-welcome,JNS,Howard Blas,2026-07-14T05:19:44,2026-07-14 05:31:17.380610,https://www.jns.org/feature/we-made-history-israels-u20-women-return-home-to-heroes-welcome
Israel pushes back on growing calls to free Gaza terror doctor,"Hussam Abu Safiya used his position at Kamal Adwan Hospital to engage in terrorist activity, according to Israel’s Permanent Mission to the United Nations and International Organizations in Geneva.",https://www.jns.org/news/israel-news/israel-pushes-back-on-growing-calls-to-free-gaza-terror-doctor,JNS,David Isaac,2026-07-14T05:22:54,2026-07-14 05:31:17.380571,https://www.jns.org/news/israel-news/israel-pushes-back-on-growing-calls-to-free-gaza-terror-doctor
So who actually controls the Strait of Hormuz?,"Both US and Iran claim to be 'guardian' of the key waterway, with Trump declaring US will reimpose blockade and charge fees on shipping while Tehran attacks vessels not using its preferred route The post So who actually controls the Strait of Hormuz? appeared first on The Times of Israel .",https://www.timesofisrael.com/so-who-actually-controls-the-strait-of-hormuz/,Times of Israel,,2026-07-14T03:22:16,2026-07-14 05:31:12.894077,https://www.timesofisrael.com/?p=3860734
Candidate vying to replace Platner claims Israel ‘committing genocide in Gaza right now’,"Maine's Shenna Bellows adopts anti-Israel stance while seeking Democratic nomination for US Senate, as belief in genocide claim becomes increasingly prevalent among party members The post Candidate vying to replace Platner claims Israel &#8216;committing genocide in Gaza right now&#8217; appeared first on The Times of Israel .",https://www.timesofisrael.com/candidate-vying-to-replace-platner-claims-israel-committing-genocide-in-gaza-right-now/,Times of Israel,,2026-07-14T03:53:19,2026-07-14 05:31:12.894027,https://www.timesofisrael.com/?p=3860742
IDF detains several Israelis who attempted to cross border into Syria,,https://www.haaretz.com/israel-news/israel-security/2026-07-14/ty-article-live/idf-detains-several-israelis-who-attempted-to-cross-border-into-syria/0000019f-5e52-d72f-afff-5f7e97fc0000,Haaretz,Haaretz,2026-07-14T02:00:25,2026-07-14 02:32:23.882555,https://www.haaretz.com/israel-news/israel-security/2026-07-14/ty-article-live/idf-detains-several-israelis-who-attempted-to-cross-border-into-syria/0000019f-5e52-d72f-afff-5f7e97fc0000
When celebrity ignorance gets a stage,Rock star Julian Casablancas freely bashes Israel and Zionism at Oxford University in England.,https://www.jns.org/opinion/joseph-milstein/when-celebrity-ignorance-gets-a-stage,JNS,Joseph Milstein,2026-07-14T00:45:00,2026-07-14 02:32:17.094816,https://www.jns.org/opinion/joseph-milstein/when-celebrity-ignorance-gets-a-stage
"‘100% woke’ US grad student charged with hoax over ‘kill Jews,’ pro-Trump graffiti","Ziheng Fang, who identified as a 'social justice activist,' allegedly posted fake threats, hate speech and swastikas around San Jose State University, causing chaos on the campus The post ‘100% woke’ US grad student charged with hoax over ‘kill Jews,’ pro-Trump graffiti appeared first on The Times of Israel .",https://www.timesofisrael.com/100-woke-us-grad-student-charged-with-hoax-over-kill-jews-pro-trump-graffiti/,Times of Israel,,2026-07-14T00:51:12,2026-07-14 02:32:12.597651,https://www.timesofisrael.com/?p=3860673
US strikes Iran for 3rd night in a row as Trump weighs taking out Pickaxe nuclear site,"US president says the mountain facility 'is a possible target for a nice big fat shot'; Iran's Revolutionary Guards claim responsibility for attack on UAE tankers that killed a crew member, wounded 8 others The post US strikes Iran for 3rd night in a row as Trump weighs taking out Pickaxe nuclear site appeared first on The Times of Israel .",https://www.timesofisrael.com/trump-weighs-taking-out-pickaxe-nuclear-site-as-us-strikes-iran-for-3rd-night-in-a-row/,Times of Israel,,2026-07-14T01:25:55,2026-07-14 02:32:12.597603,https://www.timesofisrael.com/?post_type=liveblog_entry&p=3860703
Bill extending mandatory military service to 32 months finalized before last plenum votes,Coalition advances legislation despite IDF's calls to have men serve 36 months instead of current 30 * Trump says he wants Gulf states to reimburse US for ‘protection’ from Iran The post Bill extending mandatory military service to 32 months finalized before last plenum votes appeared first on The Times of Israel .,https://www.timesofisrael.com/liveblog-july-14-2026/,Times of Israel,,2026-07-14T01:56:29,2026-07-14 02:32:12.597548,https://www.timesofisrael.com/?p=3860721
"‘Doesn’t impact my life’ if someone sits in their basement hating me, Jewish NY City Council member says","“I knew I was gonna be fighting antisemitism,” Inna Vernikov, a Republican, told JNS. “I didn’t see politicians doing that on a big scale. I just saw a lot of pandering on both sides.”",https://www.jns.org/feature/doesnt-impact-my-life-if-someone-sits-in-their-basement-hating-me-jewish-ny-city-council-member-says,JNS,Rikki Zagelbaum,2026-07-13T23:01:37,2026-07-13 23:55:01.860162,https://www.jns.org/feature/doesnt-impact-my-life-if-someone-sits-in-their-basement-hating-me-jewish-ny-city-council-member-says
"'We're going to take out Pickaxe Mountain,' Trump says, of Iranian nuclear site",The U.S. president ordered a third consecutive night of strikes against the Islamic Republic.,https://www.jns.org/news/u-s-news/were-going-to-take-out-pickaxe-mountain-trump-says-of-iranian-nuclear-site,JNS,,2026-07-13T23:24:56,2026-07-13 23:55:01.860125,https://www.jns.org/news/u-s-news/were-going-to-take-out-pickaxe-mountain-trump-says-of-iranian-nuclear-site
Poll shows Eisenkot with significant lead over Netanyahu as preferred PM; Knesset blocs static,"TV survey says former IDF chief's Yashar party would get the most votes if election held now, though together with rest of the anti-Netanyahu bloc would lack a parliamentary majority without Arab party support The post Poll shows Eisenkot with significant lead over Netanyahu as preferred PM; Knesset blocs static appeared first on The Times of Israel .",https://www.timesofisrael.com/poll-shows-eisenkot-with-significant-lead-over-netanyahu-for-pm-knesset-blocs-static/,Times of Israel,,2026-07-13T23:32:51,2026-07-13 23:54:55.855501,https://www.timesofisrael.com/?post_type=liveblog_entry&p=3860694
Sha’ar Zahav shifts part of endowment to social good,"As it nears its 50th anniversary, Congregation Sha’ar Zahav has done something that very few other synagogues in the country have considered. San Francisco’s pioneering LGBTQ synagogue, founded in 1977, [&#8230;]",https://jweekly.com/2026/07/13/in-a-rare-move-shaar-zahav-used-its-endowment-for-social-good-its-paying-off/,J. Weekly,Emma Goss,2026-07-13T23:16:37,2026-07-13 23:54:46.275672,https://jweekly.com/?p=307257
Israel's Torah study law spits in the face of soldiers,,https://www.haaretz.com/opinion/editorial/2026-07-14/ty-article-opinion/israels-torah-study-law-spits-in-the-face-of-soldiers/0000019f-5d7e-d0b9-ab9f-7f7e1efe0000,Haaretz,Haaretz Editorial,2026-07-13T22:10:59,2026-07-13 22:56:26.781907,https://www.haaretz.com/opinion/editorial/2026-07-14/ty-article-opinion/israels-torah-study-law-spits-in-the-face-of-soldiers/0000019f-5d7e-d0b9-ab9f-7f7e1efe0000
"Graham’s Death Leaves Israel With ‘Almost No Recourse’ in Congress, Former Israeli Envoy Says","The death of US Sen. Lindsey Graham (R-SC) marks a &#8220;fundamental shift&#8221; in Israel&#8217;s relationship with Congress, leaving the country...",https://www.algemeiner.com/2026/07/13/grahams-death-leaves-israel-with-almost-no-recourse-in-congress-former-israeli-envoy-says/,Algemeiner,Debbie Weiss,2026-07-13T22:08:41,2026-07-13 22:56:22.180232,https://www.algemeiner.com/?p=776086
Pro-Israel World Mourns Lindsey Graham as Fight for His Senate Seat Tests GOP’s Direction on Israel,Pro-Israel organizations and leaders of the American Jewish community have begun to assess the impact of the sudden death of...,https://www.algemeiner.com/2026/07/13/pro-israel-world-mourns-lindsey-graham-as-fight-for-his-senate-seat-tests-gops-direction-on-israel/,Algemeiner,Corey Walker,2026-07-13T22:09:48,2026-07-13 22:56:22.180190,https://www.algemeiner.com/?p=776043
"Trump admin launches campaign to dismantle ICC ‘brick by brick, if necessary’","U.S. Secretary of State Marco Rubio says Washington will press allies to withdraw from the Hague-based court while weighing sanctions, visa bans and other measures against its officials.",https://www.jns.org/news/u-s-news/trump-admin-launches-campaign-to-dismantle-icc-brick-by-brick-if-necessary,JNS,Mike Wagenheim,2026-07-13T22:24:30,2026-07-13 22:56:18.916244,https://www.jns.org/news/u-s-news/trump-admin-launches-campaign-to-dismantle-icc-brick-by-brick-if-necessary
San Jose State graduate student charged in antisemitic bomb-hoax threats,"Prosecutors said that fingerprint, surveillance footage and key-card records link the suspect to more than 20 threatening campus messages.",https://www.jns.org/news/u-s-news/san-jose-state-graduate-student-charged-in-antisemitic-bomb-hoax-threats,JNS,,2026-07-13T22:55:43,2026-07-13 22:56:18.916212,https://www.jns.org/news/u-s-news/san-jose-state-graduate-student-charged-in-antisemitic-bomb-hoax-threats
Jew Hatred is an Emotion. Discrimination is the Evidence.,"Just like any emotion or any label, hate can be denied. What is much harder to deny is one set of rules for the world and another for the Jews. That’s not an emotion. It’s an action. The post Jew Hatred is an Emotion. Discrimination is the Evidence. appeared first on Jewish Journal .",https://jewishjournal.com/commentary/columnist/editors-note/390131/jew-hatred-is-an-emotion-discrimination-is-the-evidence/,Jewish Journal,David Suissa,2026-07-13T22:35:32,2026-07-13 22:56:15.954381,https://jewishjournal.com/?p=390131
"In major escalation, Yemen’s Houthis target Saudi Arabia’s Abha airport","Iran-backed rebels warn airlines against using Saudi air space as they fire missiles and drones in response to attack on Sanaa International Airport that they blame on Riyadh The post In major escalation, Yemen&#8217;s Houthis target Saudi Arabia&#8217;s Abha airport appeared first on The Times of Israel .",https://www.timesofisrael.com/in-major-escalation-yemens-houthis-target-saudi-arabias-abha-airport/,Times of Israel,,2026-07-13T21:56:45,2026-07-13 22:56:13.108226,https://www.timesofisrael.com/?p=3860633
Lindsey Graham’s sister chosen to fulfill remainder of his US Senate term,"'Lindsey has always been there for me. And now, I will be there for him,' says Darline Graham Nordone, as special vote to be held to pick new GOP nominee for the general election The post Lindsey Graham’s sister chosen to fulfill remainder of his US Senate term appeared first on The Times of Israel .",https://www.timesofisrael.com/lindsey-grahams-sister-chosen-to-fulfill-remainder-of-his-us-senate-term/,Times of Israel,,2026-07-13T22:26:14,2026-07-13 22:56:13.108187,https://www.timesofisrael.com/?p=3860667
