title,description,link,source,author,published,scraped_at,guid
It’s time for the pro-Palestinian movement to make a radical change,"Over the past two years, activists across the world ramped up calls for divestment from Israel. On university campuses and at meetings of pension boards, the same call has become increasingly prominent: pull money away from anything tied to Israel. But now that a fragile ceasefire may be taking hold, I want to offer a... The post It&#8217;s time for the pro-Palestinian movement to make a radical change appeared first on The Forward .",https://forward.com/opinion/777040/israel-divestment-gaza-reconstruction/,The Forward,Dany Bahar,2025-10-19T13:00:58,2025-10-19 13:11:57.050905,https://forward.com/?p=777040
"Hundreds attended funeral of slain hostage Uriel Baruch, whose body was released from Gaza last week","Baruch was murdered on October 7 near Kibbutz Mefalsim on the Gaza border after escaping from the Nova music festival. In his eulogy, President Herzog apologized to Baruch in the name of Israel – 'Sorry that it took such a long time for you to return to your homeland'",https://www.haaretz.com/israel-news/2025-10-19/ty-article/.premium/hundreds-attended-funeral-of-slain-hostage-uriel-baruch-whose-body-was-released-last-week/00000199-fc1f-d1c4-a99d-ffbfffb40000,Haaretz,Yael Freidson,2025-10-19T12:00:04,2025-10-19 12:13:28.669931,https://www.haaretz.com/israel-news/2025-10-19/ty-article/.premium/hundreds-attended-funeral-of-slain-hostage-uriel-baruch-whose-body-was-released-last-week/00000199-fc1f-d1c4-a99d-ffbfffb40000
Slain hostage Bipin Joshi praised for October 7 heroism as body flown to Nepal,"Joshi, 23, deflected grenade in shelter, tried to save friends before he was abducted from Kibbutz Alumim; government's hostage point man: 'I'm sorry. It shouldn't have ended this way' The post Slain hostage Bipin Joshi praised for October 7 heroism as body flown to Nepal appeared first on The Times of Israel .",https://www.timesofisrael.com/slain-hostage-bipin-joshi-praised-for-october-7-heroism-as-body-flown-to-nepal/,Times of Israel,,2025-10-19T11:02:31,2025-10-19 12:13:15.312209,https://www.timesofisrael.com/?post_type=liveblog_entry&p=3668586
"Daily Briefing Oct. 19: Day 744 – As skirmishes continue in Gaza, when is the war over?","Military correspondent Emanuel Fabian discusses process of finding hostages' bodies, determining war's end; plus, uptick in West Bank activity, and individual Hezbollah operatives The post Daily Briefing Oct. 19: Day 744 &#8211; As skirmishes continue in Gaza, when is the war over? appeared first on The Times of Israel .",https://www.timesofisrael.com/daily-briefing-oct-19-day-744-as-skirmishes-continue-in-gaza-when-is-the-war-over/,Times of Israel,,2025-10-19T11:13:46,2025-10-19 12:13:15.312170,https://www.timesofisrael.com/?p=3668580&preview=true&preview_id=3668580
The 16 hostages whose bodies are still held in Gaza,"The bodies of 14 Israelis and 2 foreign nationals remain in the Strip; Hamas claims it cannot get to some, doesn't know where others are The post The 16 hostages whose bodies are still held in Gaza appeared first on The Times of Israel .",https://www.timesofisrael.com/the-16-hostages-whose-bodies-are-still-held-in-gaza/,Times of Israel,,2025-10-19T12:05:59,2025-10-19 12:13:15.312122,https://www.timesofisrael.com/?p=3668504
"Susan Stamberg, iconic Jewish ‘founding mother’ of NPR, dies at 87","(JTA) — When Susan Stamberg first sat behind the microphone to host a newfangled broadcasting venture called National Public Radio, in 1972, some board members had a concern: She sounded too Jewish. Though that wasn’t quite how they tended to phrase it, recalled a colleague. Instead, NPR board members feared that the “All Things Considered”... The post Susan Stamberg, iconic Jewish ‘founding mother’ of NPR, dies at 87 appeared first on The Forward .",https://forward.com/fast-forward/776872/susan-stamberg-iconic-jewish-founding-mother-of-npr-dies-at-87/,The Forward,Andrew Lapin,2025-10-19T11:09:23,2025-10-19 12:13:13.130431,https://forward.com/?p=776872
Far-right UK activist Tommy Robinson visits Israel on invite of Diaspora Minister Amichai Chikli,"(JTA) — Far-right British agitator Tommy Robinson, known for his anti-Muslim rhetoric and leadership of the now-defunct extremist British Defense League, is in Israel this week on the invitation of Israeli Diaspora Minister Amichai Chikli. Together, Robinson and Chikli toured the site of the Nova music festival massacre, explored Jerusalem&#8217;s Mahane Yehuda market on Friday... The post Far-right UK activist Tommy Robinson visits Israel on invite of Diaspora Minister Amichai Chikli appeared first on The Forward .",https://forward.com/fast-forward/776932/far-right-uk-activist-tommy-robinson-visits-israel-on-invite-of-diaspora-minister-amichai-chikli/,The Forward,Grace Gilson,2025-10-19T11:11:59,2025-10-19 12:13:13.130385,https://forward.com/?p=776932
Palestinian man who allegedly participated in Oct. 7 attack on Israel arrested in Louisiana,"(JTA) — A Palestinian man in Louisiana was arrested Thursday after federal prosecutors accused him of participating in the Hamas-led Oct. 7, 2023 attacks on Israel. Mahmoud Amin Ya’qub Al-Muhtadi, 33, a Palestinian resident of Lafayette, Louisiana, is accused of being an operative for the National Resistance Brigades, a Gaza-based paramilitary group that took part... The post Palestinian man who allegedly participated in Oct. 7 attack on Israel arrested in Louisiana appeared first on The Forward .",https://forward.com/fast-forward/776977/palestinian-man-who-allegedly-participated-in-oct-7-attack-on-israel-arrested-in-louisiana/,The Forward,Grace Gilson,2025-10-19T11:13:54,2025-10-19 12:13:13.130336,https://forward.com/?p=776977
"NY State Young Republicans chapter disbanded amid racist, antisemitic chat scandal","(JTA) — New York’s state Young Republicans organization has been disbanded in the wake of leaked group chats in which officials joked about gas chambers, praised Adolf Hitler and used racist, antisemitic and homophobic slurs. “The Young Republicans was already grossly mismanaged, and vile language of the sort made in the group chat has no... The post NY State Young Republicans chapter disbanded amid racist, antisemitic chat scandal appeared first on The Forward .",https://forward.com/fast-forward/776989/ny-state-young-republicans-chapter-disbanded-amid-racist-antisemitic-chat-scandal/,The Forward,Asaf Elia-Shalev,2025-10-19T11:15:42,2025-10-19 12:13:13.130279,https://forward.com/?p=776989
Close the consulate and repair the French-Israel relationship,"The French consulate functions as a de facto embassy to “Palestine,” advancing an anti-Israel agenda. The post Close the consulate and repair the French-Israel relationship appeared first on JNS.org .",https://www.jns.org/close-the-consulate-and-repair-the-french-israel-relationship/,JNS,Naomi Linder Kahn,2025-10-19T10:33:00,2025-10-19 11:08:31.462215,https://www.jns.org/?p=596184
Grenoble Jewish community targeted with graffiti and death threats,"“Today, we hide our Jewish identity, no one wears a kippah anymore, we remove the mezuzah, we avoid being recognized,” says local CRIF head. The post Grenoble Jewish community targeted with graffiti and death threats appeared first on JNS.org .",https://www.jns.org/grenoble-jewish-community-targeted-with-graffiti-and-death-threats/,JNS,Yossi Lempkowicz,2025-10-19T10:52:55,2025-10-19 11:08:31.462178,https://www.jns.org/?p=596524
’60 Minutes’ of misplaced schadenfreude,Never mind the nonsense. What’s important is that Trump hasn’t wavered from his backing of Israel and tough stance against Hamas. The post &#8217;60 Minutes&#8217; of misplaced schadenfreude appeared first on JNS.org .,https://www.jns.org/60-minutes-of-misplaced-schadenfreude/,JNS,Ruthie Blum,2025-10-19T10:56:51,2025-10-19 11:08:31.462132,https://www.jns.org/?p=596512
UK man claims he was detained after Star of David ‘antagonized’ pro-Palestinian protesters,Footage shows detective questioning suspect over necklace; police say he was because he violated order separating counterprotest from Jewish anti-Zionist group's rally The post UK man claims he was detained after Star of David ‘antagonized’ pro-Palestinian protesters appeared first on The Times of Israel .,https://www.timesofisrael.com/uk-man-claims-he-was-detained-after-star-of-david-antagonized-pro-palestinian-protesters/,Times of Israel,,2025-10-19T10:54:54,2025-10-19 11:08:25.819749,https://www.timesofisrael.com/?p=3668529
BBC penalized after failing to identify narrator in Gaza documentary as son of Hamas minister,"(JTA) — The BBC will be required to air a statement correcting its coverage after the U.K. media watchdog Ofcom sanctioned the channel failing to identify the narrator of a Gaza documentary as the son of a Hamas official. “Gaza: How to Survive a Warzone,” aired on the BBC in February. It quickly drew fire... The post BBC penalized after failing to identify narrator in Gaza documentary as son of Hamas minister appeared first on The Forward .",https://forward.com/fast-forward/776779/bbc-penalized-after-failing-to-identify-narrator-in-gaza-documentary-as-son-of-hamas-minister/,The Forward,Grace Gilson,2025-10-19T11:07:42,2025-10-19 11:08:23.624626,https://forward.com/?p=776779
Israeli government to discuss diverting education and defense funds to benefit religious students,"Ministers are considering a proposal from the Israeli education minister to allocate nearly $11 million to programs run by Garin Torani, which sets up Jewish religious Zionist groups in underprivileged areas. The funding would come from budgets previously earmarked for housing, culture, defense, and sustainability",https://www.haaretz.com/israel-news/2025-10-19/ty-article/.premium/israeli-govt-to-discuss-education-defense-cuts-to-benefit-religious-students/00000199-fb72-d3e1-adfd-ff73ebee0000,Haaretz,Jonathan Lis,2025-10-19T09:55:01,2025-10-19 10:09:13.422707,https://www.haaretz.com/israel-news/2025-10-19/ty-article/.premium/israeli-govt-to-discuss-education-defense-cuts-to-benefit-religious-students/00000199-fb72-d3e1-adfd-ff73ebee0000
Israel bids farewell to Nepali captive Bipin Joshi,"Friends, family and officials gathered near Ben-Gurion Airport to honor the agricultural student slain by Hamas in Gaza. The post Israel bids farewell to Nepali captive Bipin Joshi appeared first on JNS.org .",https://www.jns.org/israel-bids-farewell-to-nepali-captive-bipin-joshi/,JNS,JNS Staff,2025-10-19T09:26:40,2025-10-19 10:09:05.497729,https://www.jns.org/?p=596472
"PA paid $70 million to terrorists freed in hostage deal, watchdog says","“The Palestinian Authority ensures that it very much pays to slay,” said Palestinian Media Watch. The post PA paid $70 million to terrorists freed in hostage deal, watchdog says appeared first on JNS.org .",https://www.jns.org/pa-paid-70-million-to-terrorists-freed-in-hostage-deal-watchdog-says/,JNS,David Isaac,2025-10-19T09:38:42,2025-10-19 10:09:05.497696,https://www.jns.org/?p=596473
‘Redemption War’: Israeli gov’t approves new name for fighting sparked by Oct. 7 attacks,"""This is the war of our revival—a direct continuation of the War of Independence,"" said Israeli Prime Minister Benjamin Netanyahu. The post &#8216;Redemption War&#8217;: Israeli gov&#8217;t approves new name for fighting sparked by Oct. 7 attacks appeared first on JNS.org .",https://www.jns.org/redemption-war-israeli-govt-approves-new-name-for-fighting-sparked-by-oct-7-attacks/,JNS,JNS Staff,2025-10-19T09:46:58,2025-10-19 10:09:05.497660,https://www.jns.org/?p=596478
Ostrich is returned safely after escaping Ramat Gan Safari,"The bird ran into a nearby park area, surprising passersby. The post Ostrich is returned safely after escaping Ramat Gan Safari appeared first on JNS.org .",https://www.jns.org/ostrich-is-returned-safely-after-escaping-ramat-gan-safari/,JNS,JNS Staff,2025-10-19T09:54:26,2025-10-19 10:09:05.497617,https://www.jns.org/?p=596494
Starmer slams police’s ‘wrong’ ban of Israeli soccer fans,A prominent Jewish group dismissed the British PM's criticism as disingenuous and called the prohibition a “badge of shame” on the U.K. The post Starmer slams police&#8217;s ‘wrong&#8217; ban of Israeli soccer fans appeared first on JNS.org .,https://www.jns.org/starmer-slams-polices-wrong-ban-of-israeli-soccer-fans/,JNS,Canaan Lidor,2025-10-19T10:00:56,2025-10-19 10:09:05.497576,https://www.jns.org/?p=596399
"Government said working to appoint own Oct. 7 inquiry, angering bereaved families, opposition","Government commission of inquiry would also examine 'role' of protest movement and High Court in Hamas invasion; critics accuse government of seeking to investigate itself The post Government said working to appoint own Oct. 7 inquiry, angering bereaved families, opposition appeared first on The Times of Israel .",https://www.timesofisrael.com/government-said-working-to-appoint-own-oct-7-inquiry-angering-bereaved-families-opposition/,Times of Israel,,2025-10-19T09:16:33,2025-10-19 10:08:59.008895,https://www.timesofisrael.com/?p=3668532
IDF strikes in Gaza's Rafah after armed militants attack Israeli forces,U.S. Vice President JD Vance and President Trump's Middle East envoy Steve Witkoff are slated to arrive in Israel on Monday to discuss Israel's claims that Hamas is violating the cease-fire agreement,https://www.haaretz.com/israel-news/2025-10-19/ty-article/.premium/idf-strikes-in-gazas-rafah-after-armed-militants-attack-israeli-forces/00000199-fbab-dfc6-a3bf-fbaf60b30000,Haaretz,Yaniv Kubovich,2025-10-19T08:58:28,2025-10-19 09:09:05.350081,https://www.haaretz.com/israel-news/2025-10-19/ty-article/.premium/idf-strikes-in-gazas-rafah-after-armed-militants-attack-israeli-forces/00000199-fbab-dfc6-a3bf-fbaf60b30000
Where do great tits learn their tricks?,"Baby big birds learn from their parents but with only a few weeks' nesting time, great tit chicks need more options",https://www.haaretz.com/science-and-health/2025-10-19/ty-article/where-do-great-tits-learn-their-tricks/00000199-fb9a-dfc6-a3bf-fbbe75ec0000,Haaretz,Ruth Schuster,2025-10-19T08:59:15,2025-10-19 09:09:05.350042,https://www.haaretz.com/science-and-health/2025-10-19/ty-article/where-do-great-tits-learn-their-tricks/00000199-fb9a-dfc6-a3bf-fbbe75ec0000
Ben-Gvir demands death penalty law for terrorists following hostages’ return,"""It's the right thing to do, it's moral and it will prevent them from taking hostages,"" said the leader of the right-wing Otzma Yehudit Party. The post Ben-Gvir demands death penalty law for terrorists following hostages&#8217; return appeared first on JNS.org .",https://www.jns.org/ben-gvir-demands-death-penalty-law-for-terrorists-following-hostages-return/,JNS,JNS Staff,2025-10-19T08:13:57,2025-10-19 09:08:54.953034,https://www.jns.org/?p=596433
BBC censured for failing to disclose Gaza documentary’s Hamas link,"""Transparency isn't optional. It's a fundamental requirement of journalistic ethics,"" Israel's Foreign Ministry said of the findings. The post BBC censured for failing to disclose Gaza documentary&#8217;s Hamas link appeared first on JNS.org .",https://www.jns.org/bbc-censured-for-failing-to-disclose-gaza-documentarys-hamas-link/,JNS,JNS Staff,2025-10-19T08:26:04,2025-10-19 09:08:54.952990,https://www.jns.org/?p=596411
Ronen Engel identified as one of 2 hostage bodies returned to Israel by Hamas overnight,"Engel, 54, was photographer and ambulance volunteer who was 'always smiling'; Mika Engel says her father is 'finally home'; 2nd body undergoing identification at forensic institute The post Ronen Engel identified as one of 2 hostage bodies returned to Israel by Hamas overnight appeared first on The Times of Israel .",https://www.timesofisrael.com/ronen-engel-identified-as-one-of-2-hostage-bodies-returned-to-israel-by-hamas-overnight/,Times of Israel,,2025-10-19T08:33:59,2025-10-19 09:08:50.152280,https://www.timesofisrael.com/?p=3668484&preview=true&preview_id=3668484
"Two IDF soldiers injured in Tubas blast amid surge in Judea, Samaria attacks","The attack marked the third such incident in as many days. The post Two IDF soldiers injured in Tubas blast amid surge in Judea, Samaria attacks appeared first on JNS.org .",https://www.jns.org/two-idf-soldiers-injured-in-tubas-blast-amid-surge-in-judea-samaria-attacks/,JNS,JNS Staff,2025-10-19T07:22:36,2025-10-19 08:10:14.925141,https://www.jns.org/?p=596390
"Ending war in Gaza early would have meant Israel’s ‘days were numbered,’ says Netanyahu","Now-slain Hamas terror leader Yahya Sinwar would have become ""a modern-day Saladin,"" he said. The post Ending war in Gaza early would have meant Israel’s ‘days were numbered,’ says Netanyahu appeared first on JNS.org .",https://www.jns.org/ending-war-in-gaza-early-would-have-meant-israels-days-were-numbered-says-netanyahu/,JNS,JNS Staff,2025-10-19T07:55:44,2025-10-19 08:10:14.925107,https://www.jns.org/?p=596407
Israel reaffirms Gaza demilitarization policy,"Defense Minister Katz says Jerusalem remains committed to returning all hostages, disarming Hamas and preventing the Strip from posing threat. The post Israel reaffirms Gaza demilitarization policy appeared first on JNS.org .",https://www.jns.org/israel-reaffirms-gaza-demilitarization-policy/,JNS,JNS Staff,2025-10-19T08:08:19,2025-10-19 08:10:14.925059,https://www.jns.org/?p=596419
"When things get real, countries seeking defense tech put politics aside and go for Israel","Technological superiority will decide the outcome of future wars, fueling interest for Israeli defense solutions born in the wake of the Oct. 7 onslaught, overriding boycott tensions, experts say The post When things get real, countries seeking defense tech put politics aside and go for Israel appeared first on The Times of Israel .",https://www.timesofisrael.com/when-things-get-real-countries-seeking-defense-tech-put-politics-aside-and-go-for-israel/,Times of Israel,,2025-10-19T07:54:38,2025-10-19 08:10:10.110431,https://www.timesofisrael.com/?p=3660612
"Tommy Robinson draws crowd of 1,000 in Tel Aviv amid controversy; protester attacked","Supporters praise free speech while critics denounce antisemitic past; heckler violently accosted by attendees after calling the controversial figure a 'racist' The post Tommy Robinson draws crowd of 1,000 in Tel Aviv amid controversy; protester attacked appeared first on The Times of Israel .",https://www.timesofisrael.com/tommy-robinson-draws-crowd-of-1000-in-tel-aviv-amid-controversy-protester-attacked/,Times of Israel,,2025-10-19T07:56:11,2025-10-19 08:10:10.110378,https://www.timesofisrael.com/?p=3666552
America’s added benefits from Israel’s posture of deterrence,"From the devastation of the Soviet-aligned Egypt in 1967 to the toppling of Hezbollah, Israel's action in the Middle East have also benefitted the United States. The post America’s added benefits from Israel’s posture of deterrence appeared first on JNS.org .",https://www.jns.org/americas-added-benefits-from-israels-posture-of-deterrence/,JNS,Yoram Ettinger,2025-10-19T06:15:00,2025-10-19 07:08:47.215943,https://www.jns.org/?p=596105
Israel kills Hezbollah terrorist trying to rebuild infrastructure,"The site in Southern Lebanon was previously struck during the IDF's ""Operation Northern Arrows"" in September 2024. The post Israel kills Hezbollah terrorist trying to rebuild infrastructure appeared first on JNS.org .",https://www.jns.org/israel-kills-hezbollah-terrorist-trying-to-rebuild-infrastructure/,JNS,JNS Staff,2025-10-19T06:48:21,2025-10-19 07:08:47.215895,https://www.jns.org/?p=596382
Rothman said planning to fast-track bill that would split AG’s role into 2 jobs,Coalition official fears Haredi parties may block bill over failure to approve IDF exemptions for yeshiva students; Rothman: It'll solve 'inherent conflict of interest' in current role The post Rothman said planning to fast-track bill that would split AG&#8217;s role into 2 jobs appeared first on The Times of Israel .,https://www.timesofisrael.com/rothman-said-planning-to-fast-track-bill-that-would-split-ags-role-into-2-jobs/,Times of Israel,,2025-10-19T06:41:16,2025-10-19 07:08:42.486596,https://www.timesofisrael.com/?p=3668472
2 troops wounded by bomb thrown in West Bank; reports of settler attacks on Palestinians,"IDF deploys additional troops to Tubas following incident; Palestinian couple said wounded by settlers near Hebron, olive harvesters attacked in 2 locations, vehicles set alight The post 2 troops wounded by bomb thrown in West Bank; reports of settler attacks on Palestinians appeared first on The Times of Israel .",https://www.timesofisrael.com/2-troops-wounded-by-bomb-thrown-in-west-bank-reports-of-settler-attacks-on-palestinians/,Times of Israel,,2025-10-19T06:53:54,2025-10-19 07:08:42.486551,https://www.timesofisrael.com/?p=3668493
‘Librarian of Auschwitz’: Holocaust survivor Dita Kraus dies at 96,"Kraus survived Terezin Ghetto, Auschwitz, Bergen-Belsen before moving to Israel in 1949; book published in 2012 brought story of concentration camp's secret library to wider audience The post &#8216;Librarian of Auschwitz&#8217;: Holocaust survivor Dita Kraus dies at 96 appeared first on The Times of Israel .",https://www.timesofisrael.com/librarian-of-auschwitz-holocaust-survivor-dita-kraus-dies-at-96/,Times of Israel,,2025-10-19T06:54:29,2025-10-19 07:08:42.486500,https://www.timesofisrael.com/?p=3668474
Identity of second body handed over by Hamas Saturday night yet to be announced,,https://www.haaretz.com/israel-news/2025-10-19/ty-article-live/israel-receives-two-coffins-of-deceased-hostages-to-be-identified-overnight/00000199-fa2e-d3e1-adfd-fe3fbf4a0000,Haaretz,Haaretz,2025-10-19T02:02:45,2025-10-19 05:09:16.091171,https://www.haaretz.com/israel-news/2025-10-19/ty-article-live/israel-receives-two-coffins-of-deceased-hostages-to-be-identified-overnight/00000199-fa2e-d3e1-adfd-fe3fbf4a0000
Body returned by Hamas on Saturday identified as Israeli hostage Ronen Engel,"Engel, 54 years old at the time of his death, was a resident of the Gaza border community of Kibbutz Nir Oz. The identity of the second body that was handed over by Hamas on Saturday night has yet to be announced",https://www.haaretz.com/israel-news/2025-10-19/ty-article/.premium/body-returned-by-hamas-on-saturday-night-identified-as-ronen-engel/00000199-fa2a-dfc6-a3bf-fb2e38f70000,Haaretz,Yaniv Kubovich,2025-10-19T04:23:31,2025-10-19 05:09:16.091123,https://www.haaretz.com/israel-news/2025-10-19/ty-article/.premium/body-returned-by-hamas-on-saturday-night-identified-as-ronen-engel/00000199-fa2a-dfc6-a3bf-fb2e38f70000
Who are the Gaza clans opposing Hamas?,"The clans are “substantial, influential players that control hundreds if not thousands of enforcers.” The post Who are the Gaza clans opposing Hamas? appeared first on JNS.org .",https://www.jns.org/who-are-the-gaza-clans-opposing-hamas/,JNS,Shimon Sherman,2025-10-19T04:01:00,2025-10-19 04:11:31.037757,https://www.jns.org/?p=596272
"US warns of imminent Hamas ‘attack on Palestinian civilians,’ says it would violate truce","State Department says it informed mediators of plot, adds that if it goes ahead, 'measures will be taken to protect the people of Gaza and preserve the integrity of the ceasefire' The post US warns of imminent Hamas ‘attack on Palestinian civilians,’ says it would violate truce appeared first on The Times of Israel .",https://www.timesofisrael.com/us-warns-of-imminent-hamas-attack-on-palestinian-civilians-says-it-would-violate-truce/,Times of Israel,,2025-10-19T03:51:52,2025-10-19 04:11:26.128528,https://www.timesofisrael.com/?p=3668449
U.S. warns of 'imminent cease-fire violation' by Hamas against Palestinian civilians in Gaza,"According to the U.S. State Department, if Hamas goes through with its planned assault, 'measures will be taken to protect the people of Gaza and preserve the integrity of the cease-fire'",https://www.haaretz.com/israel-news/2025-10-19/ty-article/.premium/u-s-warns-of-imminent-cease-fire-violation-by-hamas-against-palestinian-civilians/00000199-fa3d-dfc6-a3bf-fb3d2a050000,Haaretz,Ben Samuels,2025-10-19T03:17:54,2025-10-19 03:30:04.459324,https://www.haaretz.com/israel-news/2025-10-19/ty-article/.premium/u-s-warns-of-imminent-cease-fire-violation-by-hamas-against-palestinian-civilians/00000199-fa3d-dfc6-a3bf-fb3d2a050000
"Netanyahu denies Trump forced truce on him, says war ends ‘for good’ when Hamas disarmed","In appearance on staunchly supportive TV network, PM says Jerusalem insisting on full implementation of ceasefire deal, says he'll run in next election and expects to win The post Netanyahu denies Trump forced truce on him, says war ends &#8216;for good&#8217; when Hamas disarmed appeared first on The Times of Israel .",https://www.timesofisrael.com/netanyahu-denies-trump-forced-truce-on-him-says-war-ends-for-good-when-hamas-disarmed/,Times of Israel,,2025-10-19T03:06:09,2025-10-19 03:29:51.828892,https://www.timesofisrael.com/?p=3668362
"Once again, Netanyahu chooses Hamas over Israel's security","The organization is still an 'asset' from the prime minister's point of view. Instead of helping establish a new diplomatic order alongside the UAE and Saudi Arabia, Netanyahu is enabling Qatar and Turkey to restore Hamas' stronghold in Gaza",https://www.haaretz.com/opinion/2025-10-19/ty-article-opinion/.premium/once-again-netanyahu-chooses-hamas-over-israels-security/00000199-f886-d72d-addd-f997e8610000,Haaretz,Yair Golan,2025-10-19T01:18:10,2025-10-19 02:41:07.519272,https://www.haaretz.com/opinion/2025-10-19/ty-article-opinion/.premium/once-again-netanyahu-chooses-hamas-over-israels-security/00000199-f886-d72d-addd-f997e8610000
