title,description,link,source,author,published,scraped_at,guid
"Israel's population growth rate fell to a dramatic low in 2025, study finds","The estimated 0.9 percent growth rate is 'an unprecedented decline' as Israeli mortality, fertility and migration have changed significantly in recent years, according to a paper by an Israeli think tank. Israel will need to attract large numbers of immigrants even to maintain low growth rates",https://www.haaretz.com/israel-news/2025-12-31/ty-article/.premium/israels-population-growth-rate-fell-to-a-dramatic-low-in-2025-study-finds/0000019b-7102-d019-a9df-7faf67d70000,Haaretz,Nati Tucker,2025-12-31T11:57:23,2025-12-31 12:16:07.580908,https://www.haaretz.com/israel-news/2025-12-31/ty-article/.premium/israels-population-growth-rate-fell-to-a-dramatic-low-in-2025-study-finds/0000019b-7102-d019-a9df-7faf67d70000
Why Trump should follow Netanyahu: Recognizing Somaliland defeats ‘Ilhan Omar’ narrative,"For too long, American policy has been paralyzed by the fear that recognizing reality would cause instability. But the instability is already here. The post Why Trump should follow Netanyahu: Recognizing Somaliland defeats ‘Ilhan Omar’ narrative appeared first on JNS.org .",https://www.jns.org/why-trump-should-follow-netanyahu-recognizing-somaliland-defeats-ilhan-omar-narrative/,JNS,,2025-12-31T11:30:00,2025-12-31 12:16:00.173348,https://www.jns.org/?p=622280
Israeli High Court halts State Comptroller’s Oct. 7 investigation,"The State Comptroller began his Oct. 7 audit in Jan. 2024, focusing mainly on the political echelon, the IDF and the Shin Bet. The post Israeli High Court halts State Comptroller&#8217;s Oct. 7 investigation appeared first on JNS.org .",https://www.jns.org/israeli-high-court-halts-state-comptrollers-oct-7-investigation/,JNS,David Isaac,2025-12-31T11:57:20,2025-12-31 12:16:00.173298,https://www.jns.org/?p=622314
Iran’s chief prosecutor pledges ‘decisive’ response if protests destabilize country,Legal head says mass demonstrations part of 'understandable realities' but must not be 'tool of insecurity'; new central bank governor appointed after record currency fall The post Iran&#8217;s chief prosecutor pledges &#8216;decisive&#8217; response if protests destabilize country appeared first on The Times of Israel .,https://www.timesofisrael.com/irans-chief-prosecutor-pledges-decisive-response-if-protests-destabilize-country/,Times of Israel,,2025-12-31T11:11:33,2025-12-31 12:15:55.412661,https://www.timesofisrael.com/?p=3723943
"In 1988, a futurist envisioned Israel in 2025. Some of his predictions were spot-on","In his book 'Israel in the Year 2025,' Dr. Alan Price imagines the Jewish state in an era of space travel, but his visions of smart homes, solar fields and cellphones ring true The post In 1988, a futurist envisioned Israel in 2025. Some of his predictions were spot-on appeared first on The Times of Israel .",https://www.timesofisrael.com/in-1988-a-futurist-envisioned-israel-in-2025-some-of-his-predictions-were-spot-on/,Times of Israel,,2025-12-31T11:11:46,2025-12-31 12:15:55.412619,https://www.timesofisrael.com/?p=3721494
"Arab society marks deadliest year on record, with 252 murder victims in 2025","While police chief claims progress, killings continue to run rampant, including record number of female victims, with almost all deadly crime continuing to go unsolved, monitor says The post Arab society marks deadliest year on record, with 252 murder victims in 2025 appeared first on The Times of Israel .",https://www.timesofisrael.com/arab-society-marks-deadliest-year-on-record-with-252-murder-victims-in-2025/,Times of Israel,,2025-12-31T11:30:04,2025-12-31 12:15:55.412571,https://www.timesofisrael.com/?p=3722321
Daily Briefing Dec. 31: Day 817 – Mamdani to become NYC mayor as apple drops in Times Square,"NY correspondent Luke Tress on Zohran Mamdani's policies that concern NYC Jews, ADL report that 20% of his transitional staff hold anti-Israel views, and a movement against anti-Zionism The post Daily Briefing Dec. 31: Day 817 &#8211; Mamdani to become NYC mayor as apple drops in Times Square appeared first on The Times of Israel .",https://www.timesofisrael.com/daily-briefing-dec-31-day-817-mamdani-to-become-nyc-mayor-as-apple-drops-in-times-square/,Times of Israel,,2025-12-31T11:55:22,2025-12-31 12:15:55.412521,https://www.timesofisrael.com/?p=3724028&preview=true&preview_id=3724028
Jewish actress Odessa A’zion pushes back after IDF t-shirt controversy: ‘Not a zio!’,"(JTA) — Jewish actress Odessa A’zion appeared to push back this week on social media claims labeling her as a “Zionist,” after controversy swirled online over her political opinions. The speculation about the 25-year-old actress’s political leanings first surfaced last week after users on X posted a screenshot of her modeling an Israeli Defense Forces... The post Jewish actress Odessa A’zion pushes back after IDF t-shirt controversy: ‘Not a zio!’ appeared first on The Forward .",https://forward.com/fast-forward/793822/jewish-actress-odessa-azion-pushes-back-after-idf-t-shirt-controversy-not-a-zio/,The Forward,Grace Gilson,2025-12-31T11:45:00,2025-12-31 12:15:53.205119,https://forward.com/?p=793822
Gov. Hochul says she stepped in to block demolition of historic Brooklyn shul,"(New York Jewish Week) — New York Gov. Kathy Hochul said Friday she has intervened to prevent the destruction of a nearly century-old synagogue in Brooklyn. Officially known as Congregation Chaim Albert but known colloquially as the Kingsbrook Synagogue, the synagogue was part of a Jewish hospital founded in 1928 in response to antisemitism in... The post Gov. Hochul says she stepped in to block demolition of historic Brooklyn shul appeared first on The Forward .",https://forward.com/fast-forward/794014/gov-hochul-says-she-stepped-in-to-block-demolition-of-historic-brooklyn-shul/,The Forward,Jackie Hajdenberg,2025-12-31T11:50:18,2025-12-31 12:15:53.205069,https://forward.com/?p=794014
"Before ‘SNL,’ there was Sid Caesar — and a roomful of Jewish writers","(JTA) — Sid Caesar once dominated American television so completely that it was hard to imagine Saturday nights without him. In the early 1950s, his live sketch-comedy program “Your Show of Shows” drew tens of millions of viewers. That show and its other iterations — “The Admiral Broadway Revue,” “Caesar’s Hour” and “Sid Caesar Invites... The post Before ‘SNL,’ there was Sid Caesar — and a roomful of Jewish writers appeared first on The Forward .",https://forward.com/fast-forward/793636/before-snl-there-was-sid-caesar-and-a-roomful-of-jewish-writers/,The Forward,Andrew Silow-Carroll,2025-12-31T11:55:51,2025-12-31 12:15:53.205019,https://forward.com/?p=793636
Rep. Randy Fine’s incendiary comments on Muslims alarm many Jews — without denting his standing on the pro-Israel right,"(JTA) — In his brief time in the House, freshman Jewish Congressman Randy Fine has built a reputation for combative outbursts — particularly about Muslims. But the Florida Republican ignited a new round of controversy earlier this month with a series of disparaging remarks about Palestinians and what he called “mainstream Muslims” that his critics... The post Rep. Randy Fine’s incendiary comments on Muslims alarm many Jews — without denting his standing on the pro-Israel right appeared first on The Forward .",https://forward.com/fast-forward/794191/rep-randy-fines-incendiary-comments-on-muslims-alarm-many-jews-without-denting-his-standing-on-the-pro-israel-right/,The Forward,Andrew Lapin,2025-12-31T12:00:40,2025-12-31 12:15:53.204952,https://forward.com/?p=794191
18 notable Jews who died in 2025,"(JTA) — Jews around the world were already reeling after nearly two years of war and death in Gaza and the grim confirmation that many hostages hadn&#8217;t survived the Oct. 7 attacks or two years of captivity. Then came news of the shootings in Sydney, Australia, where 15 people were gunned down at a celebration... The post 18 notable Jews who died in 2025 appeared first on The Forward .",https://forward.com/fast-forward/793720/18-notable-jews-who-died-in-2025/,The Forward,Grace Gilson,2025-12-31T12:05:51,2025-12-31 12:15:53.204888,https://forward.com/?p=793720
NYC Mayor-elect Mamdani taps Mahmoud Khalil's lawyer as top legal advisor,"Ramzi Kassem, a former senior immigration policy adviser in the Biden administration who represented pro-Palestinian and anti-Gaza war activists detained under the Trump administration, will serve as Chief Counsel, guiding Zohran Mamdani's legal strategy",https://www.haaretz.com/us-news/2025-12-31/ty-article/.premium/nyc-mayor-elect-mamdani-taps-mahmoud-khalils-lawyer-as-top-legal-advisor/0000019b-7375-da0b-a1bf-fffd351d0000,Haaretz,Etan Nechin,2025-12-31T10:30:27,2025-12-31 11:09:19.367160,https://www.haaretz.com/us-news/2025-12-31/ty-article/.premium/nyc-mayor-elect-mamdani-taps-mahmoud-khalils-lawyer-as-top-legal-advisor/0000019b-7375-da0b-a1bf-fffd351d0000
UAE announces pullout from Yemen following Saudi strike,Relations between the two anti-Iranian oil producers have soured as their proxies clashed for control of lands in their war-torn southern neighbor. The post UAE announces pullout from Yemen following Saudi strike appeared first on JNS.org .,https://www.jns.org/uae-announces-pullout-from-yemen-following-saudi-strike/,JNS,Canaan Lidor,2025-12-31T10:23:20,2025-12-31 11:09:10.102847,https://www.jns.org/?p=622320
Heavy rainfall turns parts of Negev green following two years of war,"The weather system led to the filling of runoff basins in several areas, bringing about noticeable changes to the local scenery. The post Heavy rainfall turns parts of Negev green following two years of war appeared first on JNS.org .",https://www.jns.org/heavy-rainfall-turns-parts-of-negev-green-following-two-years-of-war/,JNS,,2025-12-31T10:55:00,2025-12-31 11:09:10.102810,https://www.jns.org/?p=622113
Israeli police launch major raid on Negev Bedouin town,"Forces enter Tarabin, arresting 16 suspects and vowing an open-ended crackdown on illegal weapons. The post Israeli police launch major raid on Negev Bedouin town appeared first on JNS.org .",https://www.jns.org/israeli-police-launch-major-raid-on-negev-bedouin-town/,JNS,JNS Staff,2025-12-31T10:55:52,2025-12-31 11:09:10.102761,https://www.jns.org/?p=622299
Rosner’s Domain | When Something Meets Nothing,"What other choice can Israel offer when Trump has a bad plan, and Netanyahu entered the meeting with no plan? The post Rosner&#8217;s Domain | When Something Meets Nothing appeared first on Jewish Journal .",https://jewishjournal.com/rosnersdomain/385998/when-something-meets-nothing/,Jewish Journal,Shmuel Rosner,2025-12-31T10:31:06,2025-12-31 11:09:07.279293,https://jewishjournal.com/?p=385998
A Rabbi and a Pastor,My Time with IBSI: A New Hope The post A Rabbi and a Pastor appeared first on Jewish Journal .,https://jewishjournal.com/community/386001/a-rabbi-and-a-pastor/,Jewish Journal,Rabbi Nolan Lebovitz,2025-12-31T10:43:09,2025-12-31 11:09:07.279248,https://jewishjournal.com/?p=386001
McDonald's keeps control of Israel operations as search for new franchisee drags on,"A year and a half after buying back the Israeli franchise amid global backlash over the Gaza war, McDonald's is still searching for a local operator – and some in the industry say it is in no hurry to let go",https://www.haaretz.com/israel-news/business/2025-12-31/ty-article/.premium/mcdonalds-unusual-move-in-israel-explained/0000019b-7367-dd15-a3fb-fb6710ff0000,Haaretz,Yarden Ben Gal Hirshorn,2025-12-31T09:29:31,2025-12-31 10:10:03.349902,https://www.haaretz.com/israel-news/business/2025-12-31/ty-article/.premium/mcdonalds-unusual-move-in-israel-explained/0000019b-7367-dd15-a3fb-fb6710ff0000
The two incarnations of Mohammad Bakri: The actor gave Israelis hope; the director they couldn't handle,"On the screen he brought the noble and upright Palestinian to the Israeli audience. Behind the camera Bakri, who died last week at 72, tried to show Palestinian pain and trauma – and paid a price for it",https://www.haaretz.com/life/2025-12-31/ty-article-magazine/.premium/the-two-incarnations-of-mohammad-bakri-one-gave-israelis-hope-the-other-couldnt-handle/0000019b-6a16-d1d0-a9bf-eed768be0000,Haaretz,Nirit Anderman,2025-12-31T10:02:11,2025-12-31 10:10:03.349856,https://www.haaretz.com/life/2025-12-31/ty-article-magazine/.premium/the-two-incarnations-of-mohammad-bakri-one-gave-israelis-hope-the-other-couldnt-handle/0000019b-6a16-d1d0-a9bf-eed768be0000
Jewish pilgrims to be allowed daytime visits to Joseph’s Tomb,"Visiting hours are being expanded for the first time in a quarter century, the Defense Ministry announced. The post Jewish pilgrims to be allowed daytime visits to Joseph’s Tomb appeared first on JNS.org .",https://www.jns.org/jewish-pilgrims-to-be-allowed-daytime-visits-to-josephs-tomb/,JNS,JNS Staff,2025-12-31T09:44:00,2025-12-31 10:09:54.943853,https://www.jns.org/?p=621495
"IDF struck nearly 21,000 times across seven theaters in 2025","The military carried out some 430 operations in the Gaza Strip, Iran, Iraq, Judea and Samaria, Lebanon, Syria and Yemen. The post IDF struck nearly 21,000 times across seven theaters in 2025 appeared first on JNS.org .",https://www.jns.org/idf-struck-nearly-21000-times-across-seven-theaters-in-2025/,JNS,JNS Staff,2025-12-31T09:56:52,2025-12-31 10:09:54.943808,https://www.jns.org/?p=622293
Muslims and Jews Are Not Destined to Be Enemies – New York Must Lead the Way,"At a moment when hatred and distortion are being normalized and fear amplified, we are stating something simple and urgent: Muslims and Jews refuse to allow antisemitism, extremism, or ideological manipulation to define our future – or our faiths. The post Muslims and Jews Are Not Destined to Be Enemies – New York Must Lead the Way appeared first on Jewish Journal .",https://jewishjournal.com/commentary/opinion/385988/muslims-and-jews-are-not-destined-to-be-enemies-new-york-must-lead-the-way/,Jewish Journal,Sheikh Musa Drammeh,2025-12-31T09:27:51,2025-12-31 10:09:52.157224,https://jewishjournal.com/?p=385988
The Mind of a Restless Thinker: Remembering Norman Podhoretz,We lost a towering Jewish figure on Dec. 16 when Norman Podhoretz died only a month shy of 96. The post The Mind of a Restless Thinker: Remembering Norman Podhoretz appeared first on Jewish Journal .,https://jewishjournal.com/judaism/obituaries/385991/the-mind-of-a-restless-thinker-remembering-norman-podhoretz/,Jewish Journal,Adam L. Fuller,2025-12-31T09:31:16,2025-12-31 10:09:52.157176,https://jewishjournal.com/?p=385991
"Other Olim, Including Former Angeleno, Find Their Voice at Jerusalem Conference","Whatever we accomplish in this lifetime, in business or charity, it is the next generation that we must prepare to carry it forward. The post Other Olim, Including Former Angeleno, Find Their Voice at Jerusalem Conference appeared first on Jewish Journal .",https://jewishjournal.com/community/385992/other-olim-including-former-angeleno-find-their-voice-at-jerusalem-conference/,Jewish Journal,Toby Klein Greenwald,2025-12-31T09:45:17,2025-12-31 10:09:52.157135,https://jewishjournal.com/?p=385992
"In first, Israeli population growth drops below 1 percent; life expectancy also down","Citing 'very unusual figure,' Taub research institute predicts increase of just 0.9% over 2025; blames negative migration, falling fertility The post In first, Israeli population growth drops below 1 percent; life expectancy also down appeared first on The Times of Israel .",https://www.timesofisrael.com/in-first-israeli-population-growth-drops-below-1-percent-life-expectancy-also-down/,Times of Israel,,2025-12-31T09:45:47,2025-12-31 10:09:49.206341,https://www.timesofisrael.com/?p=3723860
"IDF troops kill Palestinian terrorist, thwarting attempted Samaria attack","The assailant attempted to run over soldiers operating near the village of Einabus, according to the Israeli military. The post IDF troops kill Palestinian terrorist, thwarting attempted Samaria attack appeared first on JNS.org .",https://www.jns.org/idf-troops-kill-palestinian-terrorist-thwarting-attempted-samaria-attack/,JNS,JNS Staff,2025-12-31T08:15:08,2025-12-31 09:12:33.334462,https://www.jns.org/?p=622281
"Ariel, Avigail remained top names for Israeli Jewish babies in 2025","Muhammad, Yosef and Adam were the three most popular boys’ names among the general population. The post Ariel, Avigail remained top names for Israeli Jewish babies in 2025 appeared first on JNS.org .",https://www.jns.org/ariel-and-abigail-remain-top-names-for-jewish-babies-in-2025/,JNS,JNS Staff,2025-12-31T08:33:00,2025-12-31 09:12:33.334421,https://www.jns.org/?p=621887
Becoming More Welcoming,"Throughout our history, the Jewish people have been much more committed “bonders,” often as a result of necessity and survival. But there are times when we would benefit from being “bridgers” as well. The post Becoming More Welcoming appeared first on Jewish Journal .",https://jewishjournal.com/commentary/columnist/385983/becoming-more-welcoming/,Jewish Journal,Dan Schnur,2025-12-31T08:59:54,2025-12-31 09:12:30.641326,https://jewishjournal.com/?p=385983
Nick Reiner’s Solution,"Does my being sober make me smarter than Nick? Probably not. Where we differ is that I gave up trying to control my disease. Sometimes, the wealthiest, smartest, and most successful have the hardest time. The post Nick Reiner’s Solution appeared first on Jewish Journal .",https://jewishjournal.com/commentary/columnist/385985/nick-reiners-solution/,Jewish Journal,Mark Schiff,2025-12-31T09:03:21,2025-12-31 09:12:30.641263,https://jewishjournal.com/?p=385985
Almost 1 in 3 Israelis say they need professional mental health support – survey,"After two years of war, 39% of IDF personnel report needing support for mental health issues, 26% are concerned about depression, 48% have difficulty sleeping The post Almost 1 in 3 Israelis say they need professional mental health support &#8211; survey appeared first on The Times of Israel .",https://www.timesofisrael.com/almost-1-in-3-israelis-say-they-need-professional-mental-health-support-survey/,Times of Israel,,2025-12-31T09:02:13,2025-12-31 09:12:27.767261,https://www.timesofisrael.com/?p=3723865
"Israel orphans of 10/7 are rebuilding their childhood, one hero at a time - Sponsored Content","Rebuilding childhood after October 7 through play therapy, trauma care, and community support—so orphaned children can heal, feel safe again, and rediscover joy together. The post Israel orphans of 10/7 are rebuilding their childhood, one hero at a time appeared first on The Times of Israel .",https://www.timesofisrael.com/spotlight/israel-orphans-of-10-7-are-rebuilding-their-childhood-one-hero-at-a-time/,Times of Israel,,2025-12-31T09:04:24,2025-12-31 09:12:27.767208,https://www.timesofisrael.com/?post_type=spotlight&p=3723204
"Trump admin pledged no Phase 2 in Gaza until son’s return, father of last hostage tells JNS","“They say now the most important thing for them is to bring Rani [home]. On this, we got a promise from all of them,” Itzik Gvili, father of Ran, told JNS. The post Trump admin pledged no Phase 2 in Gaza until son’s return, father of last hostage tells JNS appeared first on JNS.org .",https://www.jns.org/trump-admin-pledged-no-phase-2-in-gaza-until-his-sons-return-says-father-of-last-gaza-hostage/,JNS,Mike Wagenheim,2025-12-31T07:14:16,2025-12-31 08:13:19.792938,https://www.jns.org/?p=622219
Arab Muslim makes history as Israel Border Police unit commander,Yasser Hadaya Asadi emphasized his commitment to serving the state in an interview with JNS as he takes over the Adumim Battalion in the Jerusalem envelope. The post Arab Muslim makes history as Israel Border Police unit commander appeared first on JNS.org .,https://www.jns.org/arab-muslim-makes-history-as-israel-border-police-unit-commander/,JNS,Joshua Marks,2025-12-31T07:22:00,2025-12-31 08:13:19.792892,https://www.jns.org/?p=621545
IDF intercepts drone from Egypt carrying 20 M16 rifles,The UAV was also carrying additional gun barrels and stocks. The post IDF intercepts drone from Egypt carrying 20 M16 rifles appeared first on JNS.org .,https://www.jns.org/idf-intercepts-drone-from-egypt-carrying-20-m16-rifles/,JNS,JNS Staff,2025-12-31T07:41:00,2025-12-31 08:13:19.792856,https://www.jns.org/?p=622260
Netanyahu: Hamas disarmament key obstacle to advancing Gaza peace in 2026,"The Israeli prime minister told Fox News that ""the point here is not to negotiate with Hamas,"" adding: ""Their job is to vanish."" The post Netanyahu: Hamas disarmament key obstacle to advancing Gaza peace in 2026 appeared first on JNS.org .",https://www.jns.org/netanyahu-hamas-disarmament-key-obstacle-to-advancing-gaza-peace-in-2026/,JNS,Akiva Van Koningsveld,2025-12-31T08:00:17,2025-12-31 08:13:19.792817,https://www.jns.org/?p=622222
Netanyahu: ‘Handful of kids’ not from West Bank behind rising settler violence,"In US interviews, PM says extremists 'sometimes try to burn a home'; insists Hamas must give up its 60,000 rifles for Gaza plan to advance, 'all bets are off' if Iran escalates The post Netanyahu: ‘Handful of kids’ not from West Bank behind rising settler violence appeared first on The Times of Israel .",https://www.timesofisrael.com/netanyahu-handful-of-kids-not-from-west-bank-behind-rising-settler-violence/,Times of Israel,,2025-12-31T07:40:52,2025-12-31 08:13:14.202171,https://www.timesofisrael.com/?p=3723818
Antisemitism as a public relations problem,"A people that survived crusaders, pogroms and genocide is now reclassified as insufficiently vulnerable. The post Antisemitism as a public relations problem appeared first on JNS.org .",https://www.jns.org/antisemitism-as-a-public-relations-problem/,JNS,Linda Argalgi Sadacka,2025-12-31T05:01:00,2025-12-31 07:12:26.296896,https://www.jns.org/?p=622245
‘Defense Minister’s Shield’ honors supporters of reservists,"“On behalf of hundreds of thousands of reservists, thank you,” Israel Katz said. “You are the vanguard of the State of Israel.” The post ‘Defense Minister&#8217;s Shield’ honors supporters of reservists appeared first on JNS.org .",https://www.jns.org/defense-ministers-shield-honors-supporters-of-reservists/,JNS,David Isaac,2025-12-31T06:11:00,2025-12-31 07:12:26.296860,https://www.jns.org/?p=621728
Israel to suspend licenses of NGOs over terror-linked staff,"New regulations take effect Jan. 1 after security reviews found some NGO employees tied to Hamas and Palestinian Islamic Jihad, officials say. The post Israel to suspend licenses of NGOs over terror-linked staff appeared first on JNS.org .",https://www.jns.org/israel-to-suspend-licenses-of-ngos-over-terror-linked-staff/,JNS,JNS Staff,2025-12-31T06:35:00,2025-12-31 07:12:26.296822,https://www.jns.org/?p=622216
"Germany probes 55 troops over extremism, antisemitic speech","The allegations concern 200 offenses, including sexual misconduct at a special forces unit, with several soldiers already dismissed. The post Germany probes 55 troops over extremism, antisemitic speech appeared first on JNS.org .",https://www.jns.org/germany-probes-55-troops-over-extremism-antisemitic-speech/,JNS,Canaan Lidor,2025-12-31T06:42:04,2025-12-31 07:12:26.296789,https://www.jns.org/?p=622047
Israeli ambassador honors Bondi Chanukah attack hero,"Maimon Amir praised Ahmed al Ahmed's bravery for confronting a gunman who opened fire on civilians, including children and women, calling him a ""true hero."" The post Israeli ambassador honors Bondi Chanukah attack hero appeared first on JNS.org .",https://www.jns.org/israeli-ambassador-honors-bondi-chanukah-attack-hero/,JNS,JNS Staff,2025-12-31T06:59:00,2025-12-31 07:12:26.296756,https://www.jns.org/?p=621852
IDF reports steep drop in soldier deaths in 2025,"Israel’s army says 151 troops died in 2025, less than half the 2024 toll, as combat intensity fell. The post IDF reports steep drop in soldier deaths in 2025 appeared first on JNS.org .",https://www.jns.org/idf-reports-steep-drop-in-soldier-deaths-in-2025/,JNS,JNS Staff,2025-12-31T06:59:34,2025-12-31 07:12:26.296718,https://www.jns.org/?p=622217
2025: The year in which antisemitism became an algorithm of hate,"From campuses to newsrooms, the hatred of Jews has become a tool—profitable, fashionable and deadly. The post 2025: The year in which antisemitism became an algorithm of hate appeared first on JNS.org .",https://www.jns.org/2025-the-year-in-which-antisemitism-became-an-algorithm-of-hate/,JNS,Fiamma Nirenstein,2025-12-31T07:01:26,2025-12-31 07:12:26.296674,https://www.jns.org/?p=622234
Women of Iron: Leadership forged in the aftermath of Oct. 7,"Chochmat Nashim honors 18 Israeli women in Jerusalem for their courage, advocacy and resilience. The post Women of Iron: Leadership forged in the aftermath of Oct. 7 appeared first on JNS.org .",https://www.jns.org/women-of-iron-leadership-forged-in-the-aftermath-of-oct-7/,JNS,Sharon Altshul and Amelie Botbol,2025-12-26T06:00:00,2025-12-26 06:14:24.901999,https://www.jns.org/?p=620262
Housing snapshot: Home sales and rentals across Israel in December 2025,The Times of Israel’s regular feature on what is happening in the local property market right now The post Housing snapshot: Home sales and rentals across Israel in December 2025 appeared first on The Times of Israel .,https://www.timesofisrael.com/housing-snapshot-home-sales-and-rentals-across-israel-in-december-2025/,Times of Israel,,2025-12-26T05:44:00,2025-12-26 06:14:20.527286,https://www.timesofisrael.com/?p=3717736
