title,description,link,source,author,published,scraped_at,guid
Israel Expels Spain From US-Backed Gaza Coordination Center as Diplomatic Rift Deepens,"Israel has expelled Spain from the United States&#8217; Civil-Military Coordination Center (CMCC) in Kiryat Gat, a hub established to coordinate...",https://www.algemeiner.com/2026/04/10/israel-expels-spain-us-backed-gaza-coordination-center-diplomatic-rift-deepens/,Algemeiner,Ailin Vilches Arguello,2026-04-10T21:49:00,2026-04-10 22:19:12.176834,https://www.algemeiner.com/?p=769774
Palestinian NGO linked to terror group shuts down after 35 years,Defense for Children International–Palestine cited Israeli restrictions following its designation by Jerusalem as part of a network linked to the Popular Front for the Liberation of Palestine.,https://www.jns.org/news/israel-news/palestinian-ngo-linked-to-terror-group-shuts-down-after-35-years,JNS,Mike Wagenheim,2026-04-10T21:17:40,2026-04-10 22:19:09.881368,https://www.jns.org/news/israel-news/palestinian-ngo-linked-to-terror-group-shuts-down-after-35-years
Former congressman Eliot Engel dies at 79,"The former chair of the House Foreign Affairs Committee ""was a leading force against efforts to delegitimize our ally Israel,"" AIPAC stated.",https://www.jns.org/news/u-s-news/former-congressman-eliot-engel-dies-at-79,JNS,,2026-04-10T21:19:47,2026-04-10 22:19:09.881327,https://www.jns.org/news/u-s-news/former-congressman-eliot-engel-dies-at-79
"L.A. Jewish Symphony Concert, Open Temple Seder Crawl","Notable people and events in the Jewish LA community. The post L.A. Jewish Symphony Concert, Open Temple Seder Crawl appeared first on Jewish Journal .",https://jewishjournal.com/events/movers-shakers/388100/l-a-jewish-symphony-concert-open-temple-seder-crawl/,Jewish Journal,Jewish Journal Staff,2026-04-10T22:12:09,2026-04-10 22:19:07.707638,https://jewishjournal.com/?p=388100
"White House opted against announcing Iran ceasefire on TV, fearing it may not last","US official says Trump was 'adamant' about giving speech, aides talked him out of it; White House denies report as 'fake news,' says idea 'never even discussed with the president' The post White House opted against announcing Iran ceasefire on TV, fearing it may not last appeared first on The Times of Israel .",https://www.timesofisrael.com/white-house-opted-against-announcing-iran-ceasefire-on-tv-fearing-it-may-not-last/,Times of Israel,,2026-04-10T21:55:33,2026-04-10 22:19:04.699050,https://www.timesofisrael.com/?p=3799367
Israel's top court orders police to allow Tel Aviv anti-gov't protests despite IDF gathering limit,"The ruling, which followed a hearing on petitions to lift wartime restrictions, sets minimum attendance of 150 protestors in Haifa and 1,000 in Tel Aviv, overriding the IDF's Home Front Command caps ahead of Saturday evening anti-gov't rallies",https://www.haaretz.com/israel-news/israel-politics/2026-04-10/ty-article/.premium/israels-top-court-orders-police-to-allow-anti-govt-protests-despite-idf-limit/0000019d-77b6-da4e-a5df-7fbea86e0000,Haaretz,Josh Breiner,2026-04-10T20:24:44,2026-04-10 21:18:35.899173,https://www.haaretz.com/israel-news/israel-politics/2026-04-10/ty-article/.premium/israels-top-court-orders-police-to-allow-anti-govt-protests-despite-idf-limit/0000019d-77b6-da4e-a5df-7fbea86e0000
Israeli Report Sounds Alarm Over ‘America Only’ Faction Influencing US Right,Israel&#8217;s Ministry for Diaspora Affairs and Combating Antisemitism has published a new report warning of a high-stakes schism among US President...,https://www.algemeiner.com/2026/04/10/israeli-report-sounds-alarm-america-only-faction-influencing-us-right/,Algemeiner,David Michael Swindle,2026-04-10T20:33:52,2026-04-10 21:18:30.807014,https://www.algemeiner.com/?p=769721
"DNC Fails to Pass Resolutions Condemning AIPAC, Pushing for Conditioning Aid to Israel",A panel at the Democratic National Committee (DNC) on Thursday voted down a resolution to condemn the influence of the...,https://www.algemeiner.com/2026/04/10/dnc-fails-pass-resolutions-condemning-aipac-pushing-conditioning-aid-israel/,Algemeiner,Jack Elbaum,2026-04-10T20:58:38,2026-04-10 21:18:30.806976,https://www.algemeiner.com/?p=769738
Unsealed indictment details ISIS-inspired NYC bomb plot,"The eight-count indictment describes written plans in a notebook, dashcam recordings and plans for mass casualties near Gracie Mansion during dueling protests.",https://www.jns.org/unsealed-indictment-details-isis-inspired-nyc-bomb-plot,JNS,,2026-04-10T20:32:00,2026-04-10 21:18:28.383003,https://www.jns.org/unsealed-indictment-details-isis-inspired-nyc-bomb-plot
Appeals board turns down Khalil’s bid to have deportation case dismissed,"The anti-Israel pro-Hamas activist still has a case pending in federal court, preventing his removal for now.",https://www.jns.org/appeals-board-turns-down-khalils-bid-to-have-deportation-case-dismissed,JNS,Mike Wagenheim,2026-04-10T21:11:02,2026-04-10 21:18:28.382966,https://www.jns.org/appeals-board-turns-down-khalils-bid-to-have-deportation-case-dismissed
"Brad Lander joins call to end U.S. aid to Israel, in quest to replace Rep. Dan Goldman","Brad Lander, a Jewish Democrat running for Congress who has described himself as a liberal Zionist, has joined some progressive House members in calling for an end to U.S. aid to Israel. Lander, the former New York City comptroller who ran for mayor last year, is challenging Rep. Dan Goldman, a two-term incumbent, in a... The post Brad Lander joins call to end U.S. aid to Israel, in quest to replace Rep. Dan Goldman appeared first on The Forward .",https://forward.com/news/817927/brad-lander-aid-israel-dan-goldman-iron-dome/,The Forward,Jacob Kornbluh,2026-04-10T18:07:08,2026-04-10 21:18:20.949089,https://forward.com/?p=817927
"Trump's peace board faces cash crunch, stalling Gaza plan, sources say","One of the sources, a person with direct knowledge of the peace board's operations, said that out of ten countries that pledged ⁠funds, only three: the United Arab Emirates, Morocco and the U.S., had contributed funding. The Iran war 'has affected everything,' the source added",https://www.haaretz.com/gaza/2026-04-10/ty-article/trumps-peace-board-faces-cash-crunch-stalling-gaza-plan-sources-say/0000019d-78a4-d759-ab9d-79bd1d770000,Haaretz,Reuters,2026-04-10T20:05:01,2026-04-10 20:18:09.012719,https://www.haaretz.com/gaza/2026-04-10/ty-article/trumps-peace-board-faces-cash-crunch-stalling-gaza-plan-sources-say/0000019d-78a4-d759-ab9d-79bd1d770000
"Trump Condemns Far-Right Podcasters Carlson, Kelly, Owens, Jones: ‘They’re Stupid People, and They Know It’",US President Donald Trump on Thursday dropped a nuclear-level social media bomb to explode on the growing contingent of far-right...,https://www.algemeiner.com/2026/04/10/trump-condemns-far-right-podcasters-carlson-kelly-owens-jones-theyre-stupid-people-they-know-it/,Algemeiner,David Michael Swindle,2026-04-10T19:29:21,2026-04-10 20:18:04.525195,https://www.algemeiner.com/?p=769707
Israeli Restaurant in Munich Targeted in Suspected Antisemitic Attack,An Israeli restaurant in the German city of Munich was attacked on Thursday night when assailants smashed multiple windows and...,https://www.algemeiner.com/2026/04/10/israeli-restaurant-munich-targeted-suspected-antisemitic-attack/,Algemeiner,Ailin Vilches Arguello,2026-04-10T19:41:12,2026-04-10 20:18:04.525162,https://www.algemeiner.com/?p=769740
Antisemitic Social Media Personality Dan Bilzerian Launches Longshot US Congressional Bid Against Randy Fine,"Antisemitic social media personality Dan Bilzerian launched a bid for the US Congress this week, setting off a firestorm of...",https://www.algemeiner.com/2026/04/10/antisemitic-social-media-personality-dan-bilzerian-launches-longshot-us-congressional-bid-against-randy-fine/,Algemeiner,Corey Walker,2026-04-10T20:05:35,2026-04-10 20:18:04.525124,https://www.algemeiner.com/?p=769747
US officials head to Pakistan for Iran talks,"“If they're going to try to play us, then they're going to find the negotiating team is not that receptive,” U.S. Vice President JD Vance told reporters.",https://www.jns.org/news/u-s-news/us-officials-head-to-pakistan-for-iran-talks,JNS,Andrew Bernard,2026-04-10T19:57:17,2026-04-10 20:18:02.243687,https://www.jns.org/news/u-s-news/us-officials-head-to-pakistan-for-iran-talks
Wyoming man sentenced to a year in federal prison for antisemitic voicemail threats against ADL,"“True threats of violence are not protected by the First Amendment,” U.S. Attorney Darin Smith stated.",https://www.jns.org/news/u-s-news/wyoming-man-sentenced-to-a-year-in-federal-prison-for-antisemitic-voicemail-threats-against-adl,JNS,,2026-04-10T20:04:08,2026-04-10 20:18:02.243650,https://www.jns.org/news/u-s-news/wyoming-man-sentenced-to-a-year-in-federal-prison-for-antisemitic-voicemail-threats-against-adl
Direct Israel-Lebanon talks set for Tuesday in DC; US said pressing Israel for ceasefire,"PM, Trump reportedly held 'tense' call on Lebanon, with Netanyahu fearing US would declare unilateral truce with Hezbollah if he didn't accede; terror group urges Beirut to hold firm The post Direct Israel-Lebanon talks set for Tuesday in DC; US said pressing Israel for ceasefire appeared first on The Times of Israel .",https://www.timesofisrael.com/direct-israel-lebanon-talks-set-for-tuesday-in-dc-us-said-pressing-israel-for-ceasefire/,Times of Israel,,2026-04-10T20:08:43,2026-04-10 20:17:57.804110,https://www.timesofisrael.com/?p=3799291
The Pentagon fears the Vatican’s authority in a battle over Christianity’s power,"The Vatican has not been a major player on the geopolitical stage in, well, at least a few centuries. The Catholic state is tiny, and has not had a real army or ruled land since, give or take a century, the days of Machiavelli. Nevertheless, in January the Pentagon summoned Cardinal Christophe Pierre, then the... The post The Pentagon fears the Vatican’s authority in a battle over Christianity’s power appeared first on The Forward .",https://forward.com/culture/818020/pentagon-vaticans-meeting-leo-xiv-christianity-catholicism/,The Forward,Mira Fox,2026-04-10T19:38:50,2026-04-10 20:17:55.690456,https://forward.com/?p=818020
Temple Israel rabbi criticizes Michigan Senate candidate for ‘offensive’ remarks about attack,"(JTA) — A rabbi at Temple Israel in West Bloomfield, Michigan, has publicly chastised a candidate for U.S. Senate in her state who grew up near the temple, for what she said was an “offensive” response to the recent attack on her synagogue. Rabbi Jen Lader criticized Abdul El-Sayed, a physician and former county health... The post Temple Israel rabbi criticizes Michigan Senate candidate for &#8216;offensive&#8217; remarks about attack appeared first on The Forward .",https://forward.com/fast-forward/818011/temple-israel-rabbi-michigan-senate-abu-el-sayed/,The Forward,Andrew Lapin,2026-04-10T19:54:19,2026-04-10 20:17:55.690408,https://forward.com/?p=818011
42 Jewish authors slam Jewish Book Council for ‘bias toward centering Israeli and Zionist voices’,"(JTA) — Dozens of anti-Zionist and non-Zionist Jewish authors are criticizing the Jewish Book Council, a historic literary group, for what they said was a “bias toward centering Israeli and Zionist voices” and “narrowing its vision to a Zionist approach to Jewish culture.” A new open letter signed by 42 authors argues that the council,... The post 42 Jewish authors slam Jewish Book Council for ‘bias toward centering Israeli and Zionist voices’ appeared first on The Forward .",https://forward.com/fast-forward/817957/42-jewish-authors-slam-jewish-book-council-for-bias-toward-centering-israeli-and-zionist-voices/,The Forward,Andrew Lapin,2026-04-10T19:56:45,2026-04-10 20:17:55.690350,https://forward.com/?p=817957
Israel and Lebanon's envoys in Washington to hold call ahead of next week's negotiations,The preliminary conversation comes ahead of expected peace talks between Israel and Lebanon that are set to take place at the U.S. State Department in Washington next Tuesday. A diplomatic source familiar with the matter said Israel has agreed to cease attacks in Beirut,https://www.haaretz.com/israel-news/israel-security/2026-04-10/ty-article/.premium/israel-and-lebanons-u-s-envoys-to-hold-call-ahead-of-next-weeks-negotiations/0000019d-78a1-d759-ab9d-79b9b3400000,Haaretz,Liza Rozovsky,2026-04-10T18:37:33,2026-04-10 19:24:56.003313,https://www.haaretz.com/israel-news/israel-security/2026-04-10/ty-article/.premium/israel-and-lebanons-u-s-envoys-to-hold-call-ahead-of-next-weeks-negotiations/0000019d-78a1-d759-ab9d-79b9b3400000
"Iran calls for Lebanon cease-fire, asset release as Trump says 'they have no cards'","Iranian officials say Lebanon cease-fire and release of frozen assets must precede U.S. talks, urge Washington to halt Israeli strikes and honor commitments. Earlier on Friday, Trump told The New York Post that the U.S. is 'loading up the ships with the best ammunition'",https://www.haaretz.com/middle-east-news/iran/2026-04-10/ty-article/iran-urges-lebanon-cease-fire-asset-release-as-trump-says-they-have-no-cards/0000019d-7852-d759-ab9d-79dbcd0f0000,Haaretz,Reuters,2026-04-10T18:58:20,2026-04-10 19:24:56.003279,https://www.haaretz.com/middle-east-news/iran/2026-04-10/ty-article/iran-urges-lebanon-cease-fire-asset-release-as-trump-says-they-have-no-cards/0000019d-7852-d759-ab9d-79dbcd0f0000
Netanyahu could have learned his lesson the last time he took Trump to war with Iran,"'America is a thing you can move very easily,' the Israeli leader once quipped. But Trump started looking for a way out almost as soon as the fighting began, and Israel's strategic objectives are of little concern to him",https://www.haaretz.com/israel-news/israel-security/2026-04-10/ty-article/.premium/netanyahu-could-have-learned-his-lesson-last-time-he-took-trump-to-war-with-iran/0000019d-769d-d68a-a39d-77bfc9c10000,Haaretz,Joshua Leifer,2026-04-10T19:17:01,2026-04-10 19:24:56.003233,https://www.haaretz.com/israel-news/israel-security/2026-04-10/ty-article/.premium/netanyahu-could-have-learned-his-lesson-last-time-he-took-trump-to-war-with-iran/0000019d-769d-d68a-a39d-77bfc9c10000
Missouri legislature approves bill adopting Jew-hatred definition for public schools,"“Our Jewish community can be assured that the Missouri General Assembly has their back,” bill sponsor George Hruza, a Republican state representative, said.",https://www.jns.org/news/u-s-news/missouri-legislature-approves-bill-adopting-jew-hatred-definition-for-public-schools,JNS,,2026-04-10T18:28:12,2026-04-10 19:24:48.629258,https://www.jns.org/news/u-s-news/missouri-legislature-approves-bill-adopting-jew-hatred-definition-for-public-schools
Husband of Francesca Albanese constrained at World Bank due to sanctions on wife,"A lawsuit filed by Massimiliano Cali seeks to have U.S. sanctions against her lifted, claiming they're affecting their job prospects and finances.",https://www.jns.org/news/u-s-news/husband-of-francesca-albanese-constrained-at-world-bank-due-to-sanctions-on-wife,JNS,Mike Wagenheim,2026-04-10T18:57:21,2026-04-10 19:24:48.629217,https://www.jns.org/news/u-s-news/husband-of-francesca-albanese-constrained-at-world-bank-due-to-sanctions-on-wife
"Over 100,000 Muslim worshipers at Al-Aqsa in first Friday prayers after Jerusalem holy sites reopen","The mosque on the Temple Mount had been largely closed to the public, along with other Muslim, Christian and Jewish holy sites due to safety restrictions amid Iran missile fire The post Over 100,000 Muslim worshipers at Al-Aqsa in first Friday prayers after Jerusalem holy sites reopen appeared first on The Times of Israel .",https://www.timesofisrael.com/over-100000-muslim-worshipers-at-al-aqsa-in-first-friday-prayers-after-jerusalem-holy-sites-reopen/,Times of Israel,,2026-04-10T18:30:08,2026-04-10 19:24:44.064566,https://www.timesofisrael.com/?p=3799315
I’m a Jewish candidate for New York comptroller. Our state must divest from Israel bonds,"The New York state and local retirement fund owns $368 million in Israel bonds. Most state pension funds own none. And most New Yorkers have no idea that their tax-funded pension fund, as invested by State Comptroller Tom DiNapoli, helps finance Israeli Prime Minister Benjamin Netanyahu’s wars. As an American Jew and as a candidate... The post I&#8217;m a Jewish candidate for New York comptroller. Our state must divest from Israel bonds appeared first on The Forward .",https://forward.com/opinion/817987/new-york-comptroller-israel-bonds-divest/,The Forward,Drew Warshaw,2026-04-10T18:43:38,2026-04-10 19:24:41.957377,https://forward.com/?p=817987
Temple Israel rabbi criticizes Michigan Senate candidate for ‘offensive’ remarks about attack,Abdul El-Sayed’s response to the attack had mentioned Israel’s war in Lebanon. -- The post Temple Israel rabbi criticizes Michigan Senate candidate for &#8216;offensive&#8217; remarks about attack appeared first on Jewish Telegraphic Agency .,https://www.jta.org/2026/04/10/politics/temple-israel-rabbi-criticizes-michigan-senate-candidate-for-offensive-remarks-about-attack,JTA,Andrew Lapin,2026-04-10T18:43:45,2026-04-10 19:24:39.527028,https://www.jta.org/?p=1899696
OPINION | Why non-Jews can now be members of our synagogue,"Last month, Mosaic Law Congregation in Sacramento changed its bylaws to be more inclusive of interfaith families and patrilineal Jews. Non-Jews in interfaith relationships are now considered full members of [&#8230;]",https://jweekly.com/2026/04/10/why-we-changed-the-rules-so-non-jews-can-be-members-of-our-synagogue/,J. Weekly,Rabbi Ben Herman,2026-04-10T18:34:12,2026-04-10 19:24:34.977614,https://jweekly.com/?p=302675
Good Intentions Without Humility Can Be Dangerous,&#8220;The road to Hell is paved with good intentions.&#8221; It&#8217;s one of those sayings we hear so often that it...,https://www.algemeiner.com/2026/04/10/good-intentions-without-humility-can-be-dangerous/,Algemeiner,Pini Dunner,2026-04-10T14:56:19,2026-04-10 18:28:23.576036,https://www.algemeiner.com/?p=769731
Ohio State University Says It Could Not Stop Holocaust Denier Myron Gaines From Speaking on Campus,The Ohio State University (OSU) has said it was legally powerless to prevent online influencer Myron Gaines — who regularly...,https://www.algemeiner.com/2026/04/10/ohio-state-university-says-could-not-stop-holocaust-denier-myron-gaines-speaking-campus/,Algemeiner,Dion J. Pierre,2026-04-10T18:22:44,2026-04-10 18:28:23.575991,https://www.algemeiner.com/?p=769628
"War in numbers: US hit tens of thousands of targets in Iran, but capabilities remain","Pentagon says it struck over 13,000 targets during 'Epic Fury', including missiles, launchers, navy ships and factories; Iran's fire remained steady despite heavy strikes The post War in numbers: US hit tens of thousands of targets in Iran, but capabilities remain appeared first on The Times of Israel .",https://www.timesofisrael.com/war-in-numbers-us-hit-tens-of-thousands-of-targets-in-iran-but-capabilities-remain/,Times of Israel,,2026-04-10T17:25:50,2026-04-10 18:28:15.813148,https://www.timesofisrael.com/?p=3799268
Jewish-owned Israeli restaurant vandalized in Munich; police suspect antisemitic motive,"No one injured; investigators believe pyrotechnic devices were thrown into Eclipse Grillbar restaurant, breaking several windows; suspects fled, no arrests made The post Jewish-owned Israeli restaurant vandalized in Munich; police suspect antisemitic motive appeared first on The Times of Israel .",https://www.timesofisrael.com/jewish-owned-israeli-restaurant-vandalized-in-munich-police-suspect-antisemitic-motive/,Times of Israel,,2026-04-10T18:06:03,2026-04-10 18:28:15.813102,https://www.timesofisrael.com/?p=3799248
"Brad Lander joins call to end U.S. aid to Israel, in quest to replace Rep. Dan Goldman","Brad Lander, a Jewish Democrat running for Congress who has described himself as a liberal Zionist, has joined some progressive House members in calling for an end to U.S. aid to Israel. Lander, the former New York City comptroller who ran for mayor last year, is challenging Rep. Dan Goldman, a two-term incumbent, in a... The post Brad Lander joins call to end U.S. aid to Israel, in quest to replace Rep. Dan Goldman appeared first on The Forward .",https://forward.com/brad-lander-aid-israel-dan-goldman-iron-dome/,The Forward,Jacob Kornbluh,2026-04-10T18:07:08,2026-04-10 18:28:13.647440,https://forward.com/?p=817927
Netanyahu asks to delay corruption trial testimony by two weeks for 'security and political' reasons,"His appeal to the court cited recent 'dramatic events across the Middle East,' a day after judges announced that the corruption trial would resume normally after the cease-fire with Iran",https://www.haaretz.com/israel-news/israel-politics/2026-04-10/ty-article/.premium/netanyahu-asks-to-delay-corruption-trial-testimony-by-two-weeks/0000019d-77ae-d1d5-a1df-f7af60be0000,Haaretz,Yael Freidson,2026-04-10T17:07:41,2026-04-10 17:24:42.509003,https://www.haaretz.com/israel-news/israel-politics/2026-04-10/ty-article/.premium/netanyahu-asks-to-delay-corruption-trial-testimony-by-two-weeks/0000019d-77ae-d1d5-a1df-f7af60be0000
"Israel's toll in 40 days of Iran war: 650 missiles, 24 dead and over 7,000 wounded",Around 60 cluster missiles scattered bomblets over the country ■ The deadliest strike killed nine people at Beit Shemesh near Jerusalem,https://www.haaretz.com/israel-news/security-aviation/2026-04-10/ty-article-magazine/.premium/israels-toll-in-40-days-of-iran-war-650-missiles-24-dead-over-7-000-hurt/0000019d-7214-d68a-a39d-73375b050000,Haaretz,Bar Peleg,2026-04-10T17:11:46,2026-04-10 17:24:42.508967,https://www.haaretz.com/israel-news/security-aviation/2026-04-10/ty-article-magazine/.premium/israels-toll-in-40-days-of-iran-war-650-missiles-24-dead-over-7-000-hurt/0000019d-7214-d68a-a39d-73375b050000
"Trump’s Peace Board Faces Cash Crunch, Stalling Gaza Plan, Sources Say","Donald Trump&#8217;s Board of Peace has received only a tiny fraction of the $17 billion pledged for Gaza, preventing the US president from pushing ahead with...",https://www.algemeiner.com/2026/04/10/trumps-peace-board-faces-cash-crunch-stalling-gaza-plan-sources-say/,Algemeiner,Reuters and Algemeiner Staff,2026-04-10T16:53:39,2026-04-10 17:24:37.215403,https://www.algemeiner.com/?p=769722
Lebanon Heads to Historic Israel Talks as Hezbollah Strikes Continue,Lebanon&#8216;s President Joseph Aoun has called for historic direct talks with longtime foe Israel since war erupted a month ago &#8211; a month in which Israel&#8216;s military...,https://www.algemeiner.com/2026/04/10/lebanon-heads-historic-israel-talks-hezbollah-strikes-continue/,Algemeiner,Reuters and Algemeiner Staff,2026-04-10T17:04:00,2026-04-10 17:24:37.215370,https://www.algemeiner.com/?p=769727
"Iran Demands Lebanon Ceasefire, Unfreezing of Assets Before Peace Talks","Iran said on Friday that blocked Iranian assets must be released and that a ceasefire must take hold in Lebanon before peace talks can proceed, throwing last-minute doubt over negotiations scheduled...",https://www.algemeiner.com/2026/04/10/iran-demands-lebanon-ceasefire-unfreezing-assets-before-peace-talks/,Algemeiner,Reuters and Algemeiner Staff,2026-04-10T17:15:06,2026-04-10 17:24:37.215330,https://www.algemeiner.com/?p=769729
State Dept summons Iraqi envoy after Iran-backed militias ‘ambush’ US diplomats,"The United States “expects the Iraqi government to immediately take all measures to dismantle the Iran-aligned militia groups in Iraq,” the department stated.",https://www.jns.org/news/u-s-news/state-dept-summons-iraqi-envoy-after-iran-backed-militias-ambush-us-diplomats,JNS,,2026-04-10T16:20:29,2026-04-10 17:24:34.862524,https://www.jns.org/news/u-s-news/state-dept-summons-iraqi-envoy-after-iran-backed-militias-ambush-us-diplomats
On the record and off the court: Meet the only Jewish player on the NCAA championship team,Harrison Hochberg reflects on being a member of Michigan’s championship squad. -- The post On the record and off the court: Meet the only Jewish player on the NCAA championship team appeared first on Jewish Telegraphic Agency .,https://www.jta.org/2026/04/10/sports/on-the-record-and-off-the-court-meet-the-only-jewish-player-on-the-ncaa-championship-team,JTA,Adam Finkel,2026-04-10T16:42:46,2026-04-10 17:24:25.492674,https://www.jta.org/?p=1899620
42 Jewish authors slam Jewish Book Council for ‘bias toward centering Israeli and Zionist voices’,The open letter accuses the literary organization of betraying its mission. -- The post 42 Jewish authors slam Jewish Book Council for ‘bias toward centering Israeli and Zionist voices’ appeared first on Jewish Telegraphic Agency .,https://www.jta.org/2026/04/10/culture/42-jewish-authors-slam-jewish-book-council-for-bias-toward-centering-israeli-and-zionist-voices,JTA,Andrew Lapin,2026-04-10T16:47:26,2026-04-10 17:24:25.492633,https://www.jta.org/?p=1899657
"A month after our synagogue was attacked, the hardest part has been everything that came after","The executive director of Michigan's Temple Israel reflects on the quiet, complicated reality of life after March 12. -- The post A month after our synagogue was attacked, the hardest part has been everything that came after appeared first on Jewish Telegraphic Agency .",https://www.jta.org/2026/04/10/ideas/a-month-after-our-synagogue-was-attacked-the-hardest-part-has-been-everything-that-came-after,JTA,Jason Plotkin,2026-04-10T17:02:36,2026-04-10 17:24:25.492583,https://www.jta.org/?p=1899593
