title,description,link,source,author,published,scraped_at,guid
"Frankly, My Deer","Fine caviar, Persian carpets, a potential Nazi, cold-blooded murder, and some of the last 'olim' to leave Iran before the Revolution The post Frankly, My Deer appeared first on The Times of Israel .",https://www.timesofisrael.com/frankly-my-deer/,Times of Israel,,2025-12-16T08:23:41,2025-12-16 09:13:02.566333,https://www.timesofisrael.com/?p=3713202&preview=true&preview_id=3713202
The Impact Forum and the next chapter of Jewish philanthropy,"Twenty years ago, I made a pivotal decision that changed my professional life: After a successful business career, I chose to shift my focus from making money to maximizing impact. I committed my wealth, time, energy, experience and networks to venture philanthropy, a strategic approach to fighting antisemitism, strengthening the American way of life and... Read More The post The Impact Forum and the next chapter of Jewish philanthropy appeared first on eJewishPhilanthropy .",https://ejewishphilanthropy.com/the-impact-forum-and-the-next-chapter-of-jewish-philanthropy/,eJewish Philanthropy,Adam Milstein,2025-12-16T09:00:00,2025-12-16 09:12:55.482525,https://ejewishphilanthropy.com/?p=166993
"Nearly two years after Gaza paramedic's death at Sde Teiman, Israel has yet to provide answers to his family","The paramedic died in Israeli military custody the same day he was detained during a coordinated medical evacuation in northern Gaza. His family learned of his death only after petitioning the court, and the autopsy results remain undisclosed",https://www.haaretz.com/gaza/2025-12-16/ty-article/.premium/nearly-two-years-after-gaza-paramedics-death-at-sde-teiman-family-still-awaits-answers/0000019b-25d6-dc39-abbb-fff6d34f0000,Haaretz,Yaniv Kubovich,2025-12-16T07:15:05,2025-12-16 08:13:55.665537,https://www.haaretz.com/gaza/2025-12-16/ty-article/.premium/nearly-two-years-after-gaza-paramedics-death-at-sde-teiman-family-still-awaits-answers/0000019b-25d6-dc39-abbb-fff6d34f0000
"Mass shooting at Sydney's Bondi Beach inspired by Islamic State, Australian police say","A Tuesday news conference by state officials marked the first official confirmation of the suspects' suspected ideologies, with the Australian PM revealing that evidence from the scene included Islamic State flags. The New South Wales Police chief suggested a possible link between them and Muslim militant groups in the Philippines",https://www.haaretz.com/world-news/asia-and-australia/2025-12-16/ty-article/mass-shooting-at-sydneys-bondi-beach-inspired-by-islamic-state-australian-police-say/0000019b-25d7-dc39-abbb-fff7e0020000,Haaretz,The Associated Press,2025-12-16T07:27:15,2025-12-16 08:13:55.665496,https://www.haaretz.com/world-news/asia-and-australia/2025-12-16/ty-article/mass-shooting-at-sydneys-bondi-beach-inspired-by-islamic-state-australian-police-say/0000019b-25d7-dc39-abbb-fff7e0020000
Pope urges prayers after Sydney terror shooting,"""Enough with this antisemitic violence! Let us eliminate hatred from our hearts."" The post Pope urges prayers after Sydney terror shooting appeared first on JNS.org .",https://www.jns.org/pope-urges-prayers-after-sydney-terror-shooting/,JNS,JNS Staff,2025-12-16T07:59:00,2025-12-16 08:13:48.104154,https://www.jns.org/?p=617389
The world’s oldest Jewish cemetery is getting an upgrade. Not everyone is at peace with it,"Plans for a major visitor center at the Mount of Olives in East Jerusalem promise education and security, but opponents say it's a right-wing project designed to push out Arab neighbors The post The world’s oldest Jewish cemetery is getting an upgrade. Not everyone is at peace with it appeared first on The Times of Israel .",https://www.timesofisrael.com/the-worlds-oldest-jewish-cemetery-is-getting-an-upgrade-not-everyone-is-at-peace-with-it/,Times of Israel,,2025-12-16T07:35:23,2025-12-16 08:13:42.618996,https://www.timesofisrael.com/?p=3691533
"Jerusalem, Defense Ministry sign strategic pact","“Jerusalem is being built, developing and growing stronger as the eternal capital of the State of Israel and of the Jewish people,"" said Defense Minister Israel Katz. The post Jerusalem, Defense Ministry sign strategic pact appeared first on JNS.org .",https://www.jns.org/jerusalem-defense-ministry-sign-strategic-pact/,JNS,JNS Staff,2025-12-16T06:11:00,2025-12-16 07:12:22.371191,https://www.jns.org/?p=617133
WATCH: Middle East’s largest Christmas tree lit in Nazareth,"The Christian population in Israel stands at approximately 180,300, accounting for 1.8% of the country’s total population. The post WATCH: Middle East&#8217;s largest Christmas tree lit in Nazareth appeared first on JNS.org .",https://www.jns.org/watch-middle-easts-largest-christmas-tree-lit-in-nazareth/,JNS,JNS Staff,2025-12-16T06:30:00,2025-12-16 07:12:22.371154,https://www.jns.org/?p=617127
The genocide smear: A victim-blaming blood libel,A state bent on killing an entire people does not facilitate the welfare of the population it intends to destroy. The post The genocide smear: A victim-blaming blood libel appeared first on JNS.org .,https://www.jns.org/the-genocide-smear-a-victim-blaming-blood-libel/,JNS,Mark Friedgut,2025-12-16T06:50:00,2025-12-16 07:12:22.371116,https://www.jns.org/?p=617298
Australian Jews call gun laws a deflection after Sydney massacre,Community leaders argue Islamist immigration and antisemitism — not firearms regulations — drove the deadly Chanukah attack at Bondi Beach. The post Australian Jews call gun laws a deflection after Sydney massacre appeared first on JNS.org .,https://www.jns.org/australian-jews-call-gun-laws-a-deflection-after-sydney-massacre/,JNS,Canaan Lidor,2025-12-16T06:53:09,2025-12-16 07:12:22.371075,https://www.jns.org/?p=617132
"Australian officials: Bondi terror attack inspired by ISIS, bombs found in shooters’ car","PM Albanese says homemade Islamic State flags also found in vehicle, younger terrorist was probed in 2019 but not considered a threat; visits 'true Australian hero' who tackled shooter The post Australian officials: Bondi terror attack inspired by ISIS, bombs found in shooters&#8217; car appeared first on The Times of Israel .",https://www.timesofisrael.com/australian-officials-bondi-terror-attack-inspired-by-isis-bombs-found-in-shooters-car/,Times of Israel,,2025-12-16T06:46:41,2025-12-16 07:12:16.546800,https://www.timesofisrael.com/?p=3713122
Sa’ar to convene ‘J-50’ Forum amid rising Jew-hatred,"During the conference, scheduled for Dec. 21–24, participants will receive policy briefings, engage in public diplomacy and take part in workshops. The post Sa&#8217;ar to convene &#8216;J-50&#8217; Forum amid rising Jew-hatred appeared first on JNS.org .",https://www.jns.org/saar-to-convene-j-50-forum-amid-rising-jew-hatred/,JNS,,2025-12-16T05:21:00,2025-12-16 06:14:45.216015,https://www.jns.org/?p=617381
"1,300-year-old menorah pendant shows Jews ‘didn’t stop’ visiting Jerusalem","The rare find, bearing the menorah symbol on both sides, was uncovered during recent excavations in the Temple Mount area. The post 1,300-year-old menorah pendant shows Jews ‘didn’t stop’ visiting Jerusalem appeared first on JNS.org .",https://www.jns.org/1300-year-old-menorah-pendant-shows-jews-didnt-stop-visiting-jerusalem/,JNS,JNS Staff,2025-12-16T05:45:00,2025-12-16 06:14:45.215964,https://www.jns.org/?p=617067
Israeli-led discovery redefines how dinosaurs took flight,"The Tel Aviv University study indicates that some feathered dinosaurs may have lost the ability to fly, revealing that evolution of flight could be more complex than once believed. The post Israeli-led discovery redefines how dinosaurs took flight appeared first on JNS.org .",https://www.jns.org/israeli-led-discovery-redefines-how-dinosaurs-took-flight/,JNS,JNS Staff,2025-12-16T05:01:00,2025-12-16 05:11:39.957855,https://www.jns.org/?p=617080
Jewish donors help raise $1.3M for the Muslim man who disarmed a Bondi Beach attacker,"Sponsors of GoFundMe campaign hail Ahmed Al Ahmed for his 'selfless, instinctive, and undeniably heroic actions,' as he recovers in the hospital after being shot twice The post Jewish donors help raise $1.3M for the Muslim man who disarmed a Bondi Beach attacker appeared first on The Times of Israel .",https://www.timesofisrael.com/jewish-donors-help-raise-1-3m-for-the-muslim-man-who-disarmed-a-bondi-beach-attacker/,Times of Israel,,2025-12-16T04:42:50,2025-12-16 05:11:35.514650,https://www.timesofisrael.com/?p=3713099
Lebanon is flexing its muscles with Iran - but war with Israel could play into Tehran's hands,"Beirut needs international support to curb Iranian efforts to maintain its presence in Lebanon while it continues to support Hezbollah. The resumption of war would free Tehran from this dilemma, as it fears the complete crushing of its regional sphere of influence",https://www.haaretz.com/israel-news/2025-12-16/ty-article/.premium/lebanon-flexes-its-muscles-with-iran-but-war-with-israel-could-play-into-tehrans-hands/0000019b-2447-d5c5-a3df-bee7c4d10000,Haaretz,Zvi Bar'el,2025-12-16T04:11:43,2025-12-16 04:20:11.790524,https://www.haaretz.com/israel-news/2025-12-16/ty-article/.premium/lebanon-flexes-its-muscles-with-iran-but-war-with-israel-could-play-into-tehrans-hands/0000019b-2447-d5c5-a3df-bee7c4d10000
"Bondi Beach shooting was inspired by Islamic State, Australian police chief says",,https://www.haaretz.com/israel-news/2025-12-16/ty-article-live/at-bondi-memorial-israeli-ambassador-calls-for-greater-protection-for-australian-jews/0000019b-252b-d5c5-a3df-bfef7b8c0000,Haaretz,Haaretz,2025-12-16T03:26:21,2025-12-16 03:37:40.598970,https://www.haaretz.com/israel-news/2025-12-16/ty-article-live/at-bondi-memorial-israeli-ambassador-calls-for-greater-protection-for-australian-jews/0000019b-252b-d5c5-a3df-bfef7b8c0000
Sydney Opera House lit up with giant menorah in tribute to Bondi Beach attack victims,Memorial events held across Australia on Monday to commemorate the 15 people killed and dozens wounded by terrorists at Hanukkah event The post Sydney Opera House lit up with giant menorah in tribute to Bondi Beach attack victims appeared first on The Times of Israel .,https://www.timesofisrael.com/sydney-opera-house-lit-up-with-giant-menorah-in-tribute-to-bondi-beach-attack-victims/,Times of Israel,,2025-12-16T02:46:17,2025-12-16 03:37:28.016591,https://www.timesofisrael.com/?p=3713089
Antisemitism tensions rise as NYC Young Republicans host the far-right,"A Jewish Republican lawmaker turned down her invitation, despite being touted by the group as an ""honored guest."" -- The post Antisemitism tensions rise as NYC Young Republicans host the far-right appeared first on Jewish Telegraphic Agency .",https://www.jta.org/2025/12/15/politics/antisemitism-tensions-rise-as-nyc-young-republicans-host-the-far-right,JTA,Joseph Strauss,2025-12-16T02:53:13,2025-12-16 03:37:23.266958,https://www.jta.org/?p=1893902
"Exiled in Moscow, toppled Syrian dictator said to make quiet return to ophthalmology","Report says Bashar al-Assad and his family are living a quiet and luxurious life in Russia and UAE, though are cut off from political power and considered 'irrelevant' by Putin The post Exiled in Moscow, toppled Syrian dictator said to make quiet return to ophthalmology appeared first on The Times of Israel .",https://www.timesofisrael.com/exiled-in-moscow-toppled-syrian-dictator-said-to-make-quiet-return-to-ophthalmology/,Times of Israel,,2025-12-16T02:16:10,2025-12-16 02:44:39.350314,https://www.timesofisrael.com/?post_type=liveblog_entry&p=3713092
"Jewish donors help raise $1.3M for Ahmed al Ahmed, the Muslim man who disarmed a Bondi Beach attacker","Jewish hedge fund billionaire Bill Ackman donated $66,500 to a GoFundMe page for al Ahmed. -- The post Jewish donors help raise $1.3M for Ahmed al Ahmed, the Muslim man who disarmed a Bondi Beach attacker appeared first on Jewish Telegraphic Agency .",https://www.jta.org/2025/12/15/global/jewish-donors-help-raise-1-3m-for-ahmed-al-ahmed-the-muslim-man-who-disarmed-a-bondi-beach-attacker,JTA,Grace Gilson,2025-12-16T01:42:55,2025-12-16 02:44:34.445499,https://www.jta.org/?p=1893886
Pomona College Reaches Resolution Agreement on Antisemitism Lawsuit,"Pomona College has reached a voluntary resolution agreement with the Anti-Defamation League (ADL), the Louis D. Brandeis Center for Human Rights Under Law (Brandeis Center), and Hillel International following allegations of antisemitism The post Pomona College Reaches Resolution Agreement on Antisemitism Lawsuit appeared first on Jewish Journal .",https://jewishjournal.com/community/385660/pomona-college-reaches-resolution-agreement-on-antisemitism-lawsuit/,Jewish Journal,Kylie Ora Lobell,2025-12-16T01:23:03,2025-12-16 01:38:05.925919,https://jewishjournal.com/?p=385660
JIMENA Study Shows Gaps – and Progress – in Sephardi and Mizrahi Inclusion in Jewish Schools and Camps,"According to the study, 79% of educators report feeling comfortable teaching about other cultures, but only 31% feel confident in their knowledge of both Sephardi and Mizrahi culture and history. The post JIMENA Study Shows Gaps – and Progress – in Sephardi and Mizrahi Inclusion in Jewish Schools and Camps appeared first on Jewish Journal .",https://jewishjournal.com/community/385662/jimena-study-shows-gaps-and-progress-in-sephardi-and-mizrahi-inclusion-in-jewish-schools-and-camps/,Jewish Journal,Kylie Ora Lobell,2025-12-16T01:29:42,2025-12-16 01:38:05.925873,https://jewishjournal.com/?p=385662
Israeli envoy urges Australia to better protect its Jews: ‘Only they are forced to worship behind closed doors’,Mourners in Sydney pay tribute to victims of massacre * Aussie PM notes ones of the terrorists was previously on radar of intelligence agency but wasn't considered an imminent threat The post Israeli envoy urges Australia to better protect its Jews: ‘Only they are forced to worship behind closed doors’ appeared first on The Times of Israel .,https://www.timesofisrael.com/liveblog-december-16-2025/,Times of Israel,,2025-12-16T00:52:16,2025-12-16 01:38:03.043761,https://www.timesofisrael.com/?p=3713078
Israel extends administrative detention of Palestinian rights activist for five more months,"Ayman Ghrayeb, who documents the forcible displacement of Jordan Valley communities, has been in 'administrative detention,' custody without trial, since November 17. On Monday his custody was extended by five months. Friends say that before his arrest, two Shin Bet agents told him they were fed up with his activism",https://www.haaretz.com/israel-news/2025-12-16/ty-article/.premium/israel-extends-administrative-detention-of-palestinian-activist-for-five-more-months/0000019b-243a-d5c5-a3df-befebba90000,Haaretz,Matan Golan,2025-12-15T23:09:30,2025-12-16 00:39:45.270645,https://www.haaretz.com/israel-news/2025-12-16/ty-article/.premium/israel-extends-administrative-detention-of-palestinian-activist-for-five-more-months/0000019b-243a-d5c5-a3df-befebba90000
New York City councilor slammed for call to expel Muslims in the wake of Bondi attack,Mayor-elect Zohran Mamdani blasts 'vile Islamophobia' after Republican council member Vickie Paladino wrote on X that 'we need to take very seriously the need to begin the expulsion of Muslims from Western nations',https://www.haaretz.com/israel-news/2025-12-16/ty-article/.premium/new-york-city-councilor-slammed-for-call-to-expel-muslims-in-the-wake-of-bondi-attack/0000019b-246e-d5c5-a3df-beeed74f0000,Haaretz,Etan Nechin,2025-12-16T00:17:49,2025-12-16 00:39:45.270589,https://www.haaretz.com/israel-news/2025-12-16/ty-article/.premium/new-york-city-councilor-slammed-for-call-to-expel-muslims-in-the-wake-of-bondi-attack/0000019b-246e-d5c5-a3df-beeed74f0000
A painful reminder of the true meaning of Chanukah,The Bondi Beach massacre is the result of incitement rooted in demonization of Israel. The only response must be a defiant refusal to let the antisemites and their enablers prevail. The post A painful reminder of the true meaning of Chanukah appeared first on JNS.org .,https://www.jns.org/a-painful-reminder-of-the-true-meaning-of-chanukah/,JNS,Jonathan S. Tobin,2025-12-15T23:20:12,2025-12-16 00:39:37.367743,https://www.jns.org/?p=617362
"More US police patrols at Jewish sites, ‘abundance of caution’ cited after Sydney attack","“They usually do this during these times,” the CEO of a private security company told JNS. “Then they go back to being complacent like normal.” The post More US police patrols at Jewish sites, ‘abundance of caution’ cited after Sydney attack appeared first on JNS.org .",https://www.jns.org/more-us-police-patrols-at-jewish-sites-abundance-of-caution-cited-after-sydney-attack/,JNS,Jessica Russak-Hoffman,2025-12-15T23:48:35,2025-12-16 00:39:37.367698,https://www.jns.org/?p=617367
"Mavis Tire to pay $303,758 to settle suit accusing it of denying manager role to religious Jew","""Employers cannot refuse to hire a job applicant to avoid granting a request for a religious accommodation,"" stated Arlean Nieto, acting director of the U.S. Equal Employment Opportunity Commission's New York District Office. The post Mavis Tire to pay $303,758 to settle suit accusing it of denying manager role to religious Jew appeared first on JNS.org .",https://www.jns.org/mavis-tire-to-pay-303758-to-settle-suit-accusing-it-of-denying-manager-role-to-religious-jew/,JNS,JNS Staff,2025-12-16T00:23:31,2025-12-16 00:39:37.367647,https://www.jns.org/?p=617373
"Rob Reiner, Wife Michele, Found Dead in Brentwood Home","Los Angeles authorities are investigating the deaths as a homicide. The post Rob Reiner, Wife Michele, Found Dead in Brentwood Home appeared first on Jewish Journal .",https://jewishjournal.com/judaism/obituaries/385658/rob-reiner-wife-michele-found-dead-in-brentwood-home/,Jewish Journal,Brian Fishbach,2025-12-15T23:35:24,2025-12-16 00:39:34.524696,https://jewishjournal.com/?p=385658
"1,300-year-old menorah pendant suggests Rome’s ban on Jews from Jerusalem was a failure","After the Holy City was razed in 135 CE, an edict seemed designed to prevent a Jewish return. The discovery of an artifact suggests some tenacious residents could not be kept away The post 1,300-year-old menorah pendant suggests Rome&#8217;s ban on Jews from Jerusalem was a failure appeared first on The Times of Israel .",https://www.timesofisrael.com/1300-year-old-menorah-pendant-suggests-romes-ban-on-jews-from-jerusalem-was-a-failure/,Times of Israel,,2025-12-15T23:07:29,2025-12-16 00:39:31.469750,https://www.timesofisrael.com/?p=3712499
Police arrest 3 suspects for attacking pregnant Arab woman in Jaffa over the weekend,"Shin Bet said to be assisting in probe; rebuffing police, court frees all 15 demonstrators detained after march decrying attack, as Jaffa's Arab community goes on strike The post Police arrest 3 suspects for attacking pregnant Arab woman in Jaffa over the weekend appeared first on The Times of Israel .",https://www.timesofisrael.com/police-arrest-3-suspects-for-attacking-pregnant-arab-woman-in-jaffa-over-the-weekend/,Times of Israel,,2025-12-15T23:13:19,2025-12-16 00:39:31.469704,https://www.timesofisrael.com/?post_type=liveblog_entry&p=3712826
"Despite war, tech exits soared to $59 billion in 2025 thanks to Wiz deal — report","US buyers again lead with 43 M&#038;A deals and IPOs, followed by Israeli purchasers with 30 transactions, according to annual PwC report The post Despite war, tech exits soared to $59 billion in 2025 thanks to Wiz deal &#8212; report appeared first on The Times of Israel .",https://www.timesofisrael.com/despite-war-tech-exits-soared-to-59-billion-in-2025-thanks-to-wiz-deal-report/,Times of Israel,,2025-12-16T00:04:41,2025-12-16 00:39:31.469653,https://www.timesofisrael.com/?p=3712466
4 members of pro-Palestinian group arrested for planning bombings across Los Angeles,Attorney General Pam Bondi said the FBI had foiled the “far-left” group’s plot for “massive and horrific terror.” -- The post 4 members of pro-Palestinian group arrested for planning bombings across Los Angeles appeared first on Jewish Telegraphic Agency .,https://www.jta.org/2025/12/15/united-states/4-members-of-pro-palestinian-group-arrested-for-planning-bombings-across-los-angeles,JTA,Grace Gilson,2025-12-16T00:24:48,2025-12-16 00:39:26.419923,https://www.jta.org/?p=1893895
Report: Top Trump officials 'very frustrated' with Netanyahu amid Gaza cease-fire violation,"A U.S. official told Axios, 'Netanyahu has turned over the last two years into a global pariah. He should ask himself why Egypt's al-Sisi refuses to meet him and why, five years after the Abraham Accords, he still hasn't been invited to visit the UAE'",https://www.haaretz.com/israel-news/2025-12-16/ty-article/report-top-trump-officials-very-frustrated-with-netanyahu-amid-gaza-truce-violation/0000019b-23a1-d932-a7bf-6fa1ead20000,Haaretz,Haaretz,2025-12-15T22:26:18,2025-12-15 23:10:03.987326,https://www.haaretz.com/israel-news/2025-12-16/ty-article/report-top-trump-officials-very-frustrated-with-netanyahu-amid-gaza-truce-violation/0000019b-23a1-d932-a7bf-6fa1ead20000
"Dutch Police Arrest 22 After Anti-Israel Protests, Vandalism at Amsterdam Venue During IDF Cantor Performance",Dutch police arrested 22 people on Sunday after anti-Israel protests outside an Amsterdam concert hall erupted into violent clashes during...,https://www.algemeiner.com/2025/12/15/dutch-police-arrest-22-anti-israel-protests-vandalism-amsterdam-venue-idf-cantor-performance/,Algemeiner,Ailin Vilches Arguello,2025-12-15T22:28:06,2025-12-15 23:09:59.290973,https://www.algemeiner.com/?p=760330
All 25 Jewish Lawmakers in US House Sign Statement on ‘Grotesque’ Antisemitic Bondi Beach Shooting,Every Jewish member of the US House of Representatives on Monday signed a bipartisan statement condemning the prior day&#8217;s antisemitic...,https://www.algemeiner.com/2025/12/15/all-25-jewish-lawmakers-us-house-sign-statement-grotesque-antisemitic-bondi-beach-shooting/,Algemeiner,Corey Walker,2025-12-15T23:06:45,2025-12-15 23:09:59.290921,https://www.algemeiner.com/?p=760327
Victoria premier booed at Melbourne vigil amid ire at Labor party over Bondi attack,"Jacinta Allan heckled while attending Hanukkah candle lighting and memorial at local synagogue, day after deadly antisemitic terror shooting at Jewish event in Syndey The post Victoria premier booed at Melbourne vigil amid ire at Labor party over Bondi attack appeared first on The Times of Israel .",https://www.timesofisrael.com/victoria-premier-booed-at-melbourne-vigil-amid-ire-at-labor-party-over-bondi-attack/,Times of Israel,,2025-12-15T22:27:35,2025-12-15 23:09:52.428740,https://www.timesofisrael.com/?p=3712984
Haaretz Cartoon,,https://www.haaretz.com/opinion/daily-cartoon/2025-12-15/ty-article-opinion/haaretz-cartoon/0000019b-23d5-d60f-a5db-6bdfeda30000,Haaretz,Amos Biderman,2025-12-15T21:08:11,2025-12-15 22:10:04.807100,https://www.haaretz.com/opinion/daily-cartoon/2025-12-15/ty-article-opinion/haaretz-cartoon/0000019b-23d5-d60f-a5db-6bdfeda30000
IDF assesses Hezbollah's capabilities as Lebanese Army struggles to seize remaining arms,"The IDF says the Lebanese Army struggles to target Hezbollah's weapons stockpiles and operations in Shiite areas, while the group lacks the capability to carry out large-scale attacks on Israel. Hamas is also active, attempting to establish itself in Lebanon",https://www.haaretz.com/middle-east-news/2025-12-15/ty-article/.premium/idf-assesses-hezbollahs-capabilities-as-lebanese-army-struggles-to-seize-remaining-arms/0000019b-2382-dc39-abbb-fff21a590000,Haaretz,Yaniv Kubovich,2025-12-15T21:44:54,2025-12-15 22:10:04.807075,https://www.haaretz.com/middle-east-news/2025-12-15/ty-article/.premium/idf-assesses-hezbollahs-capabilities-as-lebanese-army-struggles-to-seize-remaining-arms/0000019b-2382-dc39-abbb-fff21a590000
Jerusalem fans wave Jewish supremacist Kahane flag; Tel Aviv fans' anti-Ben-Gvir shirts seized,"Beitar Jerusalem fans waved the flag of the late Rabbi Meir Kahane's far-right Kach movement at a match against an Arab-Israeli team on Monday. A day earlier, a security official confiscated a shirt reading 'FCK BNGVR,' a reference to far-right National Security Minister Itamar Ben-Gvir, from Hapoel Tel Aviv fans",https://www.haaretz.com/israel-news/2025-12-15/ty-article/.premium/jerusalem-fans-wave-far-right-kahane-flag-anti-ben-gvir-shirts-of-tel-aviv-fans-seized/0000019b-2261-dc39-abbb-fff3f71e0000,Haaretz,Yotam Koren,2025-12-15T21:47:38,2025-12-15 22:10:04.807040,https://www.haaretz.com/israel-news/2025-12-15/ty-article/.premium/jerusalem-fans-wave-far-right-kahane-flag-anti-ben-gvir-shirts-of-tel-aviv-fans-seized/0000019b-2261-dc39-abbb-fff3f71e0000
"Netanyahu's pardon plea isn't for the trial, but to absolve him from responsibility for Oct. 7","Netanyahu knew full well when he submitted his request that it had no merit, but he judged it would spark a public debate in which even opponents of the pardon would treat it as a legitimate request. He judged correctly",https://www.haaretz.com/opinion/2025-12-15/ty-article-opinion/.premium/netanyahus-pardon-plea-isnt-for-the-trial-but-absolve-him-from-oct-7-responsibility/0000019b-2350-d5c5-a3df-bff685740000,Haaretz,Uzi Baram,2025-12-15T21:49:16,2025-12-15 22:10:04.807001,https://www.haaretz.com/opinion/2025-12-15/ty-article-opinion/.premium/netanyahus-pardon-plea-isnt-for-the-trial-but-absolve-him-from-oct-7-responsibility/0000019b-2350-d5c5-a3df-bff685740000
